Unclean,Clean,Noise_Pre_Processing,Training_Data,Noise_Post_Processing,Query
"each bit of data in a dram is stored as a positive or negative electrical charge in a capacitive structure the structure providing the capacitance as well as the transistors that control access to it is collectively referred to as a dram cell they are the fundamental building block in dram arrays multiple dram memory cell variants exist but the most commonly used variant in modern drams is the one transistor one capacitor  cell the transistor is used to admit current into the capacitor during writes and to discharge the capacitor during reads the access transistor is designed to maximize drive strength and minimize transistor transistor leakage  
",bit data dram stored positive negative electrical charge capacitive structure structure providing capacitance transistors control access collectively referred dram cell fundamental building block dram arrays multiple dram memory cell variants exist commonly variant modern drams transistor capacitor cell transistor admit current capacitor writes discharge capacitor reads access transistor designed maximize drive strength minimize transistor transistor leakage,7.79,"bit,data,dram,stored,positive,negative,electrical,charge,capacitive,structure,structure,providing,capacitance,transistors,control,access,collectively,referred,dram,cell,fundamental,building,block,dram,arrays,multiple,dram,memory,cell,variants,exist,commonly,variant,modern,drams,transistor,capacitor,cell,transistor,admit,current,capacitor,writes,discharge,capacitor,reads,access,transistor,designed,maximize,drive,strength,minimize,transistor,transistor,leakage",0.00,dram
"up until the mid s the capacitors in dram cells were co planar with the access transistor  thus they were referred to as planar capacitors the drive to increase both density and to a lesser extent performance required denser designs this was strongly motivated by economics a major consideration for dram devices especially commodity drams the minimization of dram cell area can produce a denser device and lower the cost per bit of storage starting in the mid s the capacitor was moved above or below the silicon substrate in order to meet these objectives dram cells featuring capacitors above the substrate are referred to as stacked or folded plate capacitors those with capacitors buried beneath the substrate surface are referred to as trench capacitors in the s manufacturers were sharply divided by the type of capacitor used in their drams and the relative cost and long term scalability of both designs have been the subject of extensive debate the majority of drams from major manufactures such as hynix micron technology samsung electronics use the stacked capacitor structure whereas smaller manufacturers such nanya technology use the trench capacitor structure 
",mid capacitors dram cells co planar access transistor referred planar capacitors drive increase density lesser extent performance required denser designs strongly motivated economics major consideration dram devices especially commodity drams minimization dram cell area produce denser device lower cost bit storage starting mid capacitor moved silicon substrate order meet objectives dram cells featuring capacitors substrate referred stacked folded plate capacitors capacitors buried beneath substrate surface referred trench capacitors manufacturers sharply divided type capacitor drams relative cost long term scalability designs subject extensive debate majority drams major manufactures hynix micron technology samsung electronics use stacked capacitor structure smaller manufacturers nanya technology use trench capacitor structure,7.22,"mid,capacitors,dram,cells,co,planar,access,transistor,referred,planar,capacitors,drive,increase,density,lesser,extent,performance,required,denser,designs,strongly,motivated,economics,major,consideration,dram,devices,especially,commodity,drams,minimization,dram,cell,area,produce,denser,device,lower,cost,bit,storage,starting,mid,capacitor,moved,silicon,substrate,order,meet,objectives,dram,cells,featuring,capacitors,substrate,referred,stacked,folded,plate,capacitors,capacitors,buried,beneath,substrate,surface,referred,trench,capacitors,manufacturers,sharply,divided,type,capacitor,drams,relative,cost,long,term,scalability,designs,subject,extensive,debate,majority,drams,major,manufactures,hynix,micron,technology,samsung,electronics,use,stacked,capacitor,structure,smaller,manufacturers,nanya,technology,use,trench,capacitor,structure",0.00,dram
"trench capacitors have numerous advantages since the capacitor is buried in the bulk of the substrate instead of lying on its surface the area it occupies can be minimized to what is required to connect it to the access transistors drain terminal without decreasing the capacitors size and thus capacitance  alternatively the capacitance can be increased by etching a deeper hole without any increase to surface area  another advantage of the trench capacitor is that its structure is under the layers of metal interconnect allowing them to be more easily made planar which enables it to be integrated in a logic optimized process technology which have many levels of interconnect above the substrate the fact that the capacitor is under the logic means that it is constructed before the transistors are this allows high temperature processes to fabricate the capacitors which would otherwise be degrading the logic transistors and their performance this makes trench capacitors suitable for constructing embedded dram   disadvantages of trench capacitors are difficulties in reliably constructing the capacitors structures within deep holes and in connecting the capacitor to the access transistors drain terminal 
",trench capacitors numerous advantages capacitor buried bulk substrate instead lying surface area occupies minimized required connect access transistors drain terminal decreasing capacitors size capacitance alternatively capacitance increased etching deeper hole increase surface area advantage trench capacitor structure layers metal interconnect allowing easily planar enables integrated logic optimized process technology levels interconnect substrate fact capacitor logic means constructed transistors allows high temperature processes fabricate capacitors degrading logic transistors performance makes trench capacitors suitable constructing embedded dram disadvantages trench capacitors difficulties reliably constructing capacitors structures deep holes connecting capacitor access transistors drain terminal,7.81,"trench,capacitors,numerous,advantages,capacitor,buried,bulk,substrate,instead,lying,surface,area,occupies,minimized,required,connect,access,transistors,drain,terminal,decreasing,capacitors,size,capacitance,alternatively,capacitance,increased,etching,deeper,hole,increase,surface,area,advantage,trench,capacitor,structure,layers,metal,interconnect,allowing,easily,planar,enables,integrated,logic,optimized,process,technology,levels,interconnect,substrate,fact,capacitor,logic,means,constructed,transistors,allows,high,temperature,processes,fabricate,capacitors,degrading,logic,transistors,performance,makes,trench,capacitors,suitable,constructing,embedded,dram,disadvantages,trench,capacitors,difficulties,reliably,constructing,capacitors,structures,deep,holes,connecting,capacitor,access,transistors,drain,terminal",0.00,dram
"first generation dram ics  of which the first was the intel  used a three transistor one capacitor  dram cell by the second generation the requirement to reduce cost by fitting the same amount of bits in a smaller area led to the almost universal adoption of the tc dram cell although a couple of devices with  and  kbit capacities continued to use the tc cell for performance reasons  these performance advantages included most significantly the ability to read the state stored by the capacitor without discharging it avoiding the need to write back what was read out  a second performance advantage relates to the tc cell has separate transistors for reading and writing the memory controller can exploit this feature to perform atomic read modify writes where a value is read modified and then written back as a single indivisible operation 
",generation dram ics intel transistor capacitor dram cell second generation requirement reduce cost fitting bits smaller area led universal adoption tc dram cell couple devices kbit capacities continued use tc cell performance reasons performance advantages included significantly ability read state stored capacitor discharging avoiding need write read second performance advantage relates tc cell separate transistors reading writing memory controller exploit feature perform atomic read modify writes value read modified written single indivisible operation,8.04,"generation,dram,ics,intel,transistor,capacitor,dram,cell,second,generation,requirement,reduce,cost,fitting,bits,smaller,area,led,universal,adoption,tc,dram,cell,couple,devices,kbit,capacities,continued,use,tc,cell,performance,reasons,performance,advantages,included,significantly,ability,read,state,stored,capacitor,discharging,avoiding,need,write,read,second,performance,advantage,relates,tc,cell,separate,transistors,reading,writing,memory,controller,exploit,feature,perform,atomic,read,modify,writes,value,read,modified,written,single,indivisible,operation",0.00,dram
"the one transistor zero capacitor  dram cell has been a topic of research since the late s t dram is a different way of constructing the basic dram memory cell distinct from the classic one transistorone capacitor  dram cell which is also sometimes referred to as t dram particularly in comparison to the t and t dram which it replaced in the s
",transistor zero capacitor dram cell topic research late dram different way constructing basic dram memory cell distinct classic transistorone capacitor dram cell referred dram particularly comparison dram replaced,10.14,"transistor,zero,capacitor,dram,cell,topic,research,late,dram,different,way,constructing,basic,dram,memory,cell,distinct,classic,transistorone,capacitor,dram,cell,referred,dram,particularly,comparison,dram,replaced",0.00,dram
"in t dram cells the bit of data is still stored in a capacitive region controlled by a transistor but this capacitance is no longer provided by a separate capacitor t dram is a capacitorless bit cell design that stores data using the parasitic body capacitance that is inherent to silicon on insulator  transistors considered a nuisance in logic design this floating body effect can be used for data storage this gives t dram cells the greatest density as well as allowing easier integration with high performance logic circuits since they are constructed with the same soi process technologies
",dram cells bit data stored capacitive region controlled transistor capacitance longer provided separate capacitor dram capacitorless bit cell design stores data parasitic body capacitance inherent silicon insulator transistors considered nuisance logic design floating body effect data storage gives dram cells greatest density allowing easier integration high performance logic circuits constructed soi process technologies,7.73,"dram,cells,bit,data,stored,capacitive,region,controlled,transistor,capacitance,longer,provided,separate,capacitor,dram,capacitorless,bit,cell,design,stores,data,parasitic,body,capacitance,inherent,silicon,insulator,transistors,considered,nuisance,logic,design,floating,body,effect,data,storage,gives,dram,cells,greatest,density,allowing,easier,integration,high,performance,logic,circuits,constructed,soi,process,technologies",0.00,dram
"refreshing of cells remains necessary but unlike with tc dram reads in t dram are non destructive the stored charge causes a detectable shift in the threshold voltage of the transistor performance wise access times are significantly better than capacitor based drams but slightly worse than sram there are several types of t drams the commercialized z ram from innovative silicon the ttram from renesas and the a ram from the ugrcnrs consortium
",refreshing cells remains necessary unlike tc dram reads dram non destructive stored charge causes detectable shift threshold voltage transistor performance wise access times significantly better capacitor based drams slightly worse sram types drams commercialized z ram innovative silicon ttram renesas ram ugrcnrs consortium,6.74,"refreshing,cells,remains,necessary,unlike,tc,dram,reads,dram,non,destructive,stored,charge,causes,detectable,shift,threshold,voltage,transistor,performance,wise,access,times,significantly,better,capacitor,based,drams,slightly,worse,sram,types,drams,commercialized,z,ram,innovative,silicon,ttram,renesas,ram,ugrcnrs,consortium",0.00,dram
"dram cells are laid out in a regular rectangular grid like pattern to facilitate their control and access via wordlines and bitlines the physical layout of the dram cells in an array is typically designed so that two adjacent dram cells in a column share a single bitline contact to reduce their area dram cell area is given as n f where n is a number derived from the dram cell design and f is the smallest feature size of a given process technology this scheme permits comparison of dram size over different process technology generations as dram cell area scales at linear or near linear rates with respect to feature size the typical area for modern dram cells varies between  f
",dram cells laid regular rectangular grid like pattern facilitate control access wordlines bitlines physical layout dram cells array typically designed adjacent dram cells column share single bitline contact reduce area dram cell area given n f n number derived dram cell design f smallest feature size given process technology scheme permits comparison dram size different process technology generations dram cell area scales linear near linear rates respect feature size typical area modern dram cells varies f,6.73,"dram,cells,laid,regular,rectangular,grid,like,pattern,facilitate,control,access,wordlines,bitlines,physical,layout,dram,cells,array,typically,designed,adjacent,dram,cells,column,share,single,bitline,contact,reduce,area,dram,cell,area,given,n,f,n,number,derived,dram,cell,design,f,smallest,feature,size,given,process,technology,scheme,permits,comparison,dram,size,different,process,technology,generations,dram,cell,area,scales,linear,near,linear,rates,respect,feature,size,typical,area,modern,dram,cells,varies,f",0.00,dram
"the horizontal wire the wordline is connected to the gate terminal of every access transistor in its row the vertical bitline is connected to the source terminal of the transistors in its column the lengths of the wordlines and bitlines are limited the wordline length is limited by the desired performance of the array since propagation time of the signal that must transverse the wordline is determined by the rc time constant the bitline length is limited by its capacitance  which must be kept within a range for proper sensing  bitline length is also limited by the amount of operating current the dram can draw and by how power can be dissipated since these two characteristics are largely determined by the charging and discharging of the bitline
",horizontal wire wordline connected gate terminal access transistor row vertical bitline connected source terminal transistors column lengths wordlines bitlines limited wordline length limited desired performance array propagation time signal transverse wordline determined rc time constant bitline length limited capacitance kept range proper sensing bitline length limited operating current dram draw power dissipated characteristics largely determined charging discharging bitline,9.15,"horizontal,wire,wordline,connected,gate,terminal,access,transistor,row,vertical,bitline,connected,source,terminal,transistors,column,lengths,wordlines,bitlines,limited,wordline,length,limited,desired,performance,array,propagation,time,signal,transverse,wordline,determined,rc,time,constant,bitline,length,limited,capacitance,kept,range,proper,sensing,bitline,length,limited,operating,current,dram,draw,power,dissipated,characteristics,largely,determined,charging,discharging,bitline",0.00,dram
"sense amplifiers are required to read the state contained in the dram cells when the access transistor is activated the electrical charge in the capacitor is shared with the bitline the bitlines capacitance is much greater than that of the capacitor  thus the change in bitline voltage is minute sense amplifiers are required to resolve the voltage differential into the levels specified by the logic signaling system modern drams use differential sense amplifiers and are accompanied by requirements as to how the dram arrays are constructed differential sense amplifiers work by driving their outputs to opposing extremes based on the relative voltages on pairs of bitlines the sense amplifiers function effectively and efficient only if the capacitance and voltages of these bitline pairs are closely matched besides ensuring that the lengths of the bitlines and the number of attached dram cells attached to them are equal two basic architectures to array design have emerged to provide for the requirements of the sense amplifiers open and folded bitline arrays
",sense amplifiers required read state contained dram cells access transistor activated electrical charge capacitor shared bitline bitlines capacitance greater capacitor change bitline voltage minute sense amplifiers required resolve voltage differential levels specified logic signaling system modern drams use differential sense amplifiers accompanied requirements dram arrays constructed differential sense amplifiers work driving outputs opposing extremes based relative voltages pairs bitlines sense amplifiers function effectively efficient capacitance voltages bitline pairs closely matched ensuring lengths bitlines number attached dram cells attached equal basic architectures array design emerged provide requirements sense amplifiers open folded bitline arrays,7.12,"sense,amplifiers,required,read,state,contained,dram,cells,access,transistor,activated,electrical,charge,capacitor,shared,bitline,bitlines,capacitance,greater,capacitor,change,bitline,voltage,minute,sense,amplifiers,required,resolve,voltage,differential,levels,specified,logic,signaling,system,modern,drams,use,differential,sense,amplifiers,accompanied,requirements,dram,arrays,constructed,differential,sense,amplifiers,work,driving,outputs,opposing,extremes,based,relative,voltages,pairs,bitlines,sense,amplifiers,function,effectively,efficient,capacitance,voltages,bitline,pairs,closely,matched,ensuring,lengths,bitlines,number,attached,dram,cells,attached,equal,basic,architectures,array,design,emerged,provide,requirements,sense,amplifiers,open,folded,bitline,arrays",0.00,dram
"the first generation  dram ics up until the  kbit generation  had open bitline array architectures in these architectures the bitlines are divided into multiple segments and the differential sense amplifiers are placed in between bitline segments because the sense amplifiers are placed between bitline segments to route their outputs outside the array an additional layer of interconnect placed above those used to construct the wordlines and bitlines is required
",generation dram ics kbit generation open bitline array architectures architectures bitlines divided multiple segments differential sense amplifiers placed bitline segments sense amplifiers placed bitline segments route outputs outside array additional layer interconnect placed construct wordlines bitlines required,6.88,"generation,dram,ics,kbit,generation,open,bitline,array,architectures,architectures,bitlines,divided,multiple,segments,differential,sense,amplifiers,placed,bitline,segments,sense,amplifiers,placed,bitline,segments,route,outputs,outside,array,additional,layer,interconnect,placed,construct,wordlines,bitlines,required",0.00,dram
"the dram cells that are on the edges of the array do not have adjacent segments since the differential sense amplifiers require identical capacitance and bitline lengths from both segments dummy bitline segments are provided the advantage of the open bitline array is a smaller array area although this advantage is slightly diminished by the dummy bitline segments the disadvantage that caused the near disappearance of this architecture is the inherent vulnerability to noise which affects the effectiveness of the differential sense amplifiers since each bitline segment does not have any spatial relationship to the other it is likely that noise would affect only one of the two bitline segments
",dram cells edges array adjacent segments differential sense amplifiers require identical capacitance bitline lengths segments dummy bitline segments provided advantage open bitline array smaller array area advantage slightly diminished dummy bitline segments disadvantage caused near disappearance architecture inherent vulnerability noise affects effectiveness differential sense amplifiers bitline segment spatial relationship likely noise affect bitline segments,8.00,"dram,cells,edges,array,adjacent,segments,differential,sense,amplifiers,require,identical,capacitance,bitline,lengths,segments,dummy,bitline,segments,provided,advantage,open,bitline,array,smaller,array,area,advantage,slightly,diminished,dummy,bitline,segments,disadvantage,caused,near,disappearance,architecture,inherent,vulnerability,noise,affects,effectiveness,differential,sense,amplifiers,bitline,segment,spatial,relationship,likely,noise,affect,bitline,segments",0.00,dram
"the folded bitline array architecture routes bitlines in pairs throughout the array the close proximity of the paired bitlines provide superior common mode noise rejection characteristics over open bitline arrays the folded bitline array architecture began appearing in dram ics during the mid s beginning with the  kbit generation this architecture is favored in modern dram ics for its superior noise immunity
",folded bitline array architecture routes bitlines pairs array close proximity paired bitlines provide superior common mode noise rejection characteristics open bitline arrays folded bitline array architecture began appearing dram ics mid beginning kbit generation architecture favored modern dram ics superior noise immunity,4.85,"folded,bitline,array,architecture,routes,bitlines,pairs,array,close,proximity,paired,bitlines,provide,superior,common,mode,noise,rejection,characteristics,open,bitline,arrays,folded,bitline,array,architecture,began,appearing,dram,ics,mid,beginning,kbit,generation,architecture,favored,modern,dram,ics,superior,noise,immunity",0.00,dram
"this architecture is referred to as folded because it takes its basis from the open array architecture from the perspective of the circuit schematic the folded array architecture appears to remove dram cells in alternate pairs  from a column then move the dram cells from an adjacent column into the voids
",architecture referred folded takes basis open array architecture perspective circuit schematic folded array architecture appears remove dram cells alternate pairs column dram cells adjacent column voids,8.17,"architecture,referred,folded,takes,basis,open,array,architecture,perspective,circuit,schematic,folded,array,architecture,appears,remove,dram,cells,alternate,pairs,column,dram,cells,adjacent,column,voids",0.00,dram
"the first dram integrated circuits did not have any redundancy an integrated circuit with a defective dram cell would be discarded beginning with the  kbit generation dram arrays have included spare rows and columns to improve yields spare rows and columns provide tolerance of minor fabrication defects which have caused a small number of rows or columns to be inoperable the defective rows and columns are physically disconnected from the rest of the array by a triggering a programmable fuse or by cutting the wire by a laser the spare rows or columns are substituted in by remapping logic in the row and column decoders 
",dram integrated circuits redundancy integrated circuit defective dram cell discarded beginning kbit generation dram arrays included spare rows columns improve yields spare rows columns provide tolerance minor fabrication defects caused small number rows columns inoperable defective rows columns physically disconnected rest array triggering programmable fuse cutting wire laser spare rows columns substituted remapping logic row column decoders,7.68,"dram,integrated,circuits,redundancy,integrated,circuit,defective,dram,cell,discarded,beginning,kbit,generation,dram,arrays,included,spare,rows,columns,improve,yields,spare,rows,columns,provide,tolerance,minor,fabrication,defects,caused,small,number,rows,columns,inoperable,defective,rows,columns,physically,disconnected,rest,array,triggering,programmable,fuse,cutting,wire,laser,spare,rows,columns,substituted,remapping,logic,row,column,decoders",0.00,dram
"electrical or magnetic interference inside a computer system can cause a single bit of dram to spontaneously flip to the opposite state the majority of one off  errors in dram chips occur as a result of background radiation chiefly neutrons from cosmic ray secondaries which may change the contents of one or more memory cells or interfere with the circuitry used to readwrite them
",electrical magnetic interference inside computer system cause single bit dram spontaneously flip opposite state majority errors dram chips occur result background radiation chiefly neutrons cosmic ray secondaries change contents memory cells interfere circuitry readwrite,7.85,"electrical,magnetic,interference,inside,computer,system,cause,single,bit,dram,spontaneously,flip,opposite,state,majority,errors,dram,chips,occur,result,background,radiation,chiefly,neutrons,cosmic,ray,secondaries,change,contents,memory,cells,interfere,circuitry,readwrite",0.00,dram
