Unclean,Clean,Noise_Pre_Processing,Training_Data,Noise_Post_Processing,Query
"pseudostatic ram  is dynamic ram with built in refresh and address control circuitry to make it behave similarly to static ram  it combines the high density of dram with the ease of use of true sram psram is used in the apple iphone and other embedded systems such as xflar platform
",pseudostatic ram dynamic ram built refresh address control circuitry behave similarly static ram combines high density dram ease use true sram psram apple iphone embedded systems xflar platform,8.13,"pseudostatic,ram,dynamic,ram,built,refresh,address,control,circuitry,behave,similarly,static,ram,combines,high,density,dram,ease,use,true,sram,psram,apple,iphone,embedded,systems,xflar,platform",0.00,dram
"some dram components have a self refresh mode while this involves much of the same logic that is needed for pseudo static operation this mode is often equivalent to a standby mode it is provided primarily to allow a system to suspend operation of its dram controller to save power without losing data stored in dram rather than to allow operation without a separate dram controller as is in the case of mentioned psrams
",dram components self refresh mode involves logic needed pseudo static operation mode equivalent standby mode provided primarily allow system suspend operation dram controller save power losing data stored dram allow operation separate dram controller case mentioned psrams,8.81,"dram,components,self,refresh,mode,involves,logic,needed,pseudo,static,operation,mode,equivalent,standby,mode,provided,primarily,allow,system,suspend,operation,dram,controller,save,power,losing,data,stored,dram,allow,operation,separate,dram,controller,case,mentioned,psrams",0.00,dram
"an embedded variant of psram was sold by mosys under the name t sram it is a set of small dram banks with an sram cache in front to make it behave much like a true sram it is used in nintendo gamecube and wii video game consoles
",embedded variant psram sold mosys sram set small dram banks sram cache behave like true sram nintendo gamecube wii video game consoles,11.35,"embedded,variant,psram,sold,mosys,sram,set,small,dram,banks,sram,cache,behave,like,true,sram,nintendo,gamecube,wii,video,game,consoles",0.00,dram
