Unclean,Clean,Noise_Pre_Processing,Training_Data,Noise_Post_Processing,Query
"a number of canberras were used by english electric for development work and trials on new equipment it was also used by government establishments such as the royal aircraft establishment and the royal radar establishment the canberra proved to be a useful platform for such work and was used by a number of british tests and trials establishments a number of engine manufacturers were also lent canberras as engine test beds armstrong siddeley for the sapphire bristol siddeley for the olympus de havilland engine company for the gyron junior turbojet and rolls royce limited for the avon ferranti used four different canberra bs for avionics development work
",number canberras english electric development work trials new equipment government establishments royal aircraft establishment royal radar establishment canberra proved useful platform work number british tests trials establishments number engine manufacturers lent canberras engine test beds armstrong siddeley sapphire bristol siddeley olympus de havilland engine company gyron junior turbojet rolls royce limited avon ferranti different canberra bs avionics development work,7.26,"number,canberras,english,electric,development,work,trials,new,equipment,government,establishments,royal,aircraft,establishment,royal,radar,establishment,canberra,proved,useful,platform,work,number,british,tests,trials,establishments,number,engine,manufacturers,lent,canberras,engine,test,beds,armstrong,siddeley,sapphire,bristol,siddeley,olympus,de,havilland,engine,company,gyron,junior,turbojet,rolls,royce,limited,avon,ferranti,different,canberra,bs,avionics,development,work",0.00,canberra
"one example is wv built as a canberra b in  it was lent to armstrong siddeley and fitted with sapphire engines it was later transferred to ferranti for trials for the blackburn buccaneers blue parrot radar and fitted with a b type nose and a buccaneer style radome it next was moved to the aeroplane and armament experimental establishment where it was modified to be used as a water spray tanker aircraft for de icing trials it would fly in front of the aircraft being tested which would fly into the artificial cloud created by the sprayed water to induce icing it was retired in  and later preserved at the newark air museum and is a national benchmark airframe on the national aviation heritage register
",example wv built canberra b lent armstrong siddeley fitted sapphire engines later transferred ferranti trials blackburn buccaneers blue parrot radar fitted b type nose buccaneer style radome moved aeroplane armament experimental establishment modified water spray tanker aircraft de icing trials fly aircraft tested fly artificial cloud created sprayed water induce icing retired later preserved newark air museum national benchmark airframe national aviation heritage register,8.62,"example,wv,built,canberra,b,lent,armstrong,siddeley,fitted,sapphire,engines,later,transferred,ferranti,trials,blackburn,buccaneers,blue,parrot,radar,fitted,b,type,nose,buccaneer,style,radome,moved,aeroplane,armament,experimental,establishment,modified,water,spray,tanker,aircraft,de,icing,trials,fly,aircraft,tested,fly,artificial,cloud,created,sprayed,water,induce,icing,retired,later,preserved,newark,air,museum,national,benchmark,airframe,national,aviation,heritage,register",0.00,canberra
"nuclear weapons in addition to conventional ordnance the canberra was also type approved for tactical nuclear weapon delivery including the mk  b  b and b  plus the red beard and wea  nuclear bombs all nuclear weapons were carried internally
",nuclear weapons addition conventional ordnance canberra type approved tactical nuclear weapon delivery including mk b b b plus red beard wea nuclear bombs nuclear weapons carried internally,4.96,"nuclear,weapons,addition,conventional,ordnance,canberra,type,approved,tactical,nuclear,weapon,delivery,including,mk,b,b,b,plus,red,beard,wea,nuclear,bombs,nuclear,weapons,carried,internally",0.00,canberra
