Unclean,Clean,Noise_Pre_Processing,Training_Data,Noise_Post_Processing,Query
"the initial canberra pr model was shortly succeeded by the improved pr variant which featured greater fuel capacity via wing storage the more powerful ra model of the avon engine and maxaret antilock braking system the canberra pr was the final photo reconnaissance version this aircraft was furnished with a new crew compartment a redesigned inner wing section and much more powerful ra avons in later service bomber models of the canberra were often converted with cameras and other equipment suited for reconnaissance purposes
",initial canberra pr model shortly succeeded improved pr variant featured greater fuel capacity wing storage powerful ra model avon engine maxaret antilock braking system canberra pr final photo reconnaissance version aircraft furnished new crew compartment redesigned inner wing section powerful ra avons later service bomber models canberra converted cameras equipment suited reconnaissance purposes,5.85,"initial,canberra,pr,model,shortly,succeeded,improved,pr,variant,featured,greater,fuel,capacity,wing,storage,powerful,ra,model,avon,engine,maxaret,antilock,braking,system,canberra,pr,final,photo,reconnaissance,version,aircraft,furnished,new,crew,compartment,redesigned,inner,wing,section,powerful,ra,avons,later,service,bomber,models,canberra,converted,cameras,equipment,suited,reconnaissance,purposes",0.00,canberra
"to enable crews to convert to flying the canberra a trainer version was developed to meet air ministry specification t on  june  the prototype designated t conducted its first flight it was the same basic design as the b apart from the introduction of side by side seating for the pilot and the instructor and the replacement of the glazed nose with a solid nose the first production t flew on  september  and the variant entered service with no  operational conversion unit raf in early  in addition to those assigned to the operational conversion unit all of the b equipped bomber squadrons received at least one t for training purposes
",enable crews convert flying canberra trainer version developed meet air ministry specification june prototype designated conducted flight basic design b apart introduction seating pilot instructor replacement glazed nose solid nose production flew september variant entered service operational conversion unit raf early addition assigned operational conversion unit b equipped bomber squadrons received training purposes,8.92,"enable,crews,convert,flying,canberra,trainer,version,developed,meet,air,ministry,specification,june,prototype,designated,conducted,flight,basic,design,b,apart,introduction,seating,pilot,instructor,replacement,glazed,nose,solid,nose,production,flew,september,variant,entered,service,operational,conversion,unit,raf,early,addition,assigned,operational,conversion,unit,b,equipped,bomber,squadrons,received,training,purposes",0.00,canberra
"in addition to the raf other users adopted the canberra in the trainer role the indian air force  operated a number of t aircraft for conversion training purposes the raaf adopted the australian built canberra t model which was broadly similar to the t argentina procured a pair of t trainers during the s
",addition raf users adopted canberra trainer role indian air force operated number aircraft conversion training purposes raaf adopted australian built canberra model broadly similar argentina procured pair trainers,8.50,"addition,raf,users,adopted,canberra,trainer,role,indian,air,force,operated,number,aircraft,conversion,training,purposes,raaf,adopted,australian,built,canberra,model,broadly,similar,argentina,procured,pair,trainers",0.00,canberra
"the english electric canberra is a bomber aircraft powered by two jet engines and able to fly at high altitudes an early prototype operated by rolls royce regularly flew to  ft where the usable speed range  was only  knots during avon engine test flights the overall design has been described as being of a simple nature somewhat resembling a scaled up gloster meteor fighter except for its use of a mid wing the canberra principally differed from its preceding piston powered wartime bombers by its use of twin rolls royce avon turbojet engines the fuselage was circular in cross section tapered at both ends and cockpit aside entirely without protrusions the line of the large low aspect ratio wings was broken only by the tubular engine nacelles the canberra had a two man crew in a fighter style cabin with a large blown canopy but delays in the development of the intended automatic radar bombsight resulted in the addition of a bomb aimers position housed within the nose the pilot and navigator were positioned in a tandem arrangement on martin baker ejection seats
",english electric canberra bomber aircraft powered jet engines able fly high altitudes early prototype operated rolls royce regularly flew ft usable speed range knots avon engine test flights overall design described simple nature somewhat resembling scaled gloster meteor fighter use mid wing canberra principally differed preceding piston powered wartime bombers use twin rolls royce avon turbojet engines fuselage circular cross section tapered ends cockpit aside entirely protrusions line large low aspect ratio wings broken tubular engine nacelles canberra man crew fighter style cabin large blown canopy delays development intended automatic radar bombsight resulted addition bomb aimers position housed nose pilot navigator positioned tandem arrangement martin baker ejection seats,6.99,"english,electric,canberra,bomber,aircraft,powered,jet,engines,able,fly,high,altitudes,early,prototype,operated,rolls,royce,regularly,flew,ft,usable,speed,range,knots,avon,engine,test,flights,overall,design,described,simple,nature,somewhat,resembling,scaled,gloster,meteor,fighter,use,mid,wing,canberra,principally,differed,preceding,piston,powered,wartime,bombers,use,twin,rolls,royce,avon,turbojet,engines,fuselage,circular,cross,section,tapered,ends,cockpit,aside,entirely,protrusions,line,large,low,aspect,ratio,wings,broken,tubular,engine,nacelles,canberra,man,crew,fighter,style,cabin,large,blown,canopy,delays,development,intended,automatic,radar,bombsight,resulted,addition,bomb,aimers,position,housed,nose,pilot,navigator,positioned,tandem,arrangement,martin,baker,ejection,seats",0.00,canberra
"the wing is of single spar construction that passes through the aircrafts fuselage the wingspan and total length of the canberra are almost identical at just under  ft  outboard of the engine nacelles the wing has a leading edge sweep of  and trailing edge sweep of  all flight controls are manual using push rods rather than cables but are otherwise conventional these actuate the aircrafts flight control surfaces including shrouded nosed ailerons four section conventional split type flaps and atypical airbrakes which comprise  hydraulically raised fingers located on the top and bottom surfaces of the wings swept wings were considered but not adopted since the expected operational speeds did not warrant them and because they could have introduced new aerodynamic problems into what was otherwise anticipated to be a straightforward replacement for raf hawker typhoon and westland whirlwind fighter bombers
",wing single spar construction passes aircrafts fuselage wingspan total length canberra identical ft outboard engine nacelles wing leading edge sweep trailing edge sweep flight controls manual push rods cables conventional actuate aircrafts flight control surfaces including shrouded nosed ailerons section conventional split type flaps atypical airbrakes comprise hydraulically raised fingers located surfaces wings swept wings considered adopted expected operational speeds warrant introduced new aerodynamic problems anticipated straightforward replacement raf hawker typhoon westland whirlwind fighter bombers,7.11,"wing,single,spar,construction,passes,aircrafts,fuselage,wingspan,total,length,canberra,identical,ft,outboard,engine,nacelles,wing,leading,edge,sweep,trailing,edge,sweep,flight,controls,manual,push,rods,cables,conventional,actuate,aircrafts,flight,control,surfaces,including,shrouded,nosed,ailerons,section,conventional,split,type,flaps,atypical,airbrakes,comprise,hydraulically,raised,fingers,located,surfaces,wings,swept,wings,considered,adopted,expected,operational,speeds,warrant,introduced,new,aerodynamic,problems,anticipated,straightforward,replacement,raf,hawker,typhoon,westland,whirlwind,fighter,bombers",0.00,canberra
"the fuselage of the canberra is of semi monocoque construction with a pressurised nose compartment the whole lower section of the fuselage is taken up by the sizeable bomb bay with a pair of hydraulically driven doors the canberras undercarriage used a simple arrangement the main landing gear being equipped with a single outboard mounted wheel and the nose gear being a twin wheel arrangement due to the use of a new alloy dtd the undercarriage suffered from stress corrosion cracking cracks would appear within only a few years the hazard posed by an undercarriage collapse during landing led the raf to institute regular inspections at first using radiography before moving to more effective and reliable ultrasound technology the canberra structure is mainly metal with only the forward portion of the tail fin made from wood
",fuselage canberra semi monocoque construction pressurised nose compartment lower section fuselage taken sizeable bomb bay pair hydraulically driven doors canberras undercarriage simple arrangement main landing gear equipped single outboard mounted wheel nose gear twin wheel arrangement use new alloy dtd undercarriage suffered stress corrosion cracking cracks appear years hazard posed undercarriage collapse landing led raf institute regular inspections radiography moving effective reliable ultrasound technology canberra structure mainly metal forward portion tail fin wood,7.58,"fuselage,canberra,semi,monocoque,construction,pressurised,nose,compartment,lower,section,fuselage,taken,sizeable,bomb,bay,pair,hydraulically,driven,doors,canberras,undercarriage,simple,arrangement,main,landing,gear,equipped,single,outboard,mounted,wheel,nose,gear,twin,wheel,arrangement,use,new,alloy,dtd,undercarriage,suffered,stress,corrosion,cracking,cracks,appear,years,hazard,posed,undercarriage,collapse,landing,led,raf,institute,regular,inspections,radiography,moving,effective,reliable,ultrasound,technology,canberra,structure,mainly,metal,forward,portion,tail,fin,wood",0.00,canberra
"various avionics were installed on the canberra many with their origins during the second world war they included gee h navigation rebecca beacon interrogation distance measuring equipment very high frequency radio radio compass radar altimeter identification friend or foe and orange putter radar warning receiver perhaps the most crucial of the mission systems was the hs automatic radar bombsight which was mounted in the nose delays in the development of the hs intended for the canberra led to early aircraft being fitted with a t optical sight for visual bombing the optical sight was considerably inferior to radar aiming when used from high altitudes
",avionics installed canberra origins second world war included gee h navigation rebecca beacon interrogation distance measuring equipment high frequency radio radio compass radar altimeter identification friend foe orange putter radar warning receiver crucial mission systems hs automatic radar bombsight mounted nose delays development hs intended canberra led early aircraft fitted optical sight visual bombing optical sight considerably inferior radar aiming high altitudes,6.37,"avionics,installed,canberra,origins,second,world,war,included,gee,h,navigation,rebecca,beacon,interrogation,distance,measuring,equipment,high,frequency,radio,radio,compass,radar,altimeter,identification,friend,foe,orange,putter,radar,warning,receiver,crucial,mission,systems,hs,automatic,radar,bombsight,mounted,nose,delays,development,hs,intended,canberra,led,early,aircraft,fitted,optical,sight,visual,bombing,optical,sight,considerably,inferior,radar,aiming,high,altitudes",0.00,canberra
"the value of the canberra experience cannot be over estimated it is the only modern tactical strike and reconnaissance aircraft in service with the raf and many other air forces more canberra aircraft are in service with foreign countries than the viscount which holds the record for british civil aircraft this is due to the flexibility of the canberra in its operational roles and performance 
",value canberra experience estimated modern tactical strike reconnaissance aircraft service raf air forces canberra aircraft service foreign countries viscount holds record british civil aircraft flexibility canberra operational roles performance,9.09,"value,canberra,experience,estimated,modern,tactical,strike,reconnaissance,aircraft,service,raf,air,forces,canberra,aircraft,service,foreign,countries,viscount,holds,record,british,civil,aircraft,flexibility,canberra,operational,roles,performance",0.00,canberra
"the canberra could deploy many conventional weapons typical weapons used were  pound  pound and  pound bombs the total bomb load could weigh up to  lb  two bomb bays are housed within the fuselage  normally enclosed by conventional clam she will doors a rotating door was substituted for these on the martin built b  canberras additional stores of up to  pounds  could be carried upon underwing pylons operators often developed and installed their own munitions such as rhodesias antipersonnel bomblets the alpha bomb a varied range of munitions was employed on canberra fleets around the world antipersonnel flechette bombs were tested successfully from the canberra by rhodesia but not used operationally due to international agreements
",canberra deploy conventional weapons typical weapons pound pound pound bombs total bomb load weigh lb bomb bays housed fuselage normally enclosed conventional clam doors rotating door substituted martin built b canberras additional stores pounds carried underwing pylons operators developed installed munitions rhodesias antipersonnel bomblets alpha bomb varied range munitions employed canberra fleets world antipersonnel flechette bombs tested successfully canberra rhodesia operationally international agreements,6.90,"canberra,deploy,conventional,weapons,typical,weapons,pound,pound,pound,bombs,total,bomb,load,weigh,lb,bomb,bays,housed,fuselage,normally,enclosed,conventional,clam,doors,rotating,door,substituted,martin,built,b,canberras,additional,stores,pounds,carried,underwing,pylons,operators,developed,installed,munitions,rhodesias,antipersonnel,bomblets,alpha,bomb,varied,range,munitions,employed,canberra,fleets,world,antipersonnel,flechette,bombs,tested,successfully,canberra,rhodesia,operationally,international,agreements",0.00,canberra
"in part due to its range limitation of just  miles  and its inability to carry the early bulky nuclear bombs the canberra was typically employed in the role of a tactical bomber as opposed to that of a strategic onen  in british service many of the canberras that were stationed overseas were not modified to deliver nuclear weapons until as late as 
",range limitation miles inability carry early bulky nuclear bombs canberra typically employed role tactical bomber opposed strategic onen british service canberras stationed overseas modified deliver nuclear weapons late,9.69,"range,limitation,miles,inability,carry,early,bulky,nuclear,bombs,canberra,typically,employed,role,tactical,bomber,opposed,strategic,onen,british,service,canberras,stationed,overseas,modified,deliver,nuclear,weapons,late",0.00,canberra
"the canberra b started to enter service with  squadron in january  with  squadron being fully equipped by may and a further squadron no  squadron equipping by the end of the year the production of the canberra was accelerated as a result of the outbreak of the korean war orders for the aircraft increased and outpaced production capacity as the aircraft was designated as a super priority a further five squadrons were able to be equipped with the canberra by the end of  however production in the  period had only been half of the level planned due to shortages in skilled manpower material and suitable machine tools
",canberra b started enter service squadron january squadron fully equipped squadron squadron equipping end year production canberra accelerated result outbreak korean war orders aircraft increased outpaced production capacity aircraft designated super priority squadrons able equipped canberra end production period half level planned shortages skilled manpower material suitable machine tools,9.19,"canberra,b,started,enter,service,squadron,january,squadron,fully,equipped,squadron,squadron,equipping,end,year,production,canberra,accelerated,result,outbreak,korean,war,orders,aircraft,increased,outpaced,production,capacity,aircraft,designated,super,priority,squadrons,able,equipped,canberra,end,production,period,half,level,planned,shortages,skilled,manpower,material,suitable,machine,tools",0.00,canberra
"the canberra replaced mosquitos lincolns and washingtons as front line bombers showing a drastically improved performance and proving to be effectively immune from interception during air defence exercises until the arrival of the hawker hunter the canberra also replaced the rafs mosquitos in the reconnaissance role with the canberra pr entering service in december  the improved canberra b with more powerful engines and a greater fuel capacity started to supplement the bs in the uk based squadrons of bomber command from june  when they replaced  squadrons bs this freed up older bs to allow canberra squadrons to form overseas with bomber and reconnaissance canberra wings forming in raf germany and on cyprus with squadrons also being deployed to the far east
",canberra replaced mosquitos lincolns washingtons line bombers showing drastically improved performance proving effectively immune interception air defence exercises arrival hawker hunter canberra replaced rafs mosquitos reconnaissance role canberra pr entering service december improved canberra b powerful engines greater fuel capacity started supplement bs uk based squadrons bomber command june replaced squadrons bs freed older bs allow canberra squadrons form overseas bomber reconnaissance canberra wings forming raf germany cyprus squadrons deployed far east,6.39,"canberra,replaced,mosquitos,lincolns,washingtons,line,bombers,showing,drastically,improved,performance,proving,effectively,immune,interception,air,defence,exercises,arrival,hawker,hunter,canberra,replaced,rafs,mosquitos,reconnaissance,role,canberra,pr,entering,service,december,improved,canberra,b,powerful,engines,greater,fuel,capacity,started,supplement,bs,uk,based,squadrons,bomber,command,june,replaced,squadrons,bs,freed,older,bs,allow,canberra,squadrons,form,overseas,bomber,reconnaissance,canberra,wings,forming,raf,germany,cyprus,squadrons,deployed,far,east",0.00,canberra
"the pr variant of the canberra fitted with avon  engines executed a  reconnaissance flight over the soviet rocket launch and development site at kapustin yar although the uk government has never admitted the existence of such a flight warned by either radar or agents inside the british government the soviets slightly damaged one aircraft further reconnaissance flights are alleged to have taken place along and over the borders of the soviet union in  under the code name project robin using the canberra b wh the usaf also used the canberra for reconnaissance flights the aircraft were no longer required after june  following the introduction of the us lockheed you  purpose built reconnaissance aircraft project robin was then terminated these raf canberra overflights were later featured in the  bbc timewatch episode spies in the sky and included interviews with some of the soviet mig  pilots who had attempted to intercept them
",pr variant canberra fitted avon engines executed reconnaissance flight soviet rocket launch development site kapustin yar uk government admitted existence flight warned radar agents inside british government soviets slightly damaged aircraft reconnaissance flights alleged taken place borders soviet union code project robin canberra b wh usaf canberra reconnaissance flights aircraft longer required june following introduction lockheed purpose built reconnaissance aircraft project robin terminated raf canberra overflights later featured bbc timewatch episode spies sky included interviews soviet mig pilots attempted intercept,7.47,"pr,variant,canberra,fitted,avon,engines,executed,reconnaissance,flight,soviet,rocket,launch,development,site,kapustin,yar,uk,government,admitted,existence,flight,warned,radar,agents,inside,british,government,soviets,slightly,damaged,aircraft,reconnaissance,flights,alleged,taken,place,borders,soviet,union,code,project,robin,canberra,b,wh,usaf,canberra,reconnaissance,flights,aircraft,longer,required,june,following,introduction,lockheed,purpose,built,reconnaissance,aircraft,project,robin,terminated,raf,canberra,overflights,later,featured,bbc,timewatch,episode,spies,sky,included,interviews,soviet,mig,pilots,attempted,intercept",0.00,canberra
"the canberra was the victorious aircraft flown in the last great air race from london to christchurch in  piloted by flight lieutenant roland  burton which touched down at christchurch  minutes ahead of its closest rival after  hours and  minutes in the air to this day the record has never been broken
",canberra victorious aircraft flown great air race london christchurch piloted flight lieutenant roland burton touched christchurch minutes ahead closest rival hours minutes air day record broken,8.25,"canberra,victorious,aircraft,flown,great,air,race,london,christchurch,piloted,flight,lieutenant,roland,burton,touched,christchurch,minutes,ahead,closest,rival,hours,minutes,air,day,record,broken",0.00,canberra
"the vickers valiant entered service in  capable of carrying much heavier weapon loads  over longer ranges than the canberra this led to the bomber command force of canberras equipped for high level conventional bombing to be gradually phased out this did not mean the end of the canberra in front line service as it proved suitable for the low level strike and ground attack role and versions dedicated to this role were brought into service the interim b converted from the b by adding provision for a pack of four hispano  mm cannon in the rear bomb bay and underwing pylons for bombs and rockets entered service in  with the definitive new build b which added a new forward fuselage with a fighter style canopy for the pilot entering service in january 
",vickers valiant entered service capable carrying heavier weapon loads longer ranges canberra led bomber command force canberras equipped high level conventional bombing gradually phased mean end canberra line service proved suitable low level strike ground attack role versions dedicated role brought service interim b converted b adding provision pack hispano mm cannon rear bomb bay underwing pylons bombs rockets entered service definitive new build b added new forward fuselage fighter style canopy pilot entering service january,7.40,"vickers,valiant,entered,service,capable,carrying,heavier,weapon,loads,longer,ranges,canberra,led,bomber,command,force,canberras,equipped,high,level,conventional,bombing,gradually,phased,mean,end,canberra,line,service,proved,suitable,low,level,strike,ground,attack,role,versions,dedicated,role,brought,service,interim,b,converted,b,adding,provision,pack,hispano,mm,cannon,rear,bomb,bay,underwing,pylons,bombs,rockets,entered,service,definitive,new,build,b,added,new,forward,fuselage,fighter,style,canopy,pilot,entering,service,january",0.00,canberra
"bomber command retired the last of its canberras on  september  but the germany cyprus and singapore based squadrons continued in the nuclear strike role the cyprus based squadrons and one of the raf germany squadrons disbanded in  with the singapore based unit followed in  the three remaining raf germany units which by now had replaced the old mark  bombs with newer  b nuclear bombs remained operational until  the last canberra bombers in raf service
",bomber command retired canberras september germany cyprus singapore based squadrons continued nuclear strike role cyprus based squadrons raf germany squadrons disbanded singapore based unit followed remaining raf germany units replaced old mark bombs newer b nuclear bombs remained operational canberra bombers raf service,6.80,"bomber,command,retired,canberras,september,germany,cyprus,singapore,based,squadrons,continued,nuclear,strike,role,cyprus,based,squadrons,raf,germany,squadrons,disbanded,singapore,based,unit,followed,remaining,raf,germany,units,replaced,old,mark,bombs,newer,b,nuclear,bombs,remained,operational,canberra,bombers,raf,service",0.00,canberra
