Unclean,Clean,Noise_Pre_Processing,Training_Data,Noise_Post_Processing,Query
"around  herman moll produced a map showing the northern part of the ob river and the irtysh river a major tributary of the ob as components of a series of partly joined waterways taking the boundary between europe and asia from the turkish straits and the don river all the way to the arctic ocean in  he produced a more up to date map that was easier to read however his proposal to adhere to major rivers as the line of demarcation was never taken up by other geographers who were beginning to move away from the idea of water boundaries as the only legitimate divides between europe and asia
",herman moll produced map showing northern ob river irtysh river major tributary ob components series partly joined waterways taking boundary europe asia turkish straits river way arctic ocean produced date map easier read proposal adhere major rivers line demarcation taken geographers beginning away idea water boundaries legitimate divides europe asia,10.08,"herman,moll,produced,map,showing,northern,ob,river,irtysh,river,major,tributary,ob,components,series,partly,joined,waterways,taking,boundary,europe,asia,turkish,straits,river,way,arctic,ocean,produced,date,map,easier,read,proposal,adhere,major,rivers,line,demarcation,taken,geographers,beginning,away,idea,water,boundaries,legitimate,divides,europe,asia",0.00,europe
"four years later in  philip johan von strahlenberg was the first to depart from the classical don boundary he drew a new line along the volga following the volga north until the samara bend along obshchy syrt  then north and east along the latter waterway to its source in the ural mountains at this point he proposed that mountain ranges could be included as boundaries between continents as alternatives to nearby waterways accordingly he drew the new boundary north along ural mountains rather than the nearby and parallel running ob and irtysh rivers this was endorsed by the russian empire and introduced the convention that would eventually become commonly accepted however this did not come without criticism voltaire writing in  about peter the greats efforts to make russia more european ignored the whole boundary question with his claim that neither russia scandinavia northern germany nor poland were fully part of europe since then many modern analytical geographers like halford mackinder have declared that they see little validity in the ural mountains as a boundary between continents
",years later philip johan von strahlenberg depart classical boundary drew new line volga following volga north samara bend obshchy syrt north east waterway source ural mountains point proposed mountain ranges included boundaries continents alternatives nearby waterways accordingly drew new boundary north ural mountains nearby parallel running ob irtysh rivers endorsed russian empire introduced convention eventually commonly accepted come criticism voltaire writing peter greats efforts russia european ignored boundary question claim russia scandinavia northern germany poland fully europe modern analytical geographers like halford mackinder declared little validity ural mountains boundary continents,7.80,"years,later,philip,johan,von,strahlenberg,depart,classical,boundary,drew,new,line,volga,following,volga,north,samara,bend,obshchy,syrt,north,east,waterway,source,ural,mountains,point,proposed,mountain,ranges,included,boundaries,continents,alternatives,nearby,waterways,accordingly,drew,new,boundary,north,ural,mountains,nearby,parallel,running,ob,irtysh,rivers,endorsed,russian,empire,introduced,convention,eventually,commonly,accepted,come,criticism,voltaire,writing,peter,greats,efforts,russia,european,ignored,boundary,question,claim,russia,scandinavia,northern,germany,poland,fully,europe,modern,analytical,geographers,like,halford,mackinder,declared,little,validity,ural,mountains,boundary,continents",0.00,europe
"in russia and the soviet union the boundary along the kumamanych depression was the most commonly used as early as  in  the soviet geographical society formally recommended that the boundary between the europe and asia be drawn in textbooks from baydaratskaya bay on the kara sea along the eastern foot of ural mountains then following the ural river until the mugodzhar hills and then the emba river and kumamanych depression thus placing the caucasus entirely in asia and the urals entirely in europe however most geographers in the soviet union favoured the boundary along the caucasus crest and this became the common convention in the later th century although the kumamanych boundary remained in use in some th century maps
",russia soviet union boundary kumamanych depression commonly early soviet geographical society formally recommended boundary europe asia drawn textbooks baydaratskaya bay kara sea eastern foot ural mountains following ural river mugodzhar hills emba river kumamanych depression placing caucasus entirely asia urals entirely europe geographers soviet union favoured boundary caucasus crest common convention later th century kumamanych boundary remained use th century maps,8.08,"russia,soviet,union,boundary,kumamanych,depression,commonly,early,soviet,geographical,society,formally,recommended,boundary,europe,asia,drawn,textbooks,baydaratskaya,bay,kara,sea,eastern,foot,ural,mountains,following,ural,river,mugodzhar,hills,emba,river,kumamanych,depression,placing,caucasus,entirely,asia,urals,entirely,europe,geographers,soviet,union,favoured,boundary,caucasus,crest,common,convention,later,th,century,kumamanych,boundary,remained,use,th,century,maps",0.00,europe
"some view separation of eurasia into asia and europe as a residue of eurocentrism in physical cultural and historical diversity china and india are comparable to the entire european landmass not to a single european country 
",view separation eurasia asia europe residue eurocentrism physical cultural historical diversity china india comparable entire european landmass single european country,7.11,"view,separation,eurasia,asia,europe,residue,eurocentrism,physical,cultural,historical,diversity,china,india,comparable,entire,european,landmass,single,european,country",0.00,europe
"during the  million years of the pleistocene numerous cold phases called glacials  or significant advances of continental ice sheets in europe and north america occurred at intervals of approximately  to  years the long glacial periods were separated by more temperate and shorter interglacials which lasted about  years the last cold episode of the last glacial period ended about  years ago earth is currently in an interglacial period of the quaternary called the holocene
",million years pleistocene numerous cold phases called glacials significant advances continental ice sheets europe north america occurred intervals approximately years long glacial periods separated temperate shorter interglacials lasted years cold episode glacial period ended years ago earth currently interglacial period quaternary called holocene,6.30,"million,years,pleistocene,numerous,cold,phases,called,glacials,significant,advances,continental,ice,sheets,europe,north,america,occurred,intervals,approximately,years,long,glacial,periods,separated,temperate,shorter,interglacials,lasted,years,cold,episode,glacial,period,ended,years,ago,earth,currently,interglacial,period,quaternary,called,holocene",0.00,europe
"homo erectus georgicus which lived roughly  million years ago in georgia is the earliest hominin to have been discovered in europe other hominin remains dating back roughly  million years have been discovered in atapuerca spain neanderthal man  appeared in europe  years ago  and disappeared from the fossil record about  years ago with their final refuge being the iberian peninsula the neanderthals were supplanted by modern humans  who appeared in europe around  to  years ago homo sapiens arrived in europe around  years ago some  years earlier than previously thought the earliest sites in europe dated  years ago are riparo mochi  geissenklsterle  and isturitz 
",homo erectus georgicus lived roughly million years ago georgia earliest hominin discovered europe hominin remains dating roughly million years discovered atapuerca spain neanderthal man appeared europe years ago disappeared fossil record years ago final refuge iberian peninsula neanderthals supplanted modern humans appeared europe years ago homo sapiens arrived europe years ago years earlier previously thought earliest sites europe dated years ago riparo mochi geissenklsterle isturitz,5.54,"homo,erectus,georgicus,lived,roughly,million,years,ago,georgia,earliest,hominin,discovered,europe,hominin,remains,dating,roughly,million,years,discovered,atapuerca,spain,neanderthal,man,appeared,europe,years,ago,disappeared,fossil,record,years,ago,final,refuge,iberian,peninsula,neanderthals,supplanted,modern,humans,appeared,europe,years,ago,homo,sapiens,arrived,europe,years,ago,years,earlier,previously,thought,earliest,sites,europe,dated,years,ago,riparo,mochi,geissenklsterle,isturitz",0.00,europe
"the european neolithic periodmarked by the cultivation of crops and the raising of livestock increased numbers of settlements and the widespread use of potterybegan around  bce in greece and the balkans probably influenced by earlier farming practices in anatolia and the near east it spread from the balkans along the valleys of the danube and the rhine  and along the mediterranean coast  between  and  bce these central european neolithic cultures developed further to the west and the north transmitting newly acquired skills in producing copper artifacts in western europe the neolithic period was characterised not by large agricultural settlements but by field monuments such as causewayed enclosures burial mounds and megalithic tombs the corded ware cultural horizon flourished at the transition from the neolithic to the chalcolithic during this period giant megalithic monuments such as the megalithic temples of malta and stonehenge were constructed throughout western and southern europe
",european neolithic periodmarked cultivation crops raising livestock increased numbers settlements widespread use potterybegan bce greece balkans probably influenced earlier farming practices anatolia near east spread balkans valleys danube rhine mediterranean coast bce central european neolithic cultures developed west north transmitting newly acquired skills producing copper artifacts western europe neolithic period characterised large agricultural settlements field monuments causewayed enclosures burial mounds megalithic tombs corded ware cultural horizon flourished transition neolithic chalcolithic period giant megalithic monuments megalithic temples malta stonehenge constructed western southern europe,6.69,"european,neolithic,periodmarked,cultivation,crops,raising,livestock,increased,numbers,settlements,widespread,use,potterybegan,bce,greece,balkans,probably,influenced,earlier,farming,practices,anatolia,near,east,spread,balkans,valleys,danube,rhine,mediterranean,coast,bce,central,european,neolithic,cultures,developed,west,north,transmitting,newly,acquired,skills,producing,copper,artifacts,western,europe,neolithic,period,characterised,large,agricultural,settlements,field,monuments,causewayed,enclosures,burial,mounds,megalithic,tombs,corded,ware,cultural,horizon,flourished,transition,neolithic,chalcolithic,period,giant,megalithic,monuments,megalithic,temples,malta,stonehenge,constructed,western,southern,europe",0.00,europe
"the modern native populations of europe largely descend from three distinct lineages mesolithic hunter gatherers a derivative of the cro magnon population of europe neolithic farmers who migrated from anatolia during the neolithic revolution and yamnaya pastoralists who expanded into europe in the context of the indo european migrations the european bronze age began c  bce in greece with the minoan civilisation on crete the first advanced civilisation in europe the minoans were followed by the myceneans who collapsed suddenly around  bce ushering the european iron age iron age colonisation by the greeks and phoenicians gave rise to early mediterranean cities early iron age italy and greece from around the th century bce gradually gave rise to historical classical antiquity whose beginning is sometimes dated to  bce the year of the first olympic games
",modern native populations europe largely descend distinct lineages mesolithic hunter gatherers derivative cro magnon population europe neolithic farmers migrated anatolia neolithic revolution yamnaya pastoralists expanded europe context indo european migrations european bronze age began c bce greece minoan civilisation crete advanced civilisation europe minoans followed myceneans collapsed suddenly bce ushering european iron age iron age colonisation greeks phoenicians gave rise early mediterranean cities early iron age italy greece th century bce gradually gave rise historical classical antiquity beginning dated bce year olympic games,5.91,"modern,native,populations,europe,largely,descend,distinct,lineages,mesolithic,hunter,gatherers,derivative,cro,magnon,population,europe,neolithic,farmers,migrated,anatolia,neolithic,revolution,yamnaya,pastoralists,expanded,europe,context,indo,european,migrations,european,bronze,age,began,c,bce,greece,minoan,civilisation,crete,advanced,civilisation,europe,minoans,followed,myceneans,collapsed,suddenly,bce,ushering,european,iron,age,iron,age,colonisation,greeks,phoenicians,gave,rise,early,mediterranean,cities,early,iron,age,italy,greece,th,century,bce,gradually,gave,rise,historical,classical,antiquity,beginning,dated,bce,year,olympic,games",0.00,europe
"ancient greece was the founding culture of western civilisation western democratic and rationalist culture are often attributed to ancient greece the greek city state the polis was the fundamental political unit of classical greece in  bce cleisthenes instituted the worlds first democratic system of government in athens the greek political ideals were rediscovered in the late th century by european philosophers and idealists greece also generated many cultural contributions in philosophy humanism and rationalism under aristotle socrates and plato in history with herodotus and thucydides in dramatic and narrative verse starting with the epic poems of homer in drama with sophocles and euripides in medicine with hippocrates and galen and in science with pythagoras euclid and archimedes in the course of the th century bce several of the greek city states would ultimately check the achaemenid persian advance in europe through the greco persian wars considered a pivotal moment in world history as the  years of peace that followed are known as golden age of athens the seminal period of ancient greece that laid many of the foundations of western civilisation 
",ancient greece founding culture western civilisation western democratic rationalist culture attributed ancient greece greek city state polis fundamental political unit classical greece bce cleisthenes instituted worlds democratic system government athens greek political ideals rediscovered late th century european philosophers idealists greece generated cultural contributions philosophy humanism rationalism aristotle socrates plato history herodotus thucydides dramatic narrative verse starting epic poems homer drama sophocles euripides medicine hippocrates galen science pythagoras euclid archimedes course th century bce greek city states ultimately check achaemenid persian advance europe greco persian wars considered pivotal moment world history years peace followed known golden age athens seminal period ancient greece laid foundations western civilisation,6.41,"ancient,greece,founding,culture,western,civilisation,western,democratic,rationalist,culture,attributed,ancient,greece,greek,city,state,polis,fundamental,political,unit,classical,greece,bce,cleisthenes,instituted,worlds,democratic,system,government,athens,greek,political,ideals,rediscovered,late,th,century,european,philosophers,idealists,greece,generated,cultural,contributions,philosophy,humanism,rationalism,aristotle,socrates,plato,history,herodotus,thucydides,dramatic,narrative,verse,starting,epic,poems,homer,drama,sophocles,euripides,medicine,hippocrates,galen,science,pythagoras,euclid,archimedes,course,th,century,bce,greek,city,states,ultimately,check,achaemenid,persian,advance,europe,greco,persian,wars,considered,pivotal,moment,world,history,years,peace,followed,known,golden,age,athens,seminal,period,ancient,greece,laid,foundations,western,civilisation",0.00,europe
"expanding from their base in central italy beginning in the third century bce the romans gradually expanded to eventually rule the entire mediterranean basin and western europe by the turn of the millennium the roman republic ended in  bce when augustus proclaimed the roman empire the two centuries that followed are known as the pax romana a period of unprecedented peace prosperity and political stability in most of europe the empire continued to expand under emperors such as antoninus pius and marcus aurelius who spent time on the empires northern border fighting germanic pictish and scottish tribes christianity was legalised by constantine i in  ce after three centuries of imperial persecution constantine also permanently moved the capital of the empire from rome to the city of byzantium  which was renamed constantinople in his honour in  ce christianity became the sole official religion of the empire in  ce and in  ce the emperor theodosius outlawed pagan religions this is sometimes considered to mark the end of antiquity alternatively antiquity is considered to end with the fall of the western roman empire in  ce the closure of the pagan platonic academy of athens in  ce or the rise of islam in the early th century ce during most of its existence the byzantine empire was one of the most powerful economic cultural and military forces in europe
",expanding base central italy beginning century bce romans gradually expanded eventually rule entire mediterranean basin western europe turn millennium roman republic ended bce augustus proclaimed roman empire centuries followed known pax romana period unprecedented peace prosperity political stability europe empire continued expand emperors antoninus pius marcus aurelius spent time empires northern border fighting germanic pictish scottish tribes christianity legalised constantine ce centuries imperial persecution constantine permanently moved capital empire rome city byzantium renamed constantinople honour ce christianity sole official religion empire ce ce emperor theodosius outlawed pagan religions considered mark end antiquity alternatively antiquity considered end fall western roman empire ce closure pagan platonic academy athens ce rise islam early th century ce existence byzantine empire powerful economic cultural military forces europe,7.52,"expanding,base,central,italy,beginning,century,bce,romans,gradually,expanded,eventually,rule,entire,mediterranean,basin,western,europe,turn,millennium,roman,republic,ended,bce,augustus,proclaimed,roman,empire,centuries,followed,known,pax,romana,period,unprecedented,peace,prosperity,political,stability,europe,empire,continued,expand,emperors,antoninus,pius,marcus,aurelius,spent,time,empires,northern,border,fighting,germanic,pictish,scottish,tribes,christianity,legalised,constantine,ce,centuries,imperial,persecution,constantine,permanently,moved,capital,empire,rome,city,byzantium,renamed,constantinople,honour,ce,christianity,sole,official,religion,empire,ce,ce,emperor,theodosius,outlawed,pagan,religions,considered,mark,end,antiquity,alternatively,antiquity,considered,end,fall,western,roman,empire,ce,closure,pagan,platonic,academy,athens,ce,rise,islam,early,th,century,ce,existence,byzantine,empire,powerful,economic,cultural,military,forces,europe",0.00,europe
"during the decline of the roman empire europe entered a long period of change arising from what historians call the age of migrations there were numerous invasions and migrations amongst the ostrogoths visigoths goths vandals huns franks angles saxons slavs avars bulgars and later on the vikings pechenegs cumans and magyars renaissance thinkers such as petrarch would later refer to this as the dark ages
",decline roman empire europe entered long period change arising historians age migrations numerous invasions migrations ostrogoths visigoths goths vandals huns franks angles saxons slavs avars bulgars later vikings pechenegs cumans magyars renaissance thinkers petrarch later refer dark ages,6.63,"decline,roman,empire,europe,entered,long,period,change,arising,historians,age,migrations,numerous,invasions,migrations,ostrogoths,visigoths,goths,vandals,huns,franks,angles,saxons,slavs,avars,bulgars,later,vikings,pechenegs,cumans,magyars,renaissance,thinkers,petrarch,later,refer,dark,ages",0.00,europe
"isolated monastic communities were the only places to safeguard and compile written knowledge accumulated previously apart from this very few written records survive and much literature philosophy mathematics and other thinking from the classical period disappeared from western europe though they were preserved in the east in the byzantine empire
",isolated monastic communities places safeguard compile written knowledge accumulated previously apart written records survive literature philosophy mathematics thinking classical period disappeared western europe preserved east byzantine empire,6.59,"isolated,monastic,communities,places,safeguard,compile,written,knowledge,accumulated,previously,apart,written,records,survive,literature,philosophy,mathematics,thinking,classical,period,disappeared,western,europe,preserved,east,byzantine,empire",0.00,europe
"while the roman empire in the west continued to decline roman traditions and the roman state remained strong in the predominantly greek speaking eastern roman empire also known as the byzantine empire during most of its existence the byzantine empire was the most powerful economic cultural and military force in europe emperor justinian i presided over constantinoples first golden age he established a legal code that forms the basis of many modern legal systems funded the construction of the hagia sophia and brought the christian church under state control
",roman empire west continued decline roman traditions roman state remained strong predominantly greek speaking eastern roman empire known byzantine empire existence byzantine empire powerful economic cultural military force europe emperor justinian presided constantinoples golden age established legal code forms basis modern legal systems funded construction hagia sophia brought christian church state control,6.58,"roman,empire,west,continued,decline,roman,traditions,roman,state,remained,strong,predominantly,greek,speaking,eastern,roman,empire,known,byzantine,empire,existence,byzantine,empire,powerful,economic,cultural,military,force,europe,emperor,justinian,presided,constantinoples,golden,age,established,legal,code,forms,basis,modern,legal,systems,funded,construction,hagia,sophia,brought,christian,church,state,control",0.00,europe
"during the dark ages the western roman empire fell under the control of various tribes the germanic and slav tribes established their domains over western and eastern europe respectively eventually the frankish tribes were united under clovis i charlemagne a frankish king of the carolingian dynasty who had conquered most of western europe was anointed holy roman emperor by the pope in  this led in  to the founding of the holy roman empire which eventually became centred in the german principalities of central europe
",dark ages western roman empire fell control tribes germanic slav tribes established domains western eastern europe respectively eventually frankish tribes united clovisi charlemagne frankish king carolingian dynasty conquered western europe anointed holy roman emperor pope led founding holy roman empire eventually centred german principalities central europe,7.28,"dark,ages,western,roman,empire,fell,control,tribes,germanic,slav,tribes,established,domains,western,eastern,europe,respectively,eventually,frankish,tribes,united,clovisi,charlemagne,frankish,king,carolingian,dynasty,conquered,western,europe,anointed,holy,roman,emperor,pope,led,founding,holy,roman,empire,eventually,centred,german,principalities,central,europe",0.00,europe
