Unclean,Clean,Noise_Pre_Processing,Training_Data,Noise_Post_Processing,Query
"the geology of europe is hugely varied and complex and gives rise to the wide variety of landscapes found across the continent from the scottish highlands to the rolling plains of hungary europes most significant feature is the dichotomy between highland and mountainous southern europe and a vast partially underwater northern plain ranging from ireland in the west to the ural mountains in the east these two halves are separated by the mountain chains of the pyrenees and alpscarpathians the northern plains are delimited in the west by the scandinavian mountains and the mountainous parts of the british isles major shallow water bodies submerging parts of the northern plains are the celtic sea the north sea the baltic sea complex and barents sea
",geology europe hugely varied complex gives rise wide variety landscapes found continent scottish highlands rolling plains hungary europes significant feature dichotomy highland mountainous southern europe vast partially underwater northern plain ranging ireland west ural mountains east halves separated mountain chains pyrenees alpscarpathians northern plains delimited west scandinavian mountains mountainous parts british isles major shallow water bodies submerging parts northern plains celtic sea north sea baltic sea complex barents sea,7.17,"geology,europe,hugely,varied,complex,gives,rise,wide,variety,landscapes,found,continent,scottish,highlands,rolling,plains,hungary,europes,significant,feature,dichotomy,highland,mountainous,southern,europe,vast,partially,underwater,northern,plain,ranging,ireland,west,ural,mountains,east,halves,separated,mountain,chains,pyrenees,alpscarpathians,northern,plains,delimited,west,scandinavian,mountains,mountainous,parts,british,isles,major,shallow,water,bodies,submerging,parts,northern,plains,celtic,sea,north,sea,baltic,sea,complex,barents,sea",0.00,europe
"the northern plain contains the old geological continent of baltica and so may be regarded geologically as the main continent while peripheral highlands and mountainous regions in the south and west constitute fragments from various other geological continents most of the older geology of western europe existed as part of the ancient microcontinent avalonia
",northern plain contains old geological continent baltica regarded geologically main continent peripheral highlands mountainous regions south west constitute fragments geological continents older geology western europe existed ancient microcontinent avalonia,6.94,"northern,plain,contains,old,geological,continent,baltica,regarded,geologically,main,continent,peripheral,highlands,mountainous,regions,south,west,constitute,fragments,geological,continents,older,geology,western,europe,existed,ancient,microcontinent,avalonia",0.00,europe
"having lived side by side with agricultural peoples for millennia europes animals and plants have been profoundly affected by the presence and activities of man with the exception of fennoscandia and northern russia few areas of untouched wilderness are currently found in europe except for various national parks
",lived agricultural peoples millennia europes animals plants profoundly affected presence activities man exception fennoscandia northern russia areas untouched wilderness currently found europe national parks,7.64,"lived,agricultural,peoples,millennia,europes,animals,plants,profoundly,affected,presence,activities,man,exception,fennoscandia,northern,russia,areas,untouched,wilderness,currently,found,europe,national,parks",0.00,europe
"the main natural vegetation cover in europe is mixed forest the conditions for growth are very favourable in the north the gulf stream and north atlantic drift warm the continent southern europe could be described as having a warm but mild climate there are frequent summer droughts in this region mountain ridges also affect the conditions some of these  are oriented eastwest and allow the wind to carry large masses of water from the ocean in the interior others are oriented southnorth  and because the rain falls primarily on the side of mountains that is oriented towards the sea forests grow well on this side while on the other side the conditions are much less favourable few corners of mainland europe have not been grazed by livestock at some point in time and the cutting down of the preagricultural forest habitat caused disruption to the original plant and animal ecosystems
",main natural vegetation cover europe mixed forest conditions growth favourable north gulf stream north atlantic drift warm continent southern europe described warm mild climate frequent summer droughts region mountain ridges affect conditions oriented eastwest allow wind carry large masses water ocean interior oriented southnorth rain falls primarily mountains oriented sea forests grow conditions favourable corners mainland europe grazed livestock point time cutting preagricultural forest habitat caused disruption original plant animal ecosystems,8.89,"main,natural,vegetation,cover,europe,mixed,forest,conditions,growth,favourable,north,gulf,stream,north,atlantic,drift,warm,continent,southern,europe,described,warm,mild,climate,frequent,summer,droughts,region,mountain,ridges,affect,conditions,oriented,eastwest,allow,wind,carry,large,masses,water,ocean,interior,oriented,southnorth,rain,falls,primarily,mountains,oriented,sea,forests,grow,conditions,favourable,corners,mainland,europe,grazed,livestock,point,time,cutting,preagricultural,forest,habitat,caused,disruption,original,plant,animal,ecosystems",0.00,europe
"possibly  to  percent of europe was once covered by forest it stretched from the mediterranean sea to the arctic ocean although over half of europes original forests disappeared through the centuries of deforestation europe still has over one quarter of its land area as forest such as the broadleaf and mixed forests taiga of scandinavia and russia mixed rainforests of the caucasus and the cork oak forests in the western mediterranean during recent times deforestation has been slowed and many trees have been planted however in many cases monoculture plantations of conifers have replaced the original mixed natural forest because these grow quicker the plantations now cover vast areas of land but offer poorer habitats for many european forest dwelling species which require a mixture of tree species and diverse forest structure the amount of natural forest in western europe is just  or less while in its western russia its  the european country with the smallest percentage of forested area is iceland  while the most forested country is finland 
",possibly percent europe covered forest stretched mediterranean sea arctic ocean half europes original forests disappeared centuries deforestation europe quarter land area forest broadleaf mixed forests taiga scandinavia russia mixed rainforests caucasus cork oak forests western mediterranean recent times deforestation slowed trees planted cases monoculture plantations conifers replaced original mixed natural forest grow quicker plantations cover vast areas land offer poorer habitats european forest dwelling species require mixture tree species diverse forest structure natural forest western europe western russia european country smallest percentage forested area iceland forested country finland,7.67,"possibly,percent,europe,covered,forest,stretched,mediterranean,sea,arctic,ocean,half,europes,original,forests,disappeared,centuries,deforestation,europe,quarter,land,area,forest,broadleaf,mixed,forests,taiga,scandinavia,russia,mixed,rainforests,caucasus,cork,oak,forests,western,mediterranean,recent,times,deforestation,slowed,trees,planted,cases,monoculture,plantations,conifers,replaced,original,mixed,natural,forest,grow,quicker,plantations,cover,vast,areas,land,offer,poorer,habitats,european,forest,dwelling,species,require,mixture,tree,species,diverse,forest,structure,natural,forest,western,europe,western,russia,european,country,smallest,percentage,forested,area,iceland,forested,country,finland",0.00,europe
"in temperate europe mixed forest with both broadleaf and coniferous trees dominate the most important species in central and western europe are beech and oak in the north the taiga is a mixed sprucepinebirch forest further north within russia and extreme northern scandinavia the taiga gives way to tundra as the arctic is approached in the mediterranean many olive trees have been planted which are very well adapted to its arid climate mediterranean cypress is also widely planted in southern europe the semi arid mediterranean region hosts much scrub forest a narrow eastwest tongue of eurasian grassland  extends westwards from ukraine and southern russia and ends in hungary and traverses into taiga to the north
",temperate europe mixed forest broadleaf coniferous trees dominate important species central western europe beech oak north taiga mixed sprucepinebirch forest north russia extreme northern scandinavia taiga gives way tundra arctic approached mediterranean olive trees planted adapted arid climate mediterranean cypress widely planted southern europe semi arid mediterranean region hosts scrub forest narrow eastwest tongue eurasian grassland extends westwards ukraine southern russia ends hungary traverses taiga north,6.82,"temperate,europe,mixed,forest,broadleaf,coniferous,trees,dominate,important,species,central,western,europe,beech,oak,north,taiga,mixed,sprucepinebirch,forest,north,russia,extreme,northern,scandinavia,taiga,gives,way,tundra,arctic,approached,mediterranean,olive,trees,planted,adapted,arid,climate,mediterranean,cypress,widely,planted,southern,europe,semi,arid,mediterranean,region,hosts,scrub,forest,narrow,eastwest,tongue,eurasian,grassland,extends,westwards,ukraine,southern,russia,ends,hungary,traverses,taiga,north",0.00,europe
"glaciation during the most recent ice age and the presence of man affected the distribution of european fauna as for the animals in many parts of europe most large animals and top predator species have been hunted to extinction the woolly mammoth was extinct before the end of the neolithic period today wolves  and bears  are endangered once they were found in most parts of europe however deforestation and hunting caused these animals to withdraw further and further by the middle ages the bears habitats were limited to more or less inaccessible mountains with sufficient forest cover today the brown bear lives primarily in the balkan peninsula scandinavia and russia a small number also persist in other countries across europe  but in these areas brown bear populations are fragmented and marginalised because of the destruction of their habitat in addition polar bears may be found on svalbard a norwegian archipelago far north of scandinavia the wolf the second largest predator in europe after the brown bear can be found primarily in central and eastern europe and in the balkans with a handful of packs in pockets of western europe 
",glaciation recent ice age presence man affected distribution european fauna animals parts europe large animals predator species hunted extinction woolly mammoth extinct end neolithic period today wolves bears endangered found parts europe deforestation hunting caused animals withdraw middle ages bears habitats limited inaccessible mountains sufficient forest cover today brown bear lives primarily balkan peninsula scandinavia russia small number persist countries europe areas brown bear populations fragmented marginalised destruction habitat addition polar bears found svalbard norwegian archipelago far north scandinavia wolf second largest predator europe brown bear found primarily central eastern europe balkans handful packs pockets western europe,8.03,"glaciation,recent,ice,age,presence,man,affected,distribution,european,fauna,animals,parts,europe,large,animals,predator,species,hunted,extinction,woolly,mammoth,extinct,end,neolithic,period,today,wolves,bears,endangered,found,parts,europe,deforestation,hunting,caused,animals,withdraw,middle,ages,bears,habitats,limited,inaccessible,mountains,sufficient,forest,cover,today,brown,bear,lives,primarily,balkan,peninsula,scandinavia,russia,small,number,persist,countries,europe,areas,brown,bear,populations,fragmented,marginalised,destruction,habitat,addition,polar,bears,found,svalbard,norwegian,archipelago,far,north,scandinavia,wolf,second,largest,predator,europe,brown,bear,found,primarily,central,eastern,europe,balkans,handful,packs,pockets,western,europe",0.00,europe
"biodiversity is protected in europe through the council of europes bern convention which has also been signed by the european community as well as non european states
",biodiversity protected europe council europes bern convention signed european community non european states,8.38,"biodiversity,protected,europe,council,europes,bern,convention,signed,european,community,non,european,states",0.00,europe
"the political map of europe is substantially derived from the re organisation of europe following the napoleonic wars in  the prevalent form of government in europe is parliamentary democracy in most cases in the form of republic in  the prevalent form of government was still the monarchy europes remaining eleven monarchies are constitutional
",political map europe substantially derived organisation europe following napoleonic wars prevalent form government europe parliamentary democracy cases form republic prevalent form government monarchy europes remaining monarchies constitutional,7.54,"political,map,europe,substantially,derived,organisation,europe,following,napoleonic,wars,prevalent,form,government,europe,parliamentary,democracy,cases,form,republic,prevalent,form,government,monarchy,europes,remaining,monarchies,constitutional",0.00,europe
"european integration is the process of political legal economic  integration of european states as it has been pursued by the powers sponsoring the council of europe since the end of the second world war the european union has been the focus of economic integration on the continent since its foundation in  more recently the eurasian economic union has been established as a counterpart comprising former soviet states
",european integration process political legal economic integration european states pursued powers sponsoring council europe end second world war european union focus economic integration continent foundation recently eurasian economic union established counterpart comprising soviet states,7.86,"european,integration,process,political,legal,economic,integration,european,states,pursued,powers,sponsoring,council,europe,end,second,world,war,european,union,focus,economic,integration,continent,foundation,recently,eurasian,economic,union,established,counterpart,comprising,soviet,states",0.00,europe
"the list below includes all internationally recognized sovereign countries falling even partially under any common geographical or political definitions of europe
",list includes internationally recognized sovereign countries falling partially common geographical political definitions europe,4.91,"list,includes,internationally,recognized,sovereign,countries,falling,partially,common,geographical,political,definitions,europe",0.00,europe
"several dependencies and similar territories with broad autonomy are also found within or close to europe this includes land  two autonomous territories of the kingdom of denmark  three crown dependencies and two british overseas territories svalbard is also included due to its unique status within norway although it is not autonomous not included are the three countries of the united kingdom with devolved powers and the two autonomous regions of portugal which despite having a unique degree of autonomy are not largely self governing in matters other than international affairs areas with little more than a unique tax status such as the canary islands and heligoland are also not included for this reason
",dependencies similar territories broad autonomy found close europe includes land autonomous territories kingdom denmark crown dependencies british overseas territories svalbard included unique status norway autonomous included countries united kingdom devolved powers autonomous regions portugal despite unique degree autonomy largely self governing matters international affairs areas little unique tax status canary islands heligoland included reason,8.29,"dependencies,similar,territories,broad,autonomy,found,close,europe,includes,land,autonomous,territories,kingdom,denmark,crown,dependencies,british,overseas,territories,svalbard,included,unique,status,norway,autonomous,included,countries,united,kingdom,devolved,powers,autonomous,regions,portugal,despite,unique,degree,autonomy,largely,self,governing,matters,international,affairs,areas,little,unique,tax,status,canary,islands,heligoland,included,reason",0.00,europe
"as a continent the economy of europe is currently the largest on earth and it is the richest region as measured by assets under management with over  trillion compared to north americas  trillion in  in  europe remained the wealthiest region its  trillion in assets under management represented one third of the worlds wealth it was one of several regions where wealth surpassed its precrisis year end peak as with other continents europe has a large variation of wealth among its countries the richer states tend to be in the west followed by central europeans while some of the eastern europe economies are still emerging from the collapse of the soviet union and the breakup of yugoslavia
",continent economy europe currently largest earth richest region measured assets management trillion compared north americas trillion europe remained wealthiest region trillion assets management represented worlds wealth regions wealth surpassed precrisis year end peak continents europe large variation wealth countries richer states tend west followed central europeans eastern europe economies emerging collapse soviet union breakup yugoslavia,8.82,"continent,economy,europe,currently,largest,earth,richest,region,measured,assets,management,trillion,compared,north,americas,trillion,europe,remained,wealthiest,region,trillion,assets,management,represented,worlds,wealth,regions,wealth,surpassed,precrisis,year,end,peak,continents,europe,large,variation,wealth,countries,richer,states,tend,west,followed,central,europeans,eastern,europe,economies,emerging,collapse,soviet,union,breakup,yugoslavia",0.00,europe
"capitalism has been dominant in the western world since the end of feudalism from britain it gradually spread throughout europe the industrial revolution started in europe specifically the united kingdom in the late th century and the th century saw western europe industrialise economies were disrupted by the first world war but by the beginning of the second world war they had recovered and were having to compete with the growing economic strength of the united states the second world war again damaged much of europes industries
",capitalism dominant western world end feudalism britain gradually spread europe industrial revolution started europe specifically united kingdom late th century th century saw western europe industrialise economies disrupted world war beginning second world war recovered compete growing economic strength united states second world war damaged europes industries,7.46,"capitalism,dominant,western,world,end,feudalism,britain,gradually,spread,europe,industrial,revolution,started,europe,specifically,united,kingdom,late,th,century,th,century,saw,western,europe,industrialise,economies,disrupted,world,war,beginning,second,world,war,recovered,compete,growing,economic,strength,united,states,second,world,war,damaged,europes,industries",0.00,europe
"with the fall of communism in central and eastern europe in  the post socialist states began free market reforms
",fall communism central eastern europe post socialist states began free market reforms,6.19,"fall,communism,central,eastern,europe,post,socialist,states,began,free,market,reforms",0.00,europe
"by the millennium change the eu dominated the economy of europe comprising the five largest european economies of the time germany the united kingdom france italy and spain in   of the  members of the eu joined the eurozone replacing their former national currencies by the common euro the three who chose to remain outside the eurozone were the united kingdom denmark and sweden the european union is now the largest economy in the worldbetter source needed
",millennium change eu dominated economy europe comprising largest european economies time germany united kingdom france italy spain members eu joined eurozone replacing national currencies common euro chose remain outside eurozone united kingdom denmark sweden european union largest economy worldbettersourceneeded,7.63,"millennium,change,eu,dominated,economy,europe,comprising,largest,european,economies,time,germany,united,kingdom,france,italy,spain,members,eu,joined,eurozone,replacing,national,currencies,common,euro,chose,remain,outside,eurozone,united,kingdom,denmark,sweden,european,union,largest,economy,worldbettersourceneeded",0.00,europe
"figures released by eurostat in  confirmed that the eurozone had gone into recession in  it impacted much of the region in  fears of a sovereign debt crisis developed concerning some countries in europe especially greece ireland spain and portugal as a result measures were taken especially for greece by the leading countries of the eurozone the eu  unemployment rate was  in  for those aged  it was 
",figures released eurostat confirmed eurozone gone recession impacted region fears sovereign debt crisis developed concerning countries europe especially greece ireland spain portugal result measures taken especially greece leading countries eurozone eu unemployment rate aged,7.96,"figures,released,eurostat,confirmed,eurozone,gone,recession,impacted,region,fears,sovereign,debt,crisis,developed,concerning,countries,europe,especially,greece,ireland,spain,portugal,result,measures,taken,especially,greece,leading,countries,eurozone,eu,unemployment,rate,aged",0.00,europe
"in  the population of europe was estimated to be  million according to the  revision of the world population prospects which is slightly more than one ninth of the worlds populationc
a century ago europe had nearly a quarter of the worlds population the population of europe has grown in the past century but in other areas of the world  the population has grown far more quickly among the continents europe has a relatively high population density second only to asia most of europe is in a mode of sub replacement fertility which means that each new generation is being less populous than the older
the most densely populated country in europe  is the microstate of monaco
",population europe estimated million according revision world population prospects slightly ninth worlds populationca century ago europe nearly quarter worlds population population europe grown past century areas world population grown far quickly continents europe relatively high population density second asia europe mode sub replacement fertility means new generation populous olderthe densely populated country europe microstate monaco,9.04,"population,europe,estimated,million,according,revision,world,population,prospects,slightly,ninth,worlds,populationca,century,ago,europe,nearly,quarter,worlds,population,population,europe,grown,past,century,areas,world,population,grown,far,quickly,continents,europe,relatively,high,population,density,second,asia,europe,mode,sub,replacement,fertility,means,new,generation,populous,olderthe,densely,populated,country,europe,microstate,monaco",0.00,europe
"pan and pfeil  count  distinct peoples of europe of which  form the majority population in at least one sovereign state while the remaining  constitute ethnic minorities
according to un population projection europes population may fall to about  of world population by  or  million people  within this context significant disparities exist between regions in relation to fertility rates the average number of children per female of child bearing age is  according to some sources this rate is higher among muslims in europe the un predicts a steady population decline in central and eastern europe as a result of emigration and low birth rates
",pan pfeil count distinct peoples europe form majority population sovereign state remaining constitute ethnic minoritiesaccording un population projection europes population fall world population million people context significant disparities exist regions relation fertility rates average number children female child bearing age according sources rate higher muslims europe un predicts steady population decline central eastern europe result emigration low birth rates,6.52,"pan,pfeil,count,distinct,peoples,europe,form,majority,population,sovereign,state,remaining,constitute,ethnic,minoritiesaccording,un,population,projection,europes,population,fall,world,population,million,people,context,significant,disparities,exist,regions,relation,fertility,rates,average,number,children,female,child,bearing,age,according,sources,rate,higher,muslims,europe,un,predicts,steady,population,decline,central,eastern,europe,result,emigration,low,birth,rates",0.00,europe
