Unclean,Clean,Noise_Pre_Processing,Training_Data,Noise_Post_Processing,Query
"east central europe saw the creation of the first slavic states and the adoption of christianity  the powerful west slavic state of great moravia spread its territory all the way south to the balkans reaching its largest territorial extent under svatopluk i and causing a series of armed conflicts with east francia further south the first south slavic states emerged in the late th and th century and adopted christianity the first bulgarian empire the serbian principality  and the duchy of croatia  to the east kievan rus expanded from its capital in kiev to become the largest state in europe by the th century in  vladimir the great adopted orthodox christianity as the religion of state further east volga bulgaria became an islamic state in the th century but was eventually absorbed into russia several centuries later
",east central europe saw creation slavic states adoption christianity powerful west slavic state great moravia spread territory way south balkans reaching largest territorial extent svatopluk causing series armed conflicts east francia south south slavic states emerged late th th century adopted christianity bulgarian empire serbian principality duchy croatia east kievan rus expanded capital kiev largest state europe th century vladimir great adopted orthodox christianity religion state east volga bulgaria islamic state th century eventually absorbed russia centuries later,7.13,"east,central,europe,saw,creation,slavic,states,adoption,christianity,powerful,west,slavic,state,great,moravia,spread,territory,way,south,balkans,reaching,largest,territorial,extent,svatopluk,causing,series,armed,conflicts,east,francia,south,south,slavic,states,emerged,late,th,th,century,adopted,christianity,bulgarian,empire,serbian,principality,duchy,croatia,east,kievan,rus,expanded,capital,kiev,largest,state,europe,th,century,vladimir,great,adopted,orthodox,christianity,religion,state,east,volga,bulgaria,islamic,state,th,century,eventually,absorbed,russia,centuries,later",0.00,europe
"during the high middle ages the population of europe experienced significant growth culminating in the renaissance of the th century economic growth together with the lack of safety on the mainland trading routes made possible the development of major commercial routes along the coast of the mediterranean and baltic seas the growing wealth and independence acquired by some coastal cities gave the maritime republics a leading role in the european scene
",high middle ages population europe experienced significant growth culminating renaissance th century economic growth lack safety mainland trading routes possible development major commercial routes coast mediterranean baltic seas growing wealth independence acquired coastal cities gave maritime republics leading role european scene,6.58,"high,middle,ages,population,europe,experienced,significant,growth,culminating,renaissance,th,century,economic,growth,lack,safety,mainland,trading,routes,possible,development,major,commercial,routes,coast,mediterranean,baltic,seas,growing,wealth,independence,acquired,coastal,cities,gave,maritime,republics,leading,role,european,scene",0.00,europe
"the middle ages on the mainland were dominated by the two upper echelons of the social structure the nobility and the clergy feudalism developed in france in the early middle ages and soon spread throughout europe a struggle for influence between the nobility and the monarchy in england led to the writing of the magna carta and the establishment of a parliament the primary source of culture in this period came from the roman catholic church through monasteries and cathedral schools the church was responsible for education in much of europe
",middle ages mainland dominated upper echelons social structure nobility clergy feudalism developed france early middle ages soon spread europe struggle influence nobility monarchy england led writing magna carta establishment parliament primary source culture period came roman catholic church monasteries cathedral schools church responsible education europe,8.42,"middle,ages,mainland,dominated,upper,echelons,social,structure,nobility,clergy,feudalism,developed,france,early,middle,ages,soon,spread,europe,struggle,influence,nobility,monarchy,england,led,writing,magna,carta,establishment,parliament,primary,source,culture,period,came,roman,catholic,church,monasteries,cathedral,schools,church,responsible,education,europe",0.00,europe
"the papacy reached the height of its power during the high middle ages an east west schism in  split the former roman empire religiously with the eastern orthodox church in the byzantine empire and the roman catholic church in the former western roman empire in  pope urban ii called for a crusade against muslims occupying jerusalem and the holy land in europe itself the church organised the inquisition against heretics in the iberian peninsula the reconquista concluded with the fall of granada in  ending over seven centuries of islamic rule in the south western peninsula
",papacy reached height power high middle ages east west schism split roman empire religiously eastern orthodox church byzantine empire roman catholic church western roman empire pope urban ii called crusade muslims occupying jerusalem holy land europe church organised inquisition heretics iberian peninsula reconquista concluded fall granada ending seven centuries islamic rule south western peninsula,7.09,"papacy,reached,height,power,high,middle,ages,east,west,schism,split,roman,empire,religiously,eastern,orthodox,church,byzantine,empire,roman,catholic,church,western,roman,empire,pope,urban,ii,called,crusade,muslims,occupying,jerusalem,holy,land,europe,church,organised,inquisition,heretics,iberian,peninsula,reconquista,concluded,fall,granada,ending,seven,centuries,islamic,rule,south,western,peninsula",0.00,europe
"in the east a resurgent byzantine empire recaptured crete and cyprus from the muslims and reconquered the balkans constantinople was the largest and wealthiest city in europe from the th to the th centuries with a population of approximately  the empire was weakened following the defeat at manzikert and was weakened considerably by the sack of constantinople in  during the fourth crusade although it would recover constantinople in  byzantium fell in  when constantinople was taken by the ottoman empire
",east resurgent byzantine empire recaptured crete cyprus muslims reconquered balkans constantinople largest wealthiest city europe th th centuries population approximately empire weakened following defeat manzikert weakened considerably sack constantinople fourth crusade recover constantinople byzantium fell constantinople taken ottoman empire,7.89,"east,resurgent,byzantine,empire,recaptured,crete,cyprus,muslims,reconquered,balkans,constantinople,largest,wealthiest,city,europe,th,th,centuries,population,approximately,empire,weakened,following,defeat,manzikert,weakened,considerably,sack,constantinople,fourth,crusade,recover,constantinople,byzantium,fell,constantinople,taken,ottoman,empire",0.00,europe
"in the th and th centuries constant incursions by nomadic turkic tribes such as the pechenegs and the cuman kipchaks caused a massive migration of slavic populations to the safer heavily forested regions of the north and temporarily halted the expansion of the rus state to the south and east like many other parts of eurasia these territories were overrun by the mongols the invaders who became known as tatars were mostly turkic speaking peoples under mongol suzerainty they established the state of the golden horde with headquarters in crimea which later adopted islam as a religion and ruled over modern day southern and central russia for more than three centuries after the collapse of mongol dominions the first romanian states  emerged in the th century moldavia and walachia previously these territories were under the successive control of pechenegs and cumans from the th to the th centuries the grand duchy of moscow grew from a small principality under mongol rule to the largest state in europe overthrowing the mongols in  and eventually becoming the tsardom of russia the state was consolidated under ivan iii the great and ivan the terrible steadily expanding to the east and south over the next centuries
",th th centuries constant incursions nomadic turkic tribes pechenegs cuman kipchaks caused massive migration slavic populations safer heavily forested regions north temporarily halted expansion rus state south east like parts eurasia territories overrun mongols invaders known tatars turkic speaking peoples mongol suzerainty established state golden horde headquarters crimea later adopted islam religion ruled modern day southern central russia centuries collapse mongol dominions romanian states emerged th century moldavia walachia previously territories successive control pechenegs cumans th th centuries grand duchy moscow grew small principality mongol rule largest state europe overthrowing mongols eventually tsardom russia state consolidated ivan iii great ivan terrible steadily expanding east south centuries,7.84,"th,th,centuries,constant,incursions,nomadic,turkic,tribes,pechenegs,cuman,kipchaks,caused,massive,migration,slavic,populations,safer,heavily,forested,regions,north,temporarily,halted,expansion,rus,state,south,east,like,parts,eurasia,territories,overrun,mongols,invaders,known,tatars,turkic,speaking,peoples,mongol,suzerainty,established,state,golden,horde,headquarters,crimea,later,adopted,islam,religion,ruled,modern,day,southern,central,russia,centuries,collapse,mongol,dominions,romanian,states,emerged,th,century,moldavia,walachia,previously,territories,successive,control,pechenegs,cumans,th,th,centuries,grand,duchy,moscow,grew,small,principality,mongol,rule,largest,state,europe,overthrowing,mongols,eventually,tsardom,russia,state,consolidated,ivan,iii,great,ivan,terrible,steadily,expanding,east,south,centuries",0.00,europe
"the great famine of  was the first crisis that would strike europe in the late middle ages the period between  and  witnessed the heaviest loss the population of france was reduced by half medieval britain was afflicted by  famines and france suffered the effects of  or more in the same period europe was devastated in the mid th century by the black death one of the most deadly pandemics in human history which killed an estimated  million people in europe alonea third of the european population at the time
",great famine crisis strike europe late middle ages period witnessed heaviest loss population france reduced half medieval britain afflicted famines france suffered effects period europe devastated mid th century black death deadly pandemics human history killed estimated million people europe alonea european population time,8.79,"great,famine,crisis,strike,europe,late,middle,ages,period,witnessed,heaviest,loss,population,france,reduced,half,medieval,britain,afflicted,famines,france,suffered,effects,period,europe,devastated,mid,th,century,black,death,deadly,pandemics,human,history,killed,estimated,million,people,europe,alonea,european,population,time",0.00,europe
"the plague had a devastating effect on europes social structure it induced people to live for the moment as illustrated by giovanni boccaccio in the decameron  it was a serious blow to the roman catholic church and led to increased persecution of jews beggars and lepers the plague is thought to have returned every generation with varying virulence and mortalities until the th century during this period more than  plague epidemics swept across europe
",plague devastating effect europes social structure induced people live moment illustrated giovanni boccaccio decameron blow roman catholic church led increased persecution jews beggars lepers plague thought returned generation varying virulence mortalities th century period plague epidemics swept europe,7.93,"plague,devastating,effect,europes,social,structure,induced,people,live,moment,illustrated,giovanni,boccaccio,decameron,blow,roman,catholic,church,led,increased,persecution,jews,beggars,lepers,plague,thought,returned,generation,varying,virulence,mortalities,th,century,period,plague,epidemics,swept,europe",0.00,europe
"the renaissance was a period of cultural change originating in florence and later spreading to the rest of europe the rise of a new humanism was accompanied by the recovery of forgotten classical greek and arabic knowledge from monastic libraries often translated from arabic into latin the renaissance spread across europe between the th and th centuries it saw the flowering of art philosophy music and the sciences under the joint patronage of royalty the nobility the roman catholic church and an emerging merchant class patrons in italy including the medici family of florentine bankers and the popes in rome funded prolific quattrocento and cinquecento artists such as raphael michelangelo and leonardo da vinci
",renaissance period cultural change originating florence later spreading rest europe rise new humanism accompanied recovery forgotten classical greek arabic knowledge monastic libraries translated arabic latin renaissance spread europe th th centuries saw flowering art philosophy music sciences joint patronage royalty nobility roman catholic church emerging merchant class patrons italy including medici family florentine bankers popes rome funded prolific quattrocento cinquecento artists raphael michelangelo leonardo da vinci,6.69,"renaissance,period,cultural,change,originating,florence,later,spreading,rest,europe,rise,new,humanism,accompanied,recovery,forgotten,classical,greek,arabic,knowledge,monastic,libraries,translated,arabic,latin,renaissance,spread,europe,th,th,centuries,saw,flowering,art,philosophy,music,sciences,joint,patronage,royalty,nobility,roman,catholic,church,emerging,merchant,class,patrons,italy,including,medici,family,florentine,bankers,popes,rome,funded,prolific,quattrocento,cinquecento,artists,raphael,michelangelo,leonardo,da,vinci",0.00,europe
"political intrigue within the church in the mid th century caused the western schism during this forty year period two popesone in avignon and one in romeclaimed rulership over the church although the schism was eventually healed in  the papacys spiritual authority had suffered greatly in the th century europe started to extend itself beyond its geographic frontiers spain and portugal the greatest naval powers of the time took the lead in exploring the world exploration reached the southern hemisphere in the atlantic and the southern tip of africa christopher columbus reached the new world in  and vasco da gama opened the ocean route to the east linking the atlantic and indian oceans in  the portuguese born explorer ferdinand magellan reached asia westward across the atlantic and the pacific oceans in a spanish expedition resulting in the first circumnavigation of the globe completed by the spaniard juan sebastin elcano  soon after the spanish and portuguese began establishing large global empires in the americas asia africa and oceania france the netherlands and england soon followed in building large colonial empires with vast holdings in africa the americas and asia in  a spanish armada failed to invade england a year later england tried unsuccessfully to invade spain allowing philip ii of spain to maintain his dominant war capacity in europe this english disaster also allowed the spanish fleet to retain its capability to wage war for the next decades however two more spanish armadas failed to invade england 
",political intrigue church mid th century caused western schism year period popesone avignon romeclaimed rulership church schism eventually healed papacys spiritual authority suffered greatly th century europe started extend geographic frontiers spain portugal greatest naval powers time took lead exploring world exploration reached southern hemisphere atlantic southern tip africa christopher columbus reached new world vasco da gama opened ocean route east linking atlantic indian oceans portuguese born explorer ferdinand magellan reached asia westward atlantic pacific oceans spanish expedition resulting circumnavigation globe completed spaniard juan sebastin elcano soon spanish portuguese began establishing large global empires americas asia africa oceania france netherlands england soon followed building large colonial empires vast holdings africa americas asia spanish armada failed invade england year later england tried unsuccessfully invade spain allowing philip ii spain maintain dominant war capacity europe english disaster allowed spanish fleet retain capability wage war decades spanish armadas failed invade england,6.37,"political,intrigue,church,mid,th,century,caused,western,schism,year,period,popesone,avignon,romeclaimed,rulership,church,schism,eventually,healed,papacys,spiritual,authority,suffered,greatly,th,century,europe,started,extend,geographic,frontiers,spain,portugal,greatest,naval,powers,time,took,lead,exploring,world,exploration,reached,southern,hemisphere,atlantic,southern,tip,africa,christopher,columbus,reached,new,world,vasco,da,gama,opened,ocean,route,east,linking,atlantic,indian,oceans,portuguese,born,explorer,ferdinand,magellan,reached,asia,westward,atlantic,pacific,oceans,spanish,expedition,resulting,circumnavigation,globe,completed,spaniard,juan,sebastin,elcano,soon,spanish,portuguese,began,establishing,large,global,empires,americas,asia,africa,oceania,france,netherlands,england,soon,followed,building,large,colonial,empires,vast,holdings,africa,americas,asia,spanish,armada,failed,invade,england,year,later,england,tried,unsuccessfully,invade,spain,allowing,philip,ii,spain,maintain,dominant,war,capacity,europe,english,disaster,allowed,spanish,fleet,retain,capability,wage,war,decades,spanish,armadas,failed,invade,england",0.00,europe
"the churchs power was further weakened by the protestant reformation in  when german theologian martin luther nailed his ninety five theses criticising the selling of indulgences to the church door he was subsequently excommunicated in the papal bull exsurge domine in  and his followers were condemned in the  diet of worms which divided german princes between protestant and roman catholic faiths religious fighting and warfare spread with protestantism the plunder of the empires of the americas allowed spain to finance religious persecution in europe for over a century the thirty years war  crippled the holy roman empire and devastated much of germany killing between  and  percent of its population in the aftermath of the peace of westphalia france rose to predominance within europe the defeat of the ottoman turks at the battle of vienna in  marked the historic end of ottoman expansion into europe
",churchs power weakened protestant reformation german theologian martin luther nailed ninety theses criticising selling indulgences church door subsequently excommunicated papal bull exsurge domine followers condemned diet worms divided german princes protestant roman catholic faiths religious fighting warfare spread protestantism plunder empires americas allowed spain finance religious persecution europe century thirty years war crippled holy roman empire devastated germany killing percent population aftermath peace westphalia france rose predominance europe defeat ottoman turks battle vienna marked historic end ottoman expansion europe,7.14,"churchs,power,weakened,protestant,reformation,german,theologian,martin,luther,nailed,ninety,theses,criticising,selling,indulgences,church,door,subsequently,excommunicated,papal,bull,exsurge,domine,followers,condemned,diet,worms,divided,german,princes,protestant,roman,catholic,faiths,religious,fighting,warfare,spread,protestantism,plunder,empires,americas,allowed,spain,finance,religious,persecution,europe,century,thirty,years,war,crippled,holy,roman,empire,devastated,germany,killing,percent,population,aftermath,peace,westphalia,france,rose,predominance,europe,defeat,ottoman,turks,battle,vienna,marked,historic,end,ottoman,expansion,europe",0.00,europe
"the th century in central and parts of eastern europe was a period of general decline the region experienced more than  famines in a  year period between  and  from the union of krewo  east central europe was dominated by the kingdom of poland and the grand duchy of lithuania the hegemony of the vast polishlithuanian commonwealth had ended with the devastation brought by the second northern war  and subsequent conflicts the state itself was partitioned and ceased to exist at the end of the th century
",th century central parts eastern europe period general decline region experienced famines year period union krewo east central europe dominated kingdom poland grand duchy lithuania hegemony vast polishlithuanian commonwealth ended devastation brought second northern war subsequent conflicts state partitioned ceased exist end th century,8.30,"th,century,central,parts,eastern,europe,period,general,decline,region,experienced,famines,year,period,union,krewo,east,central,europe,dominated,kingdom,poland,grand,duchy,lithuania,hegemony,vast,polishlithuanian,commonwealth,ended,devastation,brought,second,northern,war,subsequent,conflicts,state,partitioned,ceased,exist,end,th,century",0.00,europe
"the renaissance and the new monarchs marked the start of an age of discovery a period of exploration invention and scientific development among the great figures of the western scientific revolution of the th and th centuries were copernicus kepler galileo and isaac newton according to peter barrett it is widely accepted that modern science arose in the europe of the th century  introducing a new understanding of the natural world
",renaissance new monarchs marked start age discovery period exploration invention scientific development great figures western scientific revolution th th centuries copernicus kepler galileo isaac newton according peter barrett widely accepted modern science arose europe th century introducing new understanding natural world,6.90,"renaissance,new,monarchs,marked,start,age,discovery,period,exploration,invention,scientific,development,great,figures,western,scientific,revolution,th,th,centuries,copernicus,kepler,galileo,isaac,newton,according,peter,barrett,widely,accepted,modern,science,arose,europe,th,century,introducing,new,understanding,natural,world",0.00,europe
"the seven years war brought to an end the old system of alliances in europe consequently when the american revolutionary war turned into a global war between  and  britain found itself opposed by a strong coalition of european powers and lacking any substantial ally
",seven years war brought end old system alliances europe consequently american revolutionary war turned global war britain found opposed strong coalition european powers lacking substantial ally,6.74,"seven,years,war,brought,end,old,system,alliances,europe,consequently,american,revolutionary,war,turned,global,war,britain,found,opposed,strong,coalition,european,powers,lacking,substantial,ally",0.00,europe
