Unclean,Clean,Noise_Pre_Processing,Training_Data,Noise_Post_Processing,Query
"the development policy of germany is an independent area of foreign policy it is formulated by the federal ministry for economic cooperation and development and carried out by the implementing organisations the german government sees development policy as a joint responsibility of the international community it was the worlds second biggest aid donor in  after the united states
",development policy germany independent area foreign policy formulated federal ministry economic cooperation development carried implementing organisations german government sees development policy joint responsibility international community worlds second biggest aid donor united states,6.82,"development,policy,germany,independent,area,foreign,policy,formulated,federal,ministry,economic,cooperation,development,carried,implementing,organisations,german,government,sees,development,policy,joint,responsibility,international,community,worlds,second,biggest,aid,donor,united,states",0.00,germany
"as of january update the bundeswehr has a strength of  active soldiers and  civilians reservists are available to the armed forces and participate in defence exercises and deployments abroad until  military service was compulsory for men at age  but this has been officially suspended and replaced with a voluntary service since  women may serve in all functions of service without restriction according to the stockholm international peace research institute germany was the fourth largest exporter of major arms in the world from  to 
",januaryupdate bundeswehr strength active soldiers civilians reservists available armed forces participate defence exercises deployments abroad military service compulsory men age officially suspended replaced voluntary service women serve functions service restriction according stockholm international peace research institute germany fourth largest exporter major arms world,7.26,"januaryupdate,bundeswehr,strength,active,soldiers,civilians,reservists,available,armed,forces,participate,defence,exercises,deployments,abroad,military,service,compulsory,men,age,officially,suspended,replaced,voluntary,service,women,serve,functions,service,restriction,according,stockholm,international,peace,research,institute,germany,fourth,largest,exporter,major,arms,world",0.00,germany
"in peacetime the bundeswehr is commanded by the minister of defence in state of defence the chancellor would become commander in chief of the bundeswehr the role of the bundeswehr is described in the constitution of germany as defensive only but after a ruling of the federal constitutional court in  the term defence has been defined to not only include protection of the borders of germany but also crisis reaction and conflict prevention or more broadly as guarding the security of germany anywhere in the world as of update the german military has about  troops stationed in foreign countries as part of international peacekeeping forces including about  supporting operations against daesh  in the nato led resolute support mission in afghanistan and  in kosovo
",peacetime bundeswehr commanded minister defence state defence chancellor commander chief bundeswehr role bundeswehr described constitution germany defensive ruling federal constitutional court term defence defined include protection borders germany crisis reaction conflict prevention broadly guarding security germany world update german military troops stationed foreign countries international peacekeeping forces including supporting operations daesh nato led resolute support mission afghanistan kosovo,8.47,"peacetime,bundeswehr,commanded,minister,defence,state,defence,chancellor,commander,chief,bundeswehr,role,bundeswehr,described,constitution,germany,defensive,ruling,federal,constitutional,court,term,defence,defined,include,protection,borders,germany,crisis,reaction,conflict,prevention,broadly,guarding,security,germany,world,update,german,military,troops,stationed,foreign,countries,international,peacekeeping,forces,including,supporting,operations,daesh,nato,led,resolute,support,mission,afghanistan,kosovo",0.00,germany
"germany has a social market economy with a highly skilled labour force a low level of corruption and a high level of innovation it is the worlds third largest exporter and third largest importer and has the largest economy in europe which is also the worlds fourth largest economy by nominal gdp and the fifth largest by ppp its gdp per capita measured in purchasing power standards amounts to  of the eu average  the service sector contributes approximately  of the total gdp industry  and agriculture  as of update the unemployment rate published by eurostat amounts to  as of january update which is the fourth lowest in the eu
",germany social market economy highly skilled labour force low level corruption high level innovation worlds largest exporter largest importer largest economy europe worlds fourth largest economy nominal gdp fifth largest ppp gdp capita measured purchasing power standards amounts eu average service sector contributes approximately total gdp industry agriculture update unemployment rate published eurostat amounts januaryupdate fourth lowest eu,7.77,"germany,social,market,economy,highly,skilled,labour,force,low,level,corruption,high,level,innovation,worlds,largest,exporter,largest,importer,largest,economy,europe,worlds,fourth,largest,economy,nominal,gdp,fifth,largest,ppp,gdp,capita,measured,purchasing,power,standards,amounts,eu,average,service,sector,contributes,approximately,total,gdp,industry,agriculture,update,unemployment,rate,published,eurostat,amounts,januaryupdate,fourth,lowest,eu",0.00,germany
"germany is part of the european single market which represents more than  million consumers in  the country accounted for  of the eurozone economy according to the international monetary fund germany introduced the common european currency the euro in  its monetary policy is set by the european central bank which is headquartered in frankfurt
",germany european single market represents million consumers country accounted eurozone economy according international monetary fund germany introduced common european currency euro monetary policy set european central bank headquartered frankfurt,6.96,"germany,european,single,market,represents,million,consumers,country,accounted,eurozone,economy,according,international,monetary,fund,germany,introduced,common,european,currency,euro,monetary,policy,set,european,central,bank,headquartered,frankfurt",0.00,germany
"being home to the modern car the automotive industry in germany is regarded as one of the most competitive and innovative in the world and is the sixth largest by production as of  the top ten exports of germany are vehicles machinery chemical goods electronic products electrical equipments pharmaceuticals transport equipments basic metals food products and rubber and plastics
",home modern car automotive industry germany regarded competitive innovative world sixth largest production exports germany vehicles machinery chemical goods electronic products electrical equipments pharmaceuticals transport equipments basic metals food products rubber plastics,7.11,"home,modern,car,automotive,industry,germany,regarded,competitive,innovative,world,sixth,largest,production,exports,germany,vehicles,machinery,chemical,goods,electronic,products,electrical,equipments,pharmaceuticals,transport,equipments,basic,metals,food,products,rubber,plastics",0.00,germany
"of the worlds  largest stock market listed companies measured by revenue in  the fortune global   are headquartered in germany  major germany based companies are included in the dax the german stock market index which is operated by frankfurt stock exchange well known international brands include mercedes benz bmw volkswagen audi siemens allianz adidas porsche bosch and deutsche telekom berlin is a hub for startup companies and has become the leading location for venture capital funded firms in the european union germany is recognised for its large portion of specialised small and medium enterprises known as the mittelstand model these companies represent  global market leaders in their segments labelled hidden champions
",worlds largest stock market listed companies measured revenue fortune global headquartered germany major germany based companies included dax german stock market index operated frankfurt stock exchange known international brands include mercedes benz bmw volkswagen audi siemens allianz adidas porsche bosch deutsche telekom berlin hub startup companies leading location venture capital funded firms european union germany recognised large portion specialised small medium enterprises known mittelstand model companies represent global market leaders segments labelled hidden champions,4.92,"worlds,largest,stock,market,listed,companies,measured,revenue,fortune,global,headquartered,germany,major,germany,based,companies,included,dax,german,stock,market,index,operated,frankfurt,stock,exchange,known,international,brands,include,mercedes,benz,bmw,volkswagen,audi,siemens,allianz,adidas,porsche,bosch,deutsche,telekom,berlin,hub,startup,companies,leading,location,venture,capital,funded,firms,european,union,germany,recognised,large,portion,specialised,small,medium,enterprises,known,mittelstand,model,companies,represent,global,market,leaders,segments,labelled,hidden,champions",0.00,germany
"research and development efforts form an integral part of the german economy in  germany ranked fourth globally in terms of number of science and engineering research papers published research institutions in germany include the max planck society the helmholtz association and the fraunhofer society and the leibniz association germany is the largest contributor to the european space agency
",research development efforts form integral german economy germany ranked fourth globally terms number science engineering research papers published research institutions germany include max planck society helmholtz association fraunhofer society leibniz association germany largest contributor european space agency,5.34,"research,development,efforts,form,integral,german,economy,germany,ranked,fourth,globally,terms,number,science,engineering,research,papers,published,research,institutions,germany,include,max,planck,society,helmholtz,association,fraunhofer,society,leibniz,association,germany,largest,contributor,european,space,agency",0.00,germany
"with its central position in europe germany is a transport hub for the continent its road network is among the densest in europe the motorway  is widely known for having no general federally mandated speed limit for some classes of vehicles the intercity express or ice train network serves major german cities as well as destinations in neighbouring countries with speeds up to  kmh  the largest german airports are frankfurt airport and munich airport the port of hamburg is one of the top twenty largest container ports in the world
",central position europe germany transport hub continent road network densest europe motorway widely known general federally mandated speed limit classes vehicles intercity express ice train network serves major german cities destinations neighbouring countries speeds kmh largest german airports frankfurt airport munich airport port hamburg largest container ports world,7.84,"central,position,europe,germany,transport,hub,continent,road,network,densest,europe,motorway,widely,known,general,federally,mandated,speed,limit,classes,vehicles,intercity,express,ice,train,network,serves,major,german,cities,destinations,neighbouring,countries,speeds,kmh,largest,german,airports,frankfurt,airport,munich,airport,port,hamburg,largest,container,ports,world",0.00,germany
"in update germany was the worlds seventh largest consumer of energy the government and the nuclear power industry agreed to phase out all nuclear power plants by  it meets the countrys power demands using  renewable sources and it has been called an early leader in solar and offshore wind germany is committed to the paris agreement and several other treaties promoting biodiversity low emission standards and water management the countrys household recycling rate is among the highest in the worldat around  the countrys greenhouse gas emissions per capita were the ninth highest in the eu in update but these numbers have been trending downward the german energy transition  is the recognised move to a sustainable economy by means of energy efficiency and renewable energy
",update germany worlds seventh largest consumer energy government nuclear power industry agreed phase nuclear power plants meets countrys power demands renewable sources called early leader solar offshore wind germany committed paris agreement treaties promoting biodiversity low emission standards water management countrys household recycling rate highest worldat countrys greenhouse gas emissions capita ninth highest eu update numbers trending downward german energy transition recognised sustainable economy means energy efficiency renewable energy,7.08,"update,germany,worlds,seventh,largest,consumer,energy,government,nuclear,power,industry,agreed,phase,nuclear,power,plants,meets,countrys,power,demands,renewable,sources,called,early,leader,solar,offshore,wind,germany,committed,paris,agreement,treaties,promoting,biodiversity,low,emission,standards,water,management,countrys,household,recycling,rate,highest,worldat,countrys,greenhouse,gas,emissions,capita,ninth,highest,eu,update,numbers,trending,downward,german,energy,transition,recognised,sustainable,economy,means,energy,efficiency,renewable,energy",0.00,germany
"germany is the ninth most visited country in the world as of update with  million visits domestic and international travel and tourism combined directly contribute over  billion to german gdp including indirect and induced impacts the industry supports  million jobs
",germany ninth visited country world update million visits domestic international travel tourism combined directly contribute billion german gdp including indirect induced impacts industry supports million jobs,5.24,"germany,ninth,visited,country,world,update,million,visits,domestic,international,travel,tourism,combined,directly,contribute,billion,german,gdp,including,indirect,induced,impacts,industry,supports,million,jobs",0.00,germany
"with a population of  million according to the  german census rising to  million as of update germany is the most populous country in the european union the second most populous country in europe after russia and the nineteenth most populous country in the world its population density stands at  inhabitants per square kilometre  the fertility rate of  children born per woman  is below the replacement rate of  and is one of the lowest fertility rates in the world since the s germanys death rate has exceeded its birth rate however germany is witnessing increased birth rates and migration rates since the beginning of the s germany has the third oldest population in the world with an average age of  years
",population million according german census rising million update germany populous country european union second populous country europe russia nineteenth populous country world population density stands inhabitants square kilometre fertility rate children born woman replacement rate lowest fertility rates world germanys death rate exceeded birth rate germany witnessing increased birth rates migration rates beginning germany oldest population world average age years,8.44,"population,million,according,german,census,rising,million,update,germany,populous,country,european,union,second,populous,country,europe,russia,nineteenth,populous,country,world,population,density,stands,inhabitants,square,kilometre,fertility,rate,children,born,woman,replacement,rate,lowest,fertility,rates,world,germanys,death,rate,exceeded,birth,rate,germany,witnessing,increased,birth,rates,migration,rates,beginning,germany,oldest,population,world,average,age,years",0.00,germany
"after the united states germany is the second most popular immigration destination in the world the majority of migrants live in western germany in particular in urban areas of the countrys residents  million people  were of immigrant or partially immigrant descent in   in  the population division of the united nations department of economic and social affairs listed germany as host to the second highest number of international migrants worldwide about  or  million of all  million migrants as of update germany ranks seventh amongst eu countries in terms of the percentage of migrants in the countrys population at 
",united states germany second popular immigration destination world majority migrants live western germany particular urban areas countrys residents million people immigrant partially immigrant descent population division united nations department economic social affairs listed germany host second highest number international migrants worldwide million million migrants update germany ranks seventh eu countries terms percentage migrants countrys population,6.76,"united,states,germany,second,popular,immigration,destination,world,majority,migrants,live,western,germany,particular,urban,areas,countrys,residents,million,people,immigrant,partially,immigrant,descent,population,division,united,nations,department,economic,social,affairs,listed,germany,host,second,highest,number,international,migrants,worldwide,million,million,migrants,update,germany,ranks,seventh,eu,countries,terms,percentage,migrants,countrys,population",0.00,germany
"germany has a number of large cities there are  officially recognised metropolitan regions the countrys largest city is berlin while its largest urban area is the ruhr
",germany number large cities officially recognised metropolitan regions countrys largest city berlin largest urban area ruhr,6.55,"germany,number,large,cities,officially,recognised,metropolitan,regions,countrys,largest,city,berlin,largest,urban,area,ruhr",0.00,germany
"christianity was introduced to the area of modern germany by  ad and became fully christianized by the time of charlemagne in the eighth and ninth century after the reformation started by martin luther in the early th century many people left the catholic church and became protestant mainly lutheran and calvinist
",christianity introduced area modern germany ad fully christianized time charlemagne eighth ninth century reformation started martin luther early th century people left catholic church protestant mainly lutheran calvinist,7.30,"christianity,introduced,area,modern,germany,ad,fully,christianized,time,charlemagne,eighth,ninth,century,reformation,started,martin,luther,early,th,century,people,left,catholic,church,protestant,mainly,lutheran,calvinist",0.00,germany
"according to the  census christianity was the largest religion in germany with  of respondents identifying as christian of which  were not church members  declared themselves as protestants including members of the evangelical church in germany  and the free churches   declared themselves as roman catholics and orthodox believers constituted  according to data from  the catholic church and the evangelical church claimed  and  respectively of the population islam is the second largest religion in the country
",according census christianity largest religion germany respondents identifying christian church members declared protestants including members evangelical church germany free churches declared roman catholics orthodox believers constituted according data catholic church evangelical church claimed respectively population islam second largest religion country,6.63,"according,census,christianity,largest,religion,germany,respondents,identifying,christian,church,members,declared,protestants,including,members,evangelical,church,germany,free,churches,declared,roman,catholics,orthodox,believers,constituted,according,data,catholic,church,evangelical,church,claimed,respectively,population,islam,second,largest,religion,country",0.00,germany
"a study in  estimated that  of the population are not members of any religious organization or denomination though up to a third may still consider themselves religious irreligion in germany is strongest in the former east germany which used to be predominantly protestant before the enforcement of state atheism and in major metropolitan areas
",study estimated population members religious organization denomination consider religious irreligion germany strongest east germany predominantly protestant enforcement state atheism major metropolitan areas,9.28,"study,estimated,population,members,religious,organization,denomination,consider,religious,irreligion,germany,strongest,east,germany,predominantly,protestant,enforcement,state,atheism,major,metropolitan,areas",0.00,germany
"german is the official and predominant spoken language in germany it is one of  official and working languages of the european union and one of the three procedural languages of the european commission german is the most widely spoken first language in the european union with around  million native speakers
",german official predominant spoken language germany official working languages european union procedural languages european commission german widely spoken language european union million native speakers,8.41,"german,official,predominant,spoken,language,germany,official,working,languages,european,union,procedural,languages,european,commission,german,widely,spoken,language,european,union,million,native,speakers",0.00,germany
"recognised native minority languages in germany are danish low german low rhenish sorbian romani north frisian and saterland frisian they are officially protected by the european charter for regional or minority languages the most used immigrant languages are turkish arabic kurdish polish greek serbo croatian bulgarian and other balkan languages as well as russian germans are typically multilingual  of german citizens claim to be able to communicate in at least one foreign language and  in at least two
",recognised native minority languages germany danish low german low rhenish sorbian romani north frisian saterland frisian officially protected european charter regional minority languages immigrant languages turkish arabic kurdish polish greek serbo croatian bulgarian balkan languages russian germans typically multilingual german citizens claim able communicate foreign language,6.30,"recognised,native,minority,languages,germany,danish,low,german,low,rhenish,sorbian,romani,north,frisian,saterland,frisian,officially,protected,european,charter,regional,minority,languages,immigrant,languages,turkish,arabic,kurdish,polish,greek,serbo,croatian,bulgarian,balkan,languages,russian,germans,typically,multilingual,german,citizens,claim,able,communicate,foreign,language",0.00,germany
"responsibility for educational supervision in germany is primarily organised within the individual states optional kindergarten education is provided for all children between three and six years old after which school attendance is compulsory for at least nine years depending on the state primary education usually lasts for four to six years secondary schooling is divided into tracks based on whether students pursue academic or vocational education a system of apprenticeship called duale ausbildung leads to a skilled qualification which is almost comparable to an academic degree it allows students in vocational training to learn in a company as well as in a state run trade school this model is well regarded and reproduced all around the world
",responsibility educational supervision germany primarily organised individual states optional kindergarten education provided children years old school attendance compulsory years depending state primary education usually lasts years secondary schooling divided tracks based students pursue academic vocational education system apprenticeship called duale ausbildung leads skilled qualification comparable academic degree allows students vocational training learn company state run trade school model regarded reproduced world,7.44,"responsibility,educational,supervision,germany,primarily,organised,individual,states,optional,kindergarten,education,provided,children,years,old,school,attendance,compulsory,years,depending,state,primary,education,usually,lasts,years,secondary,schooling,divided,tracks,based,students,pursue,academic,vocational,education,system,apprenticeship,called,duale,ausbildung,leads,skilled,qualification,comparable,academic,degree,allows,students,vocational,training,learn,company,state,run,trade,school,model,regarded,reproduced,world",0.00,germany
