Unclean,Clean,Noise_Pre_Processing,Training_Data,Noise_Post_Processing,Query
"most of the german universities are public institutions and students traditionally study without fee payment the general requirement for attending university is the abitur according to an oecd report in  germany is the worlds third leading destination for international study the established universities in germany include some of the oldest in the world with heidelberg university  being the oldest the humboldt university of berlin founded in  by the liberal educational reformer wilhelm von humboldt became the academic model for many western universities in the contemporary era germany has developed eleven universities of excellence
",german universities public institutions students traditionally study fee payment general requirement attending university abitur according oecd report germany worlds leading destination international study established universities germany include oldest world heidelberg university oldest humboldt university berlin founded liberal educational reformer wilhelm von humboldt academic model western universities contemporary era germany developed universities excellence,6.41,"german,universities,public,institutions,students,traditionally,study,fee,payment,general,requirement,attending,university,abitur,according,oecd,report,germany,worlds,leading,destination,international,study,established,universities,germany,include,oldest,world,heidelberg,university,oldest,humboldt,university,berlin,founded,liberal,educational,reformer,wilhelm,von,humboldt,academic,model,western,universities,contemporary,era,germany,developed,universities,excellence",0.00,germany
"germanys system of hospitals called krankenhuser dates from medieval times and today germany has the worlds oldest universal health care system dating from bismarcks social legislation of the s since the s reforms and provisions have ensured a balanced health care system the population is covered by a health insurance plan provided by statute with criteria allowing some groups to opt for a private health insurance contract according to the world health organization  germanys health care system was  government funded and  privately funded as of update in  germany spent  of its gdp on health care
",germanys system hospitals called krankenhuser dates medieval times today germany worlds oldest universal health care system dating bismarcks social legislation reforms provisions ensured balanced health care system population covered health insurance plan provided statute criteria allowing groups opt private health insurance contract according world health organization germanys health care system government funded privately funded update germany spent gdp health care,5.81,"germanys,system,hospitals,called,krankenhuser,dates,medieval,times,today,germany,worlds,oldest,universal,health,care,system,dating,bismarcks,social,legislation,reforms,provisions,ensured,balanced,health,care,system,population,covered,health,insurance,plan,provided,statute,criteria,allowing,groups,opt,private,health,insurance,contract,according,world,health,organization,germanys,health,care,system,government,funded,privately,funded,update,germany,spent,gdp,health,care",0.00,germany
"germany ranked st in the world in  in life expectancy with  years for men and  years for women according to the who and it had a very low infant mortality rate  in update the principal because of death was cardiovascular disease at  obesity in germany has been increasingly cited as a major health issue a  study showed that  percent of the adult german population was overweight or obese
",germany ranked st world life expectancy years men years women according low infant mortality rate update principal death cardiovascular disease obesity germany increasingly cited major health issue study showed percent adult german population overweight obese,8.48,"germany,ranked,st,world,life,expectancy,years,men,years,women,according,low,infant,mortality,rate,update,principal,death,cardiovascular,disease,obesity,germany,increasingly,cited,major,health,issue,study,showed,percent,adult,german,population,overweight,obese",0.00,germany
"culture in german states has been shaped by major intellectual and popular currents in europe both religious and secular historically germany has been called das land der dichter und denker  because of the major role its scientists writers and philosophers have played in the development of western thought a global opinion poll for the bbc revealed that germany is recognised for having the most positive influence in the world in  and 
",culture german states shaped major intellectual popular currents europe religious secular historically germany called das land der dichter und denker major role scientists writers philosophers played development western thought global opinion poll bbc revealed germany recognised positive influence world,7.31,"culture,german,states,shaped,major,intellectual,popular,currents,europe,religious,secular,historically,germany,called,das,land,der,dichter,und,denker,major,role,scientists,writers,philosophers,played,development,western,thought,global,opinion,poll,bbc,revealed,germany,recognised,positive,influence,world",0.00,germany
"germany is well known for such folk festival traditions as the oktoberfest and christmas customs which include advent wreaths christmas pageants christmas trees stollen cakes and other practices as of update unesco inscribed  properties in germany on the world heritage list there are a number of public holidays in germany determined by each state  october has been a national day of germany since  celebrated as the tag der deutschen einheit 
",germany known folk festival traditions oktoberfest christmas customs include advent wreaths christmas pageants christmas trees stollen cakes practices update unesco inscribed properties germany world heritage list number public holidays germany determined state october national day germany celebrated tag der deutschen einheit,6.52,"germany,known,folk,festival,traditions,oktoberfest,christmas,customs,include,advent,wreaths,christmas,pageants,christmas,trees,stollen,cakes,practices,update,unesco,inscribed,properties,germany,world,heritage,list,number,public,holidays,germany,determined,state,october,national,day,germany,celebrated,tag,der,deutschen,einheit",0.00,germany
"as of  germany was the second largest music market in europe and fourth largest in the world german popular music of the th and st centuries includes the movements of neue deutsche welle pop ostrock heavy metalrock punk pop rock indie volksmusik  schlager pop and german hip hop german electronic music gained global influence with kraftwerk and tangerine dream pioneering in this genre djs and artists of the techno and house music scenes of germany have become well known 
",germany second largest music market europe fourth largest world german popular music th st centuries includes movements neue deutsche welle pop ostrock heavy metalrock punk pop rock indie volksmusik schlager pop german hip hop german electronic music gained global influence kraftwerk tangerine dream pioneering genre djs artists techno house music scenes germany known,5.47,"germany,second,largest,music,market,europe,fourth,largest,world,german,popular,music,th,st,centuries,includes,movements,neue,deutsche,welle,pop,ostrock,heavy,metalrock,punk,pop,rock,indie,volksmusik,schlager,pop,german,hip,hop,german,electronic,music,gained,global,influence,kraftwerk,tangerine,dream,pioneering,genre,djs,artists,techno,house,music,scenes,germany,known",0.00,germany
"architectural contributions from germany include the carolingian and ottonian styles which were precursors of romanesque brick gothic is a distinctive medieval style that evolved in germany also in renaissance and baroque art regional and typically german elements evolved  vernacular architecture in germany is often identified by its timber framing  traditions and varies across regions and among carpentry styles when industrialisation spread across europe classicism and a distinctive style of historicism developed in germany sometimes referred to as grnderzeit style expressionist architecture developed in the s in germany and influenced art deco and other modern styles germany was particularly important in the early modernist movement it is the home of werkbund initiated by hermann muthesius  and of the bauhaus movement founded by walter gropius ludwig mies van der rohe became one of the worlds most renowned architects in the second half of the th century he conceived of the glass faade skyscraper renowned contemporary architects and offices include pritzker prize winners gottfried bhm and frei otto
",architectural contributions germany include carolingian ottonian styles precursors romanesque brick gothic distinctive medieval style evolved germany renaissance baroque art regional typically german elements evolved vernacular architecture germany identified timber framing traditions varies regions carpentry styles industrialisation spread europe classicism distinctive style historicism developed germany referred grnderzeit style expressionist architecture developed germany influenced art deco modern styles germany particularly important early modernist movement home werkbund initiated hermann muthesius bauhaus movement founded walter gropius ludwig mies van der rohe worlds renowned architects second half th century conceived glass faade skyscraper renowned contemporary architects offices include pritzker prize winners gottfried bhm frei otto,5.82,"architectural,contributions,germany,include,carolingian,ottonian,styles,precursors,romanesque,brick,gothic,distinctive,medieval,style,evolved,germany,renaissance,baroque,art,regional,typically,german,elements,evolved,vernacular,architecture,germany,identified,timber,framing,traditions,varies,regions,carpentry,styles,industrialisation,spread,europe,classicism,distinctive,style,historicism,developed,germany,referred,grnderzeit,style,expressionist,architecture,developed,germany,influenced,art,deco,modern,styles,germany,particularly,important,early,modernist,movement,home,werkbund,initiated,hermann,muthesius,bauhaus,movement,founded,walter,gropius,ludwig,mies,van,der,rohe,worlds,renowned,architects,second,half,th,century,conceived,glass,faade,skyscraper,renowned,contemporary,architects,offices,include,pritzker,prize,winners,gottfried,bhm,frei,otto",0.00,germany
"the largest internationally operating media companies in germany are the bertelsmann enterprise axel springer se and prosiebensat media germanys television market is the largest in europe with some  million tv households around  of german households have cable or satellite tv with a variety of free to view public and commercial channels there are more than  public and private radio stations in germany germanys national radio network is the deutschlandradio and the public deutsche welle is the main german radio and television broadcaster in foreign languages germanys print market of newspapers and magazines is the largest in europe the papers with the highest circulation are bild sddeutsche zeitung frankfurter allgemeine zeitung and die welt the largest magazines include adac motorwelt and der spiegel germany has a large video gaming market with over  million players nationwide
",largest internationally operating media companies germany bertelsmann enterprise axel springer se prosiebensat media germanys television market largest europe million tv households german households cable satellite tv variety free view public commercial channels public private radio stations germany germanys national radio network deutschlandradio public deutsche welle main german radio television broadcaster foreign languages germanys print market newspapers magazines largest europe papers highest circulation bild sddeutsche zeitung frankfurter allgemeine zeitung die welt largest magazines include adac motorwelt der spiegel germany large video gaming market million players nationwide,5.51,"largest,internationally,operating,media,companies,germany,bertelsmann,enterprise,axel,springer,se,prosiebensat,media,germanys,television,market,largest,europe,million,tv,households,german,households,cable,satellite,tv,variety,free,view,public,commercial,channels,public,private,radio,stations,germany,germanys,national,radio,network,deutschlandradio,public,deutsche,welle,main,german,radio,television,broadcaster,foreign,languages,germanys,print,market,newspapers,magazines,largest,europe,papers,highest,circulation,bild,sddeutsche,zeitung,frankfurter,allgemeine,zeitung,die,welt,largest,magazines,include,adac,motorwelt,der,spiegel,germany,large,video,gaming,market,million,players,nationwide",0.00,germany
"german cinema has made major technical and artistic contributions to film the first works of the skladanowsky brothers were shown to an audience in  the renowned babelsberg studio in potsdam was established in  thus being the first large scale film studio in the world early german cinema was particularly influential with german expressionists such as robert wiene and friedrich wilhelm murnau director fritz langs metropolis  is referred to as the first major science fiction film after  many of the films of the immediate post war period can be characterised as trmmerfilm  east german film was dominated by state owned film studio defa while the dominant genre in west germany was the heimatfilm  during the s and s new german cinema directors such as volker schlndorff werner herzog wim wenders and rainer werner fassbinder brought west german auteur cinema to critical acclaim
",german cinema major technical artistic contributions film works skladanowsky brothers shown audience renowned babelsberg studio potsdam established large scale film studio world early german cinema particularly influential german expressionists robert wiene friedrich wilhelm murnau director fritz langs metropolis referred major science fiction film films immediate post war period characterised trmmerfilm east german film dominated state owned film studio defa dominant genre west germany heimatfilm new german cinema directors volker schlndorff werner herzog wim wenders rainer werner fassbinder brought west german auteur cinema critical acclaim,6.46,"german,cinema,major,technical,artistic,contributions,film,works,skladanowsky,brothers,shown,audience,renowned,babelsberg,studio,potsdam,established,large,scale,film,studio,world,early,german,cinema,particularly,influential,german,expressionists,robert,wiene,friedrich,wilhelm,murnau,director,fritz,langs,metropolis,referred,major,science,fiction,film,films,immediate,post,war,period,characterised,trmmerfilm,east,german,film,dominated,state,owned,film,studio,defa,dominant,genre,west,germany,heimatfilm,new,german,cinema,directors,volker,schlndorff,werner,herzog,wim,wenders,rainer,werner,fassbinder,brought,west,german,auteur,cinema,critical,acclaim",0.00,germany
"bread is a significant part of german cuisine and german bakeries produce about  main types of bread and  types of pastries and rolls  german cheeses account for about  of all cheese produced in europe in  over  of all meat produced in germany was either pork chicken or beef germans produce their ubiquitous sausages in almost  varieties including bratwursts and weisswursts the national alcoholic drink is beer german beer consumption per person stands at  litres  in  and remains among the highest in the world german beer purity regulations date back to the th century wine has become popular in many parts of the country especially close to german wine regions in  germany was the ninth largest wine producer in the world
",bread significant german cuisine german bakeries produce main types bread types pastries rolls german cheeses account cheese produced europe meat produced germany pork chicken beef germans produce ubiquitous sausages varieties including bratwursts weisswursts national alcoholic drink beer german beer consumption person stands litres remains highest world german beer purity regulations date th century wine popular parts country especially close german wine regions germany ninth largest wine producer world,7.15,"bread,significant,german,cuisine,german,bakeries,produce,main,types,bread,types,pastries,rolls,german,cheeses,account,cheese,produced,europe,meat,produced,germany,pork,chicken,beef,germans,produce,ubiquitous,sausages,varieties,including,bratwursts,weisswursts,national,alcoholic,drink,beer,german,beer,consumption,person,stands,litres,remains,highest,world,german,beer,purity,regulations,date,th,century,wine,popular,parts,country,especially,close,german,wine,regions,germany,ninth,largest,wine,producer,world",0.00,germany
"the  michelin guide awarded eleven restaurants in germany three stars giving the country a cumulative total of  stars
",michelin guide awarded restaurants germany stars giving country cumulative total stars,5.93,"michelin,guide,awarded,restaurants,germany,stars,giving,country,cumulative,total,stars",0.00,germany
"football is the most popular sport in germany with more than  million official members the german football association  is the largest single sport organisation worldwide and the german top league the bundesliga attracts the second highest average attendance of all professional sports leagues in the world the german mens national football team won the fifa world cup in    and  the uefa european championship in   and  and the fifa confederations cup in 
",football popular sport germany million official members german football association largest single sport organisation worldwide german league bundesliga attracts second highest average attendance professional sports leagues world german mens national football team fifa world cup uefa european championship fifa confederations cup,6.56,"football,popular,sport,germany,million,official,members,german,football,association,largest,single,sport,organisation,worldwide,german,league,bundesliga,attracts,second,highest,average,attendance,professional,sports,leagues,world,german,mens,national,football,team,fifa,world,cup,uefa,european,championship,fifa,confederations,cup",0.00,germany
"germany is one of the leading motor sports countries in the world constructors like bmw and mercedes are prominent manufacturers in motor sport porsche has won the  hours of le mans race  times and audi  times  the driver michael schumacher has set many motor sport records during his career having won seven formula one world drivers championships sebastian vettel is also among the most successful formula one drivers of all time
",germany leading motor sports countries world constructors like bmw mercedes prominent manufacturers motor sport porsche hours le mans race times audi times driver michael schumacher set motor sport records career seven formula world drivers championships sebastian vettel successful formula drivers time,6.94,"germany,leading,motor,sports,countries,world,constructors,like,bmw,mercedes,prominent,manufacturers,motor,sport,porsche,hours,le,mans,race,times,audi,times,driver,michael,schumacher,set,motor,sport,records,career,seven,formula,world,drivers,championships,sebastian,vettel,successful,formula,drivers,time",0.00,germany
