Unclean,Clean,Noise_Pre_Processing,Training_Data,Noise_Post_Processing,Query
"modern greek has in addition to standard modern greek or dimotiki a wide variety of dialects of varying levels of mutual intelligibility including cypriot pontic cappadocian griko and tsakonian  yevanic is the language of the romaniotes and survives in small communities in greece new york and israel in addition to greek many greek citizens in greece and the diaspora are bilingual in other languages such as english arvanitikaalbanian aromanian megleno romanian macedonian slavic russian and turkish
",modern greek addition standard modern greek dimotiki wide variety dialects varying levels mutual intelligibility including cypriot pontic cappadocian griko tsakonian yevanic language romaniotes survives small communities greece new york israel addition greek greek citizens greece diaspora bilingual languages english arvanitikaalbanian aromanian megleno romanian macedonian slavic russian turkish,5.78,"modern,greek,addition,standard,modern,greek,dimotiki,wide,variety,dialects,varying,levels,mutual,intelligibility,including,cypriot,pontic,cappadocian,griko,tsakonian,yevanic,language,romaniotes,survives,small,communities,greece,new,york,israel,addition,greek,greek,citizens,greece,diaspora,bilingual,languages,english,arvanitikaalbanian,aromanian,megleno,romanian,macedonian,slavic,russian,turkish",0.00,greece
"greek speaking muslims live mainly outside greece in the contemporary era there are both christian and muslim greek speaking communities in lebanon and syria while in the pontus region of turkey there is a large community of indeterminate size who were spared from the population exchange because of their religious affiliation
",greek speaking muslims live mainly outside greece contemporary era christian muslim greek speaking communities lebanon syria pontus region turkey large community indeterminate size spared population exchange religious affiliation,7.01,"greek,speaking,muslims,live,mainly,outside,greece,contemporary,era,christian,muslim,greek,speaking,communities,lebanon,syria,pontus,region,turkey,large,community,indeterminate,size,spared,population,exchange,religious,affiliation",0.00,greece
"greek art has a long and varied history greeks have contributed to the visual literary and performing arts in the west classical greek art was influential in shaping the roman and later the modern western artistic heritage following the renaissance in europe the humanist aesthetic and the high technical standards of greek art inspired generations of european artists well into the th century the classical tradition derived from greece played an important role in the art of the western world in the east alexander the greats conquests initiated several centuries of exchange between greek central asian and indian cultures resulting in indo greek and greco buddhist art whose influence reached as far as japan
",greek art long varied history greeks contributed visual literary performing arts west classical greek art influential shaping roman later modern western artistic heritage following renaissance europe humanist aesthetic high technical standards greek art inspired generations european artists th century classical tradition derived greece played important role art western world east alexander greats conquests initiated centuries exchange greek central asian indian cultures resulting indo greek greco buddhist art influence reached far japan,6.03,"greek,art,long,varied,history,greeks,contributed,visual,literary,performing,arts,west,classical,greek,art,influential,shaping,roman,later,modern,western,artistic,heritage,following,renaissance,europe,humanist,aesthetic,high,technical,standards,greek,art,inspired,generations,european,artists,th,century,classical,tradition,derived,greece,played,important,role,art,western,world,east,alexander,greats,conquests,initiated,centuries,exchange,greek,central,asian,indian,cultures,resulting,indo,greek,greco,buddhist,art,influence,reached,far,japan",0.00,greece
"as of  greece had the eighth highest percentage of tertiary enrollment in the world  while greeks of the diaspora are equally active in the field of education hundreds of thousands of greek students attend western universities every year while the faculty lists of leading western universities contain a striking number of greek names notable greek scientists of modern times include physician georgios papanicolaou  mathematician constantin carathodory  archaeologists manolis andronikos  valerios stais  spyridon marinatos  and ioannis svoronos chemists leonidas zervas  k c nicolaou  and panayotis katsoyannis  computer scientists michael dertouzos and nicholas negroponte  john argyris  joseph sifakis  christos papadimitriou  and mihalis yannakakis  physicist mathematician demetrios christodoulou  and physicists achilles papapetrou  dimitri nanopoulos  and john iliopoulos  astronomer eugenios antoniadis biologist fotis kafatos  botanist theodoros orphanides economist xenophon zolotas  indologist dimitrios galanos linguist yiannis psycharis  historians constantine paparrigopoulos  and helene glykatzi ahrweiler  and political scientists nicos poulantzas  and cornelius castoriadis 
",greece eighth highest percentage tertiary enrollment world greeks diaspora equally active field education hundreds thousands greek students attend western universities year faculty lists leading western universities contain striking number greek names notable greek scientists modern times include physician georgios papanicolaou mathematician constantin carathodory archaeologists manolis andronikos valerios stais spyridon marinatos ioannis svoronos chemists leonidas zervas k c nicolaou panayotis katsoyannis computer scientists michael dertouzos nicholas negroponte john argyris joseph sifakis christos papadimitriou mihalis yannakakis physicist mathematician demetrios christodoulou physicists achilles papapetrou dimitri nanopoulos john iliopoulos astronomer eugenios antoniadis biologist fotis kafatos botanist theodoros orphanides economist xenophon zolotas indologist dimitrios galanos linguist yiannis psycharis historians constantine paparrigopoulos helene glykatzi ahrweiler political scientists nicos poulantzas cornelius castoriadis,2.68,"greece,eighth,highest,percentage,tertiary,enrollment,world,greeks,diaspora,equally,active,field,education,hundreds,thousands,greek,students,attend,western,universities,year,faculty,lists,leading,western,universities,contain,striking,number,greek,names,notable,greek,scientists,modern,times,include,physician,georgios,papanicolaou,mathematician,constantin,carathodory,archaeologists,manolis,andronikos,valerios,stais,spyridon,marinatos,ioannis,svoronos,chemists,leonidas,zervas,k,c,nicolaou,panayotis,katsoyannis,computer,scientists,michael,dertouzos,nicholas,negroponte,john,argyris,joseph,sifakis,christos,papadimitriou,mihalis,yannakakis,physicist,mathematician,demetrios,christodoulou,physicists,achilles,papapetrou,dimitri,nanopoulos,john,iliopoulos,astronomer,eugenios,antoniadis,biologist,fotis,kafatos,botanist,theodoros,orphanides,economist,xenophon,zolotas,indologist,dimitrios,galanos,linguist,yiannis,psycharis,historians,constantine,paparrigopoulos,helene,glykatzi,ahrweiler,political,scientists,nicos,poulantzas,cornelius,castoriadis",0.00,greece
"the most widely used symbol is the flag of greece which features nine equal horizontal stripes of blue alternating with white representing the nine syllables of the greek national motto eleftheria i thanatos  which was the motto of the greek war of independence the blue square in the upper hoist side corner bears a white cross which represents greek orthodoxy the greek flag is widely used by the greek cypriots although cyprus has officially adopted a neutral flag to ease ethnic tensions with the turkish cypriot minority 
",widely symbol flag greece features equal horizontal stripes blue alternating white representing syllables greek national motto eleftheria thanatos motto greek war independence blue square upper hoist corner bears white cross represents greek orthodoxy greek flag widely greek cypriots cyprus officially adopted neutral flag ease ethnic tensions turkish cypriot minority,7.21,"widely,symbol,flag,greece,features,equal,horizontal,stripes,blue,alternating,white,representing,syllables,greek,national,motto,eleftheria,thanatos,motto,greek,war,independence,blue,square,upper,hoist,corner,bears,white,cross,represents,greek,orthodoxy,greek,flag,widely,greek,cypriots,cyprus,officially,adopted,neutral,flag,ease,ethnic,tensions,turkish,cypriot,minority",0.00,greece
"the pre   flag of greece which features a greek cross  on a blue background is widely used as an alternative to the official flag and they are often flown together the national emblem of greece features a blue escutcheon with a white cross surrounded by two laurel branches a common design involves the current flag of greece and the pre  flag of greece with crossed flagpoles and the national emblem placed in front
",pre flag greece features greek cross blue background widely alternative official flag flown national emblem greece features blue escutcheon white cross surrounded laurel branches common design involves current flag greece pre flag greece crossed flagpoles national emblem placed,8.39,"pre,flag,greece,features,greek,cross,blue,background,widely,alternative,official,flag,flown,national,emblem,greece,features,blue,escutcheon,white,cross,surrounded,laurel,branches,common,design,involves,current,flag,greece,pre,flag,greece,crossed,flagpoles,national,emblem,placed",0.00,greece
"another highly recognizable and popular greek symbol is the double headed eagle the imperial emblem of the last dynasty of the eastern roman empire and a common symbol in asia minor and later eastern europe it is not part of the modern greek flag or coat of arms although it is officially the insignia of the greek army and the flag of the church of greece it had been incorporated in the greek coat of arms between  and 
",highly recognizable popular greek symbol double headed eagle imperial emblem dynasty eastern roman empire common symbol asia minor later eastern europe modern greek flag coat arms officially insignia greek army flag church greece incorporated greek coat arms,9.72,"highly,recognizable,popular,greek,symbol,double,headed,eagle,imperial,emblem,dynasty,eastern,roman,empire,common,symbol,asia,minor,later,eastern,europe,modern,greek,flag,coat,arms,officially,insignia,greek,army,flag,church,greece,incorporated,greek,coat,arms",0.00,greece
"notable modern greek politicians include ioannis kapodistrias founder of the first hellenic republic reformist charilaos trikoupis eleftherios venizelos who marked the shape of modern greece social democrats georgios papandreou and alexandros papanastasiou konstantinos karamanlis founder of the third hellenic republic and socialist andreas papandreou
",notable modern greek politicians include ioannis kapodistrias founder hellenic republic reformist charilaos trikoupis eleftherios venizelos marked shape modern greece social democrats georgios papandreou alexandros papanastasiou konstantinos karamanlis founder hellenic republic socialist andreas papandreou,3.12,"notable,modern,greek,politicians,include,ioannis,kapodistrias,founder,hellenic,republic,reformist,charilaos,trikoupis,eleftherios,venizelos,marked,shape,modern,greece,social,democrats,georgios,papandreou,alexandros,papanastasiou,konstantinos,karamanlis,founder,hellenic,republic,socialist,andreas,papandreou",0.00,greece
"the greek shipping tradition recovered during the late ottoman rule  when a substantial merchant middle class developed which played an important part in the greek war of independence today greek shipping continues to prosper to the extent that greece has one of the largest merchant fleets in the world while many more ships under greek ownership fly flags of convenience the most notable shipping magnate of the th century was aristotle onassis others being yiannis latsis stavros g livanos and stavros niarchos
",greek shipping tradition recovered late ottoman rule substantial merchant middle class developed played important greek war independence today greek shipping continues prosper extent greece largest merchant fleets world ships greek ownership fly flags convenience notable shipping magnate th century aristotle onassis yiannis latsis stavros g livanos stavros niarchos,6.61,"greek,shipping,tradition,recovered,late,ottoman,rule,substantial,merchant,middle,class,developed,played,important,greek,war,independence,today,greek,shipping,continues,prosper,extent,greece,largest,merchant,fleets,world,ships,greek,ownership,fly,flags,convenience,notable,shipping,magnate,th,century,aristotle,onassis,yiannis,latsis,stavros,g,livanos,stavros,niarchos",0.00,greece
"in their archaeogenetic study lazaridis et al  found that minoans and mycenaean greeks were genetically highly similar but not identical modern greeks resembled the mycenaeans but with some additional dilution of the early neolithic ancestry furthermore proposed migrations by egyptian or phoenician colonists was not discernible in their data thus rejecting the hypothesis that the cultures of the aegean were seeded by migrants from the old civilizations of these regions the fst between the sampled bronze age populations and present day west eurasians was estimated finding that mycenaean greeks and minoans were least differentiated from the populations of modern greece cyprus albania and italy in a subsequent study lazaridis et al  concluded that around  of the ancestry of the mycenaeans came from anatolian neolithic farmers  while the remainder mainly came from ancient populations related to the caucasus hunter gatherers   and the pre pottery neolithic  culture in the levant  the mycenaeans had also inherited  ancestry from a source related to the eastern european hunter gatherers  introduced via a proximal source related to the inhabitants of the eurasian steppe who are hypothesized to be the proto indo europeans and  from the iron gates hunter gatherers in the balkans mycenaean elites were genetically the same as mycenaean commoners in terms of their steppe ancestry while some mycenaeans lacked it altogether
",archaeogenetic study lazaridis et al found minoans mycenaean greeks genetically highly similar identical modern greeks resembled mycenaeans additional dilution early neolithic ancestry furthermore proposed migrations egyptian phoenician colonists discernible data rejecting hypothesis cultures aegean seeded migrants old civilizations regions fst sampled bronze age populations present day west eurasians estimated finding mycenaean greeks minoans differentiated populations modern greece cyprus albania italy subsequent study lazaridis et al concluded ancestry mycenaeans came anatolian neolithic farmers remainder mainly came ancient populations related caucasus hunter gatherers pre pottery neolithic culture levant mycenaeans inherited ancestry source related eastern european hunter gatherers introduced proximal source related inhabitants eurasian steppe hypothesized proto indo europeans iron gates hunter gatherers balkans mycenaean elites genetically mycenaean commoners terms steppe ancestry mycenaeans lacked altogether,6.63,"archaeogenetic,study,lazaridis,et,al,found,minoans,mycenaean,greeks,genetically,highly,similar,identical,modern,greeks,resembled,mycenaeans,additional,dilution,early,neolithic,ancestry,furthermore,proposed,migrations,egyptian,phoenician,colonists,discernible,data,rejecting,hypothesis,cultures,aegean,seeded,migrants,old,civilizations,regions,fst,sampled,bronze,age,populations,present,day,west,eurasians,estimated,finding,mycenaean,greeks,minoans,differentiated,populations,modern,greece,cyprus,albania,italy,subsequent,study,lazaridis,et,al,concluded,ancestry,mycenaeans,came,anatolian,neolithic,farmers,remainder,mainly,came,ancient,populations,related,caucasus,hunter,gatherers,pre,pottery,neolithic,culture,levant,mycenaeans,inherited,ancestry,source,related,eastern,european,hunter,gatherers,introduced,proximal,source,related,inhabitants,eurasian,steppe,hypothesized,proto,indo,europeans,iron,gates,hunter,gatherers,balkans,mycenaean,elites,genetically,mycenaean,commoners,terms,steppe,ancestry,mycenaeans,lacked,altogether",0.00,greece
"a genetic study by clemente et al  found that in the early bronze age the populations of the minoan helladic and cycladic civilizations in the aegean were genetically homogeneous in contrast the aegean population during the middle bronze age was more differentiated probably due to gene flow from a yamnaya related population from the ponticcaspian steppe this is corroborated by sequenced genomes of middle bronze age individuals from northern greece who had a much higher proportion of steppe related ancestry the timing of this gene flow was estimated at  bce and is consistent with the dominant linguistic theories explaining the emergence of the proto greek language present day greeks share  of their ancestry with them suggesting continuity between the two time periods in the case of mycenaean greeks however this steppe related ancestry was diluted the ancestry of the mycenaeans could be explained via a  way admixture model of such mba individuals in northern greece and either an eba aegean or mba minoan population the difference between the two time periods could be explained by the general decline of the mycenaean civilization
",genetic study clemente et al found early bronze age populations minoan helladic cycladic civilizations aegean genetically homogeneous contrast aegean population middle bronze age differentiated probably gene flow yamnaya related population ponticcaspian steppe corroborated sequenced genomes middle bronze age individuals northern greece higher proportion steppe related ancestry timing gene flow estimated bce consistent dominant linguistic theories explaining emergence proto greek language present day greeks share ancestry suggesting continuity time periods case mycenaean greeks steppe related ancestry diluted ancestry mycenaeans explained way admixture model mba individuals northern greece eba aegean mba minoan population difference time periods explained general decline mycenaean civilization,7.26,"genetic,study,clemente,et,al,found,early,bronze,age,populations,minoan,helladic,cycladic,civilizations,aegean,genetically,homogeneous,contrast,aegean,population,middle,bronze,age,differentiated,probably,gene,flow,yamnaya,related,population,ponticcaspian,steppe,corroborated,sequenced,genomes,middle,bronze,age,individuals,northern,greece,higher,proportion,steppe,related,ancestry,timing,gene,flow,estimated,bce,consistent,dominant,linguistic,theories,explaining,emergence,proto,greek,language,present,day,greeks,share,ancestry,suggesting,continuity,time,periods,case,mycenaean,greeks,steppe,related,ancestry,diluted,ancestry,mycenaeans,explained,way,admixture,model,mba,individuals,northern,greece,eba,aegean,mba,minoan,population,difference,time,periods,explained,general,decline,mycenaean,civilization",0.00,greece
"the history of the greek people is closely associated with the history of greece cyprus southern italy constantinople asia minor and the black sea during the ottoman rule of greece a number of greek enclaves around the mediterranean were cut off from the core notably in southern italy the caucasus syria and egypt by the early th century over half of the overall greek speaking population was settled in asia minor  while later that century a huge wave of migration to the united states australia canada and elsewhere created the modern greek diaspora
",history greek people closely associated history greece cyprus southern italy constantinople asia minor black sea ottoman rule greece number greek enclaves mediterranean cut core notably southern italy caucasus syria egypt early th century half overall greek speaking population settled asia minor later century huge wave migration united states australia canada created modern greek diaspora,7.05,"history,greek,people,closely,associated,history,greece,cyprus,southern,italy,constantinople,asia,minor,black,sea,ottoman,rule,greece,number,greek,enclaves,mediterranean,cut,core,notably,southern,italy,caucasus,syria,egypt,early,th,century,half,overall,greek,speaking,population,settled,asia,minor,later,century,huge,wave,migration,united,states,australia,canada,created,modern,greek,diaspora",0.00,greece
