Unclean,Clean,Noise_Pre_Processing,Training_Data,Noise_Post_Processing,Query
"the first major impact on exchange rate after independence was the devaluation of sterling against the us dollar in  this impacted currencies that maintained a peg to the sterling such as the indian rupee the next major episode was in  when indian rupee was devaluated by  against united states dollar correspondingly the rates against pound sterling too suffered depreciation in  august when the bretton woods system india initially announced that it will maintain a fixed rate of us  rs  and leave pound sterling floating however by the end of  following smithsonian agreement and subsequent devaluation of united states dollar india pegged indian rupee with pound sterling once again with a rate of   rs  in the above period india had a non   commercial exchange rate with soviet union the ruble   rupee rates were announced by soviet union since ruble was not a freely traded currency and the commercial trade between both nations use to take place in rupee trade account following the indiasoviet trade treaty 
",major impact exchange rate independence devaluation sterling dollar impacted currencies maintained peg sterling indian rupee major episode indian rupee devaluated united states dollar correspondingly rates pound sterling suffered depreciation august bretton woods system india initially announced maintain fixed rate rs leave pound sterling floating end following smithsonian agreement subsequent devaluation united states dollar india pegged indian rupee pound sterling rate rs period india non commercial exchange rate soviet union ruble rupee rates announced soviet union ruble freely traded currency commercial trade nations use place rupee trade account following indiasoviet trade treaty,7.19,"major,impact,exchange,rate,independence,devaluation,sterling,dollar,impacted,currencies,maintained,peg,sterling,indian,rupee,major,episode,indian,rupee,devaluated,united,states,dollar,correspondingly,rates,pound,sterling,suffered,depreciation,august,bretton,woods,system,india,initially,announced,maintain,fixed,rate,rs,leave,pound,sterling,floating,end,following,smithsonian,agreement,subsequent,devaluation,united,states,dollar,india,pegged,indian,rupee,pound,sterling,rate,rs,period,india,non,commercial,exchange,rate,soviet,union,ruble,rupee,rates,announced,soviet,union,ruble,freely,traded,currency,commercial,trade,nations,use,place,rupee,trade,account,following,indiasoviet,trade,treaty",0.00,rupee
"in september  exchange rate of indian rupee started to be determined on the basis of basket peg the details of currencies which forms the basket and its weightage were kept confidentially by reserve bank of india and the exchange rate of rupee on the basis of market fluctuation of these currencies were periodically announced by rbi
",september exchange rate indian rupee started determined basis basket peg details currencies forms basket weightage kept confidentially reserve bank india exchange rate rupee basis market fluctuation currencies periodically announced rbi,7.78,"september,exchange,rate,indian,rupee,started,determined,basis,basket,peg,details,currencies,forms,basket,weightage,kept,confidentially,reserve,bank,india,exchange,rate,rupee,basis,market,fluctuation,currencies,periodically,announced,rbi",0.00,rupee
"the next major change that occurred to indian rupee was devaluation by about  in july  following the balance of payment crisis thereafter in march  liberalized exchange rate management system was introduced
",major change occurred indian rupee devaluation july following balance payment crisis march liberalized exchange rate management system introduced,6.28,"major,change,occurred,indian,rupee,devaluation,july,following,balance,payment,crisis,march,liberalized,exchange,rate,management,system,introduced",0.00,rupee
"as the straits settlements were originally an outpost of the british east india company the indian rupee was made the sole official currency of the straits settlements in  as it was administered as part of british india this attempt was resisted by the locals however spanish dollars continued to circulate and  saw the introduction of coinage for the straits settlements using a system of  cents   dollar with the dollar equal to the spanish dollar or mexican peso in  administration of the straits settlements was separated from india and the straits dollar was made the standard currency and attempts to reintroduce the rupee were finally abandoned
",straits settlements originally outpost british east india company indian rupee sole official currency straits settlements administered british india attempt resisted locals spanish dollars continued circulate saw introduction coinage straits settlements system cents dollar dollar equal spanish dollar mexican peso administration straits settlements separated india straits dollar standard currency attempts reintroduce rupee finally abandoned,7.98,"straits,settlements,originally,outpost,british,east,india,company,indian,rupee,sole,official,currency,straits,settlements,administered,british,india,attempt,resisted,locals,spanish,dollars,continued,circulate,saw,introduction,coinage,straits,settlements,system,cents,dollar,dollar,equal,spanish,dollar,mexican,peso,administration,straits,settlements,separated,india,straits,dollar,standard,currency,attempts,reintroduce,rupee,finally,abandoned",0.00,rupee
"after the partition of india the pakistani rupee came into existence initially using indian coins and indian currency notes simply overstamped with pakistan previously the indian rupee was an official currency of other countries including aden oman dubai kuwait bahrain qatar the trucial states kenya tanganyika uganda the seychelles and mauritius
",partition india pakistani rupee came existence initially indian coins indian currency notes simply overstamped pakistan previously indian rupee official currency countries including aden oman dubai kuwait bahrain qatar trucial states kenya tanganyika uganda seychelles mauritius,4.60,"partition,india,pakistani,rupee,came,existence,initially,indian,coins,indian,currency,notes,simply,overstamped,pakistan,previously,indian,rupee,official,currency,countries,including,aden,oman,dubai,kuwait,bahrain,qatar,trucial,states,kenya,tanganyika,uganda,seychelles,mauritius",0.00,rupee
"the indian government introduced the gulf rupee as a replacement for the indian rupee for circulation outside the country with the reserve bank of india  act of  may  the creation of a separate currency was an attempt to reduce the strain on indias foreign reserves from gold smuggling after india devalued the rupee on  june  those countries still using it  oman qatar and the trucial states   replaced the gulf rupee with their own currencies kuwait and bahrain had already done so in  with kuwaiti dinar and in  with bahraini dinar respectively
",indian government introduced gulf rupee replacement indian rupee circulation outside country reserve bank india act creation separate currency attempt reduce strain indias foreign reserves gold smuggling india devalued rupee june countries oman qatar trucial states replaced gulf rupee currencies kuwait bahrain kuwaiti dinar bahraini dinar respectively,8.21,"indian,government,introduced,gulf,rupee,replacement,indian,rupee,circulation,outside,country,reserve,bank,india,act,creation,separate,currency,attempt,reduce,strain,indias,foreign,reserves,gold,smuggling,india,devalued,rupee,june,countries,oman,qatar,trucial,states,replaced,gulf,rupee,currencies,kuwait,bahrain,kuwaiti,dinar,bahraini,dinar,respectively",0.00,rupee
"the bhutanese ngultrum is pegged at par with the indian rupee both currencies are accepted in bhutan the nepalese rupee is pegged at  the indian rupee is accepted in bhutan and nepal except  and  banknotes of the mahatma gandhi series and the   and  banknotes of the mahatma gandhi new series which are not legal tender in bhutan and nepal and are banned by their respective governments though accepted by many retailers on  january  zimbabwe added the indian rupee as a legal tender to be used
",bhutanese ngultrum pegged par indian rupee currencies accepted bhutan nepalese rupee pegged indian rupee accepted bhutan nepal banknotes mahatma gandhi series banknotes mahatma gandhi new series legal tender bhutan nepal banned respective governments accepted retailers january zimbabwe added indian rupee legal tender,8.69,"bhutanese,ngultrum,pegged,par,indian,rupee,currencies,accepted,bhutan,nepalese,rupee,pegged,indian,rupee,accepted,bhutan,nepal,banknotes,mahatma,gandhi,series,banknotes,mahatma,gandhi,new,series,legal,tender,bhutan,nepal,banned,respective,governments,accepted,retailers,january,zimbabwe,added,indian,rupee,legal,tender",0.00,rupee
