Unclean,Clean,Noise_Pre_Processing,Training_Data,Noise_Post_Processing,Query
"in  about  of the governments budget came from oil and natural gas revenues and  came from taxes and fees as of update iran had earned  billion in foreign exchange reserves mostly  from crude oil exports iranian budget deficits have been a chronic problem mostly due to large scale state subsidies that include foodstuffs and especially gasoline totaling more than  billion in  for the energy sector alone in  the economic reform plan was approved by parliament to cut subsidies gradually and replace them with targeted social assistance the objective is to move towards free market prices in a five year period and increase productivity and social justice
",governments budget came oil natural gas revenues came taxes fees update iran earned billion foreign exchange reserves crude oil exports iranian budget deficits chronic problem large scale state subsidies include foodstuffs especially gasoline totaling billion energy sector economic reform plan approved parliament cut subsidies gradually replace targeted social assistance objective free market prices year period increase productivity social justice,7.15,"governments,budget,came,oil,natural,gas,revenues,came,taxes,fees,update,iran,earned,billion,foreign,exchange,reserves,crude,oil,exports,iranian,budget,deficits,chronic,problem,large,scale,state,subsidies,include,foodstuffs,especially,gasoline,totaling,billion,energy,sector,economic,reform,plan,approved,parliament,cut,subsidies,gradually,replace,targeted,social,assistance,objective,free,market,prices,year,period,increase,productivity,social,justice",0.00,iran
"the administration continues to follow the market reform plans of the previous one and indicates that it will diversify irans oil reliant economy iran has also developed a biotechnology nanotechnology and pharmaceutical industry however nationalized industries such as the bonyads have often been managed badly making them ineffective and uncompetitive with years currently the government is trying to privatize these industries and despite successes there are still several problems to be overcome such as the lagging corruption in the public sector and lack of competitiveness
",administration continues follow market reform plans previous indicates diversify irans oil reliant economy iran developed biotechnology nanotechnology pharmaceutical industry nationalized industries bonyads managed badly making ineffective uncompetitive years currently government trying privatize industries despite successes problems overcome lagging corruption public sector lack competitiveness,7.25,"administration,continues,follow,market,reform,plans,previous,indicates,diversify,irans,oil,reliant,economy,iran,developed,biotechnology,nanotechnology,pharmaceutical,industry,nationalized,industries,bonyads,managed,badly,making,ineffective,uncompetitive,years,currently,government,trying,privatize,industries,despite,successes,problems,overcome,lagging,corruption,public,sector,lack,competitiveness",0.00,iran
"iran has leading manufacturing industries in the fields of automobile manufacture transportation construction materials home appliances food and agricultural goods armaments pharmaceuticals information technology and petrochemicals in the middle east according to the  data from the food and agriculture organization iran has been among the worlds top five producers of apricots cherries sour cherries cucumbers and gherkins dates eggplants figs pistachios quinces walnuts and watermelons
",iran leading manufacturing industries fields automobile manufacture transportation construction materials home appliances food agricultural goods armaments pharmaceuticals information technology petrochemicals middle east according data food agriculture organization iran worlds producers apricots cherries sour cherries cucumbers gherkins dates eggplants figs pistachios quinces walnuts watermelons,4.50,"iran,leading,manufacturing,industries,fields,automobile,manufacture,transportation,construction,materials,home,appliances,food,agricultural,goods,armaments,pharmaceuticals,information,technology,petrochemicals,middle,east,according,data,food,agriculture,organization,iran,worlds,producers,apricots,cherries,sour,cherries,cucumbers,gherkins,dates,eggplants,figs,pistachios,quinces,walnuts,watermelons",0.00,iran
"economic sanctions against iran such as the embargo against iranian crude oil have injured the economy in  iran and the p reached a deal on the nuclear program that removed the main sanctions pertaining to irans nuclear program by  according to the bbc renewed yous sanctions against iran have led to a sharp downturn in irans economy pushing the value of its currency to record lows quadrupling its annual inflation rate driving away foreign investors and triggering protests
",economic sanctions iran embargo iranian crude oil injured economy iran p reached deal nuclear program removed main sanctions pertaining irans nuclear program according bbc renewed yous sanctions iran led sharp downturn irans economy pushing value currency record lows quadrupling annual inflation rate driving away foreign investors triggering protests,6.29,"economic,sanctions,iran,embargo,iranian,crude,oil,injured,economy,iran,p,reached,deal,nuclear,program,removed,main,sanctions,pertaining,irans,nuclear,program,according,bbc,renewed,yous,sanctions,iran,led,sharp,downturn,irans,economy,pushing,value,currency,record,lows,quadrupling,annual,inflation,rate,driving,away,foreign,investors,triggering,protests",0.00,iran
"although tourism declined significantly during the war with iraq it has been subsequently recovered about  foreign tourists visited iran in  and  million in  mostly from asian countries including the republics of central asia while about  came from the european union and north america since the removal of some sanctions against iran in  tourism has re surged in the country over five million tourists visited iran in the fiscal year of  four percent more than the previous year
",tourism declined significantly war iraq subsequently recovered foreign tourists visited iran million asian countries including republics central asia came european union north america removal sanctions iran tourism surged country million tourists visited iran fiscal year percent previous year,8.12,"tourism,declined,significantly,war,iraq,subsequently,recovered,foreign,tourists,visited,iran,million,asian,countries,including,republics,central,asia,came,european,union,north,america,removal,sanctions,iran,tourism,surged,country,million,tourists,visited,iran,fiscal,year,percent,previous,year",0.00,iran
"alongside the capital the most popular tourist destinations are isfahan mashhad and shiraz in the early s the industry faced serious limitations in infrastructure communications industry standards and personnel training several organized tours from germany france and other european countries come to iran annually to visit archaeological sites and monuments in  iran ranked th in tourism revenues worldwide according to the unesco and the deputy head of research for irans tourism organization iran is rated fourth among the top  destinations in the middle east domestic tourism in iran is one of the largest in the world
",alongside capital popular tourist destinations isfahan mashhad shiraz early industry faced limitations infrastructure communications industry standards personnel training organized tours germany france european countries come iran annually visit archaeological sites monuments iran ranked th tourism revenues worldwide according unesco deputy head research irans tourism organization iran rated fourth destinations middle east domestic tourism iran largest world,6.42,"alongside,capital,popular,tourist,destinations,isfahan,mashhad,shiraz,early,industry,faced,limitations,infrastructure,communications,industry,standards,personnel,training,organized,tours,germany,france,european,countries,come,iran,annually,visit,archaeological,sites,monuments,iran,ranked,th,tourism,revenues,worldwide,according,unesco,deputy,head,research,irans,tourism,organization,iran,rated,fourth,destinations,middle,east,domestic,tourism,iran,largest,world",0.00,iran
"iran has a long paved road system linking most of its towns and all of its cities in  the country had  kilometers  of roads of which  were paved in  there were nearly  passenger cars for every  inhabitants
",iran long paved road system linking towns cities country kilometers roads paved nearly passenger cars inhabitants,10.19,"iran,long,paved,road,system,linking,towns,cities,country,kilometers,roads,paved,nearly,passenger,cars,inhabitants",0.00,iran
"trains operate on  km  of railroad track the countrys major port of entry is bandar abbas on the strait of hormuz after arriving in iran imported goods are distributed throughout the country by trucks and freight trains the tehranbandar abbas railroad opened in  connects bandar abbas to the railroad system of central asia via tehran and mashhad other major ports include bandar e anzali and bandar e torkeman on the caspian sea and khorramshahr and bandar e emam khomeyni on the persian gulf
",trains operate km railroad track countrys major port entry bandar abbas strait hormuz arriving iran imported goods distributed country trucks freight trains tehranbandar abbas railroad opened connects bandar abbas railroad system central asia tehran mashhad major ports include bandar e anzali bandar e torkeman caspian sea khorramshahr bandar e emam khomeyni persian gulf,6.07,"trains,operate,km,railroad,track,countrys,major,port,entry,bandar,abbas,strait,hormuz,arriving,iran,imported,goods,distributed,country,trucks,freight,trains,tehranbandar,abbas,railroad,opened,connects,bandar,abbas,railroad,system,central,asia,tehran,mashhad,major,ports,include,bandar,e,anzali,bandar,e,torkeman,caspian,sea,khorramshahr,bandar,e,emam,khomeyni,persian,gulf",0.00,iran
"dozens of cities have airports that serve passenger and cargo planes iran air the national airline was founded in  and operated domestic and international flights all large cities have mass transit systems using buses and several private companies provide bus services between cities
",dozens cities airports serve passenger cargo planes iran air national airline founded operated domestic international flights large cities mass transit systems buses private companies provide bus services cities,5.28,"dozens,cities,airports,serve,passenger,cargo,planes,iran,air,national,airline,founded,operated,domestic,international,flights,large,cities,mass,transit,systems,buses,private,companies,provide,bus,services,cities",0.00,iran
"transport in iran is inexpensive because of the governments subsidization of the price of gasoline the downside is a huge draw on government coffers economic inefficiency because of highly wasteful consumption patterns smuggling to neighboring countries and air pollution in  more than one million people worked in the transportation sector accounting for  of gdp
",transport iran inexpensive governments subsidization price gasoline downside huge draw government coffers economic inefficiency highly wasteful consumption patterns smuggling neighboring countries air pollution million people worked transportation sector accounting gdp,6.59,"transport,iran,inexpensive,governments,subsidization,price,gasoline,downside,huge,draw,government,coffers,economic,inefficiency,highly,wasteful,consumption,patterns,smuggling,neighboring,countries,air,pollution,million,people,worked,transportation,sector,accounting,gdp",0.00,iran
"iran has the worlds second largest proved gas reserves after russia with  trillion cubic meters and the third largest natural gas production after indonesia and russia it also ranks fourth in oil reserves with an estimated  barrels it is opecs second largest oil exporter and is an energy superpower
in  iran spent us billion on fuel imports because of contraband and inefficient domestic use oil industry output averaged  million barrels per day  in  compared with the peak of six million barrels per day reached in  in the early s industry infrastructure was increasingly inefficient because of technological lags few exploratory wells were drilled in 
",iran worlds second largest proved gas reserves russia trillion cubic meters largest natural gas production indonesia russia ranks fourth oil reserves estimated barrels opecs second largest oil exporter energy superpowerin iran spent billion fuel imports contraband inefficient domestic use oil industry output averaged million barrels day compared peak million barrels day reached early industry infrastructure increasingly inefficient technological lags exploratory wells drilled,6.41,"iran,worlds,second,largest,proved,gas,reserves,russia,trillion,cubic,meters,largest,natural,gas,production,indonesia,russia,ranks,fourth,oil,reserves,estimated,barrels,opecs,second,largest,oil,exporter,energy,superpowerin,iran,spent,billion,fuel,imports,contraband,inefficient,domestic,use,oil,industry,output,averaged,million,barrels,day,compared,peak,million,barrels,day,reached,early,industry,infrastructure,increasingly,inefficient,technological,lags,exploratory,wells,drilled",0.00,iran
"in  a large share of irans natural gas reserves were untapped the addition of new hydroelectric stations and the streamlining of conventional coal and oil fired stations increased installed capacity to  megawatts of that amount about  was based on natural gas  on oil and  on hydroelectric power in  iran opened its first wind powered and geothermal plants and the first solar thermal plant was to come online in  iran is the worlds third country to have developed gtl technology
",large share irans natural gas reserves untapped addition new hydroelectric stations streamlining conventional coal oil fired stations increased installed capacity megawatts based natural gas oil hydroelectric power iran opened wind powered geothermal plants solar thermal plant come online iran worlds country developed gtl technology,7.29,"large,share,irans,natural,gas,reserves,untapped,addition,new,hydroelectric,stations,streamlining,conventional,coal,oil,fired,stations,increased,installed,capacity,megawatts,based,natural,gas,oil,hydroelectric,power,iran,opened,wind,powered,geothermal,plants,solar,thermal,plant,come,online,iran,worlds,country,developed,gtl,technology",0.00,iran
"education in iran is highly centralized k is supervised by the ministry of education and higher education is under the supervision of the ministry of science and technology
",education iran highly centralized k supervised ministry education higher education supervision ministry science technology,8.09,"education,iran,highly,centralized,k,supervised,ministry,education,higher,education,supervision,ministry,science,technology",0.00,iran
"according to the webometrics ranking of world universities  irans top five universities include tehran university of medical sciences  the university of tehran  sharif university of technology  amirkabir university of technology  and the tarbiat modares university  iran was ranked th in the global innovation index in  up from th in 
",according webometrics ranking world universities irans universities include tehran university medical sciences university tehran sharif university technology amirkabir university technology tarbiat modares university iran ranked th global innovation index th,5.67,"according,webometrics,ranking,world,universities,irans,universities,include,tehran,university,medical,sciences,university,tehran,sharif,university,technology,amirkabir,university,technology,tarbiat,modares,university,iran,ranked,th,global,innovation,index,th",0.00,iran
"iran has increased its publication output nearly tenfold from  through  and has been ranked first in terms of output growth rate followed by china according to a study by scimago in  iran would rank fourth in the world in terms of research output by  if the current trend persists
",iran increased publication output nearly tenfold ranked terms output growth rate followed china according study scimago iran rank fourth world terms research output current trend persists,8.19,"iran,increased,publication,output,nearly,tenfold,ranked,terms,output,growth,rate,followed,china,according,study,scimago,iran,rank,fourth,world,terms,research,output,current,trend,persists",0.00,iran
"in  a suse linux based hpc system made by the aerospace research institute of iran  was launched with  cores and now runs  cores its performance was pegged at  gflops the iranian humanoid robot sorena  which was designed by engineers at the university of tehran was unveiled in  the institute of electrical and electronics engineers  has placed the name of surena among the five prominent robots of the world after analyzing its performance
",suse linux based hpc system aerospace research institute iran launched cores runs cores performance pegged gflops iranian humanoid robot sorena designed engineers university tehran unveiled institute electrical electronics engineers placed surena prominent robots world analyzing performance,8.16,"suse,linux,based,hpc,system,aerospace,research,institute,iran,launched,cores,runs,cores,performance,pegged,gflops,iranian,humanoid,robot,sorena,designed,engineers,university,tehran,unveiled,institute,electrical,electronics,engineers,placed,surena,prominent,robots,world,analyzing,performance",0.00,iran
"according to a study by david morrison and ali khadem hosseini  stem cell research in iran is amongst the top  in the world iran ranks th in the world in nanotechnologies
",according study david morrison ali khadem hosseini stem cell research iran world iran ranks th world nanotechnologies,8.19,"according,study,david,morrison,ali,khadem,hosseini,stem,cell,research,iran,world,iran,ranks,th,world,nanotechnologies",0.00,iran
"iran placed its domestically built satellite omid into orbit on the th anniversary of the  revolution on  february  through its first expendable launch vehicle safir becoming the ninth country in the world capable of both producing a satellite and sending it into space from a domestically made launcher
",iran placed domestically built satellite omid orbit th anniversary revolution february expendable launch vehicle safir ninth country world capable producing satellite sending space domestically launcher,7.57,"iran,placed,domestically,built,satellite,omid,orbit,th,anniversary,revolution,february,expendable,launch,vehicle,safir,ninth,country,world,capable,producing,satellite,sending,space,domestically,launcher",0.00,iran
"the iranian nuclear program was launched in the s iran is the seventh country to produce uranium hexafluoride and controls the entire nuclear fuel cycle
",iranian nuclear program launched iran seventh country produce uranium hexafluoride controls entire nuclear fuel cycle,6.54,"iranian,nuclear,program,launched,iran,seventh,country,produce,uranium,hexafluoride,controls,entire,nuclear,fuel,cycle",0.00,iran
"iranian scientists outside iran have also made some major contributions to science in  ali javan co invented the first gas laser and fuzzy set theory was introduced by lotfi a zadeh iranian cardiologist tofigh mussivand invented and developed the first artificial cardiac pump the precursor of the artificial heart furthering research and treatment of diabetes the hbac was discovered by samuel rahbar a substantial number of papers in string theory are published in iran iranian american string theorist cumrun vafa proposed the vafawitten theorem together with edward witten in august  iranian mathematician maryam mirzakhani became the first woman as well as the first iranian to receive the fields medal the highest prize in mathematics
",iranian scientists outside iran major contributions science ali javan co invented gas laser fuzzy set theory introduced lotfi zadeh iranian cardiologist tofigh mussivand invented developed artificial cardiac pump precursor artificial heart furthering research treatment diabetes hbac discovered samuel rahbar substantial number papers string theory published iran iranian american string theorist cumrun vafa proposed vafawitten theorem edward witten august iranian mathematician maryam mirzakhani woman iranian receive fields medal highest prize mathematics,5.94,"iranian,scientists,outside,iran,major,contributions,science,ali,javan,co,invented,gas,laser,fuzzy,set,theory,introduced,lotfi,zadeh,iranian,cardiologist,tofigh,mussivand,invented,developed,artificial,cardiac,pump,precursor,artificial,heart,furthering,research,treatment,diabetes,hbac,discovered,samuel,rahbar,substantial,number,papers,string,theory,published,iran,iranian,american,string,theorist,cumrun,vafa,proposed,vafawitten,theorem,edward,witten,august,iranian,mathematician,maryam,mirzakhani,woman,iranian,receive,fields,medal,highest,prize,mathematics",0.00,iran
"iran is a diverse country consisting of numerous ethnic and linguistic groups that are unified through a shared iranian nationality
",iran diverse country consisting numerous ethnic linguistic groups unified shared iranian nationality,6.06,"iran,diverse,country,consisting,numerous,ethnic,linguistic,groups,unified,shared,iranian,nationality",0.00,iran
"iran hosts one of the largest refugee populations in the world with almost one million refugees mostly from afghanistan and iraq since  iranian officials have been working with the unhcr and afghan officials for their repatriation according to estimates about five million iranian citizens have emigrated to other countries mostly since the  revolution
",iran hosts largest refugee populations world million refugees afghanistan iraq iranian officials working unhcr afghan officials repatriation according estimates million iranian citizens emigrated countries revolution,7.93,"iran,hosts,largest,refugee,populations,world,million,refugees,afghanistan,iraq,iranian,officials,working,unhcr,afghan,officials,repatriation,according,estimates,million,iranian,citizens,emigrated,countries,revolution",0.00,iran
"the majority of the population speaks persian which is also the official language of the country others include speakers of several other iranian languages within the greater indo european family and languages belonging to some other ethnicities living in iran
",majority population speaks persian official language country include speakers iranian languages greater indo european family languages belonging ethnicities living iran,7.66,"majority,population,speaks,persian,official,language,country,include,speakers,iranian,languages,greater,indo,european,family,languages,belonging,ethnicities,living,iran",0.00,iran
"in northern iran mostly confined to gilan and mazenderan the gilaki and mazenderani languages are widely spoken both having affinities to the neighboring caucasian languages in parts of gilan the talysh language is also widely spoken which stretches up to the neighboring republic of azerbaijan varieties of kurdish are widely spoken in the province of kurdistan and nearby areas in khuzestan several distinct varieties of persian are spoken luri and lari are also spoken in southern iran
",northern iran confined gilan mazenderan gilaki mazenderani languages widely spoken affinities neighboring caucasian languages parts gilan talysh language widely spoken stretches neighboring republic azerbaijan varieties kurdish widely spoken province kurdistan nearby areas khuzestan distinct varieties persian spoken luri lari spoken southern iran,7.16,"northern,iran,confined,gilan,mazenderan,gilaki,mazenderani,languages,widely,spoken,affinities,neighboring,caucasian,languages,parts,gilan,talysh,language,widely,spoken,stretches,neighboring,republic,azerbaijan,varieties,kurdish,widely,spoken,province,kurdistan,nearby,areas,khuzestan,distinct,varieties,persian,spoken,luri,lari,spoken,southern,iran",0.00,iran
"azerbaijani which is by far the most spoken language in the country after persian as well as several other turkic languages and dialects is spoken in various regions of iran especially in the region of azerbaijan
",azerbaijani far spoken language country persian turkic languages dialects spoken regions iran especially region azerbaijan,9.86,"azerbaijani,far,spoken,language,country,persian,turkic,languages,dialects,spoken,regions,iran,especially,region,azerbaijan",0.00,iran
"notable minority languages in iran include armenian georgian neo aramaic and arabic khuzi arabic is spoken by the arabs in khuzestan as well as the wider group of iranian arabs circassian was also once widely spoken by the large circassian minority but due to assimilation over the many years no sizable number of circassians speak the language anymore
",notable minority languages iran include armenian georgian neo aramaic arabic khuzi arabic spoken arabs khuzestan wider group iranian arabs circassian widely spoken large circassian minority assimilation years sizable number circassians speak language anymore,7.08,"notable,minority,languages,iran,include,armenian,georgian,neo,aramaic,arabic,khuzi,arabic,spoken,arabs,khuzestan,wider,group,iranian,arabs,circassian,widely,spoken,large,circassian,minority,assimilation,years,sizable,number,circassians,speak,language,anymore",0.00,iran
