Unclean,Clean,Noise_Pre_Processing,Training_Data,Noise_Post_Processing,Query
"the leader of the revolution  is responsible for delineation and supervision of the policies of the islamic republic of iran the iranian president has limited power compared to the supreme leader khamenei the current longtime supreme leader ali khamenei has been issuing decrees and making the final decisions on the economy environment foreign policy education national planning and everything else in the country khamenei also outlines elections guidelines and urges for the transparency and has fired and reinstated presidential cabinet appointments key ministers are selected with the supreme leader ali khameneis agreement and he has the ultimate say on irans foreign policy the supreme leader is directly involved in ministerial appointments for defense intelligence and foreign affairs as well as other top ministries after submission of candidates from the president irans regional policy is directly controlled by the office of the supreme leader with the ministry of foreign affairs task limited to protocol and ceremonial occasions all of irans ambassadors to arab countries for example are chosen by the quds corps which directly reports to the supreme leader the supreme leader can also order laws to be amended setad estimated at  billion in  by the reuters accounts of which are secret even to the iranian parliament is controlled only by the supreme leader
",leader revolution responsible delineation supervision policies islamic republic iran iranian president limited power compared supreme leader khamenei current longtime supreme leader ali khamenei issuing decrees making final decisions economy environment foreign policy education national planning country khamenei outlines elections guidelines urges transparency fired reinstated presidential cabinet appointments key ministers selected supreme leader ali khameneis agreement ultimate irans foreign policy supreme leader directly involved ministerial appointments defense intelligence foreign affairs ministries submission candidates president irans regional policy directly controlled office supreme leader ministry foreign affairs task limited protocol ceremonial occasions irans ambassadors arab countries example chosen quds corps directly reports supreme leader supreme leader order laws amended setad estimated billion reuters accounts secret iranian parliament controlled supreme leader,6.99,"leader,revolution,responsible,delineation,supervision,policies,islamic,republic,iran,iranian,president,limited,power,compared,supreme,leader,khamenei,current,longtime,supreme,leader,ali,khamenei,issuing,decrees,making,final,decisions,economy,environment,foreign,policy,education,national,planning,country,khamenei,outlines,elections,guidelines,urges,transparency,fired,reinstated,presidential,cabinet,appointments,key,ministers,selected,supreme,leader,ali,khameneis,agreement,ultimate,irans,foreign,policy,supreme,leader,directly,involved,ministerial,appointments,defense,intelligence,foreign,affairs,ministries,submission,candidates,president,irans,regional,policy,directly,controlled,office,supreme,leader,ministry,foreign,affairs,task,limited,protocol,ceremonial,occasions,irans,ambassadors,arab,countries,example,chosen,quds,corps,directly,reports,supreme,leader,supreme,leader,order,laws,amended,setad,estimated,billion,reuters,accounts,secret,iranian,parliament,controlled,supreme,leader",0.00,iran
"after the supreme leader the constitution defines the president of iran as the highest state authority the president is elected by universal suffrage for a term of four years however the president is still required to gain the leaders official approval before being sworn in before the parliament  the leader also has the power to dismiss the elected president anytime the president can only be re elected for one term
",supreme leader constitution defines president iran highest state authority president elected universal suffrage term years president required gain leaders official approval sworn parliament leader power dismiss elected president anytime president elected term,9.07,"supreme,leader,constitution,defines,president,iran,highest,state,authority,president,elected,universal,suffrage,term,years,president,required,gain,leaders,official,approval,sworn,parliament,leader,power,dismiss,elected,president,anytime,president,elected,term",0.00,iran
"the president is responsible for the implementation of the constitution and for the exercise of executive powers in implementing the decrees and general policies as outlined by the supreme leader except for matters directly related to the supreme leader who has the final say in all matters unlike the executive in other countries the president of iran does not have full control over anything as these are ultimately under the control of the supreme leader chapter ix of the constitution of the islamic republic of iran sets forth the qualifications for presidential candidates the procedures for presidential election and all other elections in iran are outlined by the supreme leader the president functions as the executive of affairs such as signing treaties and other international agreements and administering national planning budget and state employment affairs all as approved by the supreme leader
",president responsible implementation constitution exercise executive powers implementing decrees general policies outlined supreme leader matters directly related supreme leader final matters unlike executive countries president iran control ultimately control supreme leader chapter ix constitution islamic republic iran sets forth qualifications presidential candidates procedures presidential election elections iran outlined supreme leader president functions executive affairs signing treaties international agreements administering national planning budget state employment affairs approved supreme leader,8.14,"president,responsible,implementation,constitution,exercise,executive,powers,implementing,decrees,general,policies,outlined,supreme,leader,matters,directly,related,supreme,leader,final,matters,unlike,executive,countries,president,iran,control,ultimately,control,supreme,leader,chapter,ix,constitution,islamic,republic,iran,sets,forth,qualifications,presidential,candidates,procedures,presidential,election,elections,iran,outlined,supreme,leader,president,functions,executive,affairs,signing,treaties,international,agreements,administering,national,planning,budget,state,employment,affairs,approved,supreme,leader",0.00,iran
"the legislature of iran known as the islamic consultative assembly is a unicameral body comprising  members elected for four year terms it drafts legislation ratifies international treaties and approves the national budget all parliamentary candidates and all legislation from the assembly must be approved by the guardian council
",legislature iran known islamic consultative assembly unicameral body comprising members elected year terms drafts legislation ratifies international treaties approves national budget parliamentary candidates legislation assembly approved guardian council,6.04,"legislature,iran,known,islamic,consultative,assembly,unicameral,body,comprising,members,elected,year,terms,drafts,legislation,ratifies,international,treaties,approves,national,budget,parliamentary,candidates,legislation,assembly,approved,guardian,council",0.00,iran
"the guardian council comprises twelve jurists including six appointed by the supreme leader others are elected by the parliament from among the jurists nominated by the head of the judiciary the council interprets the constitution and may veto the parliament if a law is deemed incompatible with the constitution or sharia  it is referred back to the parliament for revision the expediency council has the authority to mediate disputes between the parliament and the guardian council and serves as an advisory body to the supreme leader making it one of the most powerful governing bodies in the country local city councils are elected by public vote to four year terms in all cities and villages of iran
",guardian council comprises jurists including appointed supreme leader elected parliament jurists nominated head judiciary council interprets constitution veto parliament law deemed incompatible constitution sharia referred parliament revision expediency council authority mediate disputes parliament guardian council serves advisory body supreme leader making powerful governing bodies country local city councils elected public vote year terms cities villages iran,8.65,"guardian,council,comprises,jurists,including,appointed,supreme,leader,elected,parliament,jurists,nominated,head,judiciary,council,interprets,constitution,veto,parliament,law,deemed,incompatible,constitution,sharia,referred,parliament,revision,expediency,council,authority,mediate,disputes,parliament,guardian,council,serves,advisory,body,supreme,leader,making,powerful,governing,bodies,country,local,city,councils,elected,public,vote,year,terms,cities,villages,iran",0.00,iran
"the chief justice of iran is the head of the judicial system of the islamic republic of iran and is responsible for its administration and supervision he is also the highest judge of the supreme court of iran the supreme leader of iran appoints and can dismiss the chief justice the chief justice nominates some candidates for serving as minister of justice and then the president select one of them the chief justice can serve for two five year terms
",chief justice iran head judicial system islamic republic iran responsible administration supervision highest judge supreme court iran supreme leader iran appoints dismiss chief justice chief justice nominates candidates serving minister justice president select chief justice serve year terms,9.29,"chief,justice,iran,head,judicial,system,islamic,republic,iran,responsible,administration,supervision,highest,judge,supreme,court,iran,supreme,leader,iran,appoints,dismiss,chief,justice,chief,justice,nominates,candidates,serving,minister,justice,president,select,chief,justice,serve,year,terms",0.00,iran
"since  irans nuclear program has become the subject of contention with the international community mainly the united states many countries have expressed concern that irans nuclear program could divert civilian nuclear technology into a weapons program this has led the united nations security council to impose sanctions against iran which had further isolated iran politically and economically from the rest of the global community in  the yous director of national intelligence said that iran if choosing to would not be able to develop a nuclear weapon until 
",irans nuclear program subject contention international community mainly united states countries expressed concern irans nuclear program divert civilian nuclear technology weapons program led united nations security council impose sanctions iran isolated iran politically economically rest global community yous director national intelligence said iran choosing able develop nuclear weapon,6.91,"irans,nuclear,program,subject,contention,international,community,mainly,united,states,countries,expressed,concern,irans,nuclear,program,divert,civilian,nuclear,technology,weapons,program,led,united,nations,security,council,impose,sanctions,iran,isolated,iran,politically,economically,rest,global,community,yous,director,national,intelligence,said,iran,choosing,able,develop,nuclear,weapon",0.00,iran
"as of update the government of iran maintains diplomatic relations with  members of the united nations but not with the united states and not with israela state which irans government has derecognized since the  revolution among muslim nations iran has an adversarial relationship with saudi arabia due to different political and islamic ideologies while iran is a shia islamic republic saudi arabia is a conservative sunni monarchy regarding the israelipalestinian conflict the government of iran has recognized jerusalem as the capital of the state of palestine after trump recognized jerusalem as the capital of israel
",update government iran maintains diplomatic relations members united nations united states israela state irans government derecognized revolution muslim nations iran adversarial relationship saudi arabia different political islamic ideologies iran shia islamic republic saudi arabia conservative sunni monarchy israelipalestinian conflict government iran recognized jerusalem capital state palestine trump recognized jerusalem capital israel,7.07,"update,government,iran,maintains,diplomatic,relations,members,united,nations,united,states,israela,state,irans,government,derecognized,revolution,muslim,nations,iran,adversarial,relationship,saudi,arabia,different,political,islamic,ideologies,iran,shia,islamic,republic,saudi,arabia,conservative,sunni,monarchy,israelipalestinian,conflict,government,iran,recognized,jerusalem,capital,state,palestine,trump,recognized,jerusalem,capital,israel",0.00,iran
"iran is a member of dozens of international organizations including the g  g  g  iaea ibrd ida idb ifc ilo imf i am going to interpol oic opec who and the united nations and currently has observer status at the world trade organization
",iran member dozens international organizations including g g g iaea ibrd ida idb ifc ilo imf going interpol oic opec united nations currently observer status world trade organization,6.36,"iran,member,dozens,international,organizations,including,g,g,g,iaea,ibrd,ida,idb,ifc,ilo,imf,going,interpol,oic,opec,united,nations,currently,observer,status,world,trade,organization",0.00,iran
"on  september  iran began the processes of becoming a full member of the shanghai cooperation organization  a eurasian political economic and security alliance
",september iran began processes member shanghai cooperation organization eurasian political economic security alliance,6.25,"september,iran,began,processes,member,shanghai,cooperation,organization,eurasian,political,economic,security,alliance",0.00,iran
"the islamic republic of iran has two types of armed forces the regular forces of the army the air force and the navy and the revolutionary guards totaling about  active troops iran also has around  reserve force totaling around  trained troops
",islamic republic iran types armed forces regular forces army air force navy revolutionary guards totaling active troops iran reserve force totaling trained troops,7.38,"islamic,republic,iran,types,armed,forces,regular,forces,army,air,force,navy,revolutionary,guards,totaling,active,troops,iran,reserve,force,totaling,trained,troops",0.00,iran
"the government of iran has a paramilitary volunteer militia force within the islamic revolutionary guard corps called the basij which includes about  full time active duty uniformed members up to  million men and women are members of the basij who could potentially be called up for service in  irans military spending represented  of the gdp or  per capita the lowest figure of the persian gulf nations irans military doctrine is based on deterrence in  the country spent  billion on arms while the states of the gulf cooperation council spent eight times more
",government iran paramilitary volunteer militia force islamic revolutionary guard corps called basij includes time active duty uniformed members million men women members basij potentially called service irans military spending represented gdp capita lowest figure persian gulf nations irans military doctrine based deterrence country spent billion arms states gulf cooperation council spent times,7.12,"government,iran,paramilitary,volunteer,militia,force,islamic,revolutionary,guard,corps,called,basij,includes,time,active,duty,uniformed,members,million,men,women,members,basij,potentially,called,service,irans,military,spending,represented,gdp,capita,lowest,figure,persian,gulf,nations,irans,military,doctrine,based,deterrence,country,spent,billion,arms,states,gulf,cooperation,council,spent,times",0.00,iran
"the government of iran supports the military activities of its allies in syria iraq and lebanon  with military and financial aid iran and syria are close strategic allies and iran has provided significant support for the syrian government in the syrian civil war according to some estimates iran controlled over  pro assad shiite fighters in syria
",government iran supports military activities allies syria iraq lebanon military financial aid iran syria close strategic allies iran provided significant support syrian government syrian civil war according estimates iran controlled pro assad shiite fighters syria,6.03,"government,iran,supports,military,activities,allies,syria,iraq,lebanon,military,financial,aid,iran,syria,close,strategic,allies,iran,provided,significant,support,syrian,government,syrian,civil,war,according,estimates,iran,controlled,pro,assad,shiite,fighters,syria",0.00,iran
"since the  revolution to overcome foreign embargoes the government of iran has developed its own military industry produced its own tanks armored personnel carriers missiles submarines military vessels missile destroyer radar systems helicopters and fighter planes in recent years official announcements have highlighted the development of weapons such as the hoot kowsar zelzal fateh  shahab  sejjil and a variety of unmanned aerial vehicles  iran has the largest and most diverse ballistic missile arsenal in the middle east the fajr  a liquid fuel missile with an undisclosed range which was developed and produced domestically is currently the most advanced ballistic missile of the country
",revolution overcome foreign embargoes government iran developed military industry produced tanks armored personnel carriers missiles submarines military vessels missile destroyer radar systems helicopters fighter planes recent years official announcements highlighted development weapons hoot kowsar zelzal fateh shahab sejjil variety unmanned aerial vehicles iran largest diverse ballistic missile arsenal middle east fajr liquid fuel missile undisclosed range developed produced domestically currently advanced ballistic missile country,5.61,"revolution,overcome,foreign,embargoes,government,iran,developed,military,industry,produced,tanks,armored,personnel,carriers,missiles,submarines,military,vessels,missile,destroyer,radar,systems,helicopters,fighter,planes,recent,years,official,announcements,highlighted,development,weapons,hoot,kowsar,zelzal,fateh,shahab,sejjil,variety,unmanned,aerial,vehicles,iran,largest,diverse,ballistic,missile,arsenal,middle,east,fajr,liquid,fuel,missile,undisclosed,range,developed,produced,domestically,currently,advanced,ballistic,missile,country",0.00,iran
"according to international reports irans human rights record is exceptionally poor the regime in iran is undemocratic has frequently persecuted and arrested critics of the government and its supreme leader and severely restricts the participation of candidates in popular elections as well as other forms of political activity womens rights in iran are described as seriously inadequate and childrens rights have been severely violated with more child offenders being executed in iran than in any other country in the world sexual activity between members of the same sex is illegal and is punishable by up to death
",according international reports irans human rights record exceptionally poor regime iran undemocratic frequently persecuted arrested critics government supreme leader severely restricts participation candidates popular elections forms political activity womens rights iran described seriously inadequate childrens rights severely violated child offenders executed iran country world sexual activity members sex illegal punishable death,7.47,"according,international,reports,irans,human,rights,record,exceptionally,poor,regime,iran,undemocratic,frequently,persecuted,arrested,critics,government,supreme,leader,severely,restricts,participation,candidates,popular,elections,forms,political,activity,womens,rights,iran,described,seriously,inadequate,childrens,rights,severely,violated,child,offenders,executed,iran,country,world,sexual,activity,members,sex,illegal,punishable,death",0.00,iran
"over the past decade numbers of anti government protests have broken out throughout iran  demanding reforms or the end to the islamic republic however the islamic revolutionary guard cops  and police often suppressed mass protests violently resulting in thousands of protesters being killed
",past decade numbers anti government protests broken iran demanding reforms end islamic republic islamic revolutionary guard cops police suppressed mass protests violently resulting thousands protesters killed,5.84,"past,decade,numbers,anti,government,protests,broken,iran,demanding,reforms,end,islamic,republic,islamic,revolutionary,guard,cops,police,suppressed,mass,protests,violently,resulting,thousands,protesters,killed",0.00,iran
"censorship in iran under the government of the islamic republic was ranked among the most extreme worldwide
",censorship iran government islamic republic ranked extreme worldwide,8.33,"censorship,iran,government,islamic,republic,ranked,extreme,worldwide",0.00,iran
"iran also has strict regulations when it comes to internet censorship with the government and the islamic revolutionary guard corps persistently blocking social media and other websites in january  iranian authorities added signal to the list of blocked social media platforms which included facebook telegram twitter and youtube they carried out arbitrary arrests for social media postings deemed counter revolutionary or un islamic
",iran strict regulations comes internet censorship government islamic revolutionary guard corps persistently blocking social media websites january iranian authorities added signal list blocked social media platforms included facebook telegram twitter youtube carried arbitrary arrests social media postings deemed counter revolutionary un islamic,4.84,"iran,strict,regulations,comes,internet,censorship,government,islamic,revolutionary,guard,corps,persistently,blocking,social,media,websites,january,iranian,authorities,added,signal,list,blocked,social,media,platforms,included,facebook,telegram,twitter,youtube,carried,arbitrary,arrests,social,media,postings,deemed,counter,revolutionary,un,islamic",0.00,iran
"irans economy is a mixture of central planning state ownership of oil and other large enterprises village agriculture and small scale private trading and service ventures in  gdp was  billion  or  at ppp per capita iran is ranked as a lower middle income economy by the world bank in the early st century the service sector contributed the largest percentage of the gdp followed by industry  and agriculture
",irans economy mixture central planning state ownership oil large enterprises village agriculture small scale private trading service ventures gdp billion ppp capita iran ranked lower middle income economy world bank early st century service sector contributed largest percentage gdp followed industry agriculture,6.37,"irans,economy,mixture,central,planning,state,ownership,oil,large,enterprises,village,agriculture,small,scale,private,trading,service,ventures,gdp,billion,ppp,capita,iran,ranked,lower,middle,income,economy,world,bank,early,st,century,service,sector,contributed,largest,percentage,gdp,followed,industry,agriculture",0.00,iran
"the central bank of the islamic republic of iran is responsible for developing and maintaining the iranian rial which serves as the countrys currency the government does not recognize trade unions other than the islamic labour councils which are subject to the approval of employers and the security services the minimum wage in june  was  million rials a month  unemployment has remained above  since  and the unemployment rate for women is almost double that of the men
",central bank islamic republic iran responsible developing maintaining iranian rial serves countrys currency government recognize trade unions islamic labour councils subject approval employers security services minimum wage june million rials month unemployment remained unemployment rate women double men,8.26,"central,bank,islamic,republic,iran,responsible,developing,maintaining,iranian,rial,serves,countrys,currency,government,recognize,trade,unions,islamic,labour,councils,subject,approval,employers,security,services,minimum,wage,june,million,rials,month,unemployment,remained,unemployment,rate,women,double,men",0.00,iran
