Unclean,Clean,Noise_Pre_Processing,Training_Data,Noise_Post_Processing,Query
"in november  south korea and china agreed to work together to mend south koreas relationship with north korea during a meeting between president moon and chinas foreign minister wang yi moon expressed his gratitude to china for its role in helping to foster peace in the korean peninsula moon was quoted telling wang during their meeting that the south korean government will not stop efforts to put an end  to war on the korean peninsula and achieve complete denuclearization and permanent peace together with the international community including china
",november south korea china agreed work mend south koreas relationship north korea meeting president moon chinas foreign minister wang yi moon expressed gratitude china role helping foster peace korean peninsula moon quoted telling wang meeting south korean government stop efforts end war korean peninsula achieve complete denuclearization permanent peace international community including china,6.49,"november,south,korea,china,agreed,work,mend,south,koreas,relationship,north,korea,meeting,president,moon,chinas,foreign,minister,wang,yi,moon,expressed,gratitude,china,role,helping,foster,peace,korean,peninsula,moon,quoted,telling,wang,meeting,south,korean,government,stop,efforts,end,war,korean,peninsula,achieve,complete,denuclearization,permanent,peace,international,community,including,china",0.00,korean
"the southern and southwestern coastlines of the peninsula form a well developed ria coastline known as dadohae jin in korean this convoluted coastline provides mild seas and the resulting calm environment allows for safe navigation fishing and seaweed farming in addition to the complex coastline the western coast of the korean peninsula has an extremely high tidal amplitude  vast tidal flats have been developing on the south and west coastlines
",southern southwestern coastlines peninsula form developed ria coastline known dadohae jin korean convoluted coastline provides mild seas resulting calm environment allows safe navigation fishing seaweed farming addition complex coastline western coast korean peninsula extremely high tidal amplitude vast tidal flats developing south west coastlines,5.79,"southern,southwestern,coastlines,peninsula,form,developed,ria,coastline,known,dadohae,jin,korean,convoluted,coastline,provides,mild,seas,resulting,calm,environment,allows,safe,navigation,fishing,seaweed,farming,addition,complex,coastline,western,coast,korean,peninsula,extremely,high,tidal,amplitude,vast,tidal,flats,developing,south,west,coastlines",0.00,korean
"animal life of the korean peninsula includes a considerable number of bird species and native freshwater fish native or endemic species of the korean peninsula include korean hare korean water deer korean field mouse korean brown frog korean pine and korean spruce the korean demilitarized zone  with its forest and natural wetlands is a unique biodiversity spot which harbours eighty two endangered species korea once hosted many siberian tigers but as the number of people affected by the tigers increased the tigers were killed in the joseon dynasty and the siberian tigers in the south korea became extinct during the japanese colonial era period it has been confirmed that siberian tigers are only on the side of north korea now
",animal life korean peninsula includes considerable number bird species native freshwater fish native endemic species korean peninsula include korean hare korean water deer korean field mouse korean brown frog korean pine korean spruce korean demilitarized zone forest natural wetlands unique biodiversity spot harbours eighty endangered species korea hosted siberian tigers number people affected tigers increased tigers killed joseon dynasty siberian tigers south korea extinct japanese colonial era period confirmed siberian tigers north korea,6.40,"animal,life,korean,peninsula,includes,considerable,number,bird,species,native,freshwater,fish,native,endemic,species,korean,peninsula,include,korean,hare,korean,water,deer,korean,field,mouse,korean,brown,frog,korean,pine,korean,spruce,korean,demilitarized,zone,forest,natural,wetlands,unique,biodiversity,spot,harbours,eighty,endangered,species,korea,hosted,siberian,tigers,number,people,affected,tigers,increased,tigers,killed,joseon,dynasty,siberian,tigers,south,korea,extinct,japanese,colonial,era,period,confirmed,siberian,tigers,north,korea",0.00,korean
"the combined population of the koreas is about  million  korea is chiefly populated by a highly homogeneous ethnic group the koreans who speak the korean language the number of foreigners living in korea has also steadily increased since the late th century particularly in south korea where more than  million foreigners reside it was estimated in  that only  of the old chinese community now remain in south korea however in recent years immigration from mainland china has increased  persons of chinese nationality have immigrated to south korea including  of ethnic korean descent small communities of ethnic chinese and japanese are also found in north korea
",combined population koreas million korea chiefly populated highly homogeneous ethnic group koreans speak korean language number foreigners living korea steadily increased late th century particularly south korea million foreigners reside estimated old chinese community remain south korea recent years immigration mainland china increased persons chinese nationality immigrated south korea including ethnic korean descent small communities ethnic chinese japanese found north korea,6.63,"combined,population,koreas,million,korea,chiefly,populated,highly,homogeneous,ethnic,group,koreans,speak,korean,language,number,foreigners,living,korea,steadily,increased,late,th,century,particularly,south,korea,million,foreigners,reside,estimated,old,chinese,community,remain,south,korea,recent,years,immigration,mainland,china,increased,persons,chinese,nationality,immigrated,south,korea,including,ethnic,korean,descent,small,communities,ethnic,chinese,japanese,found,north,korea",0.00,korean
"korean is the official language of both north and south korea and  of yanbian korean autonomous prefecture in  jilin province china worldwide there are up to  million speakers of the korean language south korea has around  million speakers while north korea around  million other large groups of korean speakers through korean diaspora are found in china the united states japan former soviet union and elsewhere
",korean official language north south korea yanbian korean autonomous prefecture jilin province china worldwide million speakers korean language south korea million speakers north korea million large groups korean speakers korean diaspora found china united states japan soviet union,6.54,"korean,official,language,north,south,korea,yanbian,korean,autonomous,prefecture,jilin,province,china,worldwide,million,speakers,korean,language,south,korea,million,speakers,north,korea,million,large,groups,korean,speakers,korean,diaspora,found,china,united,states,japan,soviet,union",0.00,korean
"modern korean is written almost exclusively in the script of the korean alphabet  which was invented in the th century korean is sometimes written with the addition of some chinese characters called hanja however this is only occasionally seen nowadays
",modern korean written exclusively script korean alphabet invented th century korean written addition chinese characters called hanja occasionally seen nowadays,7.91,"modern,korean,written,exclusively,script,korean,alphabet,invented,th,century,korean,written,addition,chinese,characters,called,hanja,occasionally,seen,nowadays",0.00,korean
"the modern south korean school system consists of six years in elementary school three years in middle school and three years in high school students are required to go to elementary and middle school and do not have to pay for their education except for a small fee called a school operation support fee that differs from school to school the programme for international student assessment coordinated by the oecd ranks south koreas science education as the third best in the world and being significantly higher than the oecd average
",modern south korean school system consists years elementary school years middle school years high school students required elementary middle school pay education small fee called school operation support fee differs school school programme international student assessment coordinated oecd ranks south koreas science education best world significantly higher oecd average,7.65,"modern,south,korean,school,system,consists,years,elementary,school,years,middle,school,years,high,school,students,required,elementary,middle,school,pay,education,small,fee,called,school,operation,support,fee,differs,school,school,programme,international,student,assessment,coordinated,oecd,ranks,south,koreas,science,education,best,world,significantly,higher,oecd,average",0.00,korean
"south korea ranks second on math and literature and first in problem solvingcitation needed although south korean students often rank high on international comparative assessments the education system is criticised for emphasising too much upon passive learning and memorisation the south korean education system is rather notably strict and structured   as compared to its counterparts in most western societies
",south korea ranks second math literature problem solvingcitation needed south korean students rank high international comparative assessments education system criticised emphasising passive learning memorisation south korean education system notably strict structured compared counterparts western societies,5.81,"south,korea,ranks,second,math,literature,problem,solvingcitation,needed,south,korean,students,rank,high,international,comparative,assessments,education,system,criticised,emphasising,passive,learning,memorisation,south,korean,education,system,notably,strict,structured,compared,counterparts,western,societies",0.00,korean
"the north korean education system consists primarily of universal and state funded schooling by the government the national literacy rate for citizens  years of age and above is over  per cent children go through one year of kindergarten four years of primary education six years of secondary education and then on to universities the most prestigious university in the dprk is kim il sung university other notable universities include kim chaek university of technology which focuses on computer science pyongyang university of foreign studies which trains working level diplomats and trade officials and kim hyong jik university of education which trains teachers
",north korean education system consists primarily universal state funded schooling government national literacy rate citizens years age cent children year kindergarten years primary education years secondary education universities prestigious university dprk kim il sung university notable universities include kim chaek university technology focuses computer science pyongyang university foreign studies trains working level diplomats trade officials kim hyong jik university education trains teachers,6.01,"north,korean,education,system,consists,primarily,universal,state,funded,schooling,government,national,literacy,rate,citizens,years,age,cent,children,year,kindergarten,years,primary,education,years,secondary,education,universities,prestigious,university,dprk,kim,il,sung,university,notable,universities,include,kim,chaek,university,technology,focuses,computer,science,pyongyang,university,foreign,studies,trains,working,level,diplomats,trade,officials,kim,hyong,jik,university,education,trains,teachers",0.00,korean
"the earliest known surviving korean example of woodblock printing is the great dharani sutra it is believed to have been printed in korea in  which if correct would make it older than the diamond sutra
",earliest known surviving korean example woodblock printing great dharani sutra believed printed korea correct older diamond sutra,8.91,"earliest,known,surviving,korean,example,woodblock,printing,great,dharani,sutra,believed,printed,korea,correct,older,diamond,sutra",0.00,korean
"the korean alphabet hangul was also invented during this time by king sejong the great
",korean alphabet hangul invented time king sejong great,8.05,"korean,alphabet,hangul,invented,time,king,sejong,great",0.00,korean
"in ancient chinese texts korea is referred to as rivers and mountains embroidered on silk  and eastern nation of decorum  individuals are regarded as one year old when they are born as koreans reckon the pregnancy period as one year of life for infants and age increments increase on new years day rather than on the anniversary of birthdays thus one born immediately before new years day may only be a few days old in western reckoning but two years old in korea accordingly a korean persons stated age  will be one or two years more than their age according to western reckoning however western reckoning is sometimes applied with regard to the concept of legal age for example the legal age for purchasing alcohol or cigarettes in the republic of korea is  which is measured according to western reckoning
",ancient chinese texts korea referred rivers mountains embroidered silk eastern nation decorum individuals regarded year old born koreans reckon pregnancy period year life infants age increments increase new years day anniversary birthdays born immediately new years day days old western reckoning years old korea accordingly korean persons stated age years age according western reckoning western reckoning applied regard concept legal age example legal age purchasing alcohol cigarettes republic korea measured according western reckoning,8.28,"ancient,chinese,texts,korea,referred,rivers,mountains,embroidered,silk,eastern,nation,decorum,individuals,regarded,year,old,born,koreans,reckon,pregnancy,period,year,life,infants,age,increments,increase,new,years,day,anniversary,birthdays,born,immediately,new,years,day,days,old,western,reckoning,years,old,korea,accordingly,korean,persons,stated,age,years,age,according,western,reckoning,western,reckoning,applied,regard,concept,legal,age,example,legal,age,purchasing,alcohol,cigarettes,republic,korea,measured,according,western,reckoning",0.00,korean
"korean literature written before the end of the joseon dynasty is called classical or traditional literature written in chinese characters  was established at the same time as the chinese script arrived on the peninsula korean scholars were writing poetry in the classical korean style as early as the nd century bce reflecting korean thoughts and experiences of that time classical korean literature has its roots in traditional folk beliefs and folk tales of the peninsula strongly influenced by confucianism buddhism and taoism
",korean literature written end joseon dynasty called classical traditional literature written chinese characters established time chinese script arrived peninsula korean scholars writing poetry classical korean style early nd century bce reflecting korean thoughts experiences time classical korean literature roots traditional folk beliefs folk tales peninsula strongly influenced confucianism buddhism taoism,6.03,"korean,literature,written,end,joseon,dynasty,called,classical,traditional,literature,written,chinese,characters,established,time,chinese,script,arrived,peninsula,korean,scholars,writing,poetry,classical,korean,style,early,nd,century,bce,reflecting,korean,thoughts,experiences,time,classical,korean,literature,roots,traditional,folk,beliefs,folk,tales,peninsula,strongly,influenced,confucianism,buddhism,taoism",0.00,korean
"modern literature is often linked with the development of hangul which helped spread literacy from the aristocracy to the common people hangul however only reached a dominant position in korean literature in the second half of the th century resulting in a major growth in korean literature sinsoseol for instance are novels written in hangul
",modern literature linked development hangul helped spread literacy aristocracy common people hangul reached dominant position korean literature second half th century resulting major growth korean literature sinsoseol instance novels written hangul,7.00,"modern,literature,linked,development,hangul,helped,spread,literacy,aristocracy,common,people,hangul,reached,dominant,position,korean,literature,second,half,th,century,resulting,major,growth,korean,literature,sinsoseol,instance,novels,written,hangul",0.00,korean
"the korean war led to the development of literature centered on the wounds and chaos of war much of the post war literature in south korea deals with the daily lives of ordinary people and their struggles with national pain the collapse of the traditional korean value system is another common theme of the time
",korean war led development literature centered wounds chaos war post war literature south korea deals daily lives ordinary people struggles national pain collapse traditional korean value system common theme time,8.01,"korean,war,led,development,literature,centered,wounds,chaos,war,post,war,literature,south,korea,deals,daily,lives,ordinary,people,struggles,national,pain,collapse,traditional,korean,value,system,common,theme,time",0.00,korean
"traditional korean music includes combinations of the folk vocal religious and ritual music styles of the korean people korean music has been practised since prehistoric times korean music falls into two broad categories the first hyangak literally means the local music or music native to korea a famous example of which is sujechon a piece of instrumental music often claimed to be at least  years old the second yangak represents a more western style
",traditional korean music includes combinations folk vocal religious ritual music styles korean people korean music practised prehistoric times korean music falls broad categories hyangak literally means local music music native korea famous example sujechon piece instrumental music claimed years old second yangak represents western style,6.39,"traditional,korean,music,includes,combinations,folk,vocal,religious,ritual,music,styles,korean,people,korean,music,practised,prehistoric,times,korean,music,falls,broad,categories,hyangak,literally,means,local,music,music,native,korea,famous,example,sujechon,piece,instrumental,music,claimed,years,old,second,yangak,represents,western,style",0.00,korean
"confucian tradition has dominated korean thought along with contributions by buddhism taoism and korean shamanism since the middle of the th century however christianity has competed with buddhism in south korea while religious practice has been suppressed in north korea throughout korean history and culture regardless of separation the influence of traditional beliefs of korean shamanism mahayana buddhism confucianism and taoism have remained an underlying religion of the korean people as well as a vital aspect of their culture all these traditions have coexisted peacefully for hundreds of years up to today despite strong westernisation from christian missionary conversions in the south or the pressure from the juche government in the north
",confucian tradition dominated korean thought contributions buddhism taoism korean shamanism middle th century christianity competed buddhism south korea religious practice suppressed north korea korean history culture regardless separation influence traditional beliefs korean shamanism mahayana buddhism confucianism taoism remained underlying religion korean people vital aspect culture traditions coexisted peacefully hundreds years today despite strong westernisation christian missionary conversions south pressure juche government north,6.65,"confucian,tradition,dominated,korean,thought,contributions,buddhism,taoism,korean,shamanism,middle,th,century,christianity,competed,buddhism,south,korea,religious,practice,suppressed,north,korea,korean,history,culture,regardless,separation,influence,traditional,beliefs,korean,shamanism,mahayana,buddhism,confucianism,taoism,remained,underlying,religion,korean,people,vital,aspect,culture,traditions,coexisted,peacefully,hundreds,years,today,despite,strong,westernisation,christian,missionary,conversions,south,pressure,juche,government,north",0.00,korean
"according to  statistics compiled by the south korean government about  of citizens profess to follow no particular religion christians account for  of the population  and buddhists  in north korea around  claim to be non religious or atheists  follow cheondoism and  korean folk religion while christians count for  of the population and buddhists as 
",according statistics compiled south korean government citizens profess follow particular religion christians account population buddhists north korea claim non religious atheists follow cheondoism korean folk religion christians count population buddhists,6.52,"according,statistics,compiled,south,korean,government,citizens,profess,follow,particular,religion,christians,account,population,buddhists,north,korea,claim,non,religious,atheists,follow,cheondoism,korean,folk,religion,christians,count,population,buddhists",0.00,korean
"koreans traditionally believe that the taste and quality of food depend on its spices and sauces the essential ingredients to making a delicious meal therefore soybean paste soy sauce gochujang or red pepper paste and kimchi are some of the most important staples in a korean household
",koreans traditionally believe taste quality food depend spices sauces essential ingredients making delicious meal soybean paste soy sauce gochujang red pepper paste kimchi important staples korean household,6.99,"koreans,traditionally,believe,taste,quality,food,depend,spices,sauces,essential,ingredients,making,delicious,meal,soybean,paste,soy,sauce,gochujang,red,pepper,paste,kimchi,important,staples,korean,household",0.00,korean
"korean cuisine was greatly influenced by the geography and climate of the korean peninsula which is known for its cold autumns and winters therefore there are many fermented dishes and hot soups and stews
",korean cuisine greatly influenced geography climate korean peninsula known cold autumns winters fermented dishes hot soups stews,8.29,"korean,cuisine,greatly,influenced,geography,climate,korean,peninsula,known,cold,autumns,winters,fermented,dishes,hot,soups,stews",0.00,korean
"korean cuisine is probably best known for kimchi a side dish which uses a distinctive fermentation process of preserving vegetables most commonly cabbage kimchi is said to relieve the pores on the skin thereby reducing wrinkles and providing nutrients to the skin naturally it is also healthy as it provides necessary vitamins and nutrients gochujang a traditional korean sauce made of red pepper is also commonly used often as pepper  paste earning the cuisine a reputation for spiciness
",korean cuisine probably best known kimchi dish uses distinctive fermentation process preserving vegetables commonly cabbage kimchi said relieve pores skin reducing wrinkles providing nutrients skin naturally healthy provides necessary vitamins nutrients gochujang traditional korean sauce red pepper commonly pepper paste earning cuisine reputation spiciness,6.95,"korean,cuisine,probably,best,known,kimchi,dish,uses,distinctive,fermentation,process,preserving,vegetables,commonly,cabbage,kimchi,said,relieve,pores,skin,reducing,wrinkles,providing,nutrients,skin,naturally,healthy,provides,necessary,vitamins,nutrients,gochujang,traditional,korean,sauce,red,pepper,commonly,pepper,paste,earning,cuisine,reputation,spiciness",0.00,korean
"korea is unique among asian countries in its use of metal chopsticks metal chopsticks have been discovered in archaeological sites belonging to the ancient korean kingdoms of goguryeo baekje and silla
",korea unique asian countries use metal chopsticks metal chopsticks discovered archaeological sites belonging ancient korean kingdoms goguryeo baekje silla,5.97,"korea,unique,asian,countries,use,metal,chopsticks,metal,chopsticks,discovered,archaeological,sites,belonging,ancient,korean,kingdoms,goguryeo,baekje,silla",0.00,korean
"hapkido is a modern korean martial art with a grappling focus that employs joint locks throws kicks punches and other striking attacks like attacks against pressure points hapkido emphasises circular motion non resisting movements and control of the opponent practitioners seek to gain advantage through footwork and body positioning to employ leverage avoiding the pure use of strength against strength
",hapkido modern korean martial art grappling focus employs joint locks throws kicks punches striking attacks like attacks pressure points hapkido emphasises circular motion non resisting movements control opponent practitioners seek gain advantage footwork body positioning employ leverage avoiding pure use strength strength,4.46,"hapkido,modern,korean,martial,art,grappling,focus,employs,joint,locks,throws,kicks,punches,striking,attacks,like,attacks,pressure,points,hapkido,emphasises,circular,motion,non,resisting,movements,control,opponent,practitioners,seek,gain,advantage,footwork,body,positioning,employ,leverage,avoiding,pure,use,strength,strength",0.00,korean
