Unclean,Clean,Noise_Pre_Processing,Training_Data,Noise_Post_Processing,Query
"there are seven verb paradigms or speech levels in korean and each level has its own unique set of verb endings which are used to indicate the level of formality of a situation unlike honorificswhich are used to show respect towards the referent speech levels are used to show respect towards a speakers or writers audience  the names of the seven levels are derived from the non honorific imperative form of the verb   in each level plus the suffix   which means style
",seven verb paradigms speech levels korean level unique set verb endings indicate level formality situation unlike honorificswhich respect referent speech levels respect speakers writers audience names seven levels derived non honorific imperative form verb level plus suffix means style,9.15,"seven,verb,paradigms,speech,levels,korean,level,unique,set,verb,endings,indicate,level,formality,situation,unlike,honorificswhich,respect,referent,speech,levels,respect,speakers,writers,audience,names,seven,levels,derived,non,honorific,imperative,form,verb,level,plus,suffix,means,style",0.00,korean
"the three levels with high politeness  are generally grouped together as jondaenmal  whereas the two levels with low politeness  are banmal  in korean the remaining two levels  are neither polite nor impolite
",levels high politeness generally grouped jondaenmal levels low politeness banmal korean remaining levels polite impolite,8.13,"levels,high,politeness,generally,grouped,jondaenmal,levels,low,politeness,banmal,korean,remaining,levels,polite,impolite",0.00,korean
"in general korean lacks grammatical gender as one of the few exceptions the third person singular pronoun has two different forms  geu  and  geu nyeo  before  was invented in need of translating she into korean  was the only third person singular pronoun and had no grammatical gender its origin causes  never to be used in spoken korean but appearing only in writing
",general korean lacks grammatical gender exceptions person singular pronoun different forms geu geu nyeo invented need translating korean person singular pronoun grammatical gender origin causes spoken korean appearing writing,8.97,"general,korean,lacks,grammatical,gender,exceptions,person,singular,pronoun,different,forms,geu,geu,nyeo,invented,need,translating,korean,person,singular,pronoun,grammatical,gender,origin,causes,spoken,korean,appearing,writing",0.00,korean
"to have a more complete understanding of the intricacies of gender in korean three models of language and gender that have been proposed the deficit model the dominance model and the cultural difference model in the deficit model male speech is seen as the default and any form of speech that diverges from that norm  is seen as lesser than the dominance model sees women as lacking in power due to living within a patriarchal society the cultural difference model proposes that the difference in upbringing between men and women can explain the differences in their speech patterns it is important to look at the models to better understand the misogynistic conditions that shaped the ways that men and women use the language koreans lack of grammatical gender makes it different from most european languages rather gendered differences in korean can be observed through formality intonation word choice etc
",complete understanding intricacies gender korean models language gender proposed deficit model dominance model cultural difference model deficit model male speech seen default form speech diverges norm seen lesser dominance model sees women lacking power living patriarchal society cultural difference model proposes difference upbringing men women explain differences speech patterns important look models better understand misogynistic conditions shaped ways men women use language koreans lack grammatical gender makes different european languages gendered differences korean observed formality intonation word choice etc,7.70,"complete,understanding,intricacies,gender,korean,models,language,gender,proposed,deficit,model,dominance,model,cultural,difference,model,deficit,model,male,speech,seen,default,form,speech,diverges,norm,seen,lesser,dominance,model,sees,women,lacking,power,living,patriarchal,society,cultural,difference,model,proposes,difference,upbringing,men,women,explain,differences,speech,patterns,important,look,models,better,understand,misogynistic,conditions,shaped,ways,men,women,use,language,koreans,lack,grammatical,gender,makes,different,european,languages,gendered,differences,korean,observed,formality,intonation,word,choice,etc",0.00,korean
"however one can still find stronger contrasts between genders within korean speech some examples of this can be seen in  the softer tone used by women in speech  a married woman introducing herself as someone is mother or wife not with her own name  the presence of gender differences in titles and occupational terms   females sometimes using more tag questions and rising tones in statements also seen in speech from children
",find stronger contrasts genders korean speech examples seen softer tone women speech married woman introducing mother wife presence gender differences titles occupational terms females tag questions rising tones statements seen speech children,9.11,"find,stronger,contrasts,genders,korean,speech,examples,seen,softer,tone,women,speech,married,woman,introducing,mother,wife,presence,gender,differences,titles,occupational,terms,females,tag,questions,rising,tones,statements,seen,speech,children",0.00,korean
"between two people of asymmetric status in korean society people tend to emphasize differences in status for the sake of solidarity koreans prefer to use kinship terms rather than any other terms of reference in traditional korean society women have long been in disadvantaged positions korean social structure traditionally was a patriarchically dominated family system that emphasized the maintenance of family lines that structure has tended to separate the roles of women from those of men
",people asymmetric status korean society people tend emphasize differences status sake solidarity koreans prefer use kinship terms terms reference traditional korean society women long disadvantaged positions korean social structure traditionally patriarchically dominated family system emphasized maintenance family lines structure tended separate roles women men,6.48,"people,asymmetric,status,korean,society,people,tend,emphasize,differences,status,sake,solidarity,koreans,prefer,use,kinship,terms,terms,reference,traditional,korean,society,women,long,disadvantaged,positions,korean,social,structure,traditionally,patriarchically,dominated,family,system,emphasized,maintenance,family,lines,structure,tended,separate,roles,women,men",0.00,korean
"korean societys prevalent attitude towards men being in public  and women living in private still exists today for instance the word for husband is bakkat yangban  but a husband introduces his wife as ansaram  also in kinship terminology we  is added for maternal grandparents creating oe harabeoji and oe hal meoni  with different lexicons for males and females and patriarchal society revealed further in interrogatives to an addressee of equal or lower status korean men tend to use haennya  in aggressive masculinity but women use haenni  as a soft expression however there are exceptions korean society used the question endings  ni  and  nya  the former prevailing among women and men until a few decades ago in fact  nya  was characteristic of the jeolla and chungcheong dialects however since the s large numbers of people have moved to seoul from chungcheong and jeolla and they began to influence the way men speak recently women also have used the  nya  as for  ni  it is usually used toward people to be polite even to someone not close or younger as for  nya  it is used mainly to close friends regardless of gender
",korean societys prevalent attitude men public women living private exists today instance word husband bakkat yangban husband introduces wife ansaram kinship terminology added maternal grandparents creating oe harabeoji oe hal meoni different lexicons males females patriarchal society revealed interrogatives addressee equal lower status korean men tend use haennya aggressive masculinity women use haenni soft expression exceptions korean society question endings ni nya prevailing women men decades ago fact nya characteristic jeolla chungcheong dialects large numbers people moved seoul chungcheong jeolla began influence way men speak recently women nya ni usually people polite close younger nya mainly close friends regardless gender,7.97,"korean,societys,prevalent,attitude,men,public,women,living,private,exists,today,instance,word,husband,bakkat,yangban,husband,introduces,wife,ansaram,kinship,terminology,added,maternal,grandparents,creating,oe,harabeoji,oe,hal,meoni,different,lexicons,males,females,patriarchal,society,revealed,interrogatives,addressee,equal,lower,status,korean,men,tend,use,haennya,aggressive,masculinity,women,use,haenni,soft,expression,exceptions,korean,society,question,endings,ni,nya,prevailing,women,men,decades,ago,fact,nya,characteristic,jeolla,chungcheong,dialects,large,numbers,people,moved,seoul,chungcheong,jeolla,began,influence,way,men,speak,recently,women,nya,ni,usually,people,polite,close,younger,nya,mainly,close,friends,regardless,gender",0.00,korean
"another crucial difference between men and women is the tone and pitch of their voices and how they affect the perception of politeness men learn to use an authoritative falling tone in korean culture a deeper voice is associated with being more polite in addition to the deferential speech endings being used men are seen as more polite as well as impartial and professional compared to women who use a rising tone in conjunction with  yo  they are not perceived to be as polite as men the  yo  also indicates uncertainty since the ending has many prefixes that indicate uncertainty and questioning the deferential ending does not have any prefixes and do can indicate uncertainty the  hamnida  ending is the most polite and formal form of korea and the  yo  ending is less polite and formal which causes the perception of women as less professional
",crucial difference men women tone pitch voices affect perception politeness men learn use authoritative falling tone korean culture deeper voice associated polite addition deferential speech endings men seen polite impartial professional compared women use rising tone conjunction yo perceived polite men yo indicates uncertainty ending prefixes indicate uncertainty questioning deferential ending prefixes indicate uncertainty hamnida ending polite formal form korea yo ending polite formal causes perception women professional,9.05,"crucial,difference,men,women,tone,pitch,voices,affect,perception,politeness,men,learn,use,authoritative,falling,tone,korean,culture,deeper,voice,associated,polite,addition,deferential,speech,endings,men,seen,polite,impartial,professional,compared,women,use,rising,tone,conjunction,yo,perceived,polite,men,yo,indicates,uncertainty,ending,prefixes,indicate,uncertainty,questioning,deferential,ending,prefixes,indicate,uncertainty,hamnida,ending,polite,formal,form,korea,yo,ending,polite,formal,causes,perception,women,professional",0.00,korean
"the core of the korean vocabulary is made up of native korean words however a significant proportion of the vocabulary especially words that denote abstract ideas are sino korean words  to a much lesser extent some words have also been borrowed from mongolian and other languages more recent loanwords are dominated by english
",core korean vocabulary native korean words significant proportion vocabulary especially words denote abstract ideas sino korean words lesser extent words borrowed mongolian languages recent loanwords dominated english,7.95,"core,korean,vocabulary,native,korean,words,significant,proportion,vocabulary,especially,words,denote,abstract,ideas,sino,korean,words,lesser,extent,words,borrowed,mongolian,languages,recent,loanwords,dominated,english",0.00,korean
"north korean vocabulary shows a tendency to prefer native korean over sino korean or foreign borrowings especially with recent political objectives aimed at eliminating foreign influences on the korean language in the north in the early years the north korean government tried to eliminate sino korean words consequently south korean may have several sino korean or foreign borrowings which are not in north korean
",north korean vocabulary shows tendency prefer native korean sino korean foreign borrowings especially recent political objectives aimed eliminating foreign influences korean language north early years north korean government tried eliminate sino korean words consequently south korean sino korean foreign borrowings north korean,5.30,"north,korean,vocabulary,shows,tendency,prefer,native,korean,sino,korean,foreign,borrowings,especially,recent,political,objectives,aimed,eliminating,foreign,influences,korean,language,north,early,years,north,korean,government,tried,eliminate,sino,korean,words,consequently,south,korean,sino,korean,foreign,borrowings,north,korean",0.00,korean
"sino korean vocabulary consists of
",sino korean vocabulary consists,2.86,"sino,korean,vocabulary,consists",0.00,korean
"therefore just like other words korean has two sets of numeral systems english is similar having native english words and latinate equivalents such as water aqua fire flame sea marine two dual sun solar star stellar however unlike english and latin which belong to the same indo european languages family and bear a certain resemblance korean and chinese are genetically unrelated and the two sets of korean words differ completely from each other all sino korean morphemes are monosyllabic as in chinese whereas native korean morphemes can be polysyllabic the sino korean words were deliberately imported alongside corresponding chinese characters for a written language and everything was supposed to be written in hanja so the coexistence of sino korean would be more thorough and systematic than that of latinate words in english
",like words korean sets numeral systems english similar native english words latinate equivalents water aqua fire flame sea marine dual sun solar star stellar unlike english latin belong indo european languages family bear certain resemblance korean chinese genetically unrelated sets korean words differ completely sino korean morphemes monosyllabic chinese native korean morphemes polysyllabic sino korean words deliberately imported alongside corresponding chinese characters written language supposed written hanja coexistence sino korean thorough systematic latinate words english,6.83,"like,words,korean,sets,numeral,systems,english,similar,native,english,words,latinate,equivalents,water,aqua,fire,flame,sea,marine,dual,sun,solar,star,stellar,unlike,english,latin,belong,indo,european,languages,family,bear,certain,resemblance,korean,chinese,genetically,unrelated,sets,korean,words,differ,completely,sino,korean,morphemes,monosyllabic,chinese,native,korean,morphemes,polysyllabic,sino,korean,words,deliberately,imported,alongside,corresponding,chinese,characters,written,language,supposed,written,hanja,coexistence,sino,korean,thorough,systematic,latinate,words,english",0.00,korean
"the exact proportion of sino korean vocabulary is a matter of debate sohn  stated  in  the same author gives an even higher estimate of  jeong jae do one of the compilers of the dictionary urimal keun sajeon asserts that the proportion is not so high he points out that korean dictionaries compiled during the colonial period include many unused sino korean words in his estimation the proportion of sino korean vocabulary in the korean language might be as low as 
",exact proportion sino korean vocabulary matter debate sohn stated author gives higher estimate jeong jae compilers dictionary urimal keun sajeon asserts proportion high points korean dictionaries compiled colonial period include unused sino korean words estimation proportion sino korean vocabulary korean language low,8.15,"exact,proportion,sino,korean,vocabulary,matter,debate,sohn,stated,author,gives,higher,estimate,jeong,jae,compilers,dictionary,urimal,keun,sajeon,asserts,proportion,high,points,korean,dictionaries,compiled,colonial,period,include,unused,sino,korean,words,estimation,proportion,sino,korean,vocabulary,korean,language,low",0.00,korean
"the vast majority of loanwords other than sino korean come from modern times approximately  of which are from english many words have also been borrowed from western languages such as german via japanese  part time job   allergy   plaster cast used for broken bones some western words were borrowed indirectly via japanese during the japanese occupation of korea taking a japanese sound pattern for example dozen   dsu   daseu most indirect western borrowings are now written according to current hangulization rules for the respective western language as if borrowed directly there are a few more complicated borrowings such as german  the first part of whose endonym deutschland dtlant the japanese approximated using the kanji  doitsu that were then accepted into the korean language by their sino korean pronunciation  dok   il  dogil in south korean official use a number of other sino korean country names have been replaced with phonetically oriented hangeulizations of the countries endonyms or english names
",vast majority loanwords sino korean come modern times approximately english words borrowed western languages german japanese time job allergy plaster cast broken bones western words borrowed indirectly japanese japanese occupation korea taking japanese sound pattern example dozen dsu daseu indirect western borrowings written according current hangulization rules respective western language borrowed directly complicated borrowings german endonym deutschland dtlant japanese approximated kanji doitsu accepted korean language sino korean pronunciation dok il dogil south korean official use number sino korean country names replaced phonetically oriented hangeulizations countries endonyms english names,6.69,"vast,majority,loanwords,sino,korean,come,modern,times,approximately,english,words,borrowed,western,languages,german,japanese,time,job,allergy,plaster,cast,broken,bones,western,words,borrowed,indirectly,japanese,japanese,occupation,korea,taking,japanese,sound,pattern,example,dozen,dsu,daseu,indirect,western,borrowings,written,according,current,hangulization,rules,respective,western,language,borrowed,directly,complicated,borrowings,german,endonym,deutschland,dtlant,japanese,approximated,kanji,doitsu,accepted,korean,language,sino,korean,pronunciation,dok,il,dogil,south,korean,official,use,number,sino,korean,country,names,replaced,phonetically,oriented,hangeulizations,countries,endonyms,english,names",0.00,korean
"because of such a prevalence of english in modern south korean culture and society lexical borrowing is inevitable english derived korean or konglish  is increasingly used the vocabulary of the south korean dialect of the korean language is roughly  loanwords  however due to north koreas isolation such influence is lacking in north korean speech
",prevalence english modern south korean culture society lexical borrowing inevitable english derived korean konglish increasingly vocabulary south korean dialect korean language roughly loanwords north koreas isolation influence lacking north korean speech,6.61,"prevalence,english,modern,south,korean,culture,society,lexical,borrowing,inevitable,english,derived,korean,konglish,increasingly,vocabulary,south,korean,dialect,korean,language,roughly,loanwords,north,koreas,isolation,influence,lacking,north,korean,speech",0.00,korean
"korean uses words adapted from english in ways that may seem strange or unintuitive to native english speakers for example fighting  is a term of encouragement like come ongo  in english something that is service  is free or on the house a building referred to as an apart  is an apartment  and a type of pencil that is called a sharp  is a mechanical pencil like other borrowings many of these idiosyncrasies including all the examples listed above appear to be imported into korean via japanese or influenced by japanese many english words introduced via japanese pronunciation have been reformed as in   which was once called   as in japanese
",korean uses words adapted english ways strange unintuitive native english speakers example fighting term encouragement like come ongo english service free house building referred apart apartment type pencil called sharp mechanical pencil like borrowings idiosyncrasies including examples listed appear imported korean japanese influenced japanese english words introduced japanese pronunciation reformed called japanese,8.82,"korean,uses,words,adapted,english,ways,strange,unintuitive,native,english,speakers,example,fighting,term,encouragement,like,come,ongo,english,service,free,house,building,referred,apart,apartment,type,pencil,called,sharp,mechanical,pencil,like,borrowings,idiosyncrasies,including,examples,listed,appear,imported,korean,japanese,influenced,japanese,english,words,introduced,japanese,pronunciation,reformed,called,japanese",0.00,korean
"before the creation of the modern korean alphabet known as chosngl in north korea and as hangul in south korea people in korea  primarily wrote using classical chinese alongside native phonetic writing systems that predate hangul by hundreds of years including idu hyangchal gugyeol and gakpil however the fundamental differences between the korean and chinese languages and the large number of characters to be learned made few people in the lower classes have the privilege of education and they had much difficulty in learning how to write using chinese characters to assuage that problem king sejong  created the unique alphabet known as hangul to promote literacy among the common people
",creation modern korean alphabet known chosngl north korea hangul south korea people korea primarily wrote classical chinese alongside native phonetic writing systems predate hangul hundreds years including idu hyangchal gugyeol gakpil fundamental differences korean chinese languages large number characters learned people lower classes privilege education difficulty learning write chinese characters assuage problem king sejong created unique alphabet known hangul promote literacy common people,6.78,"creation,modern,korean,alphabet,known,chosngl,north,korea,hangul,south,korea,people,korea,primarily,wrote,classical,chinese,alongside,native,phonetic,writing,systems,predate,hangul,hundreds,years,including,idu,hyangchal,gugyeol,gakpil,fundamental,differences,korean,chinese,languages,large,number,characters,learned,people,lower,classes,privilege,education,difficulty,learning,write,chinese,characters,assuage,problem,king,sejong,created,unique,alphabet,known,hangul,promote,literacy,common,people",0.00,korean
"the korean alphabet was denounced and looked down upon by the yangban aristocracy who deemed it too easy to learn but it gained widespread use among the common class and was widely used to print popular novels which were enjoyed by the common class with growing korean nationalism in the th century the gabo reformists push and the promotion of hangul in schools in  hangul displaced hanja as koreas national script hanja are still used to a certain extent in south korea where they are sometimes combined with hangul but that method is slowly declining in use even though students learn hanja in school
",korean alphabet denounced looked yangban aristocracy deemed easy learn gained widespread use common class widely print popular novels enjoyed common class growing korean nationalism th century gabo reformists push promotion hangul schools hangul displaced hanja koreas national script hanja certain extent south korea combined hangul method slowly declining use students learn hanja school,8.44,"korean,alphabet,denounced,looked,yangban,aristocracy,deemed,easy,learn,gained,widespread,use,common,class,widely,print,popular,novels,enjoyed,common,class,growing,korean,nationalism,th,century,gabo,reformists,push,promotion,hangul,schools,hangul,displaced,hanja,koreas,national,script,hanja,certain,extent,south,korea,combined,hangul,method,slowly,declining,use,students,learn,hanja,school",0.00,korean
"below is a chart of the korean alphabets  symbols and their revised romanization  and canonical international phonetic alphabet  values
",chart korean alphabets symbols revised romanization canonical international phonetic alphabet values,5.88,"chart,korean,alphabets,symbols,revised,romanization,canonical,international,phonetic,alphabet,values",0.00,korean
"the letters of the korean alphabet are not written linearly like most alphabets but instead arranged into blocks that represent syllables so while the word bibimbap  is written as eight characters in a row in the latin alphabet in korean it is written  as three syllabic blocks in a row mukbang  is seven characters after romanization but only two syllabic blocks before
",letters korean alphabet written linearly like alphabets instead arranged blocks represent syllables word bibimbap written characters row latin alphabet korean written syllabic blocks row mukbang seven characters romanization syllabic blocks,8.63,"letters,korean,alphabet,written,linearly,like,alphabets,instead,arranged,blocks,represent,syllables,word,bibimbap,written,characters,row,latin,alphabet,korean,written,syllabic,blocks,row,mukbang,seven,characters,romanization,syllabic,blocks",0.00,korean
