Unclean,Clean,Noise_Pre_Processing,Training_Data,Noise_Post_Processing,Query
"in the early th century gold from brazil allowed king john v to sponsor the building of several baroque churches and theatres in the city prior to the th century lisbon had experienced several significant earthquakes  eight in the th century five in the th century  and three in the th century
",early th century gold brazil allowed king john v sponsor building baroque churches theatres city prior th century lisbon experienced significant earthquakes th century th century th century,8.16,"early,th,century,gold,brazil,allowed,king,john,v,sponsor,building,baroque,churches,theatres,city,prior,th,century,lisbon,experienced,significant,earthquakes,th,century,th,century,th,century",0.00,lisbon
"on  november  the city was destroyed by another devastating earthquake which killed an estimated  to  lisbon residents of a population estimated at between  and  and destroyed  percent of the citys structures among several important buildings of the city the ribeira palace and the hospital real de todos os santos were lost in coastal areas such as peniche situated about  km  north of lisbon many people were killed by the following tsunami
",november city destroyed devastating earthquake killed estimated lisbon residents population estimated destroyed percent citys structures important buildings city ribeira palace hospital real de todos os santos lost coastal areas peniche situated km north lisbon people killed following tsunami,7.45,"november,city,destroyed,devastating,earthquake,killed,estimated,lisbon,residents,population,estimated,destroyed,percent,citys,structures,important,buildings,city,ribeira,palace,hospital,real,de,todos,os,santos,lost,coastal,areas,peniche,situated,km,north,lisbon,people,killed,following,tsunami",0.00,lisbon
"by  lisbon was one of the largest cities in europe the catastrophic event shocked the whole of europe and left a deep impression on its collective psyche voltaire wrote a long poem pome sur le dsastre de lisbonne shortly after the quake and mentioned it in his  novel candide  oliver wendell holmes sr also mentions it in his  poem the deacons masterpiece or the wonderful one hoss shay
",lisbon largest cities europe catastrophic event shocked europe left deep impression collective psyche voltaire wrote long poem pome sur le dsastre de lisbonne shortly quake mentioned novel candide oliver wendell holmes sr mentions poem deacons masterpiece wonderful hoss shay,7.49,"lisbon,largest,cities,europe,catastrophic,event,shocked,europe,left,deep,impression,collective,psyche,voltaire,wrote,long,poem,pome,sur,le,dsastre,de,lisbonne,shortly,quake,mentioned,novel,candide,oliver,wendell,holmes,sr,mentions,poem,deacons,masterpiece,wonderful,hoss,shay",0.00,lisbon
"in the first years of the th century portugal was invaded by the troops of napolon bonaparte forcing queen maria i and prince regent john  to flee temporarily to brazil by the time the new king returned to lisbon many of the buildings and properties were pillaged sacked or destroyed by the invaders
",years th century portugal invaded troops napolon bonaparte forcing queen maria prince regent john flee temporarily brazil time new king returned lisbon buildings properties pillaged sacked destroyed invaders,8.33,"years,th,century,portugal,invaded,troops,napolon,bonaparte,forcing,queen,maria,prince,regent,john,flee,temporarily,brazil,time,new,king,returned,lisbon,buildings,properties,pillaged,sacked,destroyed,invaders",0.00,lisbon
"lisbon was the site of the regicide of carlos i of portugal in  an event which culminated two years later in the establishment of the first republic
",lisbon site regicide carlos portugal event culminated years later establishment republic,10.74,"lisbon,site,regicide,carlos,portugal,event,culminated,years,later,establishment,republic",0.00,lisbon
"the city refounded its university in  after centuries of inactivity in lisbon incorporating reformed former colleges and other non university higher education schools of the city  today there are two public universities in the city  a public university institute  and a polytechnic institute 
",city refounded university centuries inactivity lisbon incorporating reformed colleges non university higher education schools city today public universities city public university institute polytechnic institute,6.48,"city,refounded,university,centuries,inactivity,lisbon,incorporating,reformed,colleges,non,university,higher,education,schools,city,today,public,universities,city,public,university,institute,polytechnic,institute",0.00,lisbon
"during world war ii lisbon was one of the very few neutral open european atlantic ports a major gateway for refugees to the yous and a haven for spies more than  refugees were able to flee nazi germany via lisbon
",world war ii lisbon neutral open european atlantic ports major gateway refugees yous spies refugees able flee nazi germany lisbon,9.39,"world,war,ii,lisbon,neutral,open,european,atlantic,ports,major,gateway,refugees,yous,spies,refugees,able,flee,nazi,germany,lisbon",0.00,lisbon
"during the estado novo regime  lisbon was expanded at the cost of other districts within the country resulting in nationalist and monumental projects new residential and public developments were constructed the zone of belm was modified for the  portuguese exhibition while along the periphery new districts appeared to house the growing population the inauguration of the bridge over the tagus allowed a rapid connection between both sides of the river
",estado novo regime lisbon expanded cost districts country resulting nationalist monumental projects new residential public developments constructed zone belm modified portuguese exhibition periphery new districts appeared house growing population inauguration bridge tagus allowed rapid connection sides river,7.27,"estado,novo,regime,lisbon,expanded,cost,districts,country,resulting,nationalist,monumental,projects,new,residential,public,developments,constructed,zone,belm,modified,portuguese,exhibition,periphery,new,districts,appeared,house,growing,population,inauguration,bridge,tagus,allowed,rapid,connection,sides,river",0.00,lisbon
"lisbon was the site of three revolutions in the th century the first the  october  revolution brought an end to the portuguese monarchy and established the highly unstable and corrupt portuguese first republic the  june  revolution ended the first republic and firmly established the estado novo or the portuguese second republic as the ruling regime
",lisbon site revolutions th century october revolution brought end portuguese monarchy established highly unstable corrupt portuguese republic june revolution ended republic firmly established estado novo portuguese second republic ruling regime,7.12,"lisbon,site,revolutions,th,century,october,revolution,brought,end,portuguese,monarchy,established,highly,unstable,corrupt,portuguese,republic,june,revolution,ended,republic,firmly,established,estado,novo,portuguese,second,republic,ruling,regime",0.00,lisbon
"in the s many of the districts were renovated and projects in the historic quarters were established to modernise those areas for instance architectural and patrimonial buildings were renovated the northern margin of the tagus was re purposed for leisure and residential use the vasco da gama bridge was constructed and the eastern part of the municipality was re purposed for expo  to commemorate the th anniversary of vasco da gamas sea voyage to india a voyage that would bring immense riches to lisbon and because many of lisbons landmarks to be built
",districts renovated projects historic quarters established modernise areas instance architectural patrimonial buildings renovated northern margin tagus purposed leisure residential use vasco da gama bridge constructed eastern municipality purposed expo commemorate th anniversary vasco da gamas sea voyage india voyage bring immense riches lisbon lisbons landmarks built,8.45,"districts,renovated,projects,historic,quarters,established,modernise,areas,instance,architectural,patrimonial,buildings,renovated,northern,margin,tagus,purposed,leisure,residential,use,vasco,da,gama,bridge,constructed,eastern,municipality,purposed,expo,commemorate,th,anniversary,vasco,da,gamas,sea,voyage,india,voyage,bring,immense,riches,lisbon,lisbons,landmarks,built",0.00,lisbon
"the lisbon agenda was a european union agreement on measures to revitalise the eu economy signed in lisbon in march  in october  lisbon hosted the  eu summit where an agreement was reached regarding a new eu governance model the resulting treaty of lisbon was signed on  december  and came into force on  december 
",lisbon agenda european union agreement measures revitalise eu economy signed lisbon march october lisbon hosted eu summit agreement reached new eu governance model resulting treaty lisbon signed december came force december,6.98,"lisbon,agenda,european,union,agreement,measures,revitalise,eu,economy,signed,lisbon,march,october,lisbon,hosted,eu,summit,agreement,reached,new,eu,governance,model,resulting,treaty,lisbon,signed,december,came,force,december",0.00,lisbon
"lisbon has been the site for many international events and programmes in  lisbon was the european capital of culture on  november  lisbon hosted the mtv european music awards on  july  lisbon held the ceremony of the new  wonders of the world election in the luz stadium with live transmission for millions of people all over the world every two years lisbon hosts the rock in rio lisboa music festival one of the largest in the world lisbon hosted the nato summit  a summit meeting that is regarded as a periodic opportunity for heads of state and heads of government of nato member states to evaluate and provide strategic direction for alliance activities the city hosts the web summit and is the head office for the group of seven plus  in  it hosted the eurovision song contest for the first time as well as the michelin gala on  july  the aga khan officially chose the henrique de mendona palace located on rua marqus de fronteira as the divan or seat of the global nizari muslim imamate
",lisbon site international events programmes lisbon european capital culture november lisbon hosted mtv european music awards july lisbon held ceremony new wonders world election luz stadium live transmission millions people world years lisbon hosts rock rio lisboa music festival largest world lisbon hosted nato summit summit meeting regarded periodic opportunity heads state heads government nato member states evaluate provide strategic direction alliance activities city hosts web summit head office group seven plus hosted eurovision song contest time michelin gala july aga khan officially chose henrique de mendona palace located rua marqus de fronteira divan seat global nizari muslim imamate,7.65,"lisbon,site,international,events,programmes,lisbon,european,capital,culture,november,lisbon,hosted,mtv,european,music,awards,july,lisbon,held,ceremony,new,wonders,world,election,luz,stadium,live,transmission,millions,people,world,years,lisbon,hosts,rock,rio,lisboa,music,festival,largest,world,lisbon,hosted,nato,summit,summit,meeting,regarded,periodic,opportunity,heads,state,heads,government,nato,member,states,evaluate,provide,strategic,direction,alliance,activities,city,hosts,web,summit,head,office,group,seven,plus,hosted,eurovision,song,contest,time,michelin,gala,july,aga,khan,officially,chose,henrique,de,mendona,palace,located,rua,marqus,de,fronteira,divan,seat,global,nizari,muslim,imamate",0.00,lisbon
"lisbon is located at n w  n w     situated at the mouth of the tagus river and is the westernmost capital of a mainland european country
",lisbon located n w n w situated mouth tagus river westernmost capital mainland european country,8.03,"lisbon,located,n,w,n,w,situated,mouth,tagus,river,westernmost,capital,mainland,european,country",0.00,lisbon
"the westernmost part of lisbon is occupied by the monsanto forest park a  km  urban park one of the largest in europe and occupying  of the municipality
",westernmost lisbon occupied monsanto forest park km urban park largest europe occupying municipality,9.15,"westernmost,lisbon,occupied,monsanto,forest,park,km,urban,park,largest,europe,occupying,municipality",0.00,lisbon
"the city occupies an area of  km  and its city boundaries unlike those of most major cities coincide with those of the municipality the rest of the urbanised area of the lisbon urban area known generically as greater lisbon  includes several administratively defined cities and municipalities in the north bank of the tagus river the larger lisbon metropolitan area includes the setbal peninsula to the south
",city occupies area km city boundaries unlike major cities coincide municipality rest urbanised area lisbon urban area known generically greater lisbon includes administratively defined cities municipalities north bank tagus river larger lisbon metropolitan area includes setbal peninsula south,6.85,"city,occupies,area,km,city,boundaries,unlike,major,cities,coincide,municipality,rest,urbanised,area,lisbon,urban,area,known,generically,greater,lisbon,includes,administratively,defined,cities,municipalities,north,bank,tagus,river,larger,lisbon,metropolitan,area,includes,setbal,peninsula,south",0.00,lisbon
"lisbon has a mediterranean climate  with mild rainy winters and warm to hot dry summers the average annual temperature is  c   c  during the day and  c  at night
",lisbon mediterranean climate mild rainy winters warm hot dry summers average annual temperature c c day c night,6.79,"lisbon,mediterranean,climate,mild,rainy,winters,warm,hot,dry,summers,average,annual,temperature,c,c,day,c,night",0.00,lisbon
"among european capitals lisbon ranks among those with the warmest winters and has the mildest winter nights out of any major european city with an average of  c  in the coldest month and  c  in the warmest month the coldest temperature ever recorded in lisbon was  c  in february  the highest temperature ever recorded in lisbon was  c  on  august 
",european capitals lisbon ranks warmest winters mildest winter nights major european city average c coldest month c warmest month coldest temperature recorded lisbon c february highest temperature recorded lisbon c august,8.31,"european,capitals,lisbon,ranks,warmest,winters,mildest,winter,nights,major,european,city,average,c,coldest,month,c,warmest,month,coldest,temperature,recorded,lisbon,c,february,highest,temperature,recorded,lisbon,c,august",0.00,lisbon
"lisbon has around  mm  of precipitation per year november and december are the wettest months accounting for a third of the total annual precipitation july and august are the driest
",lisbon mm precipitation year november december wettest months accounting total annual precipitation july august driest,8.24,"lisbon,mm,precipitation,year,november,december,wettest,months,accounting,total,annual,precipitation,july,august,driest",0.00,lisbon
"the municipality of lisbon included  freguesias until november  a new law  reduced the number of freguesias to the following 
",municipality lisbon included freguesias november new law reduced number freguesias following,6.35,"municipality,lisbon,included,freguesias,november,new,law,reduced,number,freguesias,following",0.00,lisbon
"locally lisbons inhabitants may commonly refer to the spaces of lisbon in terms of historic bairros de lisboa  these communities have no clearly defined boundaries and represent distinctive quarters of the city that have in common a historical culture similar living standards and identifiable architectural landmarks as exemplified by the bairro alto alfama chiado and so forth
",locally lisbons inhabitants commonly refer spaces lisbon terms historic bairros de lisboa communities clearly defined boundaries represent distinctive quarters city common historical culture similar living standards identifiable architectural landmarks exemplified bairro alto alfama chiado forth,5.80,"locally,lisbons,inhabitants,commonly,refer,spaces,lisbon,terms,historic,bairros,de,lisboa,communities,clearly,defined,boundaries,represent,distinctive,quarters,city,common,historical,culture,similar,living,standards,identifiable,architectural,landmarks,exemplified,bairro,alto,alfama,chiado,forth",0.00,lisbon
"although today it is quite central it was once a mere suburb of lisbon comprising mostly farms and country estates of the nobility with their palaces in the th century there was a brook there which the nobles used to promenade in their boats during the late th century alcntara became a popular industrial area with many small factories and warehouses
",today central mere suburb lisbon comprising farms country estates nobility palaces th century brook nobles promenade boats late th century alcntara popular industrial area small factories warehouses,9.66,"today,central,mere,suburb,lisbon,comprising,farms,country,estates,nobility,palaces,th,century,brook,nobles,promenade,boats,late,th,century,alcntara,popular,industrial,area,small,factories,warehouses",0.00,lisbon
"the oldest district of lisbon it spreads down the southern slope from the castle of so jorge to the river tagus its name derived from the arabic al hamma means fountains or baths during the islamic invasion of iberia the alfama constituted the largest part of the city extending west to the baixa neighbourhood increasingly the alfama became inhabited by fishermen and the poor its fame as a poor neighbourhood continues to this day while the  lisbon earthquake caused considerable damage throughout the capital the alfama survived with little damage thanks to its compact labyrinth of narrow streets and small squares
",oldest district lisbon spreads southern slope castle jorge river tagus derived arabic al hamma means fountains baths islamic invasion iberia alfama constituted largest city extending west baixa neighbourhood increasingly alfama inhabited fishermen poor fame poor neighbourhood continues day lisbon earthquake caused considerable damage capital alfama survived little damage thanks compact labyrinth narrow streets small squares,7.43,"oldest,district,lisbon,spreads,southern,slope,castle,jorge,river,tagus,derived,arabic,al,hamma,means,fountains,baths,islamic,invasion,iberia,alfama,constituted,largest,city,extending,west,baixa,neighbourhood,increasingly,alfama,inhabited,fishermen,poor,fame,poor,neighbourhood,continues,day,lisbon,earthquake,caused,considerable,damage,capital,alfama,survived,little,damage,thanks,compact,labyrinth,narrow,streets,small,squares",0.00,lisbon
"the mouraria or moorish quarter is one of the most traditional neighbourhoods of lisbon although most of its old buildings were demolished by the estado novo between the s and the s it takes its name from the fact that after the reconquest of lisbon the muslims who remained were confined to this part of the city in turn the jews were confined to three neighbourhoods called judiarias
",mouraria moorish quarter traditional neighbourhoods lisbon old buildings demolished estado novo takes fact reconquest lisbon muslims remained confined city turn jews confined neighbourhoods called judiarias,11.14,"mouraria,moorish,quarter,traditional,neighbourhoods,lisbon,old,buildings,demolished,estado,novo,takes,fact,reconquest,lisbon,muslims,remained,confined,city,turn,jews,confined,neighbourhoods,called,judiarias",0.00,lisbon
"bairro alto  is an area of central lisbon that functions as a residential shopping and entertainment district it is the center of the portuguese capitals nightlife attracting hipster youth and members of various music subcultures lisbons punk gay metal goth hip hop and reggae scenes all find a home in the bairro with its many clubs and bars that cater to them the crowds in the bairro alto are a multicultural mix of people representing a broad cross section of modern portuguese society many of them being entertainment seekers and devotees of various music genres outside the mainstream fado portugals national music still survives in the midst of the new nightlife
",bairro alto area central lisbon functions residential shopping entertainment district center portuguese capitals nightlife attracting hipster youth members music subcultures lisbons punk gay metal goth hip hop reggae scenes find home bairro clubs bars cater crowds bairro alto multicultural mix people representing broad cross section modern portuguese society entertainment seekers devotees music genres outside mainstream fado portugals national music survives midst new nightlife,7.16,"bairro,alto,area,central,lisbon,functions,residential,shopping,entertainment,district,center,portuguese,capitals,nightlife,attracting,hipster,youth,members,music,subcultures,lisbons,punk,gay,metal,goth,hip,hop,reggae,scenes,find,home,bairro,clubs,bars,cater,crowds,bairro,alto,multicultural,mix,people,representing,broad,cross,section,modern,portuguese,society,entertainment,seekers,devotees,music,genres,outside,mainstream,fado,portugals,national,music,survives,midst,new,nightlife",0.00,lisbon
"the heart of the city is the baixa or city centre the pombaline baixa is an elegant district primarily constructed after the  lisbon earthquake taking its name from its benefactor sebastio jos de carvalho e melo st marquis of pombal who was the minister of joseph i of portugal  and a key figure during the portuguese enlightenment following the  disaster pombal took the lead in rebuilding lisbon imposing strict conditions and guidelines on the construction of the city and transforming the organic street plan that characterised the district before the earthquake into its current grid pattern as a result the pombaline baixa is one of the first examples of earthquake resistant construction architectural models were tested by having troops march around them to simulate an earthquake notable features of pombaline structures include the pombaline cage a symmetrical wood lattice framework aimed at distributing earthquake forces and inter terrace walls that were built higher than roof timbers to inhibit the spread of fires
",heart city baixa city centre pombaline baixa elegant district primarily constructed lisbon earthquake taking benefactor sebastio jos de carvalho e melo st marquis pombal minister joseph portugal key figure portuguese enlightenment following disaster pombal took lead rebuilding lisbon imposing strict conditions guidelines construction city transforming organic street plan characterised district earthquake current grid pattern result pombaline baixa examples earthquake resistant construction architectural models tested troops march simulate earthquake notable features pombaline structures include pombaline cage symmetrical wood lattice framework aimed distributing earthquake forces inter terrace walls built higher roof timbers inhibit spread fires,6.70,"heart,city,baixa,city,centre,pombaline,baixa,elegant,district,primarily,constructed,lisbon,earthquake,taking,benefactor,sebastio,jos,de,carvalho,e,melo,st,marquis,pombal,minister,joseph,portugal,key,figure,portuguese,enlightenment,following,disaster,pombal,took,lead,rebuilding,lisbon,imposing,strict,conditions,guidelines,construction,city,transforming,organic,street,plan,characterised,district,earthquake,current,grid,pattern,result,pombaline,baixa,examples,earthquake,resistant,construction,architectural,models,tested,troops,march,simulate,earthquake,notable,features,pombaline,structures,include,pombaline,cage,symmetrical,wood,lattice,framework,aimed,distributing,earthquake,forces,inter,terrace,walls,built,higher,roof,timbers,inhibit,spread,fires",0.00,lisbon
"perhaps belms most famous feature is its tower torre de belm whose image is much used by lisbons tourist board the tower was built as a fortified lighthouse late in the reign of dom manuel l  to guard the entrance to the port it stood on a little island on the right side of the tagus surrounded by water belms other major historical building is the mosteiro dos jernimos  which the torre de belm was built partly to defend belms most notable modern feature is the padro dos descobrimentos  built for the portuguese world fair in  in the heart of belm is the praa do imprio gardens centred upon a large fountain laid out during world war ii to the west of the gardens lies the centro cultural de belm belm is one of the most visited lisbon districts here is located the estdio do restelo home to belenenses
",belms famous feature tower torre de belm image lisbons tourist board tower built fortified lighthouse late reign dom manuel l guard entrance port stood little island right tagus surrounded water belms major historical building mosteiro dos jernimos torre de belm built partly defend belms notable modern feature padro dos descobrimentos built portuguese world fair heart belm praa imprio gardens centred large fountain laid world war ii west gardens lies centro cultural de belm belm visited lisbon districts located estdio restelo home belenenses,8.30,"belms,famous,feature,tower,torre,de,belm,image,lisbons,tourist,board,tower,built,fortified,lighthouse,late,reign,dom,manuel,l,guard,entrance,port,stood,little,island,right,tagus,surrounded,water,belms,major,historical,building,mosteiro,dos,jernimos,torre,de,belm,built,partly,defend,belms,notable,modern,feature,padro,dos,descobrimentos,built,portuguese,world,fair,heart,belm,praa,imprio,gardens,centred,large,fountain,laid,world,war,ii,west,gardens,lies,centro,cultural,de,belm,belm,visited,lisbon,districts,located,estdio,restelo,home,belenenses",0.00,lisbon
