Unclean,Clean,Noise_Pre_Processing,Training_Data,Noise_Post_Processing,Query
"
common council of the city of london member ivan luckin put forward the idea of selling the bridge and recalled they all thought i was completely crazy when i suggested we should sell london bridge when it needed replacing subsequently in  council placed the bridge on the market and began to look for potential buyers on  april  rennies bridge was purchased by the missourian entrepreneur robert p mcculloch of mcculloch oil for us the claim that mcculloch believed mistakenly that he was buying the more impressive tower bridge was denied by luckin in a newspaper interview before the bridge was taken apart each granite facing block was marked for later reassembly",common council city london member ivan luckin forward idea selling bridge recalled thought completely crazy suggested sell london bridge needed replacing subsequently council placed bridge market began look potential buyers april rennies bridge purchased missourian entrepreneur robert p mcculloch mcculloch oil claim mcculloch believed mistakenly buying impressive tower bridge denied luckin newspaper interview bridge taken apart granite facing block marked later reassembly,7.34,"common,council,city,london,member,ivan,luckin,forward,idea,selling,bridge,recalled,thought,completely,crazy,suggested,sell,london,bridge,needed,replacing,subsequently,council,placed,bridge,market,began,look,potential,buyers,april,rennies,bridge,purchased,missourian,entrepreneur,robert,p,mcculloch,mcculloch,oil,claim,mcculloch,believed,mistakenly,buying,impressive,tower,bridge,denied,luckin,newspaper,interview,bridge,taken,apart,granite,facing,block,marked,later,reassembly",0.00,london
"the current london bridge was designed by architect lord holford and engineers mott hay and anderson it was constructed by contractors john mowlem and co from  to 
and opened by queen elizabeth ii on  march  it comprises three spans of prestressed concrete box girders a total of  feet  long the cost of  million  was met entirely by the bridge house estates charity the current bridge was built in the same location as rennies bridge with the previous bridge remaining in use while the first two girders were constructed upstream and downstream traffic was then transferred onto the two new girders and the previous bridge demolished to allow the final two central girders to be added
",current london bridge designed architect lord holford engineers mott hay anderson constructed contractors john mowlem co opened queen elizabeth ii march comprises spans prestressed concrete box girders total feet long cost million met entirely bridge house estates charity current bridge built location rennies bridge previous bridge remaining use girders constructed upstream downstream traffic transferred new girders previous bridge demolished allow final central girders added,7.43,"current,london,bridge,designed,architect,lord,holford,engineers,mott,hay,anderson,constructed,contractors,john,mowlem,co,opened,queen,elizabeth,ii,march,comprises,spans,prestressed,concrete,box,girders,total,feet,long,cost,million,met,entirely,bridge,house,estates,charity,current,bridge,built,location,rennies,bridge,previous,bridge,remaining,use,girders,constructed,upstream,downstream,traffic,transferred,new,girders,previous,bridge,demolished,allow,final,central,girders,added",0.00,london
"in  the british warship hms jupiter collided with london bridge causing significant damage to both the ship and the bridge
",british warship hms jupiter collided london bridge causing significant damage ship bridge,6.50,"british,warship,hms,jupiter,collided,london,bridge,causing,significant,damage,ship,bridge",0.00,london
"on remembrance day  several bridges in london were furnished with red lighting as part of a night time flight along the river by wartime aircraft london bridge was the one bridge not subsequently stripped of the illuminations which are regularly switched on at night
",remembrance day bridges london furnished red lighting night time flight river wartime aircraft london bridge bridge subsequently stripped illuminations regularly switched night,8.24,"remembrance,day,bridges,london,furnished,red,lighting,night,time,flight,river,wartime,aircraft,london,bridge,bridge,subsequently,stripped,illuminations,regularly,switched,night",0.00,london
"the current london bridge is often shown in films news and documentaries showing the throng of commuters journeying to work into the city from london bridge station  an example of this is actor hugh grant crossing the bridge north to south during the morning rush hour in the  film about a boy
",current london bridge shown films news documentaries showing throng commuters journeying work city london bridge station example actor hugh grant crossing bridge north south morning rush hour film boy,7.82,"current,london,bridge,shown,films,news,documentaries,showing,throng,commuters,journeying,work,city,london,bridge,station,example,actor,hugh,grant,crossing,bridge,north,south,morning,rush,hour,film,boy",0.00,london
"on  july  as part of the annual lord mayors charity appeal and to mark the th anniversary of old london bridges completion in the reign of king john the lord mayor and freemen of the city drove a flock of sheep across the bridge supposedly by ancient right
",july annual lord mayors charity appeal mark th anniversary old london bridges completion reign king john lord mayor freemen city drove flock sheep bridge supposedly ancient right,8.17,"july,annual,lord,mayors,charity,appeal,mark,th,anniversary,old,london,bridges,completion,reign,king,john,lord,mayor,freemen,city,drove,flock,sheep,bridge,supposedly,ancient,right",0.00,london
"the nearest london underground stations are monument at the northern end of the bridge and london bridge at the southern end london bridge station is also served by national rail
",nearest london underground stations monument northern end bridge london bridge southern end london bridge station served national rail,6.70,"nearest,london,underground,stations,monument,northern,end,bridge,london,bridge,southern,end,london,bridge,station,served,national,rail",0.00,london
