Unclean,Clean,Noise_Pre_Processing,Training_Data,Noise_Post_Processing,Query
"london is the capital and largest city of england and the united kingdom with a population of just under  million it stands on the river thames in south east england at the head of a  mile  estuary down to the north sea and has been a major settlement for two millennia the city of london its ancient core and financial centre was founded by the romans as londinium and retains its medieval boundariesnote  the city of westminster to the west of the city of london has for centuries hosted the national government and parliament  since the th century the name london has also referred to the metropolis around this core historically split between the counties of middlesex essex surrey kent and hertfordshire which since  has largely comprised greater london which is governed by  local authorities and the greater london authoritynote 
",london capital largest city england united kingdom population million stands river thames south east england head mile estuary north sea major settlement millennia city london ancient core financial centre founded romans londinium retains medieval boundariesnote city westminster west city london centuries hosted national government parliament th century london referred metropolis core historically split counties middlesex essex surrey kent hertfordshire largely comprised greater london governed local authorities greater london authoritynote,8.48,"london,capital,largest,city,england,united,kingdom,population,million,stands,river,thames,south,east,england,head,mile,estuary,north,sea,major,settlement,millennia,city,london,ancient,core,financial,centre,founded,romans,londinium,retains,medieval,boundariesnote,city,westminster,west,city,london,centuries,hosted,national,government,parliament,th,century,london,referred,metropolis,core,historically,split,counties,middlesex,essex,surrey,kent,hertfordshire,largely,comprised,greater,london,governed,local,authorities,greater,london,authoritynote",0.00,london
"as one of the worlds major global cities london exerts a strong influence on its arts entertainment fashion commerce and finance education health care media science and technology tourism and transport and communications its gdp  makes it the largest urban economy in europe and it is one of the major financial centres in the world with europes largest concentration of higher education institutions it is home to some of the highest ranked academic institutions in the worldimperial college london in natural and applied sciences the london school of economics in social sciences and the comprehensive university college london london is the most visited city in europe and has the busiest city airport system in the world the london underground is the oldest rapid transit system in the world
",worlds major global cities london exerts strong influence arts entertainment fashion commerce finance education health care media science technology tourism transport communications gdp makes largest urban economy europe major financial centres world europes largest concentration higher education institutions home highest ranked academic institutions worldimperial college london natural applied sciences london school economics social sciences comprehensive university college london london visited city europe busiest city airport system world london underground oldest rapid transit system world,6.78,"worlds,major,global,cities,london,exerts,strong,influence,arts,entertainment,fashion,commerce,finance,education,health,care,media,science,technology,tourism,transport,communications,gdp,makes,largest,urban,economy,europe,major,financial,centres,world,europes,largest,concentration,higher,education,institutions,home,highest,ranked,academic,institutions,worldimperial,college,london,natural,applied,sciences,london,school,economics,social,sciences,comprehensive,university,college,london,london,visited,city,europe,busiest,city,airport,system,world,london,underground,oldest,rapid,transit,system,world",0.00,london
"londons diverse cultures encompass over  languages the mid  population of greater london of about  million made it europes third most populous city accounting for  of the population of the united kingdom and over  of the population of england the greater london built up area is the fourth most populous in europe with about  million inhabitants at the  census the london metropolitan area is the third most populous in europe with about  million inhabitants in note  granting london the status of a megacity
",londons diverse cultures encompass languages mid population greater london million europes populous city accounting population united kingdom population england greater london built area fourth populous europe million inhabitants census london metropolitan area populous europe million inhabitants note granting london status megacity,8.06,"londons,diverse,cultures,encompass,languages,mid,population,greater,london,million,europes,populous,city,accounting,population,united,kingdom,population,england,greater,london,built,area,fourth,populous,europe,million,inhabitants,census,london,metropolitan,area,populous,europe,million,inhabitants,note,granting,london,status,megacity",0.00,london
"london has four world heritage sites the tower of london kew gardens the combined palace of westminster westminster abbey and st margarets church and also the historic settlement in greenwich where the royal observatory greenwich defines the prime meridian  and greenwich mean time other landmarks include buckingham palace the london eye piccadilly circus st pauls cathedral tower bridge and trafalgar square london has many museums galleries libraries and cultural venues including the british museum national gallery natural history museum tate modern british library and numerous west end theatres important sporting events held in london include the fa cup final  wimbledon tennis championships and the london marathon in  london became the first city to host three summer olympic games
",london world heritage sites tower london kew gardens combined palace westminster westminster abbey st margarets church historic settlement greenwich royal observatory greenwich defines prime meridian greenwich mean time landmarks include buckingham palace london eye piccadilly circus st pauls cathedral tower bridge trafalgar square london museums galleries libraries cultural venues including british museum national gallery natural history museum tate modern british library numerous west end theatres important sporting events held london include fa cup final wimbledon tennis championships london marathon london city host summer olympic games,4.17,"london,world,heritage,sites,tower,london,kew,gardens,combined,palace,westminster,westminster,abbey,st,margarets,church,historic,settlement,greenwich,royal,observatory,greenwich,defines,prime,meridian,greenwich,mean,time,landmarks,include,buckingham,palace,london,eye,piccadilly,circus,st,pauls,cathedral,tower,bridge,trafalgar,square,london,museums,galleries,libraries,cultural,venues,including,british,museum,national,gallery,natural,history,museum,tate,modern,british,library,numerous,west,end,theatres,important,sporting,events,held,london,include,fa,cup,final,wimbledon,tennis,championships,london,marathon,london,city,host,summer,olympic,games",0.00,london
"london is an ancient name already attested in the first century ad usually in the latinised form londinium for example handwritten roman tablets recovered in the city originating from ad  include the word londinio 
",london ancient attested century ad usually latinised form londinium example handwritten roman tablets recovered city originating ad include word londinio,6.51,"london,ancient,attested,century,ad,usually,latinised,form,londinium,example,handwritten,roman,tablets,recovered,city,originating,ad,include,word,londinio",0.00,london
"the toponymy of the common brythonic form is debated prominent was richard coates  argument that it derived from pre celtic old european lowonida meaning river too wide to ford coates suggested this was a name given to the part of the river thames that flows through london from which the settlement gained the celtic form of its name lowonidonjon however most work has accepted a plain celtic origin recent studies favour an explanation of a celtic derivative of a proto indo european root lendh   combined with the celtic suffix  injo  or  onjo   peter schrijver has specifically suggested that the name originally meant place that floods 
",toponymy common brythonic form debated prominent richard coates argument derived pre celtic old european lowonida meaning river wide ford coates suggested given river thames flows london settlement gained celtic form lowonidonjon work accepted plain celtic origin recent studies favour explanation celtic derivative proto indo european root lendh combined celtic suffix injo onjo peter schrijver specifically suggested originally meant place floods,7.01,"toponymy,common,brythonic,form,debated,prominent,richard,coates,argument,derived,pre,celtic,old,european,lowonida,meaning,river,wide,ford,coates,suggested,given,river,thames,flows,london,settlement,gained,celtic,form,lowonidonjon,work,accepted,plain,celtic,origin,recent,studies,favour,explanation,celtic,derivative,proto,indo,european,root,lendh,combined,celtic,suffix,injo,onjo,peter,schrijver,specifically,suggested,originally,meant,place,floods",0.00,london
"until  the name london applied officially only to the city of london but since then it has also referred to the county of london and to greater london
",london applied officially city london referred county london greater london,11.92,"london,applied,officially,city,london,referred,county,london,greater,london",0.00,london
"in writing london is occasionally contracted to ldn such usage originated in sms language and often appears in a social media user profile suffixing an alias or handle
",writing london occasionally contracted ldn usage originated sms language appears social media user profile suffixing alias handle,6.55,"writing,london,occasionally,contracted,ldn,usage,originated,sms,language,appears,social,media,user,profile,suffixing,alias,handle",0.00,london
"despite the evidence of scattered brythonic settlements in the area the first major settlement was founded by the romans about four years after the invasion of  ad this only lasted until about  ad when the iceni tribe led by queen boudica stormed it and burnt it to the ground the next planned incarnation of londinium prospered superseding colchester as capital of the roman province of britannia in  at its height in the nd century roman london had a population of about 
",despite evidence scattered brythonic settlements area major settlement founded romans years invasion ad lasted ad iceni tribe led queen boudica stormed burnt ground planned incarnation londinium prospered superseding colchester capital roman province britannia height nd century roman london population,8.86,"despite,evidence,scattered,brythonic,settlements,area,major,settlement,founded,romans,years,invasion,ad,lasted,ad,iceni,tribe,led,queen,boudica,stormed,burnt,ground,planned,incarnation,londinium,prospered,superseding,colchester,capital,roman,province,britannia,height,nd,century,roman,london,population",0.00,london
"with the early th century collapse of roman rule london ceased to be a capital and the walled city of londinium was effectively abandoned although roman civilisation continued around st martin in the fields until about  from about  an anglo saxon settlement known as lundenwic developed slightly west of the old roman city by about  the city had become a major port again but there is little evidence of large scale production from the s repeated viking assaults brought decline three are recorded those in  and  succeeded while the last in  was rebuffed
",early th century collapse roman rule london ceased capital walled city londinium effectively abandoned roman civilisation continued st martin fields anglo saxon settlement known lundenwic developed slightly west old roman city city major port little evidence large scale production repeated viking assaults brought decline recorded succeeded rebuffed,8.29,"early,th,century,collapse,roman,rule,london,ceased,capital,walled,city,londinium,effectively,abandoned,roman,civilisation,continued,st,martin,fields,anglo,saxon,settlement,known,lundenwic,developed,slightly,west,old,roman,city,city,major,port,little,evidence,large,scale,production,repeated,viking,assaults,brought,decline,recorded,succeeded,rebuffed",0.00,london
"the vikings applied danelaw over much of eastern and northern england its boundary running roughly from london to chester as an area of political and geographical control imposed by the viking incursions formally agreed by the danish warlord guthrum and the west saxon king alfred the great in  the anglo saxon chronicle records that alfred refounded london in  archaeological research shows this involved abandonment of lundenwic and a revival of life and trade within the old roman walls london then grew slowly until a dramatic increase in about 
",vikings applied danelaw eastern northern england boundary running roughly london chester area political geographical control imposed viking incursions formally agreed danish warlord guthrum west saxon king alfred great anglo saxon chronicle records alfred refounded london archaeological research shows involved abandonment lundenwic revival life trade old roman walls london grew slowly dramatic increase,6.55,"vikings,applied,danelaw,eastern,northern,england,boundary,running,roughly,london,chester,area,political,geographical,control,imposed,viking,incursions,formally,agreed,danish,warlord,guthrum,west,saxon,king,alfred,great,anglo,saxon,chronicle,records,alfred,refounded,london,archaeological,research,shows,involved,abandonment,lundenwic,revival,life,trade,old,roman,walls,london,grew,slowly,dramatic,increase",0.00,london
"by the th century london was clearly the largest town in england westminster abbey rebuilt in romanesque style by king edward the confessor was one of the grandest churches in europe winchester had been the capital of anglo saxon england but from this time london became the main forum for foreign traders and the base for defence in time of war in the view of frank stenton it had the resources and it was rapidly developing the dignity and the political self consciousness appropriate to a national capital
",th century london clearly largest town england westminster abbey rebuilt romanesque style king edward confessor grandest churches europe winchester capital anglo saxon england time london main forum foreign traders base defence time war view frank stenton resources rapidly developing dignity political self consciousness appropriate national capital,8.25,"th,century,london,clearly,largest,town,england,westminster,abbey,rebuilt,romanesque,style,king,edward,confessor,grandest,churches,europe,winchester,capital,anglo,saxon,england,time,london,main,forum,foreign,traders,base,defence,time,war,view,frank,stenton,resources,rapidly,developing,dignity,political,self,consciousness,appropriate,national,capital",0.00,london
"after winning the battle of hastings william duke of normandy was crowned king of england in newly completed westminster abbey on christmas day  william built the tower of london the first of many such in england rebuilt in stone in the south eastern corner of the city to intimidate the inhabitants in  william ii began building westminster hall close by the abbey of the same name it became the basis of a new palace of westminster
",winning battle hastings william duke normandy crowned king england newly completed westminster abbey christmas day william built tower london england rebuilt stone south eastern corner city intimidate inhabitants william ii began building westminster hall close abbey basis new palace westminster,8.29,"winning,battle,hastings,william,duke,normandy,crowned,king,england,newly,completed,westminster,abbey,christmas,day,william,built,tower,london,england,rebuilt,stone,south,eastern,corner,city,intimidate,inhabitants,william,ii,began,building,westminster,hall,close,abbey,basis,new,palace,westminster",0.00,london
"in the th century the institutions of central government which had hitherto followed the royal english court around the country grew in size and sophistication and became increasingly fixed for most purposes at westminster although the royal treasury having been moved from winchester came to rest in the tower while the city of westminster developed into a true governmental capital its distinct neighbour the city of london remained englands largest city and principal commercial centre and flourished under its own unique administration the corporation of london in  its population was some  by  it had grown to nearly  disaster struck in the form of the black death in the mid th century when london lost nearly a third of its population london was the focus of the peasants revolt in 
",th century institutions central government hitherto followed royal english court country grew size sophistication increasingly fixed purposes westminster royal treasury moved winchester came rest tower city westminster developed true governmental capital distinct neighbour city london remained englands largest city principal commercial centre flourished unique administration corporation london population grown nearly disaster struck form black death mid th century london lost nearly population london focus peasants revolt,7.97,"th,century,institutions,central,government,hitherto,followed,royal,english,court,country,grew,size,sophistication,increasingly,fixed,purposes,westminster,royal,treasury,moved,winchester,came,rest,tower,city,westminster,developed,true,governmental,capital,distinct,neighbour,city,london,remained,englands,largest,city,principal,commercial,centre,flourished,unique,administration,corporation,london,population,grown,nearly,disaster,struck,form,black,death,mid,th,century,london,lost,nearly,population,london,focus,peasants,revolt",0.00,london
"london was also a centre of englands jewish population before their expulsion by edward i in  violence against jews occurred in  when it was rumoured that the new king had ordered their massacre after they had presented themselves at his coronation in  during the second barons war simon de montforts rebels killed  jews while attempting to seize records of debts
",london centre englands jewish population expulsion edward violence jews occurred rumoured new king ordered massacre presented coronation second barons war simon de montforts rebels killed jews attempting seize records debts,8.24,"london,centre,englands,jewish,population,expulsion,edward,violence,jews,occurred,rumoured,new,king,ordered,massacre,presented,coronation,second,barons,war,simon,de,montforts,rebels,killed,jews,attempting,seize,records,debts",0.00,london
"during the tudor period the reformation produced a gradual shift to protestantism much of london property passed from church to private ownership which accelerated trade and business in the city in  the hanseatic league set up a main trading base  of england in london called the stalhof or steelyard it remained until  when the hanseatic cities of lbeck bremen and hamburg sold the property to south eastern railway woollen cloth was shipped undyed and undressed from thth century london to the nearby shores of the low countries where it was considered indispensable
",tudor period reformation produced gradual shift protestantism london property passed church private ownership accelerated trade business city hanseatic league set main trading base england london called stalhof steelyard remained hanseatic cities lbeck bremen hamburg sold property south eastern railway woollen cloth shipped undyed undressed thth century london nearby shores low countries considered indispensable,6.85,"tudor,period,reformation,produced,gradual,shift,protestantism,london,property,passed,church,private,ownership,accelerated,trade,business,city,hanseatic,league,set,main,trading,base,england,london,called,stalhof,steelyard,remained,hanseatic,cities,lbeck,bremen,hamburg,sold,property,south,eastern,railway,woollen,cloth,shipped,undyed,undressed,thth,century,london,nearby,shores,low,countries,considered,indispensable",0.00,london
"yet english maritime enterprise hardly reached beyond the seas of north west europe the commercial route to italy and the mediterranean was normally through antwerp and over the alps any ships passing through the strait of gibraltar to or from england were likely to be italian or ragusan the reopening of the netherlands to english shipping in january  spurred a burst of commercial activity the royal exchange was founded mercantilism grew and monopoly traders such as the east india company were founded as trade expanded to the new world london became the main north sea port with migrants arriving from england and abroad the population rose from about  in  to about  in 
",english maritime enterprise hardly reached seas north west europe commercial route italy mediterranean normally antwerp alps ships passing strait gibraltar england likely italian ragusan reopening netherlands english shipping january spurred burst commercial activity royal exchange founded mercantilism grew monopoly traders east india company founded trade expanded new world london main north sea port migrants arriving england abroad population rose,7.83,"english,maritime,enterprise,hardly,reached,seas,north,west,europe,commercial,route,italy,mediterranean,normally,antwerp,alps,ships,passing,strait,gibraltar,england,likely,italian,ragusan,reopening,netherlands,english,shipping,january,spurred,burst,commercial,activity,royal,exchange,founded,mercantilism,grew,monopoly,traders,east,india,company,founded,trade,expanded,new,world,london,main,north,sea,port,migrants,arriving,england,abroad,population,rose",0.00,london
"in the th century william shakespeare and his contemporaries lived in london during english renaissance theatre shakespeares globe theatre was constructed in  in southwark stage performances came to a halt in london when puritan authorities shut down the theatres in the s and s the ban on theatre was lifted during the restoration in  and londons oldest operating theatre drury lane opened in  in what is now the west end theatre district
",th century william shakespeare contemporaries lived london english renaissance theatre shakespeares globe theatre constructed southwark stage performances came halt london puritan authorities shut theatres ban theatre lifted restoration londons oldest operating theatre drury lane opened west end theatre district,7.50,"th,century,william,shakespeare,contemporaries,lived,london,english,renaissance,theatre,shakespeares,globe,theatre,constructed,southwark,stage,performances,came,halt,london,puritan,authorities,shut,theatres,ban,theatre,lifted,restoration,londons,oldest,operating,theatre,drury,lane,opened,west,end,theatre,district",0.00,london
"by the end of the tudor period in  london was still compact there was an assassination attempt on james i in westminster in the gunpowder plot of  november 
",end tudor period london compact assassination attempt james westminster gunpowder plot november,10.19,"end,tudor,period,london,compact,assassination,attempt,james,westminster,gunpowder,plot,november",0.00,london
"in  the government of charles i attempted to reform administration in the london area this called for the corporation of the city to extend its jurisdiction and administration over expanding areas around the city fearing an attempt by the crown to diminish the liberties of london coupled with a lack of interest in administering these additional areas or concern by city guilds of having to share power caused the corporations the great refusal a decision which largely continues to account for the unique governmental status of the city
",government charles attempted reform administration london area called corporation city extend jurisdiction administration expanding areas city fearing attempt crown diminish liberties london coupled lack interest administering additional areas concern city guilds share power caused corporations great refusal decision largely continues account unique governmental status city,7.98,"government,charles,attempted,reform,administration,london,area,called,corporation,city,extend,jurisdiction,administration,expanding,areas,city,fearing,attempt,crown,diminish,liberties,london,coupled,lack,interest,administering,additional,areas,concern,city,guilds,share,power,caused,corporations,great,refusal,decision,largely,continues,account,unique,governmental,status,city",0.00,london
"in the english civil war the majority of londoners supported the parliamentary because after an initial advance by the royalists in  culminating in the battles of brentford and turnham green london was surrounded by a defensive perimeter wall known as the lines of communication the lines were built by up to  people and were completed in under two months
the fortifications failed their only test when the new model army entered london in  and they were levelled by parliament the same year
",english civil war majority londoners supported parliamentary initial advance royalists culminating battles brentford turnham green london surrounded defensive perimeter wall known lines communication lines built people completed monthsthe fortifications failed test new model army entered london levelled parliament year,8.74,"english,civil,war,majority,londoners,supported,parliamentary,initial,advance,royalists,culminating,battles,brentford,turnham,green,london,surrounded,defensive,perimeter,wall,known,lines,communication,lines,built,people,completed,monthsthe,fortifications,failed,test,new,model,army,entered,london,levelled,parliament,year",0.00,london
