Unclean,Clean,Noise_Pre_Processing,Training_Data,Noise_Post_Processing,Query
"londons first and to date only cable car is the london cable car which opened in june  the cable car crosses the thames and links greenwich peninsula with the royal docks in the east of the city it is integrated with londons oyster card ticketing system although the emirates air line fares are not included in the oyster daily capping it cost  million to build and can carry up to  passengers per hour in each direction at peak times similar to the london cycle hire scheme bike hire scheme the cable car was sponsored in a  year deal by the airline emirates
",londons date cable car london cable car opened june cable car crosses thames links greenwich peninsula royal docks east city integrated londons oyster card ticketing system emirates air line fares included oyster daily capping cost million build carry passengers hour direction peak times similar london cycle hire scheme bike hire scheme cable car sponsored year deal airline emirates,7.86,"londons,date,cable,car,london,cable,car,opened,june,cable,car,crosses,thames,links,greenwich,peninsula,royal,docks,east,city,integrated,londons,oyster,card,ticketing,system,emirates,air,line,fares,included,oyster,daily,capping,cost,million,build,carry,passengers,hour,direction,peak,times,similar,london,cycle,hire,scheme,bike,hire,scheme,cable,car,sponsored,year,deal,airline,emirates",0.00,london
"in the greater london area around  people use a bike every day meaning around  of the total population of around  million use a bike on an average day this relatively low percentage of bicycle users may be due to the poor investments for cycling in london of about  million per year equating to around  per person which can be compared to  in the netherlands
",greater london area people use bike day meaning total population million use bike average day relatively low percentage bicycle users poor investments cycling london million year equating person compared netherlands,9.47,"greater,london,area,people,use,bike,day,meaning,total,population,million,use,bike,average,day,relatively,low,percentage,bicycle,users,poor,investments,cycling,london,million,year,equating,person,compared,netherlands",0.00,london
"cycling has become an increasingly popular way to get around london the launch of a bicycle hire scheme in july  was successful and generally well received
",cycling increasingly popular way london launch bicycle hire scheme july successful generally received,8.33,"cycling,increasingly,popular,way,london,launch,bicycle,hire,scheme,july,successful,generally,received",0.00,london
"the port of london once the largest in the world is now only the second largest in the united kingdom handling  million tonnes of cargo each year as of  most of this cargo passes through the port of tilbury outside the boundary of greater london
",port london largest world second largest united kingdom handling million tonnes cargo year cargo passes port tilbury outside boundary greater london,9.76,"port,london,largest,world,second,largest,united,kingdom,handling,million,tonnes,cargo,year,cargo,passes,port,tilbury,outside,boundary,greater,london",0.00,london
"london has river boat services on the thames known as thames clippers which offer both commuter and tourist boat services at major piers including canary wharf london bridge city battersea power station and london eye  services depart at least every  minutes during commuter times the woolwich ferry with  million passengers every year is a frequent service linking the north and south circular roads
",london river boat services thames known thames clippers offer commuter tourist boat services major piers including canary wharf london bridge city battersea power station london eye services depart minutes commuter times woolwich ferry million passengers year frequent service linking north south circular roads,4.99,"london,river,boat,services,thames,known,thames,clippers,offer,commuter,tourist,boat,services,major,piers,including,canary,wharf,london,bridge,city,battersea,power,station,london,eye,services,depart,minutes,commuter,times,woolwich,ferry,million,passengers,year,frequent,service,linking,north,south,circular,roads",0.00,london
"although the majority of journeys in central london are made by public transport car travel is common in the suburbs the inner ring road  the north and south circular roads  and the outer orbital motorway  encircle the city and are intersected by a number of busy radial routesbut very few motorways penetrate into inner london a plan for a comprehensive network of motorways throughout the city  was prepared in the s but was mostly cancelled in the early s the m is the second longest ring road motorway in europe at  miles  long the a and m connect london to leeds and newcastle and edinburgh
",majority journeys central london public transport car travel common suburbs inner ring road north south circular roads outer orbital motorway encircle city intersected number busy radial routesbut motorways penetrate inner london plan comprehensive network motorways city prepared cancelled early second longest ring road motorway europe miles long connect london leeds newcastle edinburgh,8.89,"majority,journeys,central,london,public,transport,car,travel,common,suburbs,inner,ring,road,north,south,circular,roads,outer,orbital,motorway,encircle,city,intersected,number,busy,radial,routesbut,motorways,penetrate,inner,london,plan,comprehensive,network,motorways,city,prepared,cancelled,early,second,longest,ring,road,motorway,europe,miles,long,connect,london,leeds,newcastle,edinburgh",0.00,london
"the austin motor company began making hackney carriages  in  and models include austin fx from  austin fx from  with more recent models txii and tx manufactured by london taxis international the bbc states ubiquitous black cabs and red double decker buses all have long and tangled stories that are deeply embedded in londons traditions
",austin motor company began making hackney carriages models include austin fx austin fx recent models txii tx manufactured london taxis international bbc states ubiquitous black cabs red double decker buses long tangled stories deeply embedded londons traditions,5.04,"austin,motor,company,began,making,hackney,carriages,models,include,austin,fx,austin,fx,recent,models,txii,tx,manufactured,london,taxis,international,bbc,states,ubiquitous,black,cabs,red,double,decker,buses,long,tangled,stories,deeply,embedded,londons,traditions",0.00,london
"london is notorious for its traffic congestion in  the average speed of a car in the rush hour was recorded at  mph  in  a congestion charge was introduced to reduce traffic volumes in the city centre with a few exceptions motorists are required to pay to drive within a defined zone encompassing much of central london motorists who are residents of the defined zone can buy a greatly reduced season pass the london government initially expected the congestion charge zone to increase daily peak period underground and bus users reduce road traffic increase traffic speeds and reduce queues however the increase in private for hire vehicles has affected these expectations over the course of several years the average number of cars entering the centre of london on a weekday was reduced from  to  cars  a  per cent reduction of vehicles driven per day
",london notorious traffic congestion average speed car rush hour recorded mph congestion charge introduced reduce traffic volumes city centre exceptions motorists required pay drive defined zone encompassing central london motorists residents defined zone buy greatly reduced season pass london government initially expected congestion charge zone increase daily peak period underground bus users reduce road traffic increase traffic speeds reduce queues increase private hire vehicles affected expectations course years average number cars entering centre london weekday reduced cars cent reduction vehicles driven day,7.14,"london,notorious,traffic,congestion,average,speed,car,rush,hour,recorded,mph,congestion,charge,introduced,reduce,traffic,volumes,city,centre,exceptions,motorists,required,pay,drive,defined,zone,encompassing,central,london,motorists,residents,defined,zone,buy,greatly,reduced,season,pass,london,government,initially,expected,congestion,charge,zone,increase,daily,peak,period,underground,bus,users,reduce,road,traffic,increase,traffic,speeds,reduce,queues,increase,private,hire,vehicles,affected,expectations,course,years,average,number,cars,entering,centre,london,weekday,reduced,cars,cent,reduction,vehicles,driven,day",0.00,london
"london is a major global centre of higher education teaching and research and has the largest concentration of higher education institutes in europe according to the qs world university rankings  london has the greatest concentration of top class universities in the world and its international student population of around  is larger than any other city in the world a  pricewaterhousecoopers report termed london the global capital of higher education
",london major global centre higher education teaching research largest concentration higher education institutes europe according qs world university rankings london greatest concentration class universities world international student population larger city world pricewaterhousecoopers report termed london global capital higher education,6.61,"london,major,global,centre,higher,education,teaching,research,largest,concentration,higher,education,institutes,europe,according,qs,world,university,rankings,london,greatest,concentration,class,universities,world,international,student,population,larger,city,world,pricewaterhousecoopers,report,termed,london,global,capital,higher,education",0.00,london
"a number of world leading education institutions are based in london in the  qs world university rankings imperial college london is ranked no  in the world university college london  is ranked th and kings college london  is ranked th all are regularly ranked highly with imperial college being the uks leading university in the research excellence framework ranking  the london school of economics has been described as the worlds leading social science institution for both teaching and research the london business school is considered one of the worlds leading business schools and in  its mba programme was ranked second best in the world by the financial times the city is also home to three of the worlds top ten performing arts schools  the royal college of music  the royal academy of music  and the guildhall school of music and drama 
",number world leading education institutions based london qs world university rankings imperial college london ranked world university college london ranked th kings college london ranked th regularly ranked highly imperial college uks leading university research excellence framework ranking london school economics described worlds leading social science institution teaching research london business school considered worlds leading business schools mba programme ranked second best world financial times city home worlds performing arts schools royal college music royal academy music guildhall school music drama,6.97,"number,world,leading,education,institutions,based,london,qs,world,university,rankings,imperial,college,london,ranked,world,university,college,london,ranked,th,kings,college,london,ranked,th,regularly,ranked,highly,imperial,college,uks,leading,university,research,excellence,framework,ranking,london,school,economics,described,worlds,leading,social,science,institution,teaching,research,london,business,school,considered,worlds,leading,business,schools,mba,programme,ranked,second,best,world,financial,times,city,home,worlds,performing,arts,schools,royal,college,music,royal,academy,music,guildhall,school,music,drama",0.00,london
"with students in london and around  in university of london worldwide the federal university of london is the largest contact teaching university in the uk it includes five multi faculty universities  city kings college london queen mary royal holloway and ucl  and a number of smaller and more specialised institutions including birkbeck the courtauld institute of art goldsmiths the london business school the london school of economics the london school of hygiene  tropical medicine the royal academy of music the central school of speech and drama the royal veterinary college and the school of oriental and african studies members of the university of london have their own admissions procedures and most award their own degrees
",students london university london worldwide federal university london largest contact teaching university uk includes multi faculty universities city kings college london queen mary royal holloway ucl number smaller specialised institutions including birkbeck courtauld institute art goldsmiths london business school london school economics london school hygiene tropical medicine royal academy music central school speech drama royal veterinary college school oriental african studies members university london admissions procedures award degrees,6.39,"students,london,university,london,worldwide,federal,university,london,largest,contact,teaching,university,uk,includes,multi,faculty,universities,city,kings,college,london,queen,mary,royal,holloway,ucl,number,smaller,specialised,institutions,including,birkbeck,courtauld,institute,art,goldsmiths,london,business,school,london,school,economics,london,school,hygiene,tropical,medicine,royal,academy,music,central,school,speech,drama,royal,veterinary,college,school,oriental,african,studies,members,university,london,admissions,procedures,award,degrees",0.00,london
"a number of universities in london are outside the university of london system including brunel university imperial college londonnote  kingston university london metropolitan university university of east london university of west london university of westminster london south bank university middlesex university and university of the arts london  in addition there are three international universities in london  regents university london richmond the american international university in london and schiller international university
",number universities london outside university london system including brunel university imperial college londonnote kingston university london metropolitan university university east london university west london university westminster london south bank university middlesex university university arts london addition international universities london regents university london richmond american international university london schiller international university,3.72,"number,universities,london,outside,university,london,system,including,brunel,university,imperial,college,londonnote,kingston,university,london,metropolitan,university,university,east,london,university,west,london,university,westminster,london,south,bank,university,middlesex,university,university,arts,london,addition,international,universities,london,regents,university,london,richmond,american,international,university,london,schiller,international,university",0.00,london
"london is home to five major medical schools  barts and the london school of medicine and dentistry  kings college london school of medicine  imperial college school of medicine ucl medical school and st georges university of london  and has many affiliated teaching hospitals it is also a major centre for biomedical research and three of the uks eight academic health science centres are based in the city  imperial college healthcare kings health partners and ucl partners  additionally many biomedical and biotechnology spin out companies from these research institutions are based around the city most prominently in white city founded by pioneering nurse florence nightingale at st thomas hospital in  the first nursing school is now part of kings college london there are a number of business schools in london including the london school of business and finance cass business school  hult international business school escp europe european business school london imperial college business school the london business school and the ucl school of management 
",london home major medical schools barts london school medicine dentistry kings college london school medicine imperial college school medicine ucl medical school st georges university london affiliated teaching hospitals major centre biomedical research uks academic health science centres based city imperial college healthcare kings health partners ucl partners additionally biomedical biotechnology spin companies research institutions based city prominently white city founded pioneering nurse florence nightingale st thomas hospital nursing school kings college london number business schools london including london school business finance cass business school hult international business school escp europe european business school london imperial college business school london business school ucl school management,5.54,"london,home,major,medical,schools,barts,london,school,medicine,dentistry,kings,college,london,school,medicine,imperial,college,school,medicine,ucl,medical,school,st,georges,university,london,affiliated,teaching,hospitals,major,centre,biomedical,research,uks,academic,health,science,centres,based,city,imperial,college,healthcare,kings,health,partners,ucl,partners,additionally,biomedical,biotechnology,spin,companies,research,institutions,based,city,prominently,white,city,founded,pioneering,nurse,florence,nightingale,st,thomas,hospital,nursing,school,kings,college,london,number,business,schools,london,including,london,school,business,finance,cass,business,school,hult,international,business,school,escp,europe,european,business,school,london,imperial,college,business,school,london,business,school,ucl,school,management",0.00,london
"london is also home to many specialist arts education institutions including the central school of ballet london academy of music and dramatic art  london college of contemporary arts  london contemporary dance school national centre for circus arts royal academy of dramatic art  rambert school of ballet and contemporary dance the royal college of art sylvia young theatre school and trinity laban 
the brit school in the london borough of croydon provides training for the performing arts and the technologies that make performance possible with actor tom holland among their alumni
",london home specialist arts education institutions including central school ballet london academy music dramatic art london college contemporary arts london contemporary dance school national centre circus arts royal academy dramatic art rambert school ballet contemporary dance royal college art sylvia young theatre school trinity laban brit school london borough croydon provides training performing arts technologies performance possible actor tom holland alumni,4.95,"london,home,specialist,arts,education,institutions,including,central,school,ballet,london,academy,music,dramatic,art,london,college,contemporary,arts,london,contemporary,dance,school,national,centre,circus,arts,royal,academy,dramatic,art,rambert,school,ballet,contemporary,dance,royal,college,art,sylvia,young,theatre,school,trinity,laban,brit,school,london,borough,croydon,provides,training,performing,arts,technologies,performance,possible,actor,tom,holland,alumni",0.00,london
"the majority of primary and secondary schools and further education colleges in london are controlled by the london boroughs or otherwise state funded leading examples include ashbourne college bethnal green academy brampton manor academy city and islington college city of westminster college david game college ealing hammersmith and west london college leyton sixth form college london academy of excellence tower hamlets college and newham collegiate sixth form centre there are also a number of private schools and colleges in london some old and famous such as city of london school harrow st pauls school haberdashers askes boys school university college school the john lyon school highgate school and westminster school
",majority primary secondary schools education colleges london controlled london boroughs state funded leading examples include ashbourne college bethnal green academy brampton manor academy city islington college city westminster college david game college ealing hammersmith west london college leyton sixth form college london academy excellence tower hamlets college newham collegiate sixth form centre number private schools colleges london old famous city london school harrow st pauls school haberdashers askes boys school university college school john lyon school highgate school westminster school,4.12,"majority,primary,secondary,schools,education,colleges,london,controlled,london,boroughs,state,funded,leading,examples,include,ashbourne,college,bethnal,green,academy,brampton,manor,academy,city,islington,college,city,westminster,college,david,game,college,ealing,hammersmith,west,london,college,leyton,sixth,form,college,london,academy,excellence,tower,hamlets,college,newham,collegiate,sixth,form,centre,number,private,schools,colleges,london,old,famous,city,london,school,harrow,st,pauls,school,haberdashers,askes,boys,school,university,college,school,john,lyon,school,highgate,school,westminster,school",0.00,london
"important scientific learned societies based in london include the royal societythe uks national academy of sciences and the oldest national scientific institution in the worldfounded in  and the royal institution founded in  the basement of the latter is where michael faraday first demonstrated electric motion in  since  the royal institution christmas lectures have presented scientific subjects to a general audience and speakers have included aerospace engineer frank whittle naturalist david attenborough and evolutionary biologist richard dawkins
",important scientific learned societies based london include royal societythe uks national academy sciences oldest national scientific institution worldfounded royal institution founded basement michael faraday demonstrated electric motion royal institution christmas lectures presented scientific subjects general audience speakers included aerospace engineer frank whittle naturalist david attenborough evolutionary biologist richard dawkins,4.86,"important,scientific,learned,societies,based,london,include,royal,societythe,uks,national,academy,sciences,oldest,national,scientific,institution,worldfounded,royal,institution,founded,basement,michael,faraday,demonstrated,electric,motion,royal,institution,christmas,lectures,presented,scientific,subjects,general,audience,speakers,included,aerospace,engineer,frank,whittle,naturalist,david,attenborough,evolutionary,biologist,richard,dawkins",0.00,london
"leisure is a major part of the london economy a  report attributed a quarter of the entire uk leisure economy to london at  events per  people the city is one of the four fashion capitals of the world and according to official statistics is the worlds third busiest film production centre presents more live comedy than any other city and has the biggest theatre audience of any city in the world
",leisure major london economy report attributed quarter entire uk leisure economy london events people city fashion capitals world according official statistics worlds busiest film production centre presents live comedy city biggest theatre audience city world,9.07,"leisure,major,london,economy,report,attributed,quarter,entire,uk,leisure,economy,london,events,people,city,fashion,capitals,world,according,official,statistics,worlds,busiest,film,production,centre,presents,live,comedy,city,biggest,theatre,audience,city,world",0.00,london
