Unclean,Clean,Noise_Pre_Processing,Training_Data,Noise_Post_Processing,Query
"the electronics industry of mexico has grown enormously within the last decade mexico has the sixth largest electronics industry in the world after china united states japan south korea and taiwan mexico is the second largest exporter of electronics to the united states where it exported  billion worth of electronics in  the mexican electronics industry is dominated by the manufacture and oem design of televisions displays computers mobile phones circuit boards semiconductors electronic appliances communications equipment and lcd modules the mexican electronics industry grew  between  and  up from its constant growth rate of  between  and  currently electronics represent  of mexicos exports
",electronics industry mexico grown enormously decade mexico sixth largest electronics industry world china united states japan south korea taiwan mexico second largest exporter electronics united states exported billion worth electronics mexican electronics industry dominated manufacture oem design televisions displays computers mobile phones circuit boards semiconductors electronic appliances communications equipment lcd modules mexican electronics industry grew constant growth rate currently electronics represent mexicos exports,5.43,"electronics,industry,mexico,grown,enormously,decade,mexico,sixth,largest,electronics,industry,world,china,united,states,japan,south,korea,taiwan,mexico,second,largest,exporter,electronics,united,states,exported,billion,worth,electronics,mexican,electronics,industry,dominated,manufacture,oem,design,televisions,displays,computers,mobile,phones,circuit,boards,semiconductors,electronic,appliances,communications,equipment,lcd,modules,mexican,electronics,industry,grew,constant,growth,rate,currently,electronics,represent,mexicos,exports",0.00,mexican
"the remittances from mexican citizens working in the united states account are significant after dipping during the after the  great recession and again during covid pandemic in  they are topping other sources of foreign income remittances are directed to mexico by direct links from a yous government banking program
",remittances mexican citizens working united states account significant dipping great recession covid pandemic topping sources foreign income remittances directed mexico direct links yous government banking program,7.23,"remittances,mexican,citizens,working,united,states,account,significant,dipping,great,recession,covid,pandemic,topping,sources,foreign,income,remittances,directed,mexico,direct,links,yous,government,banking,program",0.00,mexican
"the telecommunications industry is mostly dominated by telmex  previously a government monopoly privatized in  by  telmex had expanded its operations to colombia peru chile argentina brazil uruguay and the united states other players in the domestic industry are axtel maxcom alestra marcatel att mexico because of mexican orography providing a landline telephone service at remote mountainous areas is expensive and the penetration of line phones per capita is low compared to other latin american countries at  percent however  of mexicans over the age of  own a mobile phone mobile telephony has the advantage of reaching all areas at a lower cost and the total number of mobile lines is almost two times that of landlines with an estimation of  million lines the telecommunication industry is regulated by the government through cofetel 
",telecommunications industry dominated telmex previously government monopoly privatized telmex expanded operations colombia peru chile argentina brazil uruguay united states players domestic industry axtel maxcom alestra marcatel att mexico mexican orography providing landline telephone service remote mountainous areas expensive penetration line phones capita low compared latin american countries percent mexicans age mobile phone mobile telephony advantage reaching areas lower cost total number mobile lines times landlines estimation million lines telecommunication industry regulated government cofetel,6.89,"telecommunications,industry,dominated,telmex,previously,government,monopoly,privatized,telmex,expanded,operations,colombia,peru,chile,argentina,brazil,uruguay,united,states,players,domestic,industry,axtel,maxcom,alestra,marcatel,att,mexico,mexican,orography,providing,landline,telephone,service,remote,mountainous,areas,expensive,penetration,line,phones,capita,low,compared,latin,american,countries,percent,mexicans,age,mobile,phone,mobile,telephony,advantage,reaching,areas,lower,cost,total,number,mobile,lines,times,landlines,estimation,million,lines,telecommunication,industry,regulated,government,cofetel",0.00,mexican
"the mexican satellite system is domestic and operates  earth stations there is also extensive microwave radio relay network and considerable use of fiber optic and coaxial cable mexican satellites are operated by satlites mexicanos  a private company leader in latin america and servicing both north and south america it offers broadcast telephone and telecommunication services to  countries in the americas from canada to argentina through business partnerships satmex provides high speed connectivity to isps and digital broadcast services satmex maintains its own satellite fleet with most of the fleet being designed and built in mexico major players in the broadcasting industry are televisa the largest mexican media company in the spanish speaking world tv azteca and imagen televisin
",mexican satellite system domestic operates earth stations extensive microwave radio relay network considerable use fiber optic coaxial cable mexican satellites operated satlites mexicanos private company leader latin america servicing north south america offers broadcast telephone telecommunication services countries americas canada argentina business partnerships satmex provides high speed connectivity isps digital broadcast services satmex maintains satellite fleet fleet designed built mexico major players broadcasting industry televisa largest mexican media company spanish speaking world tv azteca imagen televisin,5.30,"mexican,satellite,system,domestic,operates,earth,stations,extensive,microwave,radio,relay,network,considerable,use,fiber,optic,coaxial,cable,mexican,satellites,operated,satlites,mexicanos,private,company,leader,latin,america,servicing,north,south,america,offers,broadcast,telephone,telecommunication,services,countries,americas,canada,argentina,business,partnerships,satmex,provides,high,speed,connectivity,isps,digital,broadcast,services,satmex,maintains,satellite,fleet,fleet,designed,built,mexico,major,players,broadcasting,industry,televisa,largest,mexican,media,company,spanish,speaking,world,tv,azteca,imagen,televisin",0.00,mexican
"the national autonomous university of mexico was officially established in  and the university became one of the most important institutes of higher learning in mexico unam provides world class education in science medicine and engineering many scientific institutes and new institutes of higher learning such as national polytechnic institute  were established during the first half of the th century most of the new research institutes were created within unam twelve institutes were integrated into unam from  to  in  the mexican academy of sciences was created to coordinate scientific efforts between academics
",national autonomous university mexico officially established university important institutes higher learning mexico unam provides world class education science medicine engineering scientific institutes new institutes higher learning national polytechnic institute established half th century new research institutes created unam institutes integrated unam mexican academy sciences created coordinate scientific efforts academics,6.82,"national,autonomous,university,mexico,officially,established,university,important,institutes,higher,learning,mexico,unam,provides,world,class,education,science,medicine,engineering,scientific,institutes,new,institutes,higher,learning,national,polytechnic,institute,established,half,th,century,new,research,institutes,created,unam,institutes,integrated,unam,mexican,academy,sciences,created,coordinate,scientific,efforts,academics",0.00,mexican
"in  the mexican chemist mario j molina shared the nobel prize in chemistry with paul j crutzen and f sherwood rowland for their work in atmospheric chemistry particularly concerning the formation and decomposition of ozone molina an alumnus of unam became the first mexican citizen to win the nobel prize in science
",mexican chemist mario j molina shared nobel prize chemistry paul j crutzen f sherwood rowland work atmospheric chemistry particularly concerning formation decomposition ozone molina alumnus unam mexican citizen win nobel prize science,6.33,"mexican,chemist,mario,j,molina,shared,nobel,prize,chemistry,paul,j,crutzen,f,sherwood,rowland,work,atmospheric,chemistry,particularly,concerning,formation,decomposition,ozone,molina,alumnus,unam,mexican,citizen,win,nobel,prize,science",0.00,mexican
"starting in the late nineteenth century mexico was one of the first latin american countries to promote railway development and the network covers  km  the secretary of communications and transport of mexico proposed a high speed rail link that will transport its passengers from mexico city to guadalajara jalisco the train which will travel at  kilometers per hour  will allow passengers to travel from mexico city to guadalajara in just  hours the whole project was projected to cost  billion pesos or about  billion us and is being paid for jointly by the mexican government and the local private sector including the wealthiest man in the world mexicos billionaire business tycoon carlos slim the government of the state of yucatn is also funding the construction of a high speed line connecting the cities of cozumel to mrida and chichen itza and cancn
",starting late nineteenth century mexico latin american countries promote railway development network covers km secretary communications transport mexico proposed high speed rail link transport passengers mexico city guadalajara jalisco train travel kilometers hour allow passengers travel mexico city guadalajara hours project projected cost billion pesos billion paid jointly mexican government local private sector including wealthiest man world mexicos billionaire business tycoon carlos slim government state yucatn funding construction high speed line connecting cities cozumel mrida chichen itza cancn,7.33,"starting,late,nineteenth,century,mexico,latin,american,countries,promote,railway,development,network,covers,km,secretary,communications,transport,mexico,proposed,high,speed,rail,link,transport,passengers,mexico,city,guadalajara,jalisco,train,travel,kilometers,hour,allow,passengers,travel,mexico,city,guadalajara,hours,project,projected,cost,billion,pesos,billion,paid,jointly,mexican,government,local,private,sector,including,wealthiest,man,world,mexicos,billionaire,business,tycoon,carlos,slim,government,state,yucatn,funding,construction,high,speed,line,connecting,cities,cozumel,mrida,chichen,itza,cancn",0.00,mexican
"throughout the th century the population of mexico had barely doubled this trend continued during the first two decades of the th century the  census reported a loss of about  million inhabitants the mexican revolution  greatly impacted population increases the growth rate increased dramatically between the s and the s when the country registered growth rates of over   the mexican population doubled in twenty years and at that rate it was expected that by  there would be  million people living in mexico life expectancy increased from  years  to  years  according to estimations made by mexicos national geography and statistics institute is estimated in  to be  as of  mexico had  million inhabitants making it the most populous spanish speaking country in the world
",th century population mexico barely doubled trend continued decades th century census reported loss million inhabitants mexican revolution greatly impacted population increases growth rate increased dramatically country registered growth rates mexican population doubled years rate expected million people living mexico life expectancy increased years years according estimations mexicos national geography statistics institute estimated mexico million inhabitants making populous spanish speaking country world,7.76,"th,century,population,mexico,barely,doubled,trend,continued,decades,th,century,census,reported,loss,million,inhabitants,mexican,revolution,greatly,impacted,population,increases,growth,rate,increased,dramatically,country,registered,growth,rates,mexican,population,doubled,years,rate,expected,million,people,living,mexico,life,expectancy,increased,years,years,according,estimations,mexicos,national,geography,statistics,institute,estimated,mexico,million,inhabitants,making,populous,spanish,speaking,country,world",0.00,mexican
"mexicos population is highly diverse but research on mexican ethnicity has felt the impact of nationalist discourses on identity since the s the mexican government has promoted the view that all mexicans are part of the mestizo community within which they are distinguished only by residence in or outside of an indigenous community degree of fluency in an indigenous language and degree of adherence to indigenous customs even then across the years the government has used different criteria to count indigenous peoples with each of them returning considerably different numbers ranging from  to  of the countrys population it is not until very recently that the mexican government began conducting surveys that consider other ethnic groups that live in the country such as afro mexicans  or white mexicans   less numerous groups in mexico such as asians and middle easterners are also accounted for with numbers of around  each while mestizos are a prominent ethnic group in contemporary mexico the subjective and ever changing definition of this category have led to its estimations being imprecise having been observed that many mexicans do not identify as mestizos favoring instead ethnoracial labels such as white or indigenous due to having more consistent and static definitions
",mexicos population highly diverse research mexican ethnicity felt impact nationalist discourses identity mexican government promoted view mexicans mestizo community distinguished residence outside indigenous community degree fluency indigenous language degree adherence indigenous customs years government different criteria count indigenous peoples returning considerably different numbers ranging countrys population recently mexican government began conducting surveys consider ethnic groups live country afro mexicans white mexicans numerous groups mexico asians middle easterners accounted numbers mestizos prominent ethnic group contemporary mexico subjective changing definition category led estimations imprecise observed mexicans identify mestizos favoring instead ethnoracial labels white indigenous consistent static definitions,8.24,"mexicos,population,highly,diverse,research,mexican,ethnicity,felt,impact,nationalist,discourses,identity,mexican,government,promoted,view,mexicans,mestizo,community,distinguished,residence,outside,indigenous,community,degree,fluency,indigenous,language,degree,adherence,indigenous,customs,years,government,different,criteria,count,indigenous,peoples,returning,considerably,different,numbers,ranging,countrys,population,recently,mexican,government,began,conducting,surveys,consider,ethnic,groups,live,country,afro,mexicans,white,mexicans,numerous,groups,mexico,asians,middle,easterners,accounted,numbers,mestizos,prominent,ethnic,group,contemporary,mexico,subjective,changing,definition,category,led,estimations,imprecise,observed,mexicans,identify,mestizos,favoring,instead,ethnoracial,labels,white,indigenous,consistent,static,definitions",0.00,mexican
"the total percentage of mexicos indigenous peoples tends to vary depending on the criteria used by the government in its censuses if the ability to speak an indigenous language is used as the criterion to define a person as indigenous it is  if racial self identification is used it is d and if people who consider themselves part indigenous are also included it amounts to  nonetheless all the censuses conclude that the majority of mexicos indigenous population is concentrated in rural areas of the southern and south eastern mexican states with the highest percentages being found in yucatn  oaxaca  quintana roo  chiapas  and campeche 
",total percentage mexicos indigenous peoples tends vary depending criteria government censuses ability speak indigenous language criterion define person indigenous racial self identification people consider indigenous included amounts nonetheless censuses conclude majority mexicos indigenous population concentrated rural areas southern south eastern mexican states highest percentages found yucatn oaxaca quintana roo chiapas campeche,8.27,"total,percentage,mexicos,indigenous,peoples,tends,vary,depending,criteria,government,censuses,ability,speak,indigenous,language,criterion,define,person,indigenous,racial,self,identification,people,consider,indigenous,included,amounts,nonetheless,censuses,conclude,majority,mexicos,indigenous,population,concentrated,rural,areas,southern,south,eastern,mexican,states,highest,percentages,found,yucatn,oaxaca,quintana,roo,chiapas,campeche",0.00,mexican
"similarly to mestizo and indigenous peoples estimates of the percentage of european descended mexicans vary considerably depending on the criteria used recent nationwide field surveys that account for different phenotypical traits  report a percentage between   if the criterion is the presence of blond hair and of  if the criterion is skin color with the later surveys having been conducted by mexicos government itself while during the colonial era most of the european migration into mexico was spanish in the th and th centuries a substantial number of non spanish europeans immigrated to the country with europeans often being the most numerous ethnic group in colonial mexican cities nowadays mexicos northern and western regions have the highest percentages of european populations with the majority of the people not having native admixture or being of predominantly european ancestry
",similarly mestizo indigenous peoples estimates percentage european descended mexicans vary considerably depending criteria recent nationwide field surveys account different phenotypical traits report percentage criterion presence blond hair criterion skin color later surveys conducted mexicos government colonial era european migration mexico spanish th th centuries substantial number non spanish europeans immigrated country europeans numerous ethnic group colonial mexican cities nowadays mexicos northern western regions highest percentages european populations majority people native admixture predominantly european ancestry,6.94,"similarly,mestizo,indigenous,peoples,estimates,percentage,european,descended,mexicans,vary,considerably,depending,criteria,recent,nationwide,field,surveys,account,different,phenotypical,traits,report,percentage,criterion,presence,blond,hair,criterion,skin,color,later,surveys,conducted,mexicos,government,colonial,era,european,migration,mexico,spanish,th,th,centuries,substantial,number,non,spanish,europeans,immigrated,country,europeans,numerous,ethnic,group,colonial,mexican,cities,nowadays,mexicos,northern,western,regions,highest,percentages,european,populations,majority,people,native,admixture,predominantly,european,ancestry",0.00,mexican
"the afro mexican population  is an ethnic group made up of descendants of colonial era slaves and recent immigrants of sub saharan african descent mexico had an active slave trade during the colonial period and some  africans were taken there primarily in the th century the creation of a national mexican identity especially after the mexican revolution emphasized mexicos indigenous and european past it passively eliminated the african ancestors and contributions most of the african descended population was absorbed into the surrounding mestizo  and indigenous populations through unions among the groups evidence of this long history of intermarriage with mestizo and indigenous mexicans is also expressed in the fact that in the  inter census   of afro mexicans also identified as indigenous it was also reported that  of afro mexicans speak an indigenous language the states with the highest self report of afro mexicans were guerrero  oaxaca  and baja california sur  afro mexican culture is strongest in the communities of the costa chica of oaxaca and costa chica of guerrero
",afro mexican population ethnic group descendants colonial era slaves recent immigrants sub saharan african descent mexico active slave trade colonial period africans taken primarily th century creation national mexican identity especially mexican revolution emphasized mexicos indigenous european past passively eliminated african ancestors contributions african descended population absorbed surrounding mestizo indigenous populations unions groups evidence long history intermarriage mestizo indigenous mexicans expressed fact inter census afro mexicans identified indigenous reported afro mexicans speak indigenous language states highest self report afro mexicans guerrero oaxaca baja california sur afro mexican culture strongest communities costa chica oaxaca costa chica guerrero,6.72,"afro,mexican,population,ethnic,group,descendants,colonial,era,slaves,recent,immigrants,sub,saharan,african,descent,mexico,active,slave,trade,colonial,period,africans,taken,primarily,th,century,creation,national,mexican,identity,especially,mexican,revolution,emphasized,mexicos,indigenous,european,past,passively,eliminated,african,ancestors,contributions,african,descended,population,absorbed,surrounding,mestizo,indigenous,populations,unions,groups,evidence,long,history,intermarriage,mestizo,indigenous,mexicans,expressed,fact,inter,census,afro,mexicans,identified,indigenous,reported,afro,mexicans,speak,indigenous,language,states,highest,self,report,afro,mexicans,guerrero,oaxaca,baja,california,sur,afro,mexican,culture,strongest,communities,costa,chica,oaxaca,costa,chica,guerrero",0.00,mexican
"spanish is the de facto national language spoken by the vast majority of the population making mexico the worlds most populous hispanophone country mexican spanish refers to the varieties of the language spoken in the country which differ from one region to another in sound structure and vocabulary in general mexican spanish does not make any phonetic distinction among the letters s and z as well as c when preceding the vowels e and i as opposed to peninsular spanish the letters b and v have the same pronunciation as well furthermore the usage of vos the second person singular pronoun found in several latin american varieties is replaced by t whereas vosotros the second person plural pronoun fell out of use and was effectively replaced by ustedes in written form the spanish royal academy serves as the primary guideline for spelling except for words of amerindian origin that retain their original phonology such as cenzontle instead of sinzontle and mxico not mjico words of foreign origin also maintain their original spelling such as whisky and film as opposed to gisqui and filme as the royal academy suggests the letter x is distinctly used in mexican spanish where it may be pronounced as ks  as  particularly in amerindian words  and as the voiceless velar fricative x 
",spanish de facto national language spoken vast majority population making mexico worlds populous hispanophone country mexican spanish refers varieties language spoken country differ region sound structure vocabulary general mexican spanish phonetic distinction letters z c preceding vowels e opposed peninsular spanish letters b v pronunciation furthermore usage vos second person singular pronoun found latin american varieties replaced vosotros second person plural pronoun fell use effectively replaced ustedes written form spanish royal academy serves primary guideline spelling words amerindian origin retain original phonology cenzontle instead sinzontle mxico mjico words foreign origin maintain original spelling whisky film opposed gisqui filme royal academy suggests letter x distinctly mexican spanish pronounced ks particularly amerindian words voiceless velar fricative x,7.84,"spanish,de,facto,national,language,spoken,vast,majority,population,making,mexico,worlds,populous,hispanophone,country,mexican,spanish,refers,varieties,language,spoken,country,differ,region,sound,structure,vocabulary,general,mexican,spanish,phonetic,distinction,letters,z,c,preceding,vowels,e,opposed,peninsular,spanish,letters,b,v,pronunciation,furthermore,usage,vos,second,person,singular,pronoun,found,latin,american,varieties,replaced,vosotros,second,person,plural,pronoun,fell,use,effectively,replaced,ustedes,written,form,spanish,royal,academy,serves,primary,guideline,spelling,words,amerindian,origin,retain,original,phonology,cenzontle,instead,sinzontle,mxico,mjico,words,foreign,origin,maintain,original,spelling,whisky,film,opposed,gisqui,filme,royal,academy,suggests,letter,x,distinctly,mexican,spanish,pronounced,ks,particularly,amerindian,words,voiceless,velar,fricative,x",0.00,mexican
