Unclean,Clean,Noise_Pre_Processing,Training_Data,Noise_Post_Processing,Query
"after pancho villa was defeated by revolutionary forces in  he led an incursion raid into columbus new mexico prompting the yous to send  troops led by general john j pershing in an unsuccessful attempt to capture villa carranza pushed back against yous troops being in northern mexico the expeditionary forces withdrew as the yous entered world war i germany attempted to get mexico to side with it sending a coded telegram in  to incite war between the yous and mexico with mexico to regain the territory it lost in the mexican american war mexico remained neutral in the conflict
",pancho villa defeated revolutionary forces led incursion raid columbus new mexico prompting yous send troops led general john j pershing unsuccessful attempt capture villa carranza pushed yous troops northern mexico expeditionary forces withdrew yous entered world war germany attempted mexico sending coded telegram incite war yous mexico mexico regain territory lost mexican american war mexico remained neutral conflict,7.03,"pancho,villa,defeated,revolutionary,forces,led,incursion,raid,columbus,new,mexico,prompting,yous,send,troops,led,general,john,j,pershing,unsuccessful,attempt,capture,villa,carranza,pushed,yous,troops,northern,mexico,expeditionary,forces,withdrew,yous,entered,world,war,germany,attempted,mexico,sending,coded,telegram,incite,war,yous,mexico,mexico,regain,territory,lost,mexican,american,war,mexico,remained,neutral,conflict",0.00,mexican
"the first quarter century of the post revolutionary period  was characterized by revolutionary generals serving as presidents of mexico including lvaro obregn  plutarco elas calles  lzaro crdenas  and manuel avila camacho  since  no member of the military has been president of mexico the post revolutionary project of the mexican government sought to bring order to the country end military intervention in politics and create organizations of interest groups workers peasants urban office workers and even the army for a short period were incorporated as sectors of the single party that dominated mexican politics from its founding in  obregn instigated land reform and strengthened the power of organized labor he gained recognition from the united states and took steps to settle claims with companies and individuals that lost property during the revolution he imposed his fellow former sonoran revolutionary general calles as his successor prompting an unsuccessful military revolt as president calles provoked a major conflict with the catholic church and catholic guerrilla armies when he strictly enforced anticlerical articles of the  constitution the church state conflict was mediated and ended with the aid of the yous ambassador to mexico and ended with an agreement between the parties in conflict by means of which the respective fields of action were defined although the constitution prohibited reelection of the president obregn wished to run again and the constitution was amended to allow non consecutive re election obregn won the  elections but was assassinated by a catholic zealot causing a political crisis of succession calles could not become president again since he has just ended his term he sought to set up a structure to manage presidential succession founding the party that was to dominate mexico until the late twentieth century calles declared that the revolution had moved from caudillismo  to the era institucional 
",quarter century post revolutionary period characterized revolutionary generals serving presidents mexico including lvaro obregn plutarco elas calles lzaro crdenas manuel avila camacho member military president mexico post revolutionary project mexican government sought bring order country end military intervention politics create organizations interest groups workers peasants urban office workers army short period incorporated sectors single party dominated mexican politics founding obregn instigated land reform strengthened power organized labor gained recognition united states took steps settle claims companies individuals lost property revolution imposed fellow sonoran revolutionary general calles successor prompting unsuccessful military revolt president calles provoked major conflict catholic church catholic guerrilla armies strictly enforced anticlerical articles constitution church state conflict mediated ended aid yous ambassador mexico ended agreement parties conflict means respective fields action defined constitution prohibited reelection president obregn wished run constitution amended allow non consecutive election obregn elections assassinated catholic zealot causing political crisis succession calles president ended term sought set structure manage presidential succession founding party dominate mexico late twentieth century calles declared revolution moved caudillismo era institucional,6.69,"quarter,century,post,revolutionary,period,characterized,revolutionary,generals,serving,presidents,mexico,including,lvaro,obregn,plutarco,elas,calles,lzaro,crdenas,manuel,avila,camacho,member,military,president,mexico,post,revolutionary,project,mexican,government,sought,bring,order,country,end,military,intervention,politics,create,organizations,interest,groups,workers,peasants,urban,office,workers,army,short,period,incorporated,sectors,single,party,dominated,mexican,politics,founding,obregn,instigated,land,reform,strengthened,power,organized,labor,gained,recognition,united,states,took,steps,settle,claims,companies,individuals,lost,property,revolution,imposed,fellow,sonoran,revolutionary,general,calles,successor,prompting,unsuccessful,military,revolt,president,calles,provoked,major,conflict,catholic,church,catholic,guerrilla,armies,strictly,enforced,anticlerical,articles,constitution,church,state,conflict,mediated,ended,aid,yous,ambassador,mexico,ended,agreement,parties,conflict,means,respective,fields,action,defined,constitution,prohibited,reelection,president,obregn,wished,run,constitution,amended,allow,non,consecutive,election,obregn,elections,assassinated,catholic,zealot,causing,political,crisis,succession,calles,president,ended,term,sought,set,structure,manage,presidential,succession,founding,party,dominate,mexico,late,twentieth,century,calles,declared,revolution,moved,caudillismo,era,institucional",0.00,mexican
"despite not holding the presidency calles remained the key political figure during the period known as the maximato  the maximato ended during the presidency of lzaro crdenas who expelled calles from the country and implemented many economic and social reforms this included the mexican oil expropriation in march  which nationalized the yous and anglo dutch oil company known as the mexican eagle petroleum company this movement would result in the creation of the state owned mexican oil company pemex this sparked a diplomatic crisis with the countries whose citizens had lost businesses by crdenass radical measure but since then the company has played an important role in the economic development of mexico crdenass successor manuel vila camacho  was more moderate and relations between the yous and mexico vastly improved during world war ii when mexico was a significant ally providing manpower and materiel to aid the war effort from  the election of miguel alemn the first civilian president in the post revolutionary period mexico embarked on an aggressive program of economic development known as the mexican miracle which was characterized by industrialization urbanization and the increase of inequality in mexico between urban and rural areas
",despite holding presidency calles remained key political figure period known maximato maximato ended presidency lzaro crdenas expelled calles country implemented economic social reforms included mexican oil expropriation march nationalized yous anglo dutch oil company known mexican eagle petroleum company movement result creation state owned mexican oil company pemex sparked diplomatic crisis countries citizens lost businesses crdenass radical measure company played important role economic development mexico crdenass successor manuel vila camacho moderate relations yous mexico vastly improved world war ii mexico significant ally providing manpower materiel aid war effort election miguel alemn civilian president post revolutionary period mexico embarked aggressive program economic development known mexican miracle characterized industrialization urbanization increase inequality mexico urban rural areas,6.44,"despite,holding,presidency,calles,remained,key,political,figure,period,known,maximato,maximato,ended,presidency,lzaro,crdenas,expelled,calles,country,implemented,economic,social,reforms,included,mexican,oil,expropriation,march,nationalized,yous,anglo,dutch,oil,company,known,mexican,eagle,petroleum,company,movement,result,creation,state,owned,mexican,oil,company,pemex,sparked,diplomatic,crisis,countries,citizens,lost,businesses,crdenass,radical,measure,company,played,important,role,economic,development,mexico,crdenass,successor,manuel,vila,camacho,moderate,relations,yous,mexico,vastly,improved,world,war,ii,mexico,significant,ally,providing,manpower,materiel,aid,war,effort,election,miguel,alemn,civilian,president,post,revolutionary,period,mexico,embarked,aggressive,program,economic,development,known,mexican,miracle,characterized,industrialization,urbanization,increase,inequality,mexico,urban,rural,areas",0.00,mexican
"with robust economic growth mexico sought to showcase it to the world by hosting the  summer olympics the government poured huge resources into building new facilities at the same time there was political unrest by university students and others with those expenditures while their own circumstances were difficult demonstrations in central mexico city went on for weeks before the planned opening of the games with the government of gustavo daz ordaz cracking down the culmination was the tlatelolco massacre which claimed the lives of around  protesters based on conservative estimates and perhaps as many as  although the economy continued to flourish for some social inequality remained a factor of discontent pri rule became increasingly authoritarian and at times oppressive in what is now referred to as the mexican dirty war
",robust economic growth mexico sought showcase world hosting summer olympics government poured huge resources building new facilities time political unrest university students expenditures circumstances difficult demonstrations central mexico city went weeks planned opening games government gustavo daz ordaz cracking culmination tlatelolco massacre claimed lives protesters based conservative estimates economy continued flourish social inequality remained factor discontent pri rule increasingly authoritarian times oppressive referred mexican dirty war,7.68,"robust,economic,growth,mexico,sought,showcase,world,hosting,summer,olympics,government,poured,huge,resources,building,new,facilities,time,political,unrest,university,students,expenditures,circumstances,difficult,demonstrations,central,mexico,city,went,weeks,planned,opening,games,government,gustavo,daz,ordaz,cracking,culmination,tlatelolco,massacre,claimed,lives,protesters,based,conservative,estimates,economy,continued,flourish,social,inequality,remained,factor,discontent,pri,rule,increasingly,authoritarian,times,oppressive,referred,mexican,dirty,war",0.00,mexican
"salinas embarked on a program of neoliberal reforms that fixed the exchange rate of the peso controlled inflation opened mexico to foreign investment and began talks with the yous and canada to join their free trade agreement in order to do that the constitution of  was amended in several important ways article  which had allowed the government to expropriate natural resources and distribute land was amended to end agrarian reform and to guarantee private owners property rights the anti clerical articles that muzzled religious institutions especially the catholic church were amended and mexico reestablished of diplomatic relations with the holy see signing on to the north american free trade agreement  removed mexicos autonomy over trade policy the agreement came into effect on  january  the same day the zapatista army of national liberation  in chiapas began armed peasant rebellion against the federal government which captured a few towns but brought world attention to the situation in mexico the armed conflict was short lived and has continued as a non violent opposition movement against neoliberalism and globalization in  following the assassination of the pris presidential candidate luis donaldo colosio salinas was succeeded by a victorious substitute pri candidate ernesto zedillo salinas left zedillos government to deal with the mexican peso crisis requiring a  billion imf bailout major macroeconomic reforms were started by president zedillo and the economy rapidly recovered and growth peaked at almost  by the end of 
",salinas embarked program neoliberal reforms fixed exchange rate peso controlled inflation opened mexico foreign investment began talks yous canada join free trade agreement order constitution amended important ways article allowed government expropriate natural resources distribute land amended end agrarian reform guarantee private owners property rights anti clerical articles muzzled religious institutions especially catholic church amended mexico reestablished diplomatic relations holy signing north american free trade agreement removed mexicos autonomy trade policy agreement came effect january day zapatista army national liberation chiapas began armed peasant rebellion federal government captured towns brought world attention situation mexico armed conflict short lived continued non violent opposition movement neoliberalism globalization following assassination pris presidential candidate luis donaldo colosio salinas succeeded victorious substitute pri candidate ernesto zedillo salinas left zedillos government deal mexican peso crisis requiring billion imf bailout major macroeconomic reforms started president zedillo economy rapidly recovered growth peaked end,5.87,"salinas,embarked,program,neoliberal,reforms,fixed,exchange,rate,peso,controlled,inflation,opened,mexico,foreign,investment,began,talks,yous,canada,join,free,trade,agreement,order,constitution,amended,important,ways,article,allowed,government,expropriate,natural,resources,distribute,land,amended,end,agrarian,reform,guarantee,private,owners,property,rights,anti,clerical,articles,muzzled,religious,institutions,especially,catholic,church,amended,mexico,reestablished,diplomatic,relations,holy,signing,north,american,free,trade,agreement,removed,mexicos,autonomy,trade,policy,agreement,came,effect,january,day,zapatista,army,national,liberation,chiapas,began,armed,peasant,rebellion,federal,government,captured,towns,brought,world,attention,situation,mexico,armed,conflict,short,lived,continued,non,violent,opposition,movement,neoliberalism,globalization,following,assassination,pris,presidential,candidate,luis,donaldo,colosio,salinas,succeeded,victorious,substitute,pri,candidate,ernesto,zedillo,salinas,left,zedillos,government,deal,mexican,peso,crisis,requiring,billion,imf,bailout,major,macroeconomic,reforms,started,president,zedillo,economy,rapidly,recovered,growth,peaked,end",0.00,mexican
"mexicos total area is  km  making it the worlds th largest country by total area it has coastlines on the pacific ocean and gulf of california as well as the gulf of mexico and caribbean sea the latter two forming part of the atlantic ocean within these seas are about  km  of islands  from its farthest land points mexico is a little over  mi  in length mexico has nine distinct regions baja california the pacific coastal lowlands the mexican plateau the sierra madre oriental the sierra madre occidental the cordillera neo volcnica the gulf coastal plain the southern highlands and the yucatn peninsula although mexico is large much of its land mass is incompatible with agriculture due to aridity soil or terrain in  an estimated  of land is agricultural  is arable  is in permanent crops  is permanent pasture and  is forest
",mexicos total area km making worlds th largest country total area coastlines pacific ocean gulf california gulf mexico caribbean sea forming atlantic ocean seas km islands farthest land points mexico little mi length mexico distinct regions baja california pacific coastal lowlands mexican plateau sierra madre oriental sierra madre occidental cordillera neo volcnica gulf coastal plain southern highlands yucatn peninsula mexico large land mass incompatible agriculture aridity soil terrain estimated land agricultural arable permanent crops permanent pasture forest,7.71,"mexicos,total,area,km,making,worlds,th,largest,country,total,area,coastlines,pacific,ocean,gulf,california,gulf,mexico,caribbean,sea,forming,atlantic,ocean,seas,km,islands,farthest,land,points,mexico,little,mi,length,mexico,distinct,regions,baja,california,pacific,coastal,lowlands,mexican,plateau,sierra,madre,oriental,sierra,madre,occidental,cordillera,neo,volcnica,gulf,coastal,plain,southern,highlands,yucatn,peninsula,mexico,large,land,mass,incompatible,agriculture,aridity,soil,terrain,estimated,land,agricultural,arable,permanent,crops,permanent,pasture,forest",0.00,mexican
"mexico is crossed from north to south by two mountain ranges known as sierra madre oriental and sierra madre occidental which are the extension of the rocky mountains from northern north america from east to west at the center the country is crossed by the trans mexican volcanic belt also known as the sierra nevada a fourth mountain range the sierra madre del sur runs from michoacn to oaxaca as such the majority of the mexican central and northern territories are located at high altitudes and the highest elevations are found at the trans mexican volcanic belt pico de orizaba  popocatpetl  and iztaccihuatl  and the nevado de toluca  three major urban agglomerations are located in the valleys between these four elevations toluca greater mexico city and pueblacitation needed an important geologic feature of the yucatn peninsula is the chicxulub crater the scientific consensus is that the chicxulub impactor was responsible for the cretaceouspaleogene extinction event mexico is subject to a number of natural hazards including hurricanes on both coasts tsunamis on the pacific coast and volcanism
",mexico crossed north south mountain ranges known sierra madre oriental sierra madre occidental extension rocky mountains northern north america east west center country crossed trans mexican volcanic belt known sierra nevada fourth mountain range sierra madre del sur runs michoacn oaxaca majority mexican central northern territories located high altitudes highest elevations found trans mexican volcanic belt pico de orizaba popocatpetl iztaccihuatl nevado de toluca major urban agglomerations located valleys elevations toluca greater mexico city pueblacitation needed important geologic feature yucatn peninsula chicxulub crater scientific consensus chicxulub impactor responsible cretaceouspaleogene extinction event mexico subject number natural hazards including hurricanes coasts tsunamis pacific coast volcanism,6.59,"mexico,crossed,north,south,mountain,ranges,known,sierra,madre,oriental,sierra,madre,occidental,extension,rocky,mountains,northern,north,america,east,west,center,country,crossed,trans,mexican,volcanic,belt,known,sierra,nevada,fourth,mountain,range,sierra,madre,del,sur,runs,michoacn,oaxaca,majority,mexican,central,northern,territories,located,high,altitudes,highest,elevations,found,trans,mexican,volcanic,belt,pico,de,orizaba,popocatpetl,iztaccihuatl,nevado,de,toluca,major,urban,agglomerations,located,valleys,elevations,toluca,greater,mexico,city,pueblacitation,needed,important,geologic,feature,yucatn,peninsula,chicxulub,crater,scientific,consensus,chicxulub,impactor,responsible,cretaceouspaleogene,extinction,event,mexico,subject,number,natural,hazards,including,hurricanes,coasts,tsunamis,pacific,coast,volcanism",0.00,mexican
"mexico has few rivers and lakes the lerma river flows west to form lake chapala the countrys largest natural lake the santiago river flows from lake chapala out of the lake to the pacific ocean the pnuco river flows to the gulf of mexico lake ptzcuaro and lake cuitzeo west of mexico city are remnants of vast lakes and marshes that covered much of the southern mesa central before european settlement the central lake system where the aztec capital of tenochtitlan and surrounding communities thrived before the spanish conquest have almost entirely been drained there are few permanent streams in the arid mesa del norte and most of these drain into the interior rather than to the ocean by far the most important river in that part of the country is the ro bravo del norte  which forms a lengthy part of the international border from ciudad jurez to the gulf coast  km  the balsas river provides hydroelectric power  grijalva river and usumacinta river system drains most of the humid chiapas highlands the papaloapan river flows into the gulf of mexico south of veracruz the grijalva and usumacinta further southeast are significant mexican rivers both the baja california peninsula and the yucatn peninsula are extremely arid with no surface streams
",mexico rivers lakes lerma river flows west form lake chapala countrys largest natural lake santiago river flows lake chapala lake pacific ocean pnuco river flows gulf mexico lake ptzcuaro lake cuitzeo west mexico city remnants vast lakes marshes covered southern mesa central european settlement central lake system aztec capital tenochtitlan surrounding communities thrived spanish conquest entirely drained permanent streams arid mesa del norte drain interior ocean far important river country ro bravo del norte forms lengthy international border ciudad jurez gulf coast km balsas river provides hydroelectric power grijalva river usumacinta river system drains humid chiapas highlands papaloapan river flows gulf mexico south veracruz grijalva usumacinta southeast significant mexican rivers baja california peninsula yucatn peninsula extremely arid surface streams,7.25,"mexico,rivers,lakes,lerma,river,flows,west,form,lake,chapala,countrys,largest,natural,lake,santiago,river,flows,lake,chapala,lake,pacific,ocean,pnuco,river,flows,gulf,mexico,lake,ptzcuaro,lake,cuitzeo,west,mexico,city,remnants,vast,lakes,marshes,covered,southern,mesa,central,european,settlement,central,lake,system,aztec,capital,tenochtitlan,surrounding,communities,thrived,spanish,conquest,entirely,drained,permanent,streams,arid,mesa,del,norte,drain,interior,ocean,far,important,river,country,ro,bravo,del,norte,forms,lengthy,international,border,ciudad,jurez,gulf,coast,km,balsas,river,provides,hydroelectric,power,grijalva,river,usumacinta,river,system,drains,humid,chiapas,highlands,papaloapan,river,flows,gulf,mexico,south,veracruz,grijalva,usumacinta,southeast,significant,mexican,rivers,baja,california,peninsula,yucatn,peninsula,extremely,arid,surface,streams",0.00,mexican
"descriptors of regions are by temperature with the tierra caliente  being coastal up to  meters tierra templada  being from  meters tierra fra  extending to  meters beyond the cold lands are the pramos alpine pastures and the tierra helada   in central mexico areas south of the tropic of cancer with elevations up to  m   have a yearly median temperature between  to  c  temperatures here remain high throughout the year with only a  c  difference between winter and summer median temperatures both mexican coasts except for the south coast of the bay of campeche and northern baja california are also vulnerable to serious hurricanes during the summer and fall although low lying areas north of the tropic of cancer are hot and humid during the summer they generally have lower yearly temperature averages  because of more moderate conditions during the winter
",descriptors regions temperature tierra caliente coastal meters tierra templada meters tierra fra extending meters cold lands pramos alpine pastures tierra helada central mexico areas south tropic cancer elevations yearly median temperature c temperatures remain high year c difference winter summer median temperatures mexican coasts south coast bay campeche northern baja california vulnerable hurricanes summer fall low lying areas north tropic cancer hot humid summer generally lower yearly temperature averages moderate conditions winter,7.76,"descriptors,regions,temperature,tierra,caliente,coastal,meters,tierra,templada,meters,tierra,fra,extending,meters,cold,lands,pramos,alpine,pastures,tierra,helada,central,mexico,areas,south,tropic,cancer,elevations,yearly,median,temperature,c,temperatures,remain,high,year,c,difference,winter,summer,median,temperatures,mexican,coasts,south,coast,bay,campeche,northern,baja,california,vulnerable,hurricanes,summer,fall,low,lying,areas,north,tropic,cancer,hot,humid,summer,generally,lower,yearly,temperature,averages,moderate,conditions,winter",0.00,mexican
