Unclean,Clean,Noise_Pre_Processing,Training_Data,Noise_Post_Processing,Query
"ireland has participated in the eurovision song contest since  its first win was in  when dana won with all kinds of everything it has subsequently won the competition six more times the highest number of wins by any competing country the phenomenon riverdance originated as an interval performance during the  contest
",ireland participated eurovision song contest win dana kinds subsequently competition times highest number wins competing country phenomenon riverdance originated interval performance contest,9.09,"ireland,participated,eurovision,song,contest,win,dana,kinds,subsequently,competition,times,highest,number,wins,competing,country,phenomenon,riverdance,originated,interval,performance,contest",0.00,ireland
"ireland has a wealth of structures surviving in various states of preservation from the neolithic period such as br na binne poulnabrone dolmen castlestrange stone turoe stone and drombeg stone circle as ireland was never a part of the roman empire ancient architecture in greco roman style is extremely rare in contrast to most of western europe the country instead had an extended period of iron age architecture the irish round tower originated during the early medieval period
",ireland wealth structures surviving states preservation neolithic period br na binne poulnabrone dolmen castlestrange stone turoe stone drombeg stone circle ireland roman empire ancient architecture greco roman style extremely rare contrast western europe country instead extended period iron age architecture irish round tower originated early medieval period,6.44,"ireland,wealth,structures,surviving,states,preservation,neolithic,period,br,na,binne,poulnabrone,dolmen,castlestrange,stone,turoe,stone,drombeg,stone,circle,ireland,roman,empire,ancient,architecture,greco,roman,style,extremely,rare,contrast,western,europe,country,instead,extended,period,iron,age,architecture,irish,round,tower,originated,early,medieval,period",0.00,ireland
"gothic cathedrals such as st patricks were also introduced by the normans franciscans were dominant in directing the abbeys by the late middle ages while elegant tower houses such as bunratty castle were built by the gaelic and norman aristocracy many religious buildings were ruined with the dissolution of the monasteries following the restoration palladianism and rococo particularly country houses swept through ireland under the initiative of edward lovett pearce with the houses of parliament being the most significant
",gothic cathedrals st patricks introduced normans franciscans dominant directing abbeys late middle ages elegant tower houses bunratty castle built gaelic norman aristocracy religious buildings ruined dissolution monasteries following restoration palladianism rococo particularly country houses swept ireland initiative edward lovett pearce houses parliament significant,6.84,"gothic,cathedrals,st,patricks,introduced,normans,franciscans,dominant,directing,abbeys,late,middle,ages,elegant,tower,houses,bunratty,castle,built,gaelic,norman,aristocracy,religious,buildings,ruined,dissolution,monasteries,following,restoration,palladianism,rococo,particularly,country,houses,swept,ireland,initiative,edward,lovett,pearce,houses,parliament,significant",0.00,ireland
"with the erection of buildings such as the custom house four courts general post office and kings inns the neoclassical and georgian styles flourished especially in dublin georgian townhouses produced streets of singular distinction particularly in dublin limerick and cork following catholic emancipation cathedrals and churches influenced by the french gothic revival emerged such as st colmans and st finbarres ireland has long been associated with thatched roof cottages though these are nowadays considered quaint
",erection buildings custom house courts general post office kings inns neoclassical georgian styles flourished especially dublin georgian townhouses produced streets singular distinction particularly dublin limerick cork following catholic emancipation cathedrals churches influenced french gothic revival emerged st colmans st finbarres ireland long associated thatched roof cottages nowadays considered quaint,5.01,"erection,buildings,custom,house,courts,general,post,office,kings,inns,neoclassical,georgian,styles,flourished,especially,dublin,georgian,townhouses,produced,streets,singular,distinction,particularly,dublin,limerick,cork,following,catholic,emancipation,cathedrals,churches,influenced,french,gothic,revival,emerged,st,colmans,st,finbarres,ireland,long,associated,thatched,roof,cottages,nowadays,considered,quaint",0.00,ireland
"beginning with the american designed art deco church at turners cross cork in  irish architecture followed the international trend towards modern and sleek building styles since the th century other developments include the regeneration of ballymun and an urban extension of dublin at adamstown since the establishment of the dublin docklands development authority in  the dublin docklands area underwent large scale redevelopment which included the construction of the convention centre dublin and grand canal theatre completed in  capital dock in dublin is the tallest building in the republic of ireland achieving  metres  in height  the royal institute of the architects of ireland regulates the practice of architecture in the state
",beginning american designed art deco church turners cross cork irish architecture followed international trend modern sleek building styles th century developments include regeneration ballymun urban extension dublin adamstown establishment dublin docklands development authority dublin docklands area underwent large scale redevelopment included construction convention centre dublin grand canal theatre completed capital dock dublin tallest building republic ireland achieving metres height royal institute architects ireland regulates practice architecture state,5.83,"beginning,american,designed,art,deco,church,turners,cross,cork,irish,architecture,followed,international,trend,modern,sleek,building,styles,th,century,developments,include,regeneration,ballymun,urban,extension,dublin,adamstown,establishment,dublin,docklands,development,authority,dublin,docklands,area,underwent,large,scale,redevelopment,included,construction,convention,centre,dublin,grand,canal,theatre,completed,capital,dock,dublin,tallest,building,republic,ireland,achieving,metres,height,royal,institute,architects,ireland,regulates,practice,architecture,state",0.00,ireland
"raidi teilifs ireann  is irelands public service broadcaster funded by a television licence fee and advertising rt operates two national television channels rt one and rt two the other independent national television channels are virgin media one virgin media two virgin media three and tg the latter of which is a public service broadcaster for speakers of the irish language all these channels are available on saorview the national free to air digital terrestrial television service additional channels included in the service are rt news now rtjr and rt one  subscription based television providers operating in ireland include virgin media and sky
",raidi teilifs ireann irelands public service broadcaster funded television licence fee advertising rt operates national television channels rt rt independent national television channels virgin media virgin media virgin media tg public service broadcaster speakers irish language channels available saorview national free air digital terrestrial television service additional channels included service rt news rtjr rt subscription based television providers operating ireland include virgin media sky,5.82,"raidi,teilifs,ireann,irelands,public,service,broadcaster,funded,television,licence,fee,advertising,rt,operates,national,television,channels,rt,rt,independent,national,television,channels,virgin,media,virgin,media,virgin,media,tg,public,service,broadcaster,speakers,irish,language,channels,available,saorview,national,free,air,digital,terrestrial,television,service,additional,channels,included,service,rt,news,rtjr,rt,subscription,based,television,providers,operating,ireland,include,virgin,media,sky",0.00,ireland
"the bbcs northern irish division is widely available in ireland bbc one northern ireland and bbc two northern ireland are available in pay television providers including virgin and sky as well as via signal overspill by freeview in border counties
",bbcs northern irish division widely available ireland bbc northern ireland bbc northern ireland available pay television providers including virgin sky signal overspill freeview border counties,6.05,"bbcs,northern,irish,division,widely,available,ireland,bbc,northern,ireland,bbc,northern,ireland,available,pay,television,providers,including,virgin,sky,signal,overspill,freeview,border,counties",0.00,ireland
"ireland has a traditionally competitive print media which is divided into daily national newspapers and weekly regional newspapers as well as national sunday editions the strength of the british press is a unique feature of the irish print media scene with the availability of a wide selection of british published newspapers and magazines
",ireland traditionally competitive print media divided daily national newspapers weekly regional newspapers national sunday editions strength british press unique feature irish print media scene availability wide selection british published newspapers magazines,6.47,"ireland,traditionally,competitive,print,media,divided,daily,national,newspapers,weekly,regional,newspapers,national,sunday,editions,strength,british,press,unique,feature,irish,print,media,scene,availability,wide,selection,british,published,newspapers,magazines",0.00,ireland
"irish cuisine was traditionally based on meat and dairy products supplemented with vegetables and seafood
examples of popular irish cuisine include boxty colcannon coddle stew and bacon and cabbage ireland is known for the full irish breakfast which involves a fried or grilled meal generally consisting of rashers egg sausage white and black pudding and fried tomato apart from the influence by european and international dishes there has been an emergence of a new irish cuisine based on traditional ingredients handled in new ways this cuisine is based on fresh vegetables fish oysters mussels and other shellfish and the wide range of hand made cheeses that are now being produced across the country shellfish have increased in popularity especially due to the high quality shellfish available from the countrys coastline the most popular fish include salmon and cod traditional breads include soda bread and wheaten bread barmbrack is a yeasted bread with added sultanas and raisins traditionally eaten on halloween
",irish cuisine traditionally based meat dairy products supplemented vegetables seafoodexamples popular irish cuisine include boxty colcannon coddle stew bacon cabbage ireland known irish breakfast involves fried grilled meal generally consisting rashers egg sausage white black pudding fried tomato apart influence european international dishes emergence new irish cuisine based traditional ingredients handled new ways cuisine based fresh vegetables fish oysters mussels shellfish wide range hand cheeses produced country shellfish increased popularity especially high quality shellfish available countrys coastline popular fish include salmon cod traditional breads include soda bread wheaten bread barmbrack yeasted bread added sultanas raisins traditionally eaten halloween,5.97,"irish,cuisine,traditionally,based,meat,dairy,products,supplemented,vegetables,seafoodexamples,popular,irish,cuisine,include,boxty,colcannon,coddle,stew,bacon,cabbage,ireland,known,irish,breakfast,involves,fried,grilled,meal,generally,consisting,rashers,egg,sausage,white,black,pudding,fried,tomato,apart,influence,european,international,dishes,emergence,new,irish,cuisine,based,traditional,ingredients,handled,new,ways,cuisine,based,fresh,vegetables,fish,oysters,mussels,shellfish,wide,range,hand,cheeses,produced,country,shellfish,increased,popularity,especially,high,quality,shellfish,available,countrys,coastline,popular,fish,include,salmon,cod,traditional,breads,include,soda,bread,wheaten,bread,barmbrack,yeasted,bread,added,sultanas,raisins,traditionally,eaten,halloween",0.00,ireland
"popular everyday beverages among the irish include tea and coffee alcoholic drinks associated with ireland include poitn and the world famous guinness which is a dry stout that originated in the brewery of arthur guinness at st jamess gate in dublin irish whiskey is also popular throughout the country and comes in various forms including single malt single grain and blended whiskey
",popular everyday beverages irish include tea coffee alcoholic drinks associated ireland include poitn world famous guinness dry stout originated brewery arthur guinness st jamess gate dublin irish whiskey popular country comes forms including single malt single grain blended whiskey,5.97,"popular,everyday,beverages,irish,include,tea,coffee,alcoholic,drinks,associated,ireland,include,poitn,world,famous,guinness,dry,stout,originated,brewery,arthur,guinness,st,jamess,gate,dublin,irish,whiskey,popular,country,comes,forms,including,single,malt,single,grain,blended,whiskey",0.00,ireland
"gaelic football and hurling are the traditional sports of ireland as well as popular spectator sports they are administered by the gaelic athletics association on an all ireland basis other gaelic games organised by the association include gaelic handball and rounders
",gaelic football hurling traditional sports ireland popular spectator sports administered gaelic athletics association ireland basis gaelic games organised association include gaelic handball rounders,6.69,"gaelic,football,hurling,traditional,sports,ireland,popular,spectator,sports,administered,gaelic,athletics,association,ireland,basis,gaelic,games,organised,association,include,gaelic,handball,rounders",0.00,ireland
"association football  is the third most popular spectator sport and has the highest level of participation although the league of ireland is the national league the english premier league is the most popular among the public the republic of ireland national football team plays at international level and is administered by the football association of ireland
",association football popular spectator sport highest level participation league ireland national league english premier league popular public republic ireland national football team plays international level administered football association ireland,7.50,"association,football,popular,spectator,sport,highest,level,participation,league,ireland,national,league,english,premier,league,popular,public,republic,ireland,national,football,team,plays,international,level,administered,football,association,ireland",0.00,ireland
"the irish rugby football union is the governing body of rugby union which is played at local and international levels on an all ireland basis and has produced players such as brian odriscoll and ronan ogara who were on the team that won the grand slam in 
",irish rugby football union governing body rugby union played local international levels ireland basis produced players brian odriscoll ronan ogara team grand slam,9.38,"irish,rugby,football,union,governing,body,rugby,union,played,local,international,levels,ireland,basis,produced,players,brian,odriscoll,ronan,ogara,team,grand,slam",0.00,ireland
"the success of the irish cricket team in the  cricket world cup has led to an increase in the popularity of cricket which is also administered on an all ireland basis by cricket ireland ireland are one of the twelve test playing members of the international cricket council having been granted test status in  professional domestic matches are played between the major cricket unions of leinster munster northern and north west
",success irish cricket team cricket world cup led increase popularity cricket administered ireland basis cricket ireland ireland test playing members international cricket council granted test status professional domestic matches played major cricket unions leinster munster northern north west,7.71,"success,irish,cricket,team,cricket,world,cup,led,increase,popularity,cricket,administered,ireland,basis,cricket,ireland,ireland,test,playing,members,international,cricket,council,granted,test,status,professional,domestic,matches,played,major,cricket,unions,leinster,munster,northern,north,west",0.00,ireland
"netball is represented by the ireland national netball team
",netball represented ireland national netball team,5.00,"netball,represented,ireland,national,netball,team",0.00,ireland
"golf is another popular sport in ireland with over  courses countrywide the country has produced several internationally successful golfers such as pdraig harrington shane lowry and paul mcginley
",golf popular sport ireland courses countrywide country produced internationally successful golfers pdraig harrington shane lowry paul mcginley,5.61,"golf,popular,sport,ireland,courses,countrywide,country,produced,internationally,successful,golfers,pdraig,harrington,shane,lowry,paul,mcginley",0.00,ireland
"horse racing has a large presence with influential breeding and racing operations in the country racing takes place at courses at the curragh racecourse in county kildare leopardstown racecourse just outside dublin and galway ireland has produced champion horses such as galileo montjeu and sea the stars
",horse racing large presence influential breeding racing operations country racing takes place courses curragh racecourse county kildare leopardstown racecourse outside dublin galway ireland produced champion horses galileo montjeu sea stars,5.57,"horse,racing,large,presence,influential,breeding,racing,operations,country,racing,takes,place,courses,curragh,racecourse,county,kildare,leopardstown,racecourse,outside,dublin,galway,ireland,produced,champion,horses,galileo,montjeu,sea,stars",0.00,ireland
"boxing is irelands most successful sport at an olympic level administered by the irish athletic boxing association on an all ireland basis it has gained in popularity as a result of the international success of boxers such as bernard dunne andy lee and katie taylor
",boxing irelands successful sport olympic level administered irish athletic boxing association ireland basis gained popularity result international success boxers bernard dunne andy lee katie taylor,7.52,"boxing,irelands,successful,sport,olympic,level,administered,irish,athletic,boxing,association,ireland,basis,gained,popularity,result,international,success,boxers,bernard,dunne,andy,lee,katie,taylor",0.00,ireland
"rugby league is represented by the ireland national rugby league team and administered by rugby league ireland  on an all ireland basis the team compete in the european cup  and the rugby league world cup ireland reached the quarter finals of the  rugby league world cup as well as reaching the semi finals in the  rugby league world cup the irish elite league is a domestic competition for rugby league teams in ireland
",rugby league represented ireland national rugby league team administered rugby league ireland ireland basis team compete european cup rugby league world cup ireland reached quarter finals rugby league world cup reaching semi finals rugby league world cup irish elite league domestic competition rugby league teams ireland,6.41,"rugby,league,represented,ireland,national,rugby,league,team,administered,rugby,league,ireland,ireland,basis,team,compete,european,cup,rugby,league,world,cup,ireland,reached,quarter,finals,rugby,league,world,cup,reaching,semi,finals,rugby,league,world,cup,irish,elite,league,domestic,competition,rugby,league,teams,ireland",0.00,ireland
"while australian rules football in ireland has a limited following a series of international rules football games  takes place annually between teams representing ireland and australia baseball and basketball are also emerging sports in ireland both of which have an international team representing the island of ireland other sports which retain a following in ireland include cycling greyhound racing horse riding and motorsport
",australian rules football ireland limited following series international rules football games takes place annually teams representing ireland australia baseball basketball emerging sports ireland international team representing island ireland sports retain following ireland include cycling greyhound racing horse riding motorsport,5.57,"australian,rules,football,ireland,limited,following,series,international,rules,football,games,takes,place,annually,teams,representing,ireland,australia,baseball,basketball,emerging,sports,ireland,international,team,representing,island,ireland,sports,retain,following,ireland,include,cycling,greyhound,racing,horse,riding,motorsport",0.00,ireland
"ireland ranks fifth in the world in terms of gender equality in  ireland was ranked the most charitable country in europe and second most charitable in the world contraception was controlled in ireland until  however the receding influence of the catholic church has led to an increasingly secularised society a constitutional ban on divorce was lifted following a referendum in  divorce rates in ireland are very low compared to european union averages  while the marriage rate in ireland is slightly above the european union average  abortion had been banned throughout the period of the irish state first through provisions of the offences against the person act  and later by the protection of life during pregnancy act  the right to life of the unborn was protected in the constitution by the eighth amendment in  this provision was removed following a referendum and replaced it with a provision allowing legislation to regulate the termination of pregnancy the health  act  passed later that year provided for abortion generally during the first  weeks of pregnancy and in specified circumstances after that date
",ireland ranks fifth world terms gender equality ireland ranked charitable country europe second charitable world contraception controlled ireland receding influence catholic church led increasingly secularised society constitutional ban divorce lifted following referendum divorce rates ireland low compared european union averages marriage rate ireland slightly european union average abortion banned period irish state provisions offences person act later protection life pregnancy act right life unborn protected constitution eighth amendment provision removed following referendum replaced provision allowing legislation regulate termination pregnancy health act passed later year provided abortion generally weeks pregnancy specified circumstances date,7.68,"ireland,ranks,fifth,world,terms,gender,equality,ireland,ranked,charitable,country,europe,second,charitable,world,contraception,controlled,ireland,receding,influence,catholic,church,led,increasingly,secularised,society,constitutional,ban,divorce,lifted,following,referendum,divorce,rates,ireland,low,compared,european,union,averages,marriage,rate,ireland,slightly,european,union,average,abortion,banned,period,irish,state,provisions,offences,person,act,later,protection,life,pregnancy,act,right,life,unborn,protected,constitution,eighth,amendment,provision,removed,following,referendum,replaced,provision,allowing,legislation,regulate,termination,pregnancy,health,act,passed,later,year,provided,abortion,generally,weeks,pregnancy,specified,circumstances,date",0.00,ireland
"capital punishment is constitutionally banned in ireland while discrimination based on age gender sexual orientation marital or familial status religion race or membership of the travelling community is illegal the legislation which outlawed homosexual acts was repealed in  the civil partnership and certain rights and obligations of cohabitants act  permitted civil partnerships between same sex couples the children and family relationships act  allowed for adoption rights for couples other than married couples including civil partners and cohabitants and provided for donor assisted human reproduction however significant sections of the act have yet to be commenced following a referendum held on  may  ireland became the eighteenth country to provide in law for same sex marriage and the first to do so by popular vote
",capital punishment constitutionally banned ireland discrimination based age gender sexual orientation marital familial status religion race membership travelling community illegal legislation outlawed homosexual acts repealed civil partnership certain rights obligations cohabitants act permitted civil partnerships sex couples children family relationships act allowed adoption rights couples married couples including civil partners cohabitants provided donor assisted human reproduction significant sections act commenced following referendum held ireland eighteenth country provide law sex marriage popular vote,6.17,"capital,punishment,constitutionally,banned,ireland,discrimination,based,age,gender,sexual,orientation,marital,familial,status,religion,race,membership,travelling,community,illegal,legislation,outlawed,homosexual,acts,repealed,civil,partnership,certain,rights,obligations,cohabitants,act,permitted,civil,partnerships,sex,couples,children,family,relationships,act,allowed,adoption,rights,couples,married,couples,including,civil,partners,cohabitants,provided,donor,assisted,human,reproduction,significant,sections,act,commenced,following,referendum,held,ireland,eighteenth,country,provide,law,sex,marriage,popular,vote",0.00,ireland
