Unclean,Clean,Noise_Pre_Processing,Training_Data,Noise_Post_Processing,Query
"despite irish neutrality during world war ii ireland had more than  participants in the war through enlistment in the british armed forces during the cold war irish military policy while ostensibly neutral was biased towards nato during the cuban missile crisis sen lemass authorised the search of cuban and czechoslovak aircraft passing through shannon and passed the information to the cia irelands air facilities were used by the united states military for the delivery of military personnel involved in the  invasion of iraq through shannon airport the airport had previously been used for the invasion of afghanistan in  as well as the first gulf war
",despite irish neutrality world war ii ireland participants war enlistment british armed forces cold war irish military policy ostensibly neutral biased nato cuban missile crisis sen lemass authorised search cuban czechoslovak aircraft passing shannon passed information cia irelands air facilities united states military delivery military personnel involved invasion iraq shannon airport airport previously invasion afghanistan gulf war,7.32,"despite,irish,neutrality,world,war,ii,ireland,participants,war,enlistment,british,armed,forces,cold,war,irish,military,policy,ostensibly,neutral,biased,nato,cuban,missile,crisis,sen,lemass,authorised,search,cuban,czechoslovak,aircraft,passing,shannon,passed,information,cia,irelands,air,facilities,united,states,military,delivery,military,personnel,involved,invasion,iraq,shannon,airport,airport,previously,invasion,afghanistan,gulf,war",0.00,ireland
"since  ireland has been a member of natos partnership for peace  program and natos euro atlantic partnership council  which is aimed at creating trust between nato and other states in europe and the former soviet union
",ireland member natos partnership peace program natos euro atlantic partnership council aimed creating trust nato states europe soviet union,7.76,"ireland,member,natos,partnership,peace,program,natos,euro,atlantic,partnership,council,aimed,creating,trust,nato,states,europe,soviet,union",0.00,ireland
"ireland is a neutral country and has triple lock rules governing the participation of irish troops in conflict zones whereby approval must be given by the un the dil and government accordingly its military role is limited to national self defence and participation in united nations peacekeeping
",ireland neutral country triple lock rules governing participation irish troops conflict zones approval given un dil government accordingly military role limited national self defence participation united nations peacekeeping,6.42,"ireland,neutral,country,triple,lock,rules,governing,participation,irish,troops,conflict,zones,approval,given,un,dil,government,accordingly,military,role,limited,national,self,defence,participation,united,nations,peacekeeping",0.00,ireland
"in  ireland signed the united nations treaty on the prohibition of nuclear weapons
",ireland signed united nations treaty prohibition nuclear weapons,6.02,"ireland,signed,united,nations,treaty,prohibition,nuclear,weapons",0.00,ireland
"ireland is an open economy  and ranks first for high value foreign direct investment  flows ireland ranks th of   and th of   in gdp per capita as well as ranking in the top ten for gni per capita an alternative metric modified gross national income  was created by the central statistics office and is sometimes used by the irish government and to give an additional view of activity in the domestic economy stripping out the activities of large multinational export movements which can relate to intangible assets this is particularly relevant in irelands globalised economy us based multinationals are the main driver of irelands economy in the last decade employing a quarter of the private sector workforce and paying  of irish business taxes  of irelands top  firms  are us based multinationals and  of foreign multinationals in ireland are from the us 
",ireland open economy ranks high value foreign direct investment flows ireland ranks th th gdp capita ranking gni capita alternative metric modified gross national income created central statistics office irish government additional view activity domestic economy stripping activities large multinational export movements relate intangible assets particularly relevant irelands globalised economy based multinationals main driver irelands economy decade employing quarter private sector workforce paying irish business taxes irelands firms based multinationals foreign multinationals ireland,7.91,"ireland,open,economy,ranks,high,value,foreign,direct,investment,flows,ireland,ranks,th,th,gdp,capita,ranking,gni,capita,alternative,metric,modified,gross,national,income,created,central,statistics,office,irish,government,additional,view,activity,domestic,economy,stripping,activities,large,multinational,export,movements,relate,intangible,assets,particularly,relevant,irelands,globalised,economy,based,multinationals,main,driver,irelands,economy,decade,employing,quarter,private,sector,workforce,paying,irish,business,taxes,irelands,firms,based,multinationals,foreign,multinationals,ireland",0.00,ireland
"ireland adopted the euro currency in  along with eleven other eu member states as of january  there are  eu member states using the euro currency with croatia the most recent member to join on  january 
",ireland adopted euro currency eu member states january eu member states euro currency croatia recent member join january,8.37,"ireland,adopted,euro,currency,eu,member,states,january,eu,member,states,euro,currency,croatia,recent,member,join,january",0.00,ireland
"following the great recession and the bursting of the irish property bubble the country officially exited recession in  driven by a growth in exports from us multinationals in ireland however due to a rise in the cost of public borrowing due to government guarantees of private banking debt the irish government accepted an  billion programme of assistance from the eu international monetary fund  and bilateral loans from the united kingdom sweden and denmark following three years of contraction the economy grew by  in  and  in  the unemployment rate was  in  including  among recent immigrants in march  the unemployment rate was reported by the cso to be  down from a peak unemployment rate of  in february  in addition to unemployment net emigration from ireland between  and  totalled  or some  of the total population according to the census of ireland  one third of the emigrants were aged between  and  as of november  unemployment had fallen back to 
",following great recession bursting irish property bubble country officially exited recession driven growth exports multinationals ireland rise cost public borrowing government guarantees private banking debt irish government accepted billion programme assistance eu international monetary fund bilateral loans united kingdom sweden denmark following years contraction economy grew unemployment rate including recent immigrants march unemployment rate reported cso peak unemployment rate february addition unemployment net emigration ireland totalled total population according census ireland emigrants aged november unemployment fallen,8.21,"following,great,recession,bursting,irish,property,bubble,country,officially,exited,recession,driven,growth,exports,multinationals,ireland,rise,cost,public,borrowing,government,guarantees,private,banking,debt,irish,government,accepted,billion,programme,assistance,eu,international,monetary,fund,bilateral,loans,united,kingdom,sweden,denmark,following,years,contraction,economy,grew,unemployment,rate,including,recent,immigrants,march,unemployment,rate,reported,cso,peak,unemployment,rate,february,addition,unemployment,net,emigration,ireland,totalled,total,population,according,census,ireland,emigrants,aged,november,unemployment,fallen",0.00,ireland
"ireland exited its eu imf bailout programme on  december  having implemented budget cuts reforms and sold assets ireland was again able to access debt markets since then ireland has been able to sell long term bonds at record rates however the stabilisation of the irish credit bubble required a large transfer of debt from the private sector balance sheet  to the public sector balance sheet  via irish bank bailouts and public deficit spending the transfer of this debt means that ireland in  still has one of the highest levels of both public sector indebtedness and private sector indebtedness in the eu oecd
",ireland exited eu imf bailout programme december implemented budget cuts reforms sold assets ireland able access debt markets ireland able sell long term bonds record rates stabilisation irish credit bubble required large transfer debt private sector balance sheet public sector balance sheet irish bank bailouts public deficit spending transfer debt means ireland highest levels public sector indebtedness private sector indebtedness eu oecd,6.53,"ireland,exited,eu,imf,bailout,programme,december,implemented,budget,cuts,reforms,sold,assets,ireland,able,access,debt,markets,ireland,able,sell,long,term,bonds,record,rates,stabilisation,irish,credit,bubble,required,large,transfer,debt,private,sector,balance,sheet,public,sector,balance,sheet,irish,bank,bailouts,public,deficit,spending,transfer,debt,means,ireland,highest,levels,public,sector,indebtedness,private,sector,indebtedness,eu,oecd",0.00,ireland
"ireland became one of the main destinations for us pharmaceutical corporate tax inversions from  to  and has also become one of the largest foreign locations for us technology multinationals such as apple google microsoft and facebook
",ireland main destinations pharmaceutical corporate tax inversions largest foreign locations technology multinationals apple google microsoft facebook,8.51,"ireland,main,destinations,pharmaceutical,corporate,tax,inversions,largest,foreign,locations,technology,multinationals,apple,google,microsoft,facebook",0.00,ireland
"the multinational tax schemes foreign firms use in ireland materially distort irish economic statistics this reached a climax with the famous leprechaun economics gdpgnp growth rates of   the central bank of ireland introduced a new statistic modified gross national income to remove these distortions gni is  below gdp 
",multinational tax schemes foreign firms use ireland materially distort irish economic statistics reached climax famous leprechaun economics gdpgnp growth rates central bank ireland introduced new statistic modified gross national income remove distortions gni gdp,4.36,"multinational,tax,schemes,foreign,firms,use,ireland,materially,distort,irish,economic,statistics,reached,climax,famous,leprechaun,economics,gdpgnp,growth,rates,central,bank,ireland,introduced,new,statistic,modified,gross,national,income,remove,distortions,gni,gdp",0.00,ireland
"from the creation of the ifsc the country experienced strong and sustained economic growth which fuelled a dramatic rise in irish consumer borrowing and spending and irish construction and investment which became known as the celtic tiger period by  ireland had the highest private sector debt in the oecd with a household debt to disposable income ratio of  global capital markets who had financed irelands build up of debt in the celtic tiger period by enabling irish banks to borrow in excess of the domestic deposit base  withdrew support in the financial crisis of  their withdrawal from the over borrowed irish credit system would precipitate a deep irish property correction which then led to the post  irish banking crisis
",creation ifsc country experienced strong sustained economic growth fuelled dramatic rise irish consumer borrowing spending irish construction investment known celtic tiger period ireland highest private sector debt oecd household debt disposable income ratio global capital markets financed irelands build debt celtic tiger period enabling irish banks borrow excess domestic deposit base withdrew support financial crisis withdrawal borrowed irish credit system precipitate deep irish property correction led post irish banking crisis,6.70,"creation,ifsc,country,experienced,strong,sustained,economic,growth,fuelled,dramatic,rise,irish,consumer,borrowing,spending,irish,construction,investment,known,celtic,tiger,period,ireland,highest,private,sector,debt,oecd,household,debt,disposable,income,ratio,global,capital,markets,financed,irelands,build,debt,celtic,tiger,period,enabling,irish,banks,borrow,excess,domestic,deposit,base,withdrew,support,financial,crisis,withdrawal,borrowed,irish,credit,system,precipitate,deep,irish,property,correction,led,post,irish,banking,crisis",0.00,ireland
"irelands successful low tax economy opens it to accusations of being a corporate tax haven and led to it being blacklisted by brazil a  study ranks ireland as the th largest global conduit of course a serious challenge is the passing of the us tax cuts and jobs act of    is also seen as an attempt to restrict irish multinational tax schemes by us technology firms
",irelands successful low tax economy opens accusations corporate tax led blacklisted brazil study ranks ireland th largest global conduit course challenge passing tax cuts jobs act seen attempt restrict irish multinational tax schemes technology firms,8.47,"irelands,successful,low,tax,economy,opens,accusations,corporate,tax,led,blacklisted,brazil,study,ranks,ireland,th,largest,global,conduit,course,challenge,passing,tax,cuts,jobs,act,seen,attempt,restrict,irish,multinational,tax,schemes,technology,firms",0.00,ireland
"although multinational corporations dominate irelands export sector exports from other sources also contribute significantly to the national income the activities of multinational companies based in ireland have made it one of the largest exporters of pharmaceutical agents medical devices and software related goods and services in the world irelands exports also relate to the activities of large irish companies  and exports of mineral resources including zinc and lead concentrates the country also has significant deposits of gypsum and smaller quantities of copper silver gold barite and dolomite tourism in ireland contributes about  of gdp and is a significant source of employment
",multinational corporations dominate irelands export sector exports sources contribute significantly national income activities multinational companies based ireland largest exporters pharmaceutical agents medical devices software related goods services world irelands exports relate activities large irish companies exports mineral resources including zinc lead concentrates country significant deposits gypsum smaller quantities copper silver gold barite dolomite tourism ireland contributes gdp significant source employment,5.94,"multinational,corporations,dominate,irelands,export,sector,exports,sources,contribute,significantly,national,income,activities,multinational,companies,based,ireland,largest,exporters,pharmaceutical,agents,medical,devices,software,related,goods,services,world,irelands,exports,relate,activities,large,irish,companies,exports,mineral,resources,including,zinc,lead,concentrates,country,significant,deposits,gypsum,smaller,quantities,copper,silver,gold,barite,dolomite,tourism,ireland,contributes,gdp,significant,source,employment",0.00,ireland
"esb bord gis energy and airtricity are the three main electricity and gas suppliers in ireland there are  billion cubic metres of proven reserves of gas natural gas extraction previously occurred at the kinsale head until its exhaustion the corrib gas field was due to come on stream in  in  the barryroe field was confirmed to have up to  billion barrels of oil in reserve with between  and  million recoverable that could provide for irelands entire energy needs for up to  years when it is developed in  
",esb bord gis energy airtricity main electricity gas suppliers ireland billion cubic metres proven reserves gas natural gas extraction previously occurred kinsale head exhaustion corrib gas field come stream barryroe field confirmed billion barrels oil reserve million recoverable provide irelands entire energy needs years developed,8.27,"esb,bord,gis,energy,airtricity,main,electricity,gas,suppliers,ireland,billion,cubic,metres,proven,reserves,gas,natural,gas,extraction,previously,occurred,kinsale,head,exhaustion,corrib,gas,field,come,stream,barryroe,field,confirmed,billion,barrels,oil,reserve,million,recoverable,provide,irelands,entire,energy,needs,years,developed",0.00,ireland
"there have been significant efforts to increase the use of renewable and sustainable forms of energy in ireland particularly in wind power with  megawatts of wind farms being constructed some for the purpose of export the sustainable energy authority of ireland  has estimated that  of irelands  energy requirements were produced by renewable sources the seai has also reported an increase in energy efficiency in ireland with a  reduction in carbon emissions per house from  to 
",significant efforts increase use renewable sustainable forms energy ireland particularly wind power megawatts wind farms constructed purpose export sustainable energy authority ireland estimated irelands energy requirements produced renewable sources seai reported increase energy efficiency ireland reduction carbon emissions house,7.50,"significant,efforts,increase,use,renewable,sustainable,forms,energy,ireland,particularly,wind,power,megawatts,wind,farms,constructed,purpose,export,sustainable,energy,authority,ireland,estimated,irelands,energy,requirements,produced,renewable,sources,seai,reported,increase,energy,efficiency,ireland,reduction,carbon,emissions,house",0.00,ireland
"as of  ireland was the th largest wind energy producer in the world and the rd ranked in  on a per capita basis
",ireland th largest wind energy producer world rd ranked capita basis,10.71,"ireland,th,largest,wind,energy,producer,world,rd,ranked,capita,basis",0.00,ireland
"the countrys three main international airports at dublin shannon and cork serve many european and intercontinental routes with scheduled and chartered flights the london to dublin air route is the ninth busiest international air route in the world and also the busiest international air route in europe with  flights between the two in  in   million people took the route at that time the worlds second busiest aer lingus is the flag carrier of ireland although ryanair is the countrys largest airline ryanair is europes largest low cost carrier the second largest in terms of passenger numbers and the worlds largest in terms of international passenger numbers
",countrys main international airports dublin shannon cork serve european intercontinental routes scheduled chartered flights london dublin air route ninth busiest international air route world busiest international air route europe flights million people took route time worlds second busiest aer lingus flag carrier ireland ryanair countrys largest airline ryanair europes largest low cost carrier second largest terms passenger numbers worlds largest terms international passenger numbers,6.34,"countrys,main,international,airports,dublin,shannon,cork,serve,european,intercontinental,routes,scheduled,chartered,flights,london,dublin,air,route,ninth,busiest,international,air,route,world,busiest,international,air,route,europe,flights,million,people,took,route,time,worlds,second,busiest,aer,lingus,flag,carrier,ireland,ryanair,countrys,largest,airline,ryanair,europes,largest,low,cost,carrier,second,largest,terms,passenger,numbers,worlds,largest,terms,international,passenger,numbers",0.00,ireland
"railway services are provided by iarnrd ireann  which operates all internal intercity commuter and freight railway services in the country dublin is the centre of the network with two main stations heuston station and connolly station linking to the countrys cities and main towns the enterprise service which runs jointly with northern ireland railways connects dublin and belfast the whole of irelands mainline network operates on track with a gauge of  ft  in  which is unique in europe and has resulted in distinct rolling stock designs dublins public transport network includes the dart luas dublin bus and dublinbikes
",railway services provided iarnrd ireann operates internal intercity commuter freight railway services country dublin centre network main stations heuston station connolly station linking countrys cities main towns enterprise service runs jointly northern ireland railways connects dublin belfast irelands mainline network operates track gauge ft unique europe resulted distinct rolling stock designs dublins public transport network includes dart luas dublin bus dublinbikes,5.93,"railway,services,provided,iarnrd,ireann,operates,internal,intercity,commuter,freight,railway,services,country,dublin,centre,network,main,stations,heuston,station,connolly,station,linking,countrys,cities,main,towns,enterprise,service,runs,jointly,northern,ireland,railways,connects,dublin,belfast,irelands,mainline,network,operates,track,gauge,ft,unique,europe,resulted,distinct,rolling,stock,designs,dublins,public,transport,network,includes,dart,luas,dublin,bus,dublinbikes",0.00,ireland
"motorways national primary roads and national secondary roads are managed by transport infrastructure ireland while regional roads and local roads are managed by the local authorities in each of their respective areas the road network is primarily focused on the capital but motorways connect it to other major irish cities including cork limerick waterford and galway
",motorways national primary roads national secondary roads managed transport infrastructure ireland regional roads local roads managed local authorities respective areas road network primarily focused capital motorways connect major irish cities including cork limerick waterford galway,5.69,"motorways,national,primary,roads,national,secondary,roads,managed,transport,infrastructure,ireland,regional,roads,local,roads,managed,local,authorities,respective,areas,road,network,primarily,focused,capital,motorways,connect,major,irish,cities,including,cork,limerick,waterford,galway",0.00,ireland
"the population of ireland stood at  in  an increase of  since  as of update ireland had the highest birth rate in the european union  in   of births were to unmarried women annual population growth rates exceeded  during the  intercensal period which was attributed to high rates of natural increase and immigration this rate declined somewhat during the subsequent  intercensal period with an average annual percentage change of  the total fertility rate  in  was estimated at  children born per woman below the replacement rate of  it remains considerably below the high of  children born per woman in  in  the median age of the irish population was  years
",population ireland stood increase update ireland highest birth rate european union births unmarried women annual population growth rates exceeded intercensal period attributed high rates natural increase immigration rate declined somewhat subsequent intercensal period average annual percentage change total fertility rate estimated children born woman replacement rate remains considerably high children born woman median age irish population years,7.44,"population,ireland,stood,increase,update,ireland,highest,birth,rate,european,union,births,unmarried,women,annual,population,growth,rates,exceeded,intercensal,period,attributed,high,rates,natural,increase,immigration,rate,declined,somewhat,subsequent,intercensal,period,average,annual,percentage,change,total,fertility,rate,estimated,children,born,woman,replacement,rate,remains,considerably,high,children,born,woman,median,age,irish,population,years",0.00,ireland
"the following is a list of functional urban areas in ireland  and their approximate populations as of update
",following list functional urban areas ireland approximate populations update,8.26,"following,list,functional,urban,areas,ireland,approximate,populations,update",0.00,ireland
