Unclean,Clean,Noise_Pre_Processing,Training_Data,Noise_Post_Processing,Query
"interest towards membership of the european communities  developed in ireland during the s with consideration also given to membership of the european free trade area as the united kingdom intended on ec membership ireland applied for membership in july  due to the substantial economic linkages with the united kingdom however the founding ec members remained sceptical regarding irelands economic capacity neutrality and unattractive protectionist policy many irish economists and politicians realised that economic policy reform was necessary the prospect of ec membership became doubtful in  when french president general charles de gaulle stated that france opposed britains accession which ceased negotiations with all other candidate countries however in  his successor georges pompidou was not opposed to british and irish membership negotiations began and in  the treaty of accession was signed a referendum was held later that year which confirmed irelands entry into the bloc and it finally joined the ec as a member state on  january 
",interest membership european communities developed ireland consideration given membership european free trade area united kingdom intended ec membership ireland applied membership july substantial economic linkages united kingdom founding ec members remained sceptical irelands economic capacity neutrality unattractive protectionist policy irish economists politicians realised economic policy reform necessary prospect ec membership doubtful french president general charles de gaulle stated france opposed britains accession ceased negotiations candidate countries successor georges pompidou opposed british irish membership negotiations began treaty accession signed referendum held later year confirmed irelands entry bloc finally joined ec member state january,6.11,"interest,membership,european,communities,developed,ireland,consideration,given,membership,european,free,trade,area,united,kingdom,intended,ec,membership,ireland,applied,membership,july,substantial,economic,linkages,united,kingdom,founding,ec,members,remained,sceptical,irelands,economic,capacity,neutrality,unattractive,protectionist,policy,irish,economists,politicians,realised,economic,policy,reform,necessary,prospect,ec,membership,doubtful,french,president,general,charles,de,gaulle,stated,france,opposed,britains,accession,ceased,negotiations,candidate,countries,successor,georges,pompidou,opposed,british,irish,membership,negotiations,began,treaty,accession,signed,referendum,held,later,year,confirmed,irelands,entry,bloc,finally,joined,ec,member,state,january",0.00,ireland
"the economic crisis of the late s was fuelled by the fianna fil governments budget the abolition of the car tax excessive borrowing and global economic instability including the  oil crisis there were significant policy changes from  onwards with economic reform tax cuts welfare reform an increase in competition and a ban on borrowing to fund current spending this policy began in  by the fianna filprogressive democrat government and continued by the subsequent fianna fillabour government and fine gaellabourdemocratic left government ireland became one of the worlds fastest growing economies by the late s in what was known as the celtic tiger period which lasted until the great recession however since  ireland has experienced increased economic activity
",economic crisis late fuelled fianna fil governments budget abolition car tax excessive borrowing global economic instability including oil crisis significant policy changes onwards economic reform tax cuts welfare reform increase competition ban borrowing fund current spending policy began fianna filprogressive democrat government continued subsequent fianna fillabour government fine gaellabourdemocratic left government ireland worlds fastest growing economies late known celtic tiger period lasted great recession ireland experienced increased economic activity,6.29,"economic,crisis,late,fuelled,fianna,fil,governments,budget,abolition,car,tax,excessive,borrowing,global,economic,instability,including,oil,crisis,significant,policy,changes,onwards,economic,reform,tax,cuts,welfare,reform,increase,competition,ban,borrowing,fund,current,spending,policy,began,fianna,filprogressive,democrat,government,continued,subsequent,fianna,fillabour,government,fine,gaellabourdemocratic,left,government,ireland,worlds,fastest,growing,economies,late,known,celtic,tiger,period,lasted,great,recession,ireland,experienced,increased,economic,activity",0.00,ireland
"in the northern ireland question the british and irish governments started to seek a peaceful resolution to the violent conflict involving many paramilitaries and the british army in northern ireland known as the troubles a peace settlement for northern ireland known as the good friday agreement was approved in  in referendums north and south of the border as part of the peace settlement the territorial claim to northern ireland in articles  and  of the constitution of ireland was removed by referendum in its white paper on brexit the united kingdom government reiterated its commitment to the good friday agreement with regard to northern irelands status it said that the uk governments clearly stated preference is to retain northern irelands current constitutional position as part of the uk but with strong links to ireland
",northern ireland question british irish governments started seek peaceful resolution violent conflict involving paramilitaries british army northern ireland known troubles peace settlement northern ireland known good friday agreement approved referendums north south border peace settlement territorial claim northern ireland articles constitution ireland removed referendum white paper brexit united kingdom government reiterated commitment good friday agreement regard northern irelands status said uk governments clearly stated preference retain northern irelands current constitutional position uk strong links ireland,6.95,"northern,ireland,question,british,irish,governments,started,seek,peaceful,resolution,violent,conflict,involving,paramilitaries,british,army,northern,ireland,known,troubles,peace,settlement,northern,ireland,known,good,friday,agreement,approved,referendums,north,south,border,peace,settlement,territorial,claim,northern,ireland,articles,constitution,ireland,removed,referendum,white,paper,brexit,united,kingdom,government,reiterated,commitment,good,friday,agreement,regard,northern,irelands,status,said,uk,governments,clearly,stated,preference,retain,northern,irelands,current,constitutional,position,uk,strong,links,ireland",0.00,ireland
"the state extends over an area of about five sixths  of the island of ireland  with northern ireland constituting the remainder the island is bounded to the north and west by the atlantic ocean and to the northeast by the north channel to the east the irish sea connects to the atlantic ocean via st georges channel and the celtic sea to the southwest
",state extends area sixths island ireland northern ireland constituting remainder island bounded north west atlantic ocean northeast north channel east irish sea connects atlantic ocean st georges channel celtic sea southwest,9.38,"state,extends,area,sixths,island,ireland,northern,ireland,constituting,remainder,island,bounded,north,west,atlantic,ocean,northeast,north,channel,east,irish,sea,connects,atlantic,ocean,st,georges,channel,celtic,sea,southwest",0.00,ireland
"the western landscape mostly consists of rugged cliffs hills and mountains the central lowlands are extensively covered with glacial deposits of clay and sand as well as significant areas of bogland and several lakes the highest point is carrauntoohil  located in the macgillycuddys reeks mountain range in the southwest river shannon which traverses the central lowlands is the longest river in ireland at  kilometres or  miles in length the west coast is more rugged than the east with numerous islands peninsulas headlands and bays
",western landscape consists rugged cliffs hills mountains central lowlands extensively covered glacial deposits clay sand significant areas bogland lakes highest point carrauntoohil located macgillycuddys reeks mountain range southwest river shannon traverses central lowlands longest river ireland kilometres miles length west coast rugged east numerous islands peninsulas headlands bays,6.73,"western,landscape,consists,rugged,cliffs,hills,mountains,central,lowlands,extensively,covered,glacial,deposits,clay,sand,significant,areas,bogland,lakes,highest,point,carrauntoohil,located,macgillycuddys,reeks,mountain,range,southwest,river,shannon,traverses,central,lowlands,longest,river,ireland,kilometres,miles,length,west,coast,rugged,east,numerous,islands,peninsulas,headlands,bays",0.00,ireland
"ireland is one of the least forested countries in europe until the end of the middle ages the land was heavily forested native species include deciduous trees such as oak ash hazel birch alder willow aspen elm rowan and hawthorn as well as evergreen trees such scots pine yew holly and strawberry trees the growth of blanket bog and the extensive clearing of woodland for farming are believed to be the main causes of deforestation today only about  of ireland is woodland most of which is non native conifer plantations and only  of which is native woodland the average woodland cover in european countries is over  according to coillte a state owned forestry business the countrys climate gives ireland one of the fastest growth rates for forests in europe hedgerows which are traditionally used to define land boundaries are an important substitute for woodland habitat providing refuge for native wild flora and a wide range of insect bird and mammal species it is home to two terrestrial ecoregions celtic broadleaf forests and north atlantic moist mixed forests
",ireland forested countries europe end middle ages land heavily forested native species include deciduous trees oak ash hazel birch alder willow aspen elm rowan hawthorn evergreen trees scots pine yew holly strawberry trees growth blanket bog extensive clearing woodland farming believed main causes deforestation today ireland woodland non native conifer plantations native woodland average woodland cover european countries according coillte state owned forestry business countrys climate gives ireland fastest growth rates forests europe hedgerows traditionally define land boundaries important substitute woodland habitat providing refuge native wild flora wide range insect bird mammal species home terrestrial ecoregions celtic broadleaf forests north atlantic moist mixed forests,6.84,"ireland,forested,countries,europe,end,middle,ages,land,heavily,forested,native,species,include,deciduous,trees,oak,ash,hazel,birch,alder,willow,aspen,elm,rowan,hawthorn,evergreen,trees,scots,pine,yew,holly,strawberry,trees,growth,blanket,bog,extensive,clearing,woodland,farming,believed,main,causes,deforestation,today,ireland,woodland,non,native,conifer,plantations,native,woodland,average,woodland,cover,european,countries,according,coillte,state,owned,forestry,business,countrys,climate,gives,ireland,fastest,growth,rates,forests,europe,hedgerows,traditionally,define,land,boundaries,important,substitute,woodland,habitat,providing,refuge,native,wild,flora,wide,range,insect,bird,mammal,species,home,terrestrial,ecoregions,celtic,broadleaf,forests,north,atlantic,moist,mixed,forests",0.00,ireland
"the atlantic ocean and the warming influence of the gulf stream affect weather patterns in ireland temperatures differ regionally with central and eastern areas tending to be more extreme however due to a temperate oceanic climate temperatures are seldom lower than  c  in winter or higher than  c  in summer the highest temperature recorded in ireland was  c  on  june  at kilkenny castle in kilkenny while the lowest temperature recorded was  c  at markree castle in sligo rainfall is more prevalent during winter months and less so during the early months of summer southwestern areas experience the most rainfall as a result of south westerly winds while dublin receives the least sunshine duration is highest in the southeast of the country the far north and west are two of the windiest regions in europe with great potential for wind energy generation
",atlantic ocean warming influence gulf stream affect weather patterns ireland temperatures differ regionally central eastern areas tending extreme temperate oceanic climate temperatures seldom lower c winter higher c summer highest temperature recorded ireland c june kilkenny castle kilkenny lowest temperature recorded c markree castle sligo rainfall prevalent winter months early months summer southwestern areas experience rainfall result south westerly winds dublin receives sunshine duration highest southeast country far north west windiest regions europe great potential wind energy generation,7.33,"atlantic,ocean,warming,influence,gulf,stream,affect,weather,patterns,ireland,temperatures,differ,regionally,central,eastern,areas,tending,extreme,temperate,oceanic,climate,temperatures,seldom,lower,c,winter,higher,c,summer,highest,temperature,recorded,ireland,c,june,kilkenny,castle,kilkenny,lowest,temperature,recorded,c,markree,castle,sligo,rainfall,prevalent,winter,months,early,months,summer,southwestern,areas,experience,rainfall,result,south,westerly,winds,dublin,receives,sunshine,duration,highest,southeast,country,far,north,west,windiest,regions,europe,great,potential,wind,energy,generation",0.00,ireland
"ireland normally gets between  and  hours of sunshine each year most areas averaging between  and  hours a day the sunniest months are may and june which average between  and  hours per day over most of the country the extreme southeast gets most sunshine averaging over  hours a day in early summer december is the dullest month with an average daily sunshine ranging from about  hour in the north to almost  hours in the extreme southeast the sunniest summer in the  years from  to  was  according to measurements made at the phoenix park in dublin  was the dullest
",ireland normally gets hours sunshine year areas averaging hours day sunniest months june average hours day country extreme southeast gets sunshine averaging hours day early summer december dullest month average daily sunshine ranging hour north hours extreme southeast sunniest summer years according measurements phoenix park dublin dullest,8.80,"ireland,normally,gets,hours,sunshine,year,areas,averaging,hours,day,sunniest,months,june,average,hours,day,country,extreme,southeast,gets,sunshine,averaging,hours,day,early,summer,december,dullest,month,average,daily,sunshine,ranging,hour,north,hours,extreme,southeast,sunniest,summer,years,according,measurements,phoenix,park,dublin,dullest",0.00,ireland
"ireland is a constitutional republic with a parliamentary system of government the oireachtas is the bicameral national parliament composed of the president of ireland and the two houses of the oireachtas dil ireann  and seanad ireann  ras an uachtarin is the official residence of the president of ireland while the houses of the oireachtas meet at leinster house in dublin
",ireland constitutional republic parliamentary system government oireachtas bicameral national parliament composed president ireland houses oireachtas dil ireann seanad ireann ras uachtarin official residence president ireland houses oireachtas meet leinster house dublin,7.73,"ireland,constitutional,republic,parliamentary,system,government,oireachtas,bicameral,national,parliament,composed,president,ireland,houses,oireachtas,dil,ireann,seanad,ireann,ras,uachtarin,official,residence,president,ireland,houses,oireachtas,meet,leinster,house,dublin",0.00,ireland
"the president serves as head of state is elected for a seven year term and may be re elected once the president is primarily a figurehead but is entrusted with certain constitutional powers with the advice of the council of state the office has absolute discretion in some areas such as referring a bill to the supreme court for a judgment on its constitutionality michael d higgins became the ninth president of ireland on  november 
",president serves head state elected seven year term elected president primarily figurehead entrusted certain constitutional powers advice council state office absolute discretion areas referring bill supreme court judgment constitutionality michael higgins ninth president ireland november,9.20,"president,serves,head,state,elected,seven,year,term,elected,president,primarily,figurehead,entrusted,certain,constitutional,powers,advice,council,state,office,absolute,discretion,areas,referring,bill,supreme,court,judgment,constitutionality,michael,higgins,ninth,president,ireland,november",0.00,ireland
"the government is constitutionally limited to fifteen members no more than two members can be selected from the seanad and the taoiseach tnaiste  and minister for finance must be members of the dil the dil must be dissolved within five years of its first meeting following the previous election and a general election for members of the dil must take place no later than thirty days after the dissolution in accordance with the constitution of ireland parliamentary elections must be held at least every seven years though a lower limit may be set by statute law the current government is a coalition of fianna fil fine gael and the green party with leo varadkar of fine gael as taoiseach and michel martin of fianna fil as tnaiste opposition parties in the current dil are sinn fin the labour party people before profitsolidarity social democrats aont as well as a number of independents
",government constitutionally limited members members selected seanad taoiseach tnaiste minister finance members dil dil dissolved years meeting following previous election general election members dil place later thirty days dissolution accordance constitution ireland parliamentary elections held seven years lower limit set statute law current government coalition fianna fil fine gael green party leo varadkar fine gael taoiseach michel martin fianna fil tnaiste opposition parties current dil sinn fin labour party people profitsolidarity social democrats aont number independents,8.55,"government,constitutionally,limited,members,members,selected,seanad,taoiseach,tnaiste,minister,finance,members,dil,dil,dissolved,years,meeting,following,previous,election,general,election,members,dil,place,later,thirty,days,dissolution,accordance,constitution,ireland,parliamentary,elections,held,seven,years,lower,limit,set,statute,law,current,government,coalition,fianna,fil,fine,gael,green,party,leo,varadkar,fine,gael,taoiseach,michel,martin,fianna,fil,tnaiste,opposition,parties,current,dil,sinn,fin,labour,party,people,profitsolidarity,social,democrats,aont,number,independents",0.00,ireland
"ireland has been a member state of the european union since  citizens of the united kingdom can freely enter the country without a passport due to the common travel area which is a passport free zone comprising the islands of ireland great britain the isle of man and the channel islands however some identification is required at airports and seaports
",ireland member state european union citizens united kingdom freely enter country passport common travel area passport free zone comprising islands ireland great britain isle man channel islands identification required airports seaports,8.22,"ireland,member,state,european,union,citizens,united,kingdom,freely,enter,country,passport,common,travel,area,passport,free,zone,comprising,islands,ireland,great,britain,isle,man,channel,islands,identification,required,airports,seaports",0.00,ireland
"the local government act  was the founding statute of the present system of local government while the twentieth amendment to the constitution of  provided for its constitutional recognition the twenty six traditional counties of ireland are the basis of the local government areas with the traditional counties of cork dublin and galway containing two or more local government areas the local government act  as amended by the local government reform act  provides for a system of thirty one local authorities  twenty six county councils two city and county councils and three city councils counties  are divided into municipal districts a second local government tier of town councils was abolished in 
",local government act founding statute present system local government twentieth amendment constitution provided constitutional recognition traditional counties ireland basis local government areas traditional counties cork dublin galway containing local government areas local government act amended local government reform act provides system thirty local authorities county councils city county councils city councils counties divided municipal districts second local government tier town councils abolished,6.81,"local,government,act,founding,statute,present,system,local,government,twentieth,amendment,constitution,provided,constitutional,recognition,traditional,counties,ireland,basis,local,government,areas,traditional,counties,cork,dublin,galway,containing,local,government,areas,local,government,act,amended,local,government,reform,act,provides,system,thirty,local,authorities,county,councils,city,county,councils,city,councils,counties,divided,municipal,districts,second,local,government,tier,town,councils,abolished",0.00,ireland
"ireland has a common law legal system with a written constitution that provides for a parliamentary democracy the court system consists of the supreme court the court of appeal the high court the circuit court and the district court all of which apply the irish law and hear both civil and criminal matters trials for serious offences must usually be held before a jury the high court court of appeal and the supreme court have authority by means of judicial review to determine the compatibility of laws and activities of other institutions of the state with the constitution and the law except in exceptional circumstances court hearings must occur in public
",ireland common law legal system written constitution provides parliamentary democracy court system consists supreme court court appeal high court circuit court district court apply irish law hear civil criminal matters trials offences usually held jury high court court appeal supreme court authority means judicial review determine compatibility laws activities institutions state constitution law exceptional circumstances court hearings occur public,7.87,"ireland,common,law,legal,system,written,constitution,provides,parliamentary,democracy,court,system,consists,supreme,court,court,appeal,high,court,circuit,court,district,court,apply,irish,law,hear,civil,criminal,matters,trials,offences,usually,held,jury,high,court,court,appeal,supreme,court,authority,means,judicial,review,determine,compatibility,laws,activities,institutions,state,constitution,law,exceptional,circumstances,court,hearings,occur,public",0.00,ireland
"irelands citizenship laws relate to the island of ireland including islands and seas thereby extending them to northern ireland which is part of the united kingdom therefore anyone born in northern ireland who meets the requirements for being an irish citizen such as birth on the island of ireland to an irish or british citizen parent or a parent who is entitled to live in northern ireland or the republic without restriction on their residency may exercise an entitlement to irish citizenship such as an irish passport
",irelands citizenship laws relate island ireland including islands seas extending northern ireland united kingdom born northern ireland meets requirements irish citizen birth island ireland irish british citizen parent parent entitled live northern ireland republic restriction residency exercise entitlement irish citizenship irish passport,8.60,"irelands,citizenship,laws,relate,island,ireland,including,islands,seas,extending,northern,ireland,united,kingdom,born,northern,ireland,meets,requirements,irish,citizen,birth,island,ireland,irish,british,citizen,parent,parent,entitled,live,northern,ireland,republic,restriction,residency,exercise,entitlement,irish,citizenship,irish,passport",0.00,ireland
"ireland tends towards independence in foreign policy thus the country is not a member of nato and has a longstanding policy of military neutrality this policy has led to the irish defence forces contributing to peace keeping missions with the united nations since  including during the congo crisis and subsequently in cyprus lebanon and bosnia and herzegovina
",ireland tends independence foreign policy country member nato longstanding policy military neutrality policy led irish defence forces contributing peace keeping missions united nations including congo crisis subsequently cyprus lebanon bosnia herzegovina,7.20,"ireland,tends,independence,foreign,policy,country,member,nato,longstanding,policy,military,neutrality,policy,led,irish,defence,forces,contributing,peace,keeping,missions,united,nations,including,congo,crisis,subsequently,cyprus,lebanon,bosnia,herzegovina",0.00,ireland
