Unclean,Clean,Noise_Pre_Processing,Training_Data,Noise_Post_Processing,Query
"riga  livonian rg is the capital and largest city of latvia and is home to  inhabitants which is a third of latvias population the city lies on the gulf of riga at the mouth of the daugava river where it meets the baltic sea rigas territory covers  km  and lies  m  above sea level on a flat and sandy plain
",riga livonian rg capital largest city latvia home inhabitants latvias population city lies gulf riga mouth daugava river meets baltic sea rigas territory covers km lies sea level flat sandy plain,9.42,"riga,livonian,rg,capital,largest,city,latvia,home,inhabitants,latvias,population,city,lies,gulf,riga,mouth,daugava,river,meets,baltic,sea,rigas,territory,covers,km,lies,sea,level,flat,sandy,plain",0.00,riga
"riga was founded in  and is a former hanseatic league member rigas historical centre is a unesco world heritage site noted for its art nouveaujugendstil architecture and th century wooden architecture riga was the european capital of culture in  along with ume in sweden riga hosted the  nato summit the eurovision song contest  the  iihf mens world ice hockey championships  world womens curling championship and the  iihf world championship it is home to the european unions office of european regulators for electronic communications  in  it was named the european region of gastronomy
",riga founded hanseatic league member rigas historical centre unesco world heritage site noted art nouveaujugendstil architecture th century wooden architecture riga european capital culture ume sweden riga hosted nato summit eurovision song contest iihf mens world ice hockey championships world womens curling championship iihf world championship home european unions office european regulators electronic communications named european region gastronomy,5.77,"riga,founded,hanseatic,league,member,rigas,historical,centre,unesco,world,heritage,site,noted,art,nouveaujugendstil,architecture,th,century,wooden,architecture,riga,european,capital,culture,ume,sweden,riga,hosted,nato,summit,eurovision,song,contest,iihf,mens,world,ice,hockey,championships,world,womens,curling,championship,iihf,world,championship,home,european,unions,office,european,regulators,electronic,communications,named,european,region,gastronomy",0.00,riga
"in  riga received over  million visitors the city is served by riga international airport the largest and busiest airport in the baltic states riga is a member of eurocities the union of the baltic cities  and union of capitals of the european union 
",riga received million visitors city served riga international airport largest busiest airport baltic states riga member eurocities union baltic cities union capitals european union,7.57,"riga,received,million,visitors,city,served,riga,international,airport,largest,busiest,airport,baltic,states,riga,member,eurocities,union,baltic,cities,union,capitals,european,union",0.00,riga
"there are numerous and speculative theories for the origin of the name riga
",numerous speculative theories origin riga,10.53,"numerous,speculative,theories,origin,riga",0.00,riga
"however the most reliably documented explanation is the affirmation by german historian dionysius fabricius  that rigas name comes from its already established role in trade riga nomen sortita est suum ab aedificiis vel horreis quorum a litus dunae magna fuit copia quas livones sua lingua rias vocare soliti   the j in latvian rja hardened to a g in german english geographer richard hakluyt  corroborates this account calling riga rie as pronounced in latvian
",reliably documented explanation affirmation german historian dionysius fabricius rigas comes established role trade riga nomen sortita est suum ab aedificiis vel horreis quorum litus dunae magna fuit copia quas livones sua lingua rias vocare soliti j latvian rja hardened g german english geographer richard hakluyt corroborates account calling riga rie pronounced latvian,4.55,"reliably,documented,explanation,affirmation,german,historian,dionysius,fabricius,rigas,comes,established,role,trade,riga,nomen,sortita,est,suum,ab,aedificiis,vel,horreis,quorum,litus,dunae,magna,fuit,copia,quas,livones,sua,lingua,rias,vocare,soliti,j,latvian,rja,hardened,g,german,english,geographer,richard,hakluyt,corroborates,account,calling,riga,rie,pronounced,latvian",0.00,riga
"riga began to develop as a centre of viking trade during the early middle ages
rigas inhabitants occupied themselves mainly with fishing animal husbandry and trading later developing crafts 
",riga began develop centre viking trade early middle agesrigas inhabitants occupied mainly fishing animal husbandry trading later developing crafts,4.71,"riga,began,develop,centre,viking,trade,early,middle,agesrigas,inhabitants,occupied,mainly,fishing,animal,husbandry,trading,later,developing,crafts",0.00,riga
"the livonian chronicle of henry testifies to riga having long been a trading centre by the th century referring to it as portus antiquus  and describes dwellings and warehouses used to store mostly flax and hides german traders began visiting riga establishing a nearby outpost in 
",livonian chronicle henry testifies riga long trading centre th century referring portus antiquus describes dwellings warehouses store flax hides german traders began visiting riga establishing nearby outpost,6.74,"livonian,chronicle,henry,testifies,riga,long,trading,centre,th,century,referring,portus,antiquus,describes,dwellings,warehouses,store,flax,hides,german,traders,began,visiting,riga,establishing,nearby,outpost",0.00,riga
"along with german traders the monk meinhard of segeberg arrived to convert the livonian pagans to christianity catholic and orthodox christianity had already arrived in latvia more than a century earlier and many latvians had been baptised meinhard settled among the livs building a castle and church at uexkll  upstream from riga and established his bishopric there the livs however continued to practice paganism and meinhard died in uexkll in  having failed in his mission in  the bishop berthold arrived with a contingent of crusaders and commenced a campaign of forced christianisation berthold died soon afterwards and his forces were defeated
",german traders monk meinhard segeberg arrived convert livonian pagans christianity catholic orthodox christianity arrived latvia century earlier latvians baptised meinhard settled livs building castle church uexkll upstream riga established bishopric livs continued practice paganism meinhard died uexkll failed mission bishop berthold arrived contingent crusaders commenced campaign forced christianisation berthold died soon forces defeated,7.38,"german,traders,monk,meinhard,segeberg,arrived,convert,livonian,pagans,christianity,catholic,orthodox,christianity,arrived,latvia,century,earlier,latvians,baptised,meinhard,settled,livs,building,castle,church,uexkll,upstream,riga,established,bishopric,livs,continued,practice,paganism,meinhard,died,uexkll,failed,mission,bishop,berthold,arrived,contingent,crusaders,commenced,campaign,forced,christianisation,berthold,died,soon,forces,defeated",0.00,riga
"the church mobilised to avenge this defeat pope innocent iii issued a bull declaring a crusade against the livonians bishop albert was proclaimed bishop of livonia by his uncle hartwig of uthlede prince archbishop of bremen and hamburg in  albert landed in riga in  with  ships and  westphalian crusaders in  he transferred the seat of the livonian bishopric from uexkll to riga extorting agreement to do this from the elders of riga by force
",church mobilised avenge defeat pope innocent iii issued bull declaring crusade livonians bishop albert proclaimed bishop livonia uncle hartwig uthlede prince archbishop bremen hamburg albert landed riga ships westphalian crusaders transferred seat livonian bishopric uexkll riga extorting agreement elders riga force,7.45,"church,mobilised,avenge,defeat,pope,innocent,iii,issued,bull,declaring,crusade,livonians,bishop,albert,proclaimed,bishop,livonia,uncle,hartwig,uthlede,prince,archbishop,bremen,hamburg,albert,landed,riga,ships,westphalian,crusaders,transferred,seat,livonian,bishopric,uexkll,riga,extorting,agreement,elders,riga,force",0.00,riga
"the christianisation of the livs continued in  albert started to fortify the town emperor philip invested albert with livonia as a fief and principality of the holy roman empire to promote a permanent military presence territorial ownership was divided between the church and the order with the church taking riga and two thirds of all lands conquered and granting the order a third until then it had been customary for crusaders to serve for a year and then return home
",christianisation livs continued albert started fortify town emperor philip invested albert livonia fief principality holy roman empire promote permanent military presence territorial ownership divided church order church taking riga thirds lands conquered granting order customary crusaders serve year return home,8.49,"christianisation,livs,continued,albert,started,fortify,town,emperor,philip,invested,albert,livonia,fief,principality,holy,roman,empire,promote,permanent,military,presence,territorial,ownership,divided,church,order,church,taking,riga,thirds,lands,conquered,granting,order,customary,crusaders,serve,year,return,home",0.00,riga
"albert had ensured rigas commercial future by obtaining papal bulls which decreed that all german merchants had to carry on their baltic trade through riga in  riga minted its first coinage and albert laid the cornerstone for the riga dom riga was not yet secure as an alliance of tribes failed to take riga in  albert led a campaign to compel polotsk to grant german merchants free river passage polotsk conceded kukenois  and jersika to albert also ending the livs tribute to polotsk
",albert ensured rigas commercial future obtaining papal bulls decreed german merchants carry baltic trade riga riga minted coinage albert laid cornerstone riga dom riga secure alliance tribes failed riga albert led campaign compel polotsk grant german merchants free river passage polotsk conceded kukenois jersika albert ending livs tribute polotsk,7.00,"albert,ensured,rigas,commercial,future,obtaining,papal,bulls,decreed,german,merchants,carry,baltic,trade,riga,riga,minted,coinage,albert,laid,cornerstone,riga,dom,riga,secure,alliance,tribes,failed,riga,albert,led,campaign,compel,polotsk,grant,german,merchants,free,river,passage,polotsk,conceded,kukenois,jersika,albert,ending,livs,tribute,polotsk",0.00,riga
"rigas merchant citizenry chafed and sought greater autonomy from the church in  they acquired the right to independently self administer riga and adopted a city constitution
",rigas merchant citizenry chafed sought greater autonomy church acquired right independently self administer riga adopted city constitution,5.17,"rigas,merchant,citizenry,chafed,sought,greater,autonomy,church,acquired,right,independently,self,administer,riga,adopted,city,constitution",0.00,riga
"that same year albert was compelled to recognise danish rule over lands they had conquered in estonia and livonia albert had sought the aid of king valdemar of denmark to protect riga and livonian lands against liv insurrection when reinforcements could not reach riga the danes landed in livonia built a fortress at reval  and set about conquering estonian and livonian lands the germans attempted but failed to assassinate valdemar albert was able to reach an accommodation with them a year later however and in  valdemar returned all livonian lands and possessions to alberts control
",year albert compelled recognise danish rule lands conquered estonia livonia albert sought aid king valdemar denmark protect riga livonian lands liv insurrection reinforcements reach riga danes landed livonia built fortress reval set conquering estonian livonian lands germans attempted failed assassinate valdemar albert able reach accommodation year later valdemar returned livonian lands possessions alberts control,6.98,"year,albert,compelled,recognise,danish,rule,lands,conquered,estonia,livonia,albert,sought,aid,king,valdemar,denmark,protect,riga,livonian,lands,liv,insurrection,reinforcements,reach,riga,danes,landed,livonia,built,fortress,reval,set,conquering,estonian,livonian,lands,germans,attempted,failed,assassinate,valdemar,albert,able,reach,accommodation,year,later,valdemar,returned,livonian,lands,possessions,alberts,control",0.00,riga
"alberts difficulties with rigas citizenry continued with papal intervention a settlement was reached in  whereby they no longer had to pay tax to the bishop of riga and rigas citizens acquired the right to elect their magistrates and town councillors in  albert consecrated the dom cathedral built st jamess church  and founded a parochial school at the church of st george
",alberts difficulties rigas citizenry continued papal intervention settlement reached longer pay tax bishop riga rigas citizens acquired right elect magistrates town councillors albert consecrated dom cathedral built st jamess church founded parochial school church st george,6.68,"alberts,difficulties,rigas,citizenry,continued,papal,intervention,settlement,reached,longer,pay,tax,bishop,riga,rigas,citizens,acquired,right,elect,magistrates,town,councillors,albert,consecrated,dom,cathedral,built,st,jamess,church,founded,parochial,school,church,st,george",0.00,riga
"in  albert conquered oesel and the city of riga concluded a treaty with the principality of smolensk giving polotsk to riga
",albert conquered oesel city riga concluded treaty principality smolensk giving polotsk riga,7.26,"albert,conquered,oesel,city,riga,concluded,treaty,principality,smolensk,giving,polotsk,riga",0.00,riga
"in  riga became a member of the hanseatic league the hansa was instrumental in giving riga economic and political stability thus providing the city with a strong foundation which endured the political conflagrations that were to come down to modern times
",riga member hanseatic league hansa instrumental giving riga economic political stability providing city strong foundation endured political conflagrations come modern times,7.84,"riga,member,hanseatic,league,hansa,instrumental,giving,riga,economic,political,stability,providing,city,strong,foundation,endured,political,conflagrations,come,modern,times",0.00,riga
"as the influence of the hanseatic league waned riga became the object of foreign military political religious and economic aspirations riga accepted the reformation in  ending the power of the archbishops in  iconoclasts targeted a statue of the virgin mary in the cathedral to make a statement against religious icons it was accused of being a witch and given a trial by water in the daugava river the statue floated so it was denounced as a witch and burnt at kubsberg with the demise of the livonian order during the livonian war riga for twenty years had the status of a free imperial city of the holy roman empire before it came under the influence of the polishlithuanian commonwealth by the treaty of drohiczyn which ended the war for riga in  in  during the polishswedish war  riga and the outlying fortress of daugavgrva came under the rule of gustavus adolphus king of sweden who intervened in the thirty years war not only for political and economic gain but also in favour of german lutheran protestantism during the russo swedish war  riga withstood a siege by russian forces
",influence hanseatic league waned riga object foreign military political religious economic aspirations riga accepted reformation ending power archbishops iconoclasts targeted statue virgin mary cathedral statement religious icons accused witch given trial water daugava river statue floated denounced witch burnt kubsberg demise livonian order livonian war riga years status free imperial city holy roman empire came influence polishlithuanian commonwealth treaty drohiczyn ended war riga polishswedish war riga outlying fortress daugavgrva came rule gustavus adolphus king sweden intervened thirty years war political economic gain favour german lutheran protestantism russo swedish war riga withstood siege russian forces,8.54,"influence,hanseatic,league,waned,riga,object,foreign,military,political,religious,economic,aspirations,riga,accepted,reformation,ending,power,archbishops,iconoclasts,targeted,statue,virgin,mary,cathedral,statement,religious,icons,accused,witch,given,trial,water,daugava,river,statue,floated,denounced,witch,burnt,kubsberg,demise,livonian,order,livonian,war,riga,years,status,free,imperial,city,holy,roman,empire,came,influence,polishlithuanian,commonwealth,treaty,drohiczyn,ended,war,riga,polishswedish,war,riga,outlying,fortress,daugavgrva,came,rule,gustavus,adolphus,king,sweden,intervened,thirty,years,war,political,economic,gain,favour,german,lutheran,protestantism,russo,swedish,war,riga,withstood,siege,russian,forces",0.00,riga
"riga remained one of the largest cities under the swedish crown until  a period during which the city retained a great deal of autonomous self government in july  during the opening phase of the great northern war the crossing of the dna took place nearby resulting in a victory for king charles xii of sweden between november  and june  however the russians under tsar peter the great besieged and captured riga which was at the time struck by a plague along with the other livonian towns and gentry riga capitulated to russia but largely retained their privileges riga was made the capital of the governorate of riga  swedens northern dominance had ended and russias emergence as the strongest northern power was formalised through the treaty of nystad in  at the beginning of the th century riga was the largestdubious   discuss timber export port in the russian empire and ranked the rdwhen according to the external trade volume
",riga remained largest cities swedish crown period city retained great deal autonomous self government july opening phase great northern war crossing dna took place nearby resulting victory king charles xii sweden november june russians tsar peter great besieged captured riga time struck plague livonian towns gentry riga capitulated russia largely retained privileges riga capital governorate riga swedens northern dominance ended russias emergence strongest northern power formalised treaty nystad beginning th century riga largestdubious discuss timber export port russian empire ranked rdwhen according external trade volume,7.71,"riga,remained,largest,cities,swedish,crown,period,city,retained,great,deal,autonomous,self,government,july,opening,phase,great,northern,war,crossing,dna,took,place,nearby,resulting,victory,king,charles,xii,sweden,november,june,russians,tsar,peter,great,besieged,captured,riga,time,struck,plague,livonian,towns,gentry,riga,capitulated,russia,largely,retained,privileges,riga,capital,governorate,riga,swedens,northern,dominance,ended,russias,emergence,strongest,northern,power,formalised,treaty,nystad,beginning,th,century,riga,largestdubious,discuss,timber,export,port,russian,empire,ranked,rdwhen,according,external,trade,volume",0.00,riga
"during these many centuries of war and changes of power in the baltic and despite demographic changes the baltic germans in riga had maintained a dominant position by  rigas population was  german riga employed german as its official language of administration until the installation of russian in  as the official language in the baltic provinces as part of the policy of russification of the non russian speaking territories of the russian empire including congress poland finland and the baltics undertaken by tsar alexander iii more and more latvians started moving to the city during the mid th century the rise of a latvian bourgeoisie made riga a centre of the latvian national awakening with the founding of the riga latvian association in  and the organisation of the first national song festival in  the nationalist movement of the neo latvians was followed by the socialist new current during the citys rapid industrialisation culminating in the  revolution led by the latvian social democratic workers party
",centuries war changes power baltic despite demographic changes baltic germans riga maintained dominant position rigas population german riga employed german official language administration installation russian official language baltic provinces policy russification non russian speaking territories russian empire including congress poland finland baltics undertaken tsar alexander iii latvians started moving city mid th century rise latvian bourgeoisie riga centre latvian national awakening founding riga latvian association organisation national song festival nationalist movement neo latvians followed socialist new current citys rapid industrialisation culminating revolution led latvian social democratic workers party,7.35,"centuries,war,changes,power,baltic,despite,demographic,changes,baltic,germans,riga,maintained,dominant,position,rigas,population,german,riga,employed,german,official,language,administration,installation,russian,official,language,baltic,provinces,policy,russification,non,russian,speaking,territories,russian,empire,including,congress,poland,finland,baltics,undertaken,tsar,alexander,iii,latvians,started,moving,city,mid,th,century,rise,latvian,bourgeoisie,riga,centre,latvian,national,awakening,founding,riga,latvian,association,organisation,national,song,festival,nationalist,movement,neo,latvians,followed,socialist,new,current,citys,rapid,industrialisation,culminating,revolution,led,latvian,social,democratic,workers,party",0.00,riga
"the th century brought world war i and the impact of the russian revolution of  to riga as a result of the battle of jugla the german army marched into riga on  september  on  march  the treaty of brest litovsk was signed giving the baltic countries to germany because of the armistice with germany of  november  germany had to renounce that treaty as did russia leaving latvia and the other baltic states in a position to claim independence latvia with riga as its capital city thus declared its independence on  november 
between world war i and world war ii  riga and latvia shifted their focus from russia to the countries of western europe the united kingdom and germany replaced russia as latvias major trade partners the majority of the baltic germans were resettled in late  prior to the occupation of estonia and latvia by the soviet union in june 
",th century brought world war impact russian revolution riga result battle jugla german army marched riga september march treaty brest litovsk signed giving baltic countries germany armistice germany november germany renounce treaty russia leaving latvia baltic states position claim independence latvia riga capital city declared independence november world war world war ii riga latvia shifted focus russia countries western europe united kingdom germany replaced russia latvias major trade partners majority baltic germans resettled late prior occupation estonia latvia soviet union june,7.93,"th,century,brought,world,war,impact,russian,revolution,riga,result,battle,jugla,german,army,marched,riga,september,march,treaty,brest,litovsk,signed,giving,baltic,countries,germany,armistice,germany,november,germany,renounce,treaty,russia,leaving,latvia,baltic,states,position,claim,independence,latvia,riga,capital,city,declared,independence,november,world,war,world,war,ii,riga,latvia,shifted,focus,russia,countries,western,europe,united,kingdom,germany,replaced,russia,latvias,major,trade,partners,majority,baltic,germans,resettled,late,prior,occupation,estonia,latvia,soviet,union,june",0.00,riga
