Unclean,Clean,Noise_Pre_Processing,Training_Data,Noise_Post_Processing,Query
"during world war ii latvia was occupied by the soviet union in june  and then was occupied by nazi germany in  on  june  the soviet forces invaded latvia occupying bridges posttelephone telegraph and broadcasting offices three days later latvian president karlis ulmanis was forced to approve a pro soviet government which had taken office on  july rigged elections were held in latvia and the other baltic states the ballots held the following instructions only the list of the latvian working peoples bloc must be deposited in the ballot box the ballot must be deposited without any changes the alleged voter activity index was  most notably the complete election results were published in moscow  hours before the election closed soviet electoral documents found later substantiated that the results were completely fabricated the soviet authorities having regained control over riga and latvia imposed a regime of terror opening the headquarters of the kgb massive deportations started hundreds of men were arrested including leaders of the former latvian government the most notorious deportation the june deportation took place on  and  june  estimated at  men women and children and including  of latvias last legal government similar deportations were repeated after the end of wwii the building of the kgb located at  brvbas iela known as the corner house is now a museum stalins deportations also included thousands of latvian jews 
",world war ii latvia occupied soviet union june occupied nazi germany june soviet forces invaded latvia occupying bridges posttelephone telegraph broadcasting offices days later latvian president karlis ulmanis forced approve pro soviet government taken office july rigged elections held latvia baltic states ballots held following instructions list latvian working peoples bloc deposited ballot box ballot deposited changes alleged voter activity index notably complete election results published moscow hours election closed soviet electoral documents found later substantiated results completely fabricated soviet authorities regained control riga latvia imposed regime terror opening headquarters kgb massive deportations started hundreds men arrested including leaders latvian government notorious deportation june deportation took place june estimated men women children including latvias legal government similar deportations repeated end wwii building kgb located brvbas iela known corner house museum stalins deportations included thousands latvian jews,6.24,"world,war,ii,latvia,occupied,soviet,union,june,occupied,nazi,germany,june,soviet,forces,invaded,latvia,occupying,bridges,posttelephone,telegraph,broadcasting,offices,days,later,latvian,president,karlis,ulmanis,forced,approve,pro,soviet,government,taken,office,july,rigged,elections,held,latvia,baltic,states,ballots,held,following,instructions,list,latvian,working,peoples,bloc,deposited,ballot,box,ballot,deposited,changes,alleged,voter,activity,index,notably,complete,election,results,published,moscow,hours,election,closed,soviet,electoral,documents,found,later,substantiated,results,completely,fabricated,soviet,authorities,regained,control,riga,latvia,imposed,regime,terror,opening,headquarters,kgb,massive,deportations,started,hundreds,men,arrested,including,leaders,latvian,government,notorious,deportation,june,deportation,took,place,june,estimated,men,women,children,including,latvias,legal,government,similar,deportations,repeated,end,wwii,building,kgb,located,brvbas,iela,known,corner,house,museum,stalins,deportations,included,thousands,latvian,jews",0.00,riga
"during the nazi occupation the jewish community was forced into the riga ghetto and a nazi concentration camp was constructed in kaiserwald on  october  the nazis relocated all jews from riga and the vicinity to the ghetto most of latvias jews  were killed on  november and  december  in the rumbula massacre by the end of the war the remaining baltic germans were expelled to germany
",nazi occupation jewish community forced riga ghetto nazi concentration camp constructed kaiserwald october nazis relocated jews riga vicinity ghetto latvias jews killed november december rumbula massacre end war remaining baltic germans expelled germany,8.31,"nazi,occupation,jewish,community,forced,riga,ghetto,nazi,concentration,camp,constructed,kaiserwald,october,nazis,relocated,jews,riga,vicinity,ghetto,latvias,jews,killed,november,december,rumbula,massacre,end,war,remaining,baltic,germans,expelled,germany",0.00,riga
"the soviet red army re entered riga on  october  in the following years the massive influx of labourers administrators military personnel and their dependents from russia and other soviet republics started microdistricts of the large multi storied housing blocks were built to house immigrant workers
",soviet red army entered riga october following years massive influx labourers administrators military personnel dependents russia soviet republics started microdistricts large multi storied housing blocks built house immigrant workers,5.32,"soviet,red,army,entered,riga,october,following,years,massive,influx,labourers,administrators,military,personnel,dependents,russia,soviet,republics,started,microdistricts,large,multi,storied,housing,blocks,built,house,immigrant,workers",0.00,riga
"in  the percentage of latvians in riga had fallen to 
",percentage latvians riga fallen,11.11,"percentage,latvians,riga,fallen",0.00,riga
"in  the arrival of low cost airlines resulted in cheaper flights from other european cities such as london and berlin and consequently a substantial increase in numbers of tourists in the spring of  the hitherto biggest party of hospitality exchange service hc took place in riga counting  participants from  countries
",arrival low cost airlines resulted cheaper flights european cities london berlin consequently substantial increase numbers tourists spring hitherto biggest party hospitality exchange service hc took place riga counting participants countries,6.27,"arrival,low,cost,airlines,resulted,cheaper,flights,european,cities,london,berlin,consequently,substantial,increase,numbers,tourists,spring,hitherto,biggest,party,hospitality,exchange,service,hc,took,place,riga,counting,participants,countries",0.00,riga
"riga was the european capital of culture in  during latvias presidency of the council of the european union in  the th eastern partnership summit took place in riga
",riga european capital culture latvias presidency council european union th eastern partnership summit took place riga,7.27,"riga,european,capital,culture,latvias,presidency,council,european,union,th,eastern,partnership,summit,took,place,riga",0.00,riga
"riga is the second largest city  in the three baltic states lithuania latvia and estonia riga is home to approximately one tenth of the three baltic countries combined population
",riga second largest city baltic states lithuania latvia estonia riga home approximately tenth baltic countries combined population,6.70,"riga,second,largest,city,baltic,states,lithuania,latvia,estonia,riga,home,approximately,tenth,baltic,countries,combined,population",0.00,riga
"rigas administrative divisions consist of six administrative entities central kurzeme and northern districts and the latgale vidzeme and zemgale suburbs three entities were established on  september  and the other three were established in october  there are no official lower level administrative units but the riga city council development agency is working on a plan which officially makes riga consist of  neighbourhoods the current names were confirmed on  december 
",rigas administrative divisions consist administrative entities central kurzeme northern districts latgale vidzeme zemgale suburbs entities established september established october official lower level administrative units riga city council development agency working plan officially makes riga consist neighbourhoods current names confirmed december,5.93,"rigas,administrative,divisions,consist,administrative,entities,central,kurzeme,northern,districts,latgale,vidzeme,zemgale,suburbs,entities,established,september,established,october,official,lower,level,administrative,units,riga,city,council,development,agency,working,plan,officially,makes,riga,consist,neighbourhoods,current,names,confirmed,december",0.00,riga
"the climate of riga is humid continental  the coldest months are january and february when the average temperature is  c  but temperatures as low as  to  c  can be observed almost every year on the coldest days the proximity of the sea causes frequent autumn rains and fogs continuous snow cover may last eighty days the summers in riga are mild and rainy with an average temperature of  c  while the temperature on the hottest days can exceed  c 
",climate riga humid continental coldest months january february average temperature c temperatures low c observed year coldest days proximity sea causes frequent autumn rains fogs continuous snow cover eighty days summers riga mild rainy average temperature c temperature hottest days exceed c,8.26,"climate,riga,humid,continental,coldest,months,january,february,average,temperature,c,temperatures,low,c,observed,year,coldest,days,proximity,sea,causes,frequent,autumn,rains,fogs,continuous,snow,cover,eighty,days,summers,riga,mild,rainy,average,temperature,c,temperature,hottest,days,exceed,c",0.00,riga
"the head of the city government in riga is the mayor or officially the chairman of the riga city council he is assisted by one or more vice mayors  the current mayor since october  is mrti stais elected from movement for which is a part of the developmentforprogressives faction but on  march  he left the party the three other parties in the governing coalition each received a vice mayor post
",head city government riga mayor officially chairman riga city council assisted vice mayors current mayor october mrti stais elected movement developmentforprogressives faction march left party parties governing coalition received vice mayor post,9.62,"head,city,government,riga,mayor,officially,chairman,riga,city,council,assisted,vice,mayors,current,mayor,october,mrti,stais,elected,movement,developmentforprogressives,faction,march,left,party,parties,governing,coalition,received,vice,mayor,post",0.00,riga
"the city council is a democratically elected institution and is the final decision making authority in the city the council consists of  members or deputies who are elected every four years the presidium of the riga city council consists of the chairman of the riga city council and the representatives delegated by the political parties or party blocks elected to the city council from february to october  the offices of the mayor and vice mayors were suspended and the council itself had been dissolved and replaced by an interim administration of representatives from three governmental ministries until snap elections were held in 
",city council democratically elected institution final decision making authority city council consists members deputies elected years presidium riga city council consists chairman riga city council representatives delegated political parties party blocks elected city council february october offices mayor vice mayors suspended council dissolved replaced interim administration representatives governmental ministries snap elections held,7.85,"city,council,democratically,elected,institution,final,decision,making,authority,city,council,consists,members,deputies,elected,years,presidium,riga,city,council,consists,chairman,riga,city,council,representatives,delegated,political,parties,party,blocks,elected,city,council,february,october,offices,mayor,vice,mayors,suspended,council,dissolved,replaced,interim,administration,representatives,governmental,ministries,snap,elections,held",0.00,riga
"with  inhabitants in  as according to the central statistical bureau of latvia riga was the largest city in the baltic states though its population has decreased from just over  in  and the population of vilnius has just outnumbered that of riga notable causes include emigration and low birth rates according to the  data ethnic latvians made up  of the population of riga russians formed  belarusians  ukrainians  poles  other ethnicities consisted  by comparison  of latvias total population was ethnically latvian  russian  belarusian  ukrainian  polish  are lithuanian and the rest of other origins
",inhabitants according central statistical bureau latvia riga largest city baltic states population decreased population vilnius outnumbered riga notable causes include emigration low birth rates according data ethnic latvians population riga russians formed belarusians ukrainians poles ethnicities consisted comparison latvias total population ethnically latvian russian belarusian ukrainian polish lithuanian rest origins,6.79,"inhabitants,according,central,statistical,bureau,latvia,riga,largest,city,baltic,states,population,decreased,population,vilnius,outnumbered,riga,notable,causes,include,emigration,low,birth,rates,according,data,ethnic,latvians,population,riga,russians,formed,belarusians,ukrainians,poles,ethnicities,consisted,comparison,latvias,total,population,ethnically,latvian,russian,belarusian,ukrainian,polish,lithuanian,rest,origins",0.00,riga
"upon the restoration of latvias independence in  soviet era immigrants  were not automatically granted latvian citizenship because they had migrated to the territory of latvia during the years when latvia was part of the soviet union the proportion of ethnic latvians in riga increased from  in  to  in  in contrast the percentage of russians fell from  to  in the same time period in  citizens of latvia made up  non citizens  and citizens of other countries  of the population of riga
",restoration latvias independence soviet era immigrants automatically granted latvian citizenship migrated territory latvia years latvia soviet union proportion ethnic latvians riga increased contrast percentage russians fell time period citizens latvia non citizens citizens countries population riga,9.03,"restoration,latvias,independence,soviet,era,immigrants,automatically,granted,latvian,citizenship,migrated,territory,latvia,years,latvia,soviet,union,proportion,ethnic,latvians,riga,increased,contrast,percentage,russians,fell,time,period,citizens,latvia,non,citizens,citizens,countries,population,riga",0.00,riga
"riga is one of the key economic and financial centres of the baltic states roughly half of all the jobs in latvia are in riga and the city generates more than  of latvias gdp as well as around half of latvias exports the biggest exporters are in wood products it food and beverage manufacturing pharmaceuticals transport and metallurgy riga port is one of the largest in the baltics it handled a record  million tons of cargo in  and has potential for future growth with new port developments on krievu sala tourism is also a large industry in riga and after a slowdown during the global economic recessions of the late s grew  in  alone
",riga key economic financial centres baltic states roughly half jobs latvia riga city generates latvias gdp half latvias exports biggest exporters wood products food beverage manufacturing pharmaceuticals transport metallurgy riga port largest baltics handled record million tons cargo potential future growth new port developments krievu sala tourism large industry riga slowdown global economic recessions late grew,9.09,"riga,key,economic,financial,centres,baltic,states,roughly,half,jobs,latvia,riga,city,generates,latvias,gdp,half,latvias,exports,biggest,exporters,wood,products,food,beverage,manufacturing,pharmaceuticals,transport,metallurgy,riga,port,largest,baltics,handled,record,million,tons,cargo,potential,future,growth,new,port,developments,krievu,sala,tourism,large,industry,riga,slowdown,global,economic,recessions,late,grew",0.00,riga
"riga was intended to become the global financial centre in the former soviet union one bank which provided high levels of secrecy for its customers promoted itself as we are closer than switzerland a on  july  twenty latvian banks with assistance of persons from the paris stock exchange organised the riga stock exchange which was the first latvian stock exchange in riga
",riga intended global financial centre soviet union bank provided high levels secrecy customers promoted closer switzerland july latvian banks assistance persons paris stock exchange organised riga stock exchange latvian stock exchange riga,8.04,"riga,intended,global,financial,centre,soviet,union,bank,provided,high,levels,secrecy,customers,promoted,closer,switzerland,july,latvian,banks,assistance,persons,paris,stock,exchange,organised,riga,stock,exchange,latvian,stock,exchange,riga",0.00,riga
"riga stock exchange early th century now the art museum riga bourse
",riga stock exchange early th century art museum riga bourse,2.94,"riga,stock,exchange,early,th,century,art,museum,riga,bourse",0.00,riga
"riga hosted the biannual  world choir games from  to  july  which coincided with the city being named european capital of culture for  the event organised by the choral foundation interkultur takes place at various host cities every two years and was originally known as the choir olympics the event regularly sees over  choristers in over  choirs from over  nations compete for gold silver and bronze medals in over  categories the competition is further divided into a champions competition and an open competition to allow choirs from all backgrounds to enter choral workshops and festivals are also witnessed in the host cities and are usually open to the public
",riga hosted biannual world choir games july coincided city named european capital culture event organised choral foundation interkultur takes place host cities years originally known choir olympics event regularly sees choristers choirs nations compete gold silver bronze medals categories competition divided champions competition open competition allow choirs backgrounds enter choral workshops festivals witnessed host cities usually open public,7.50,"riga,hosted,biannual,world,choir,games,july,coincided,city,named,european,capital,culture,event,organised,choral,foundation,interkultur,takes,place,host,cities,years,originally,known,choir,olympics,event,regularly,sees,choristers,choirs,nations,compete,gold,silver,bronze,medals,categories,competition,divided,champions,competition,open,competition,allow,choirs,backgrounds,enter,choral,workshops,festivals,witnessed,host,cities,usually,open,public",0.00,riga
"the radio and tv tower of riga is the tallest structure in latvia and the baltic states and one of the tallest in the european union reaching  m  riga centre also has many great examples of gothic revival architecture such as the kalpaka boulevard library and a bevy of art nouveau architecture as well as a medieval old town
",radio tv tower riga tallest structure latvia baltic states tallest european union reaching riga centre great examples gothic revival architecture kalpaka boulevard library bevy art nouveau architecture medieval old town,8.90,"radio,tv,tower,riga,tallest,structure,latvia,baltic,states,tallest,european,union,reaching,riga,centre,great,examples,gothic,revival,architecture,kalpaka,boulevard,library,bevy,art,nouveau,architecture,medieval,old,town",0.00,riga
"riga has one of the largest collections of art nouveau buildings in the world with at least  buildings this is due to the fact that at the end of the th and beginning of the th centuries when art nouveau was at the height of its popularity riga experienced an unprecedented financial and demographic boom in the period from  its population grew from   to  in  the middle class of riga used their acquired wealth to build imposing apartment blocks outside the former city walls local architects mostly graduates of riga technical university adopted current european movements and in particular art nouveau between  and  between  and  new buildings were built each year in riga mostdubious   discuss of them in art nouveau style and most of them outside the old town
",riga largest collections art nouveau buildings world buildings fact end th beginning th centuries art nouveau height popularity riga experienced unprecedented financial demographic boom period population grew middle class riga acquired wealth build imposing apartment blocks outside city walls local architects graduates riga technical university adopted current european movements particular art nouveau new buildings built year riga mostdubious discuss art nouveau style outside old town,8.37,"riga,largest,collections,art,nouveau,buildings,world,buildings,fact,end,th,beginning,th,centuries,art,nouveau,height,popularity,riga,experienced,unprecedented,financial,demographic,boom,period,population,grew,middle,class,riga,acquired,wealth,build,imposing,apartment,blocks,outside,city,walls,local,architects,graduates,riga,technical,university,adopted,current,european,movements,particular,art,nouveau,new,buildings,built,year,riga,mostdubious,discuss,art,nouveau,style,outside,old,town",0.00,riga
"riga art nouveau museum
",riga art nouveau museum,0.00,"riga,art,nouveau,museum",0.00,riga
"riga has a rich basketball history in the s rgas ask became the best club in the soviet union and also in europe winning the first three editions of the european cup for mens champions clubs from  to 
",riga rich basketball history rgas ask best club soviet union europe winning editions european cup mens champions clubs,9.95,"riga,rich,basketball,history,rgas,ask,best,club,soviet,union,europe,winning,editions,european,cup,mens,champions,clubs",0.00,riga
"in  ask was not the only team from riga to take the european crown ttt riga clinched their first title in the european cup for womens champion clubs turning riga into the capital city of european basketball because for the first and to date only time in the history of european basketball clubs from the same city were concurrent european mens and womens club champions
",ask team riga european crown ttt riga clinched title european cup womens champion clubs turning riga capital city european basketball date time history european basketball clubs city concurrent european mens womens club champions,8.65,"ask,team,riga,european,crown,ttt,riga,clinched,title,european,cup,womens,champion,clubs,turning,riga,capital,city,european,basketball,date,time,history,european,basketball,clubs,city,concurrent,european,mens,womens,club,champions",0.00,riga
"in  riga was one of the hosts for eurobasket 
",riga hosts eurobasket,13.04,"riga,hosts,eurobasket",0.00,riga
"riga with its central geographic position and concentration of population has always been the infrastructural hub of latvia several national roads begin in riga and european route e crosses riga from the east and west while the via baltica crosses riga from the south and north
",riga central geographic position concentration population infrastructural hub latvia national roads begin riga european route e crosses riga east west baltica crosses riga south north,7.55,"riga,central,geographic,position,concentration,population,infrastructural,hub,latvia,national,roads,begin,riga,european,route,e,crosses,riga,east,west,baltica,crosses,riga,south,north",0.00,riga
"as a city situated by a river riga also has several bridges the oldest standing bridge is the railway bridge which is also the only railroad carrying bridge in riga the stone bridge  connects old riga and prdaugava the island bridge  connects maskavas fortate and prdaugava via zausala and the shroud bridge  connects old riga and prdaugava via psala in  the first stage of the new southern bridge  route across the daugava was completed and was opened to traffic on  november
",city situated river riga bridges oldest standing bridge railway bridge railroad carrying bridge riga stone bridge connects old riga prdaugava island bridge connects maskavas fortate prdaugava zausala shroud bridge connects old riga prdaugava psala stage new southern bridge route daugava completed opened traffic november,7.76,"city,situated,river,riga,bridges,oldest,standing,bridge,railway,bridge,railroad,carrying,bridge,riga,stone,bridge,connects,old,riga,prdaugava,island,bridge,connects,maskavas,fortate,prdaugava,zausala,shroud,bridge,connects,old,riga,prdaugava,psala,stage,new,southern,bridge,route,daugava,completed,opened,traffic,november",0.00,riga
"the southern bridge was the biggest construction project in the baltic states in  years and its purpose was to reduce traffic congestion in the city centre another major construction project is the planned riga northern transport corridor its first segment detailed project was completed in 
",southern bridge biggest construction project baltic states years purpose reduce traffic congestion city centre major construction project planned riga northern transport corridor segment detailed project completed,6.51,"southern,bridge,biggest,construction,project,baltic,states,years,purpose,reduce,traffic,congestion,city,centre,major,construction,project,planned,riga,northern,transport,corridor,segment,detailed,project,completed",0.00,riga
