Unclean,Clean,Noise_Pre_Processing,Training_Data,Noise_Post_Processing,Query
"the freeport of riga facilitates cargo and passenger traffic by sea sea ferries connect riga passenger terminal to stockholm operated by tallink
riga has one active airport that serves commercial airlinesthe riga international airport  built in  renovation and modernisation of the airport was completed in  coinciding with the th anniversary of the city in  a new terminal extension was opened extension of the runway was completed in october  and the airport is now able to accommodate large aircraft such as the airbus a boeing    and  another terminal extension is under construction as of update the annual number of passengers has grown from  in  to  million in  making riga international airport the largest in the baltic states
",freeport riga facilitates cargo passenger traffic sea sea ferries connect riga passenger terminal stockholm operated tallinkriga active airport serves commercial airlinesthe riga international airport built renovation modernisation airport completed coinciding th anniversary city new terminal extension opened extension runway completed october airport able accommodate large aircraft airbus boeing terminal extension construction update annual number passengers grown million making riga international airport largest baltic states,6.93,"freeport,riga,facilitates,cargo,passenger,traffic,sea,sea,ferries,connect,riga,passenger,terminal,stockholm,operated,tallinkriga,active,airport,serves,commercial,airlinesthe,riga,international,airport,built,renovation,modernisation,airport,completed,coinciding,th,anniversary,city,new,terminal,extension,opened,extension,runway,completed,october,airport,able,accommodate,large,aircraft,airbus,boeing,terminal,extension,construction,update,annual,number,passengers,grown,million,making,riga,international,airport,largest,baltic,states",0.00,riga
"the former international airport of riga spilve airport located  km  from riga city centre is used for small aircraft pilot training and recreational aviation riga was also home to a military air base during the cold warrumbula air base
",international airport riga spilve airport located km riga city centre small aircraft pilot training recreational aviation riga home military air base cold warrumbula air base,5.91,"international,airport,riga,spilve,airport,located,km,riga,city,centre,small,aircraft,pilot,training,recreational,aviation,riga,home,military,air,base,cold,warrumbula,air,base",0.00,riga
"riga international coach terminal provides domestic and international connections by coach
",riga international coach terminal provides domestic international connections coach,2.20,"riga,international,coach,terminal,provides,domestic,international,connections,coach",0.00,riga
"as the population of riga city started to approach  million people in the s the city became eligible  for the construction of a subway system riga metro which would have been paid for by the soviet government however the population decline and shortage of funding following latvian independence put an end to this plan
",population riga city started approach million people city eligible construction subway system riga metro paid soviet government population decline shortage funding following latvian independence end plan,8.78,"population,riga,city,started,approach,million,people,city,eligible,construction,subway,system,riga,metro,paid,soviet,government,population,decline,shortage,funding,following,latvian,independence,end,plan",0.00,riga
"riga is connected to the rest of latvia by domestic trains operated by the national carrier passenger train whose headquarters are in riga the main railway station is the riga central station it has stops for public transport along the streets satekles iela  janvra iela marijas iela and merea iela there are also international rail services to russia and belarus and plans to revive passenger rail traffic with estonia international overnight service is with latvia express trains  a ten t project called rail baltica envisages building a high speed railway line via riga connecting tallinn to warsaw using standard gauge expected to be put into operation in  latvian railways  operates the latvian rail history museum in riga
",riga connected rest latvia domestic trains operated national carrier passenger train headquarters riga main railway station riga central station stops public transport streets satekles iela janvra iela marijas iela merea iela international rail services russia belarus plans revive passenger rail traffic estonia international overnight service latvia express trains project called rail baltica envisages building high speed railway line riga connecting tallinn warsaw standard gauge expected operation latvian railways operates latvian rail history museum riga,5.91,"riga,connected,rest,latvia,domestic,trains,operated,national,carrier,passenger,train,headquarters,riga,main,railway,station,riga,central,station,stops,public,transport,streets,satekles,iela,janvra,iela,marijas,iela,merea,iela,international,rail,services,russia,belarus,plans,revive,passenger,rail,traffic,estonia,international,overnight,service,latvia,express,trains,project,called,rail,baltica,envisages,building,high,speed,railway,line,riga,connecting,tallinn,warsaw,standard,gauge,expected,operation,latvian,railways,operates,latvian,rail,history,museum,riga",0.00,riga
"riga is twinned with
",riga twinned,9.52,"riga,twinned",0.00,riga
