Unclean,Clean,Noise_Pre_Processing,Training_Data,Noise_Post_Processing,Query
"the decline culminated in a controversy over succession to the throne which consumed the first years of the th century the war of the spanish succession was a wide ranging international conflict combined with a civil war and was to cost the kingdom its european possessions and its position as one of the leading powers on the continent
",decline culminated controversy succession throne consumed years th century war spanish succession wide ranging international conflict combined civil war cost kingdom european possessions position leading powers continent,9.20,"decline,culminated,controversy,succession,throne,consumed,years,th,century,war,spanish,succession,wide,ranging,international,conflict,combined,civil,war,cost,kingdom,european,possessions,position,leading,powers,continent",0.00,spanish
"in  spain went to war against the revolutionary new french republic as a member of the first coalition the subsequent war of the pyrenees polarised the country in a reaction against the gallicised elites and following defeat in the field peace was made with france in  at the peace of basel in which spain lost control over two thirds of the island of hispaniola in  a secret treaty between napoleon and the unpopular prime minister led to a new declaration of war against britain and portugal french troops entered the country to invade portugal but instead occupied spains major fortresses the spanish king abdicated and a puppet kingdom satellite to the french empire was installed with napoleons brother joseph bonaparte as king
",spain went war revolutionary new french republic member coalition subsequent war pyrenees polarised country reaction gallicised elites following defeat field peace france peace basel spain lost control thirds island hispaniola secret treaty napoleon unpopular prime minister led new declaration war britain portugal french troops entered country invade portugal instead occupied spains major fortresses spanish king abdicated puppet kingdom satellite french empire installed napoleons brother joseph bonaparte king,7.50,"spain,went,war,revolutionary,new,french,republic,member,coalition,subsequent,war,pyrenees,polarised,country,reaction,gallicised,elites,following,defeat,field,peace,france,peace,basel,spain,lost,control,thirds,island,hispaniola,secret,treaty,napoleon,unpopular,prime,minister,led,new,declaration,war,britain,portugal,french,troops,entered,country,invade,portugal,instead,occupied,spains,major,fortresses,spanish,king,abdicated,puppet,kingdom,satellite,french,empire,installed,napoleons,brother,joseph,bonaparte,king",0.00,spanish
"further military action by spanish armies guerrilla warfare and an anglo portuguese allied army combined with napoleons failure on the russian front led to the retreat of french imperial armies from the iberian peninsula in  and the return of king ferdinand vii
",military action spanish armies guerrilla warfare anglo portuguese allied army combined napoleons failure russian led retreat french imperial armies iberian peninsula return king ferdinand vii,6.49,"military,action,spanish,armies,guerrilla,warfare,anglo,portuguese,allied,army,combined,napoleons,failure,russian,led,retreat,french,imperial,armies,iberian,peninsula,return,king,ferdinand,vii",0.00,spanish
"during the war in  a revolutionary body the cortes of cdiz was assembled to co ordinate the effort against the bonapartist regime and to prepare a constitution it met as one body and its members represented the entire spanish empire in  a constitution for universal representation under a constitutional monarchy was declared but after the fall of the bonapartist regime the spanish king dismissed the cortes generales set on ruling as an absolute monarch
",war revolutionary body cortes cdiz assembled co ordinate effort bonapartist regime prepare constitution met body members represented entire spanish empire constitution universal representation constitutional monarchy declared fall bonapartist regime spanish king dismissed cortes generales set ruling absolute monarch,7.89,"war,revolutionary,body,cortes,cdiz,assembled,co,ordinate,effort,bonapartist,regime,prepare,constitution,met,body,members,represented,entire,spanish,empire,constitution,universal,representation,constitutional,monarchy,declared,fall,bonapartist,regime,spanish,king,dismissed,cortes,generales,set,ruling,absolute,monarch",0.00,spanish
"the french occupation of mainland spain created an opportunity for overseas criollo elites who resented the privilege towards peninsular elites and demanded retroversion of the sovereignty to the people starting in  the american colonies began a series of revolutions and declared independence leading to the spanish american wars of independence that put an end to the metropoles grip over the spanish main attempts to re assert control proved futile with opposition not only in the colonies but also in the iberian peninsula and army revolts followed led by liberal officers by the end of  the only american colonies spain held were cuba and puerto rico
",french occupation mainland spain created opportunity overseas criollo elites resented privilege peninsular elites demanded retroversion sovereignty people starting american colonies began series revolutions declared independence leading spanish american wars independence end metropoles grip spanish main attempts assert control proved futile opposition colonies iberian peninsula army revolts followed led liberal officers end american colonies spain held cuba puerto rico,7.16,"french,occupation,mainland,spain,created,opportunity,overseas,criollo,elites,resented,privilege,peninsular,elites,demanded,retroversion,sovereignty,people,starting,american,colonies,began,series,revolutions,declared,independence,leading,spanish,american,wars,independence,end,metropoles,grip,spanish,main,attempts,assert,control,proved,futile,opposition,colonies,iberian,peninsula,army,revolts,followed,led,liberal,officers,end,american,colonies,spain,held,cuba,puerto,rico",0.00,spanish
"although the period around the turn of the century was one of increasing prosperity the th century brought little social peace spain played a minor part in the scramble for africa with the colonisation of western sahara spanish morocco and spanish guinea it remained neutral during world war i the heavy losses suffered by the colonial troops in conflicts in northern morocco against riffians forces brought discredit to the government and undermined the monarchy
",period turn century increasing prosperity th century brought little social peace spain played minor scramble africa colonisation western sahara spanish morocco spanish guinea remained neutral world war heavy losses suffered colonial troops conflicts northern morocco riffians forces brought discredit government undermined monarchy,6.90,"period,turn,century,increasing,prosperity,th,century,brought,little,social,peace,spain,played,minor,scramble,africa,colonisation,western,sahara,spanish,morocco,spanish,guinea,remained,neutral,world,war,heavy,losses,suffered,colonial,troops,conflicts,northern,morocco,riffians,forces,brought,discredit,government,undermined,monarchy",0.00,spanish
"industrialisation the development of railways and incipient capitalism developed in several areas of the country particularly in barcelona as well as labour movement and socialist and anarchist ideas the  barcelona universal exposition and the  barcelona labour congress are good examples of this in  the spanish socialist workers party was founded a trade union linked to this party unin general de trabajadores was founded in  in the anarcho sindicalist trend of the labour movement in spain confederacin nacional del trabajo was founded in  and federacin anarquista ibrica in 
",industrialisation development railways incipient capitalism developed areas country particularly barcelona labour movement socialist anarchist ideas barcelona universal exposition barcelona labour congress good examples spanish socialist workers party founded trade union linked party unin general de trabajadores founded anarcho sindicalist trend labour movement spain confederacin nacional del trabajo founded federacin anarquista ibrica,6.21,"industrialisation,development,railways,incipient,capitalism,developed,areas,country,particularly,barcelona,labour,movement,socialist,anarchist,ideas,barcelona,universal,exposition,barcelona,labour,congress,good,examples,spanish,socialist,workers,party,founded,trade,union,linked,party,unin,general,de,trabajadores,founded,anarcho,sindicalist,trend,labour,movement,spain,confederacin,nacional,del,trabajo,founded,federacin,anarquista,ibrica",0.00,spanish
"the spanish civil war broke out in  on  and  july part of the military carried out a coup dtat that triumphed in only part of the country the situation led to a civil war in which the territory was divided into two zones one under the authority of the republican government that counted on outside support from the soviet union and mexico  and the other controlled by the putschists  most critically supported by nazi germany and fascist italy the republic was not supported by the western powers due to the british led policy of non intervention general francisco franco was sworn in as the supreme leader of the rebels on  october  an uneasy relationship between the republican government and the grassroots anarchists who had initiated a partial social revolution also ensued
",spanish civil war broke july military carried coup dtat triumphed country situation led civil war territory divided zones authority republican government counted outside support soviet union mexico controlled putschists critically supported nazi germany fascist italy republic supported western powers british led policy non intervention general francisco franco sworn supreme leader rebels october uneasy relationship republican government grassroots anarchists initiated partial social revolution ensued,8.73,"spanish,civil,war,broke,july,military,carried,coup,dtat,triumphed,country,situation,led,civil,war,territory,divided,zones,authority,republican,government,counted,outside,support,soviet,union,mexico,controlled,putschists,critically,supported,nazi,germany,fascist,italy,republic,supported,western,powers,british,led,policy,non,intervention,general,francisco,franco,sworn,supreme,leader,rebels,october,uneasy,relationship,republican,government,grassroots,anarchists,initiated,partial,social,revolution,ensued",0.00,spanish
"the regime remained chiefly neutral from a nominal standpoint in the second world war  although it was sympathetic to the axis and provided the nazi wehrmacht with spanish volunteers in the eastern front the only legal party under francos dictatorship was the falange espaola tradicionalista y de las jons  formed in  upon the merging of the fascist falange espaola de las jons and the carlist traditionalists and to which the rest of right wing groups supporting the rebels also added the name of movimiento nacional sometimes understood as a wider structure than the fet y de las jons proper largely imposed over the laters name in official documents along the s
",regime remained chiefly neutral nominal standpoint second world war sympathetic axis provided nazi wehrmacht spanish volunteers eastern legal party francos dictatorship falange espaola tradicionalista de las jons formed merging fascist falange espaola de las jons carlist traditionalists rest right wing groups supporting rebels added movimiento nacional understood wider structure fet de las jons proper largely imposed laters official documents,7.82,"regime,remained,chiefly,neutral,nominal,standpoint,second,world,war,sympathetic,axis,provided,nazi,wehrmacht,spanish,volunteers,eastern,legal,party,francos,dictatorship,falange,espaola,tradicionalista,de,las,jons,formed,merging,fascist,falange,espaola,de,las,jons,carlist,traditionalists,rest,right,wing,groups,supporting,rebels,added,movimiento,nacional,understood,wider,structure,fet,de,las,jons,proper,largely,imposed,laters,official,documents",0.00,spanish
"with francos death in november  juan carlos succeeded to the position of king of spain and head of state in accordance with the francoist law with the approval of the new spanish constitution of  and the restoration of democracy the state devolved much authority to the regions and created an internal organisation based on autonomous communities the spanish  amnesty law let people of francos regime continue inside institutions without consequences even perpetrators of some crimes during transition to democracy like the massacre of  march  in vitoria or  massacre of atocha
",francos death november juan carlos succeeded position king spain head state accordance francoist law approval new spanish constitution restoration democracy state devolved authority regions created internal organisation based autonomous communities spanish amnesty law let people francos regime continue inside institutions consequences perpetrators crimes transition democracy like massacre march vitoria massacre atocha,6.75,"francos,death,november,juan,carlos,succeeded,position,king,spain,head,state,accordance,francoist,law,approval,new,spanish,constitution,restoration,democracy,state,devolved,authority,regions,created,internal,organisation,based,autonomous,communities,spanish,amnesty,law,let,people,francos,regime,continue,inside,institutions,consequences,perpetrators,crimes,transition,democracy,like,massacre,march,vitoria,massacre,atocha",0.00,spanish
"during the s the democratic restoration made possible a growing open society new cultural movements based on freedom appeared like la movida madrilea in may  spain joined nato followed by a referendum after a strong social opposition that year the spanish socialist workers party  came to power the first left wing government in  years in  spain joined the european economic community which later became the european union the psoe was replaced in government by the partido popular  in  after scandals around participation of the government of felipe gonzlez in the dirty war against eta at that point the psoe had served almost  consecutive years in office
",democratic restoration possible growing open society new cultural movements based freedom appeared like la movida madrilea spain joined nato followed referendum strong social opposition year spanish socialist workers party came power left wing government years spain joined european economic community later european union psoe replaced government partido popular scandals participation government felipe gonzlez dirty war eta point psoe served consecutive years office,6.69,"democratic,restoration,possible,growing,open,society,new,cultural,movements,based,freedom,appeared,like,la,movida,madrilea,spain,joined,nato,followed,referendum,strong,social,opposition,year,spanish,socialist,workers,party,came,power,left,wing,government,years,spain,joined,european,economic,community,later,european,union,psoe,replaced,government,partido,popular,scandals,participation,government,felipe,gonzlez,dirty,war,eta,point,psoe,served,consecutive,years,office",0.00,spanish
"in  the prestige oil spill occurred with big ecological consequences along spains atlantic coastline in  jos mara aznar supported us president george w bush in the iraq war and a strong movement against war rose in spanish society in march  a local islamist terrorist group inspired by al qaeda carried out the largest terrorist attack in western european history when they killed  people and wounded more than  others by bombing commuter trains in madrid though initial suspicions focused on the basque terrorist group eta evidence of islamist involvement soon emerged because of the proximity of the  spanish general election the issue of responsibility quickly became a political controversy with the main competing parties pp and psoe exchanging accusations over the handling of the incident the psoe won the election led by jos luis rodrguez zapatero
",prestige oil spill occurred big ecological consequences spains atlantic coastline jos mara aznar supported president george w bush iraq war strong movement war rose spanish society march local islamist terrorist group inspired al qaeda carried largest terrorist attack western european history killed people wounded bombing commuter trains madrid initial suspicions focused basque terrorist group eta evidence islamist involvement soon emerged proximity spanish general election issue responsibility quickly political controversy main competing parties pp psoe exchanging accusations handling incident psoe election led jos luis rodrguez zapatero,5.84,"prestige,oil,spill,occurred,big,ecological,consequences,spains,atlantic,coastline,jos,mara,aznar,supported,president,george,w,bush,iraq,war,strong,movement,war,rose,spanish,society,march,local,islamist,terrorist,group,inspired,al,qaeda,carried,largest,terrorist,attack,western,european,history,killed,people,wounded,bombing,commuter,trains,madrid,initial,suspicions,focused,basque,terrorist,group,eta,evidence,islamist,involvement,soon,emerged,proximity,spanish,general,election,issue,responsibility,quickly,political,controversy,main,competing,parties,pp,psoe,exchanging,accusations,handling,incident,psoe,election,led,jos,luis,rodrguez,zapatero",0.00,spanish
"in the early s the proportion of spains foreign born population increased rapidly during its economic boom but then declined due to the financial crisis in  the spanish government legalised same sex marriage becoming the third country worldwide to do so decentralisation was supported with much resistance of constitutional court and conservative opposition so did gender politics like quotas or the law against gender violence government talks with eta happened and the group announced its permanent cease of violence in 
",early proportion spains foreign born population increased rapidly economic boom declined financial crisis spanish government legalised sex marriage country worldwide decentralisation supported resistance constitutional court conservative opposition gender politics like quotas law gender violence government talks eta happened group announced permanent cease violence,7.07,"early,proportion,spains,foreign,born,population,increased,rapidly,economic,boom,declined,financial,crisis,spanish,government,legalised,sex,marriage,country,worldwide,decentralisation,supported,resistance,constitutional,court,conservative,opposition,gender,politics,like,quotas,law,gender,violence,government,talks,eta,happened,group,announced,permanent,cease,violence",0.00,spanish
"the bursting of the spanish property bubble in  led to the  spanish financial crisis high levels of unemployment cuts in government spending and corruption in royal family and peoples party served as a backdrop to the  spanish protests catalan independentism also rose in  mariano rajoys conservative peoples party won the election with  of votes as prime minister he implemented austerity measures for eu bailout the eu stability and growth pact on  june  the monarch juan carlos abdicated in favour of his son who became felipe vi
",bursting spanish property bubble led spanish financial crisis high levels unemployment cuts government spending corruption royal family peoples party served backdrop spanish protests catalan independentism rose mariano rajoys conservative peoples party election votes prime minister implemented austerity measures eu bailout eu stability growth pact june monarch juan carlos abdicated favour son felipe vi,6.19,"bursting,spanish,property,bubble,led,spanish,financial,crisis,high,levels,unemployment,cuts,government,spending,corruption,royal,family,peoples,party,served,backdrop,spanish,protests,catalan,independentism,rose,mariano,rajoys,conservative,peoples,party,election,votes,prime,minister,implemented,austerity,measures,eu,bailout,eu,stability,growth,pact,june,monarch,juan,carlos,abdicated,favour,son,felipe,vi",0.00,spanish
"in october  a catalan independence referendum was held and the catalan parliament voted to unilaterally declare independence from spain to form a catalan republic on the day the spanish senate was discussing approving direct rule over catalonia as called for by the spanish prime minister on the same day the senate granted the power to impose direct rule and rajoy dissolved the catalan parliament and called a new election no country recognised catalonia as a separate state
",october catalan independence referendum held catalan parliament voted unilaterally declare independence spain form catalan republic day spanish senate discussing approving direct rule catalonia called spanish prime minister day senate granted power impose direct rule rajoy dissolved catalan parliament called new election country recognised catalonia separate state,6.50,"october,catalan,independence,referendum,held,catalan,parliament,voted,unilaterally,declare,independence,spain,form,catalan,republic,day,spanish,senate,discussing,approving,direct,rule,catalonia,called,spanish,prime,minister,day,senate,granted,power,impose,direct,rule,rajoy,dissolved,catalan,parliament,called,new,election,country,recognised,catalonia,separate,state",0.00,spanish
"spain also includes the balearic islands in the mediterranean sea the canary islands in the atlantic ocean and a number of uninhabited islands on the mediterranean side of the strait of gibraltar known as plazas de soberana  such as the chafarinas islands and alhucemas the peninsula of de vlez de la gomera is also regarded as a plaza de soberana the isle of alborn located in the mediterranean between spain and north africa is also administered by spain specifically by the municipality of almera andalusia the little pheasant island in the river bidasoa is a spanish french condominium
",spain includes balearic islands mediterranean sea canary islands atlantic ocean number uninhabited islands mediterranean strait gibraltar known plazas de soberana chafarinas islands alhucemas peninsula de vlez de la gomera regarded plaza de soberana isle alborn located mediterranean spain north africa administered spain specifically municipality almera andalusia little pheasant island river bidasoa spanish french condominium,7.46,"spain,includes,balearic,islands,mediterranean,sea,canary,islands,atlantic,ocean,number,uninhabited,islands,mediterranean,strait,gibraltar,known,plazas,de,soberana,chafarinas,islands,alhucemas,peninsula,de,vlez,de,la,gomera,regarded,plaza,de,soberana,isle,alborn,located,mediterranean,spain,north,africa,administered,spain,specifically,municipality,almera,andalusia,little,pheasant,island,river,bidasoa,spanish,french,condominium",0.00,spanish
"there are  major islands in spain all of them having their own governing bodies  these islands are specifically mentioned by the spanish constitution when fixing its senatorial representation  these islands include tenerife gran canaria lanzarote fuerteventura la palma la gomera and el hierro in the canarian archipelago and mallorca ibiza menorca and formentera in the balearic archipelago
",major islands spain governing bodies islands specifically mentioned spanish constitution fixing senatorial representation islands include tenerife gran canaria lanzarote fuerteventura la palma la gomera el hierro canarian archipelago mallorca ibiza menorca formentera balearic archipelago,5.87,"major,islands,spain,governing,bodies,islands,specifically,mentioned,spanish,constitution,fixing,senatorial,representation,islands,include,tenerife,gran,canaria,lanzarote,fuerteventura,la,palma,la,gomera,el,hierro,canarian,archipelago,mallorca,ibiza,menorca,formentera,balearic,archipelago",0.00,spanish
"the constitutional history of spain dates back to the constitution of  in june  spains new king juan carlos dismissed carlos arias navarro and appointed the reformer adolfo surez as prime minister the resulting general election in  convened the constituent cortes  for the purpose of drafting and approving the constitution of  after a national referendum on  december   of voters approved of the new constitution  a culmination of the spanish transition to democracy
",constitutional history spain dates constitution june spains new king juan carlos dismissed carlos arias navarro appointed reformer adolfo surez prime minister resulting general election convened constituent cortes purpose drafting approving constitution national referendum december voters approved new constitution culmination spanish transition democracy,6.20,"constitutional,history,spain,dates,constitution,june,spains,new,king,juan,carlos,dismissed,carlos,arias,navarro,appointed,reformer,adolfo,surez,prime,minister,resulting,general,election,convened,constituent,cortes,purpose,drafting,approving,constitution,national,referendum,december,voters,approved,new,constitution,culmination,spanish,transition,democracy",0.00,spanish
"as a result spain is now composed of  autonomous communities and two autonomous cities with varying degrees of autonomy thanks to its constitution which nevertheless explicitly states the indivisible unity of the spanish nation the constitution also specifies that spain has no state religion and that all are free to practice and believe as they wish
",result spain composed autonomous communities autonomous cities varying degrees autonomy thanks constitution explicitly states indivisible unity spanish nation constitution specifies spain state religion free practice believe wish,8.24,"result,spain,composed,autonomous,communities,autonomous,cities,varying,degrees,autonomy,thanks,constitution,explicitly,states,indivisible,unity,spanish,nation,constitution,specifies,spain,state,religion,free,practice,believe,wish",0.00,spanish
