Unclean,Clean,Noise_Pre_Processing,Training_Data,Noise_Post_Processing,Query
"in the s the british sought to re establish their control over sudan once more officially in the name of the egyptian khedive but in actuality treating the country as a british colony by the early s british french and belgian claims had converged at the nile headwaters britain feared that the other powers would take advantage of sudans instability to acquire territory previously annexed to egypt apart from these political considerations britain wanted to establish control over the nile to safeguard a planned irrigation dam at aswan herbert kitchener led military campaigns against the mahdist sudan from  to  kitcheners campaigns culminated in a decisive victory in the battle of omdurman on  september  a year later the battle of umm diwaykarat on  november  resulted in the death of abdallahi ibn muhammad subsequently bringing to the end of the mahdist war
",british sought establish control sudan officially egyptian khedive actuality treating country british colony early british french belgian claims converged nile headwaters britain feared powers advantage sudans instability acquire territory previously annexed egypt apart political considerations britain wanted establish control nile safeguard planned irrigation dam aswan herbert kitchener led military campaigns mahdist sudan kitcheners campaigns culminated decisive victory battle omdurman september year later battle umm diwaykarat november resulted death abdallahi ibn muhammad subsequently bringing end mahdist war,7.39,"british,sought,establish,control,sudan,officially,egyptian,khedive,actuality,treating,country,british,colony,early,british,french,belgian,claims,converged,nile,headwaters,britain,feared,powers,advantage,sudans,instability,acquire,territory,previously,annexed,egypt,apart,political,considerations,britain,wanted,establish,control,nile,safeguard,planned,irrigation,dam,aswan,herbert,kitchener,led,military,campaigns,mahdist,sudan,kitcheners,campaigns,culminated,decisive,victory,battle,omdurman,september,year,later,battle,umm,diwaykarat,november,resulted,death,abdallahi,ibn,muhammad,subsequently,bringing,end,mahdist,war",0.00,sudan
"in  britain and egypt reached an agreement under which sudan was run by a governor general appointed by egypt with british consent in reality sudan was effectively administered as a crown colony the british were keen to reverse the process started under muhammad ali pasha of uniting the nile valley under egyptian leadership and sought to frustrate all efforts aimed at further uniting the two countriescitation needed
",britain egypt reached agreement sudan run governor general appointed egypt british consent reality sudan effectively administered crown colony british keen reverse process started muhammad ali pasha uniting nile valley egyptian leadership sought frustrate efforts aimed uniting countriescitation needed,6.90,"britain,egypt,reached,agreement,sudan,run,governor,general,appointed,egypt,british,consent,reality,sudan,effectively,administered,crown,colony,british,keen,reverse,process,started,muhammad,ali,pasha,uniting,nile,valley,egyptian,leadership,sought,frustrate,efforts,aimed,uniting,countriescitation,needed",0.00,sudan
"under the delimitation sudans border with abyssinia was contested by raiding tribesmen trading slaves breaching boundaries of the law  in  local chieftain sultan yambio reluctant to the end gave up the struggle with british forces that had occupied the kordofan region finally ending the lawlessness the continued british administration of sudan fuelled an increasingly strident nationalist backlash with egyptian nationalist leaders determined to force britain to recognise a single independent union of egypt and sudan with a formal end to ottoman rule in  sir reginald wingate was sent that december to occupy sudan as the new military governor hussein kamel was declared sultan of egypt and sudan as was his brother and successor fuad i they continued upon their insistence of a single egyptian sudanese state even when the sultanate of egypt was retitled as the kingdom of egypt and sudan but it was saad zaghloul who continued to be frustrated in the ambitions until his death in 
",delimitation sudans border abyssinia contested raiding tribesmen trading slaves breaching boundaries law local chieftain sultan yambio reluctant end gave struggle british forces occupied kordofan region finally ending lawlessness continued british administration sudan fuelled increasingly strident nationalist backlash egyptian nationalist leaders determined force britain recognise single independent union egypt sudan formal end ottoman rule sir reginald wingate sent december occupy sudan new military governor hussein kamel declared sultan egypt sudan brother successor fuad continued insistence single egyptian sudanese state sultanate egypt retitled kingdom egypt sudan saad zaghloul continued frustrated ambitions death,6.89,"delimitation,sudans,border,abyssinia,contested,raiding,tribesmen,trading,slaves,breaching,boundaries,law,local,chieftain,sultan,yambio,reluctant,end,gave,struggle,british,forces,occupied,kordofan,region,finally,ending,lawlessness,continued,british,administration,sudan,fuelled,increasingly,strident,nationalist,backlash,egyptian,nationalist,leaders,determined,force,britain,recognise,single,independent,union,egypt,sudan,formal,end,ottoman,rule,sir,reginald,wingate,sent,december,occupy,sudan,new,military,governor,hussein,kamel,declared,sultan,egypt,sudan,brother,successor,fuad,continued,insistence,single,egyptian,sudanese,state,sultanate,egypt,retitled,kingdom,egypt,sudan,saad,zaghloul,continued,frustrated,ambitions,death",0.00,sudan
"from  until independence in  the british had a policy of running sudan as two essentially separate territories the north and south the assassination of a governor general of anglo egyptian sudan in cairo was the causative factor it brought demands of the newly elected wafd government from colonial forces a permanent establishment of two battalions in khartoum was renamed the sudan defence force acting as under the government replacing the former garrison of egyptian army soldiers saw action afterward during the walwal incident the wafdist parliamentary majority had rejected sarwat pashas accommodation plan with austen chamberlain in london yet cairo still needed the money the sudanese governments revenue had reached a peak in  at  million thereafter the wafdist disruptions and italian borders incursions from somaliland london decided to reduce expenditure during the great depression cotton and gum exports were dwarfed by the necessity to import almost everything from britain leading to a balance of payments deficit at khartoum
",independence british policy running sudan essentially separate territories north south assassination governor general anglo egyptian sudan cairo causative factor brought demands newly elected wafd government colonial forces permanent establishment battalions khartoum renamed sudan defence force acting government replacing garrison egyptian army soldiers saw action afterward walwal incident wafdist parliamentary majority rejected sarwat pashas accommodation plan austen chamberlain london cairo needed money sudanese governments revenue reached peak million wafdist disruptions italian borders incursions somaliland london decided reduce expenditure great depression cotton gum exports dwarfed necessity import britain leading balance payments deficit khartoum,6.42,"independence,british,policy,running,sudan,essentially,separate,territories,north,south,assassination,governor,general,anglo,egyptian,sudan,cairo,causative,factor,brought,demands,newly,elected,wafd,government,colonial,forces,permanent,establishment,battalions,khartoum,renamed,sudan,defence,force,acting,government,replacing,garrison,egyptian,army,soldiers,saw,action,afterward,walwal,incident,wafdist,parliamentary,majority,rejected,sarwat,pashas,accommodation,plan,austen,chamberlain,london,cairo,needed,money,sudanese,governments,revenue,reached,peak,million,wafdist,disruptions,italian,borders,incursions,somaliland,london,decided,reduce,expenditure,great,depression,cotton,gum,exports,dwarfed,necessity,import,britain,leading,balance,payments,deficit,khartoum",0.00,sudan
"in july  the liberal constitutional leader muhammed mahmoud was persuaded to bring wafd delegates to london to sign the anglo egyptian treaty the beginning of a new stage in anglo egyptian relations wrote anthony eden the british army was allowed to return to sudan to protect the canal zone they were able to find training facilities and the raf was free to fly over egyptian territory it did not however resolve the problem of sudan the sudanese intelligentsia agitated for a return to metropolitan rule conspiring with germanys agents
",july liberal constitutional leader muhammed mahmoud persuaded bring wafd delegates london sign anglo egyptian treaty beginning new stage anglo egyptian relations wrote anthony eden british army allowed return sudan protect canal zone able find training facilities raf free fly egyptian territory resolve problem sudan sudanese intelligentsia agitated return metropolitan rule conspiring germanys agents,6.69,"july,liberal,constitutional,leader,muhammed,mahmoud,persuaded,bring,wafd,delegates,london,sign,anglo,egyptian,treaty,beginning,new,stage,anglo,egyptian,relations,wrote,anthony,eden,british,army,allowed,return,sudan,protect,canal,zone,able,find,training,facilities,raf,free,fly,egyptian,territory,resolve,problem,sudan,sudanese,intelligentsia,agitated,return,metropolitan,rule,conspiring,germanys,agents",0.00,sudan
"mussolini made it clear that he could not invade abyssinia without first conquering egypt and sudan they intended unification of libya with italian east africa the british imperial general staff prepared for military defence of the region which was thin on the ground the british ambassador blocked italian attempts to secure a non aggression treaty with egypt sudan but mahmoud was a supporter of the grand mufti of jerusalem the region was caught between the empires efforts to save the jews and moderate arab calls to halt migration
",mussolini clear invade abyssinia conquering egypt sudan intended unification libya italian east africa british imperial general staff prepared military defence region thin ground british ambassador blocked italian attempts secure non aggression treaty egypt sudan mahmoud supporter grand mufti jerusalem region caught empires efforts save jews moderate arab calls halt migration,7.09,"mussolini,clear,invade,abyssinia,conquering,egypt,sudan,intended,unification,libya,italian,east,africa,british,imperial,general,staff,prepared,military,defence,region,thin,ground,british,ambassador,blocked,italian,attempts,secure,non,aggression,treaty,egypt,sudan,mahmoud,supporter,grand,mufti,jerusalem,region,caught,empires,efforts,save,jews,moderate,arab,calls,halt,migration",0.00,sudan
"the sudanese government was directly involved militarily in the east african campaign formed in  the sudan defence force played an active part in responding to incursions early in world war two  italian troops occupied kassala and other border areas from italian somaliland during   in  the sdf also played a part in the invasion of the italian colony by british and commonwealth forces  the last british governor general was robert george howe
",sudanese government directly involved militarily east african campaign formed sudan defence force played active responding incursions early world war italian troops occupied kassala border areas italian somaliland sdf played invasion italian colony british commonwealth forces british governor general robert george howe,6.74,"sudanese,government,directly,involved,militarily,east,african,campaign,formed,sudan,defence,force,played,active,responding,incursions,early,world,war,italian,troops,occupied,kassala,border,areas,italian,somaliland,sdf,played,invasion,italian,colony,british,commonwealth,forces,british,governor,general,robert,george,howe",0.00,sudan
"the egyptian revolution of  finally heralded the beginning of the march towards sudanese independence having abolished the monarchy in  egypts new leaders mohammed naguib whose mother was sudanese and later gamal abdel nasser believed the only way to end british domination in sudan was for egypt to officially abandon its claims of sovereignty in addition nasser knew it would be difficult for egypt to govern an impoverished sudan after its independence the british on the other hand continued their political and financial support for the mahdist successor abd al rahman al mahdi whom it was believed would resist egyptian pressure for sudanese independence  rahman was capable of this but his regime was plagued by political ineptitude which garnered a colossal loss of support in northern and central sudan both egypt and britain sensed a great instability fomenting and thus opted to allow both sudanese regions north and south to have a free vote on whether they wished independence or a british withdrawal
",egyptian revolution finally heralded beginning march sudanese independence abolished monarchy egypts new leaders mohammed naguib mother sudanese later gamal abdel nasser believed way end british domination sudan egypt officially abandon claims sovereignty addition nasser knew difficult egypt govern impoverished sudan independence british hand continued political financial support mahdist successor abd al rahman al mahdi believed resist egyptian pressure sudanese independence rahman capable regime plagued political ineptitude garnered colossal loss support northern central sudan egypt britain sensed great instability fomenting opted allow sudanese regions north south free vote wished independence british withdrawal,7.00,"egyptian,revolution,finally,heralded,beginning,march,sudanese,independence,abolished,monarchy,egypts,new,leaders,mohammed,naguib,mother,sudanese,later,gamal,abdel,nasser,believed,way,end,british,domination,sudan,egypt,officially,abandon,claims,sovereignty,addition,nasser,knew,difficult,egypt,govern,impoverished,sudan,independence,british,hand,continued,political,financial,support,mahdist,successor,abd,al,rahman,al,mahdi,believed,resist,egyptian,pressure,sudanese,independence,rahman,capable,regime,plagued,political,ineptitude,garnered,colossal,loss,support,northern,central,sudan,egypt,britain,sensed,great,instability,fomenting,opted,allow,sudanese,regions,north,south,free,vote,wished,independence,british,withdrawal",0.00,sudan
"until the early s sudans agricultural output was mostly dedicated to internal consumption in  the sudanese government became more pro western and made plans to export food and cash crops however commodity prices declined throughout the s causing economic problems for sudan at the same time debt servicing costs from the money spent mechanizing agriculture rose in  the imf negotiated a structural adjustment program with the government this further promoted the mechanised export agriculture sector this caused great hardship for the pastoralists of sudan  in  the ansars had mounted a bloody but unsuccessful coup attempt but in july  president nimeiry met with ansar leader sadiq al mahdi opening the way for a possible reconciliation hundreds of political prisoners were released and in august a general amnesty was announced for all oppositionists
",early sudans agricultural output dedicated internal consumption sudanese government pro western plans export food cash crops commodity prices declined causing economic problems sudan time debt servicing costs money spent mechanizing agriculture rose imf negotiated structural adjustment program government promoted mechanised export agriculture sector caused great hardship pastoralists sudan ansars mounted bloody unsuccessful coup attempt july president nimeiry met ansar leader sadiq al mahdi opening way possible reconciliation hundreds political prisoners released august general amnesty announced oppositionists,6.45,"early,sudans,agricultural,output,dedicated,internal,consumption,sudanese,government,pro,western,plans,export,food,cash,crops,commodity,prices,declined,causing,economic,problems,sudan,time,debt,servicing,costs,money,spent,mechanizing,agriculture,rose,imf,negotiated,structural,adjustment,program,government,promoted,mechanised,export,agriculture,sector,caused,great,hardship,pastoralists,sudan,ansars,mounted,bloody,unsuccessful,coup,attempt,july,president,nimeiry,met,ansar,leader,sadiq,al,mahdi,opening,way,possible,reconciliation,hundreds,political,prisoners,released,august,general,amnesty,announced,oppositionists",0.00,sudan
"in the  general election he was the only candidate by law to run for election sudan became a one party state under the national congress party  during the s hassan al turabi then speaker of the national assembly reached out to islamic fundamentalist groups and invited osama bin laden to the country the united states subsequently listed sudan as a state sponsor of terrorism following al qaedas bombing of the yous embassies in kenya and tanzania the yous launched operation infinite reach and targeted the al shifa pharmaceutical factory which the yous government falsely believed was producing chemical weapons for the terrorist group al turabis influence began to wane and others in favour of more pragmatic leadership tried to change sudans international isolation the country worked to appease its critics by expelling members of the egyptian islamic jihad and encouraging bin laden to leave
",general election candidate law run election sudan party state national congress party hassan al turabi speaker national assembly reached islamic fundamentalist groups invited osama bin laden country united states subsequently listed sudan state sponsor terrorism following al qaedas bombing yous embassies kenya tanzania yous launched operation infinite reach targeted al shifa pharmaceutical factory yous government falsely believed producing chemical weapons terrorist group al turabis influence began wane favour pragmatic leadership tried change sudans international isolation country worked appease critics expelling members egyptian islamic jihad encouraging bin laden leave,6.24,"general,election,candidate,law,run,election,sudan,party,state,national,congress,party,hassan,al,turabi,speaker,national,assembly,reached,islamic,fundamentalist,groups,invited,osama,bin,laden,country,united,states,subsequently,listed,sudan,state,sponsor,terrorism,following,al,qaedas,bombing,yous,embassies,kenya,tanzania,yous,launched,operation,infinite,reach,targeted,al,shifa,pharmaceutical,factory,yous,government,falsely,believed,producing,chemical,weapons,terrorist,group,al,turabis,influence,began,wane,favour,pragmatic,leadership,tried,change,sudans,international,isolation,country,worked,appease,critics,expelling,members,egyptian,islamic,jihad,encouraging,bin,laden,leave",0.00,sudan
"before the  presidential election al turabi introduced a bill to reduce the presidents powers prompting al bashir to order a dissolution and declare a state of emergency  when al turabi urged a boycott of the presidents re election campaign signing agreement with sudan peoples liberation army al bashir suspected they were plotting to overthrow the government hassan al turabi was jailed later the same year
",presidential election al turabi introduced bill reduce presidents powers prompting al bashir order dissolution declare state emergency al turabi urged boycott presidents election campaign signing agreement sudan peoples liberation army al bashir suspected plotting overthrow government hassan al turabi jailed later year,5.62,"presidential,election,al,turabi,introduced,bill,reduce,presidents,powers,prompting,al,bashir,order,dissolution,declare,state,emergency,al,turabi,urged,boycott,presidents,election,campaign,signing,agreement,sudan,peoples,liberation,army,al,bashir,suspected,plotting,overthrow,government,hassan,al,turabi,jailed,later,year",0.00,sudan
"in february  the sudan liberation movementarmy  and justice and equality movement  groups in darfur took up arms accusing the sudanese government of oppressing non arab sudanese in favor of sudanese arabs precipitating the war in darfur the conflict has since been described as a genocide and the international criminal court  in the hague has issued two arrest warrants for al bashir arabic speaking nomadic militias known as the janjaweed stand accused of many atrocities
",february sudan liberation movementarmy justice equality movement groups darfur took arms accusing sudanese government oppressing non arab sudanese favor sudanese arabs precipitating war darfur conflict described genocide international criminal court hague issued arrest warrants al bashir arabic speaking nomadic militias known janjaweed stand accused atrocities,6.12,"february,sudan,liberation,movementarmy,justice,equality,movement,groups,darfur,took,arms,accusing,sudanese,government,oppressing,non,arab,sudanese,favor,sudanese,arabs,precipitating,war,darfur,conflict,described,genocide,international,criminal,court,hague,issued,arrest,warrants,al,bashir,arabic,speaking,nomadic,militias,known,janjaweed,stand,accused,atrocities",0.00,sudan
"on  january  the government signed the nairobi comprehensive peace agreement with the sudan peoples liberation movement  with the objective of ending the second sudanese civil war  the united nations mission in sudan  was established under the un security council resolution  to support its implementation the peace agreement was a prerequisite to the  referendum the result was a unanimous vote in favour of secession of south sudan the region of abyei will hold its own referendum at a future date
",january government signed nairobi comprehensive peace agreement sudan peoples liberation movement objective ending second sudanese civil war united nations mission sudan established un security council resolution support implementation peace agreement prerequisite referendum result unanimous vote favour secession south sudan region abyei hold referendum future date,6.80,"january,government,signed,nairobi,comprehensive,peace,agreement,sudan,peoples,liberation,movement,objective,ending,second,sudanese,civil,war,united,nations,mission,sudan,established,un,security,council,resolution,support,implementation,peace,agreement,prerequisite,referendum,result,unanimous,vote,favour,secession,south,sudan,region,abyei,hold,referendum,future,date",0.00,sudan
"the sudan peoples liberation army  was the primary member of the eastern front a coalition of rebel groups operating in eastern sudan after the peace agreement their place was taken in february  after the merger of the larger fulani and beja congress with the smaller rashaida free lions a peace agreement between the sudanese government and the eastern front was signed on  october  in asmara  on  may  the darfur peace agreement was signed aiming at ending the conflict which had continued for three years up to this point the chadsudan conflict  had erupted after the battle of adr triggered a declaration of war by chad the leaders of sudan and chad signed an agreement in saudi arabia on  may  to stop fighting from the darfur conflict spilling along their countries  kilometre  border
",sudan peoples liberation army primary member eastern coalition rebel groups operating eastern sudan peace agreement place taken february merger larger fulani beja congress smaller rashaida free lions peace agreement sudanese government eastern signed october asmara darfur peace agreement signed aiming ending conflict continued years point chadsudan conflict erupted battle adr triggered declaration war chad leaders sudan chad signed agreement saudi arabia stop fighting darfur conflict spilling countries kilometre border,7.96,"sudan,peoples,liberation,army,primary,member,eastern,coalition,rebel,groups,operating,eastern,sudan,peace,agreement,place,taken,february,merger,larger,fulani,beja,congress,smaller,rashaida,free,lions,peace,agreement,sudanese,government,eastern,signed,october,asmara,darfur,peace,agreement,signed,aiming,ending,conflict,continued,years,point,chadsudan,conflict,erupted,battle,adr,triggered,declaration,war,chad,leaders,sudan,chad,signed,agreement,saudi,arabia,stop,fighting,darfur,conflict,spilling,countries,kilometre,border",0.00,sudan
"in july  the country was hit by devastating floods with over  people being directly affected since  a series of ongoing conflicts between rival nomadic tribes in sudan and south sudan have caused a large number of civilian casualties
",july country hit devastating floods people directly affected series ongoing conflicts rival nomadic tribes sudan south sudan caused large number civilian casualties,6.84,"july,country,hit,devastating,floods,people,directly,affected,series,ongoing,conflicts,rival,nomadic,tribes,sudan,south,sudan,caused,large,number,civilian,casualties",0.00,sudan
