Unclean,Clean,Noise_Pre_Processing,Training_Data,Noise_Post_Processing,Query
"the democratic progressive party the largest pan green party officially seeks independence but in practice also supports the status quo because neither independence nor unification seems likely in the short or even medium term in  taiwanese premier william lai of the democratic progressive party said that he was a political worker who advocates taiwan independence but that as taiwan was already an independent country called the republic of china it had no need to declare independence
",democratic progressive party largest pan green party officially seeks independence practice supports status quo independence unification likely short medium term taiwanese premier william lai democratic progressive party said political worker advocates taiwan independence taiwan independent country called republic china need declare independence,6.95,"democratic,progressive,party,largest,pan,green,party,officially,seeks,independence,practice,supports,status,quo,independence,unification,likely,short,medium,term,taiwanese,premier,william,lai,democratic,progressive,party,said,political,worker,advocates,taiwan,independence,taiwan,independent,country,called,republic,china,need,declare,independence",0.00,china
"the government of the republic of china was founded on the  constitution of the roc and its three principles of the people which states that the roc shall be a democratic republic of the people to be governed by the people and for the people it underwent significant revisions in the s known collectively as the additional articles the government is divided into five branches  the executive yuan  the legislative yuan  the judicial yuan the control yuan  and the examination yuan 
",government republic china founded constitution roc principles people states roc shall democratic republic people governed people people underwent significant revisions known collectively additional articles government divided branches executive yuan legislative yuan judicial yuan control yuan examination yuan,9.13,"government,republic,china,founded,constitution,roc,principles,people,states,roc,shall,democratic,republic,people,governed,people,people,underwent,significant,revisions,known,collectively,additional,articles,government,divided,branches,executive,yuan,legislative,yuan,judicial,yuan,control,yuan,examination,yuan",0.00,china
"the examination yuan is in charge of validating the qualification of civil servants it is based on the old imperial examination system used in dynastic china it can be compared to the european personnel selection office of the european union or the office of personnel management of the united states it was downsized in  and there have been calls for its abolition
",examination yuan charge validating qualification civil servants based old imperial examination system dynastic china compared european personnel selection office european union office personnel management united states downsized calls abolition,9.02,"examination,yuan,charge,validating,qualification,civil,servants,based,old,imperial,examination,system,dynastic,china,compared,european,personnel,selection,office,european,union,office,personnel,management,united,states,downsized,calls,abolition",0.00,china
"the constitution was drafted in by the kmt while the roc still governed the chinese mainland went into effect on  december  the roc remained under martial law from  until  and much of the constitution was not in effect political reforms beginning in the late s resulted in the end of martial law in  and taiwan transformed into a multiparty democracy in the early s the constitutional basis for this transition to democracy was gradually laid in the additional articles of the constitution of the republic of china in addition these articles localized the constitution by suspending portions of the constitution designed for the governance of mainland china and replacing them with articles adapted for the governance of and guaranteeing the political rights of residents of the taiwan area as defined in the act governing relations between the people of the taiwan area and the mainland area
",constitution drafted kmt roc governed chinese mainland went effect december roc remained martial law constitution effect political reforms beginning late resulted end martial law taiwan transformed multiparty democracy early constitutional basis transition democracy gradually laid additional articles constitution republic china addition articles localized constitution suspending portions constitution designed governance mainland china replacing articles adapted governance guaranteeing political rights residents taiwan area defined act governing relations people taiwan area mainland area,8.51,"constitution,drafted,kmt,roc,governed,chinese,mainland,went,effect,december,roc,remained,martial,law,constitution,effect,political,reforms,beginning,late,resulted,end,martial,law,taiwan,transformed,multiparty,democracy,early,constitutional,basis,transition,democracy,gradually,laid,additional,articles,constitution,republic,china,addition,articles,localized,constitution,suspending,portions,constitution,designed,governance,mainland,china,replacing,articles,adapted,governance,guaranteeing,political,rights,residents,taiwan,area,defined,act,governing,relations,people,taiwan,area,mainland,area",0.00,china
"national boundaries were not explicitly prescribed by the  constitution and the constitutional court declined to define these boundaries in a  interpretation viewing the question as a political question to be resolved by the executive and legislative yuans the  constitution included articles regarding representatives from former qing dynasty territories including tibet and mongolia  the roc recognized mongolia as an independent country in  after signing the  sino soviet treaty of friendship and alliance but after retreating to taiwan in  it reneged on its agreement in order to preserve its claim over mainland china the additional articles of the s did not alter national boundaries but suspended articles regarding mongolian and tibetan representatives the roc began to accept the mongolian passport and removed clauses referring to outer mongolia from the act governing relations between the people of the taiwan area and the mainland area in  in  the mainland affairs council issued a statement clarifying that outer mongolia was not part of the rocs national territory in  and that the termination of the sino soviet treaty had not altered national territory according to the constitution the mongolian and tibetan affairs commission in the executive yuan was abolished in 
",national boundaries explicitly prescribed constitution constitutional court declined define boundaries interpretation viewing question political question resolved executive legislative yuans constitution included articles representatives qing dynasty territories including tibet mongolia roc recognized mongolia independent country signing sino soviet treaty friendship alliance retreating taiwan reneged agreement order preserve claim mainland china additional articles alter national boundaries suspended articles mongolian tibetan representatives roc began accept mongolian passport removed clauses referring outer mongolia act governing relations people taiwan area mainland area mainland affairs council issued statement clarifying outer mongolia rocs national territory termination sino soviet treaty altered national territory according constitution mongolian tibetan affairs commission executive yuan abolished,7.00,"national,boundaries,explicitly,prescribed,constitution,constitutional,court,declined,define,boundaries,interpretation,viewing,question,political,question,resolved,executive,legislative,yuans,constitution,included,articles,representatives,qing,dynasty,territories,including,tibet,mongolia,roc,recognized,mongolia,independent,country,signing,sino,soviet,treaty,friendship,alliance,retreating,taiwan,reneged,agreement,order,preserve,claim,mainland,china,additional,articles,alter,national,boundaries,suspended,articles,mongolian,tibetan,representatives,roc,began,accept,mongolian,passport,removed,clauses,referring,outer,mongolia,act,governing,relations,people,taiwan,area,mainland,area,mainland,affairs,council,issued,statement,clarifying,outer,mongolia,rocs,national,territory,termination,sino,soviet,treaty,altered,national,territory,according,constitution,mongolian,tibetan,affairs,commission,executive,yuan,abolished",0.00,china
"taiwans political scene is divided into two major camps in terms of cross strait relations that is how taiwan should relate to china or the prc the pan green coalition  leans pro independence and the pan blue coalition  leans pro unification moderates in both camps regard the republic of china as a sovereign independent state but the pan green coalition regard the roc as synonymous with taiwan while moderates in the pan blue coalition view it as synonymous with china these positions formed against the backdrop of the prcs anti secession law which threatens invasion in the event of formal independencecitation needed
",taiwans political scene divided major camps terms cross strait relations taiwan relate china prc pan green coalition leans pro independence pan blue coalition leans pro unification moderates camps regard republic china sovereign independent state pan green coalition regard roc synonymous taiwan moderates pan blue coalition view synonymous china positions formed backdrop prcs anti secession law threatens invasion event formal independencecitation needed,6.58,"taiwans,political,scene,divided,major,camps,terms,cross,strait,relations,taiwan,relate,china,prc,pan,green,coalition,leans,pro,independence,pan,blue,coalition,leans,pro,unification,moderates,camps,regard,republic,china,sovereign,independent,state,pan,green,coalition,regard,roc,synonymous,taiwan,moderates,pan,blue,coalition,view,synonymous,china,positions,formed,backdrop,prcs,anti,secession,law,threatens,invasion,event,formal,independencecitation,needed",0.00,china
"the pan green coalition is mainly led by the pro independence democratic progressive party  taiwan statebuilding party   and green party  they oppose the idea that taiwan is part of china and seek wide diplomatic recognition and an eventual declaration of formal taiwan independence in september  the then ruling dpp approved a resolution asserting separate identity from china and called for the enactment of a new constitution for a normal country it called also for general use of taiwan as the countrys name without abolishing its formal name the republic of china the name taiwan has been used increasingly often after the emergence of the taiwanese independence movement some members of the coalition such as former president chen shui bian argue that it is unnecessary to proclaim independence because taiwan is already an independent sovereign country and the republic of china is the same as taiwan despite being a member of kmt prior to and during his presidency lee teng hui also held a similar view and was a supporter of the taiwanization movement tsp and gpt have adopted a line that aggressive route more than the dpp in order to win over pro independence voters who are dissatisfied with the dpps conservative stance
",pan green coalition mainly led pro independence democratic progressive party taiwan statebuilding party green party oppose idea taiwan china seek wide diplomatic recognition eventual declaration formal taiwan independence september ruling dpp approved resolution asserting separate identity china called enactment new constitution normal country called general use taiwan countrys abolishing formal republic china taiwan increasingly emergence taiwanese independence movement members coalition president chen shui bian argue unnecessary proclaim independence taiwan independent sovereign country republic china taiwan despite member kmt prior presidency lee teng hui held similar view supporter taiwanization movement tsp gpt adopted line aggressive route dpp order win pro independence voters dissatisfied dpps conservative stance,7.95,"pan,green,coalition,mainly,led,pro,independence,democratic,progressive,party,taiwan,statebuilding,party,green,party,oppose,idea,taiwan,china,seek,wide,diplomatic,recognition,eventual,declaration,formal,taiwan,independence,september,ruling,dpp,approved,resolution,asserting,separate,identity,china,called,enactment,new,constitution,normal,country,called,general,use,taiwan,countrys,abolishing,formal,republic,china,taiwan,increasingly,emergence,taiwanese,independence,movement,members,coalition,president,chen,shui,bian,argue,unnecessary,proclaim,independence,taiwan,independent,sovereign,country,republic,china,taiwan,despite,member,kmt,prior,presidency,lee,teng,hui,held,similar,view,supporter,taiwanization,movement,tsp,gpt,adopted,line,aggressive,route,dpp,order,win,pro,independence,voters,dissatisfied,dpps,conservative,stance",0.00,china
"the pan blue coalition composed of the pro unification kuomintang  people first party  and new party generally support the spirit of the  consensus where the kmt claimed that there is one china but that the roc and prc have different interpretations of what china means they favour eventual unification with china regarding independence the mainstream pan blue position is to maintain the status quo while refusing immediate unification president ma ying jeou stated that there will be no unification nor declaration of independence during his presidency some pan blue members seek to improve relationships with prc with a focus on improving economic ties
",pan blue coalition composed pro unification kuomintang people party new party generally support spirit consensus kmt claimed china roc prc different interpretations china means favour eventual unification china independence mainstream pan blue position maintain status quo refusing immediate unification president ying jeou stated unification declaration independence presidency pan blue members seek improve relationships prc focus improving economic ties,6.86,"pan,blue,coalition,composed,pro,unification,kuomintang,people,party,new,party,generally,support,spirit,consensus,kmt,claimed,china,roc,prc,different,interpretations,china,means,favour,eventual,unification,china,independence,mainstream,pan,blue,position,maintain,status,quo,refusing,immediate,unification,president,ying,jeou,stated,unification,declaration,independence,presidency,pan,blue,members,seek,improve,relationships,prc,focus,improving,economic,ties",0.00,china
"roughly  per cent of taiwans population are descendants of han chinese immigrants from qing china between  and  another significant fraction descends from han chinese who immigrated from mainland china in the late s and early s the shared cultural origin combined with several hundred years of geographical separation some hundred years of political separation and foreign influences as well as hostility between the rival roc and prc have resulted in national identity being a contentious issue with political overtones
",roughly cent taiwans population descendants han chinese immigrants qing china significant fraction descends han chinese immigrated mainland china late early shared cultural origin combined years geographical separation years political separation foreign influences hostility rival roc prc resulted national identity contentious issue political overtones,6.91,"roughly,cent,taiwans,population,descendants,han,chinese,immigrants,qing,china,significant,fraction,descends,han,chinese,immigrated,mainland,china,late,early,shared,cultural,origin,combined,years,geographical,separation,years,political,separation,foreign,influences,hostility,rival,roc,prc,resulted,national,identity,contentious,issue,political,overtones",0.00,china
"since democratic reforms and the lifting of martial law a distinct taiwanese identity  is often at the heart of political debates its acceptance makes the island distinct from mainland china and therefore may be seen as a step towards forming a consensus for de jure taiwan independence the pan green camp supports a predominantly taiwanese identity  while the pan blue camp supports a predominantly chinese identity  the kmt has downplayed this stance in the recent years and now supports a taiwanese identity as part of a chinese identity
",democratic reforms lifting martial law distinct taiwanese identity heart political debates acceptance makes island distinct mainland china seen step forming consensus de jure taiwan independence pan green camp supports predominantly taiwanese identity pan blue camp supports predominantly chinese identity kmt downplayed stance recent years supports taiwanese identity chinese identity,7.21,"democratic,reforms,lifting,martial,law,distinct,taiwanese,identity,heart,political,debates,acceptance,makes,island,distinct,mainland,china,seen,step,forming,consensus,de,jure,taiwan,independence,pan,green,camp,supports,predominantly,taiwanese,identity,pan,blue,camp,supports,predominantly,chinese,identity,kmt,downplayed,stance,recent,years,supports,taiwanese,identity,chinese,identity",0.00,china
"according to the  constitution the territory of the roc is according to its existing national boundaries the roc is de jure constitutionally divided into provinceszh special municipalities  and the province level tibet area each province is subdivided into cities and counties which are further divided into townships and county administered cities each having elected mayors and city councillors who share duties with the county some divisions are indigenous divisions which have different degrees of autonomy to standard ones in addition districts cities and townships are further divided into villages and neighbourhoods the provinces have been streamlined and are no longer functional similarly banners in both mongolia and mainland china  also existed but they were abolished in  and the roc reaffirmed its recognition of mongolia in  as stipulated in the  constitution
",according constitution territory roc according existing national boundaries roc de jure constitutionally divided provinceszh special municipalities province level tibet area province subdivided cities counties divided townships county administered cities elected mayors city councillors share duties county divisions indigenous divisions different degrees autonomy standard ones addition districts cities townships divided villages neighbourhoods provinces streamlined longer functional similarly banners mongolia mainland china existed abolished roc reaffirmed recognition mongolia stipulated constitution,7.08,"according,constitution,territory,roc,according,existing,national,boundaries,roc,de,jure,constitutionally,divided,provinceszh,special,municipalities,province,level,tibet,area,province,subdivided,cities,counties,divided,townships,county,administered,cities,elected,mayors,city,councillors,share,duties,county,divisions,indigenous,divisions,different,degrees,autonomy,standard,ones,addition,districts,cities,townships,divided,villages,neighbourhoods,provinces,streamlined,longer,functional,similarly,banners,mongolia,mainland,china,existed,abolished,roc,reaffirmed,recognition,mongolia,stipulated,constitution",0.00,china
"when the roc retreated to taiwan in  its claimed territory consisted of  provinces  special municipalities  special administrative region and  autonomous regions however since its retreat the roc has controlled only taiwan province and some islands of fujian province the roc also controls the pratas islands and taiping island in the spratly islands which are part of the disputed south china sea islands they were placed under kaohsiung administration after the retreat to taiwan
",roc retreated taiwan claimed territory consisted provinces special municipalities special administrative region autonomous regions retreat roc controlled taiwan province islands fujian province roc controls pratas islands taiping island spratly islands disputed south china sea islands placed kaohsiung administration retreat taiwan,6.85,"roc,retreated,taiwan,claimed,territory,consisted,provinces,special,municipalities,special,administrative,region,autonomous,regions,retreat,roc,controlled,taiwan,province,islands,fujian,province,roc,controls,pratas,islands,taiping,island,spratly,islands,disputed,south,china,sea,islands,placed,kaohsiung,administration,retreat,taiwan",0.00,china
"the republic of china army takes its roots in the national revolutionary army which was established by sun yat sen in  in guangdong with a goal of reunifying china under the kuomintang when the peoples liberation army won the chinese civil war much of the national revolutionary army retreated to taiwan along with the government it was later reformed into the republic of china army units which surrendered and remained in mainland china were either disbanded or incorporated into the peoples liberation army
",republic china army takes roots national revolutionary army established sun yat sen guangdong goal reunifying china kuomintang peoples liberation army chinese civil war national revolutionary army retreated taiwan government later reformed republic china army units surrendered remained mainland china disbanded incorporated peoples liberation army,7.65,"republic,china,army,takes,roots,national,revolutionary,army,established,sun,yat,sen,guangdong,goal,reunifying,china,kuomintang,peoples,liberation,army,chinese,civil,war,national,revolutionary,army,retreated,taiwan,government,later,reformed,republic,china,army,units,surrendered,remained,mainland,china,disbanded,incorporated,peoples,liberation,army",0.00,china
"from  to the s the primary mission of the taiwanese military was to retake mainland china through project national glory as this mission has transitioned away from attack because the relative strength of the prc has massively increased the roc military has begun to shift emphasis from the traditionally dominant army to the air force and navy control of the armed forces has also passed into the hands of the civilian government
",primary mission taiwanese military retake mainland china project national glory mission transitioned away attack relative strength prc massively increased roc military begun shift emphasis traditionally dominant army air force navy control armed forces passed hands civilian government,8.14,"primary,mission,taiwanese,military,retake,mainland,china,project,national,glory,mission,transitioned,away,attack,relative,strength,prc,massively,increased,roc,military,begun,shift,emphasis,traditionally,dominant,army,air,force,navy,control,armed,forces,passed,hands,civilian,government",0.00,china
"there is no guarantee in the taiwan relations act or any other treaty that the united states will defend taiwan even in the event of invasion on several occasions in  and  yous president joe biden stated that the united states will intervene if the prc attempts to invade taiwan however when asked about the answer the white house officials insisted that us policy on taiwan has not changed the joint declaration on security between the us and japan signed in  may imply that japan would be involved in any response however japan has refused to stipulate whether the area surrounding japan mentioned in the pact includes taiwan and the precise purpose of the pact is unclear the australia new zealand united states security treaty  may mean that other us allies such as australia could theoretically be involved while this would risk damaging economic ties with china a conflict over taiwan could lead to an economic blockade of china by a greater coalition
",guarantee taiwan relations act treaty united states defend taiwan event invasion occasions yous president joe biden stated united states intervene prc attempts invade taiwan asked answer white house officials insisted policy taiwan changed joint declaration security japan signed imply japan involved response japan refused stipulate area surrounding japan mentioned pact includes taiwan precise purpose pact unclear australia new zealand united states security treaty mean allies australia theoretically involved risk damaging economic ties china conflict taiwan lead economic blockade china greater coalition,8.46,"guarantee,taiwan,relations,act,treaty,united,states,defend,taiwan,event,invasion,occasions,yous,president,joe,biden,stated,united,states,intervene,prc,attempts,invade,taiwan,asked,answer,white,house,officials,insisted,policy,taiwan,changed,joint,declaration,security,japan,signed,imply,japan,involved,response,japan,refused,stipulate,area,surrounding,japan,mentioned,pact,includes,taiwan,precise,purpose,pact,unclear,australia,new,zealand,united,states,security,treaty,mean,allies,australia,theoretically,involved,risk,damaging,economic,ties,china,conflict,taiwan,lead,economic,blockade,china,greater,coalition",0.00,china
