Unclean,Clean,Noise_Pre_Processing,Training_Data,Noise_Post_Processing,Query
"in the  cairo declaration us uk and roc representatives specified territories such as formosa and the pescadores to be restored by japan to the republic of china its terms were later referred to in the  potsdam declaration whose provisions japan agreed to carry out in its instrument of surrender in september  following japans surrender in wwii roc forces assisted by small american teams prepared an amphibious lift into taiwan to accept the surrender of the japanese military forces there under general order no  and take over the administration of taiwan on  october general rikichi and governor general of taiwan and commander in chief of all japanese forces on the island signed the receipt and handed it over to roc general chen yi to complete the official turnover chen proclaimed that day to be taiwan retrocession day but the allies having entrusted taiwan and the penghu islands to chinese administration and military occupation nonetheless considered them to be under japanese sovereignty until  when the treaty of san francisco took effect due to disagreements over which government  to invite china did not attend the eventual signing of the treaty of san francisco whereby japan renounced all titles and claims to formosa and the pescadores without specifying to whom they were surrendered in  japan and the roc signed the treaty of taipei recognizing that all treaties concluded before  december  between china and japan have become null and void interpretations of these documents and their legal implications give rise to the debate over the sovereignty status of taiwan
",cairo declaration uk roc representatives specified territories formosa pescadores restored japan republic china terms later referred potsdam declaration provisions japan agreed carry instrument surrender september following japans surrender wwii roc forces assisted small american teams prepared amphibious lift taiwan accept surrender japanese military forces general order administration taiwan october general rikichi governor general taiwan commander chief japanese forces island signed receipt handed roc general chen yi complete official turnover chen proclaimed day taiwan retrocession day allies entrusted taiwan penghu islands chinese administration military occupation nonetheless considered japanese sovereignty treaty san francisco took effect disagreements government invite china attend eventual signing treaty san francisco japan renounced titles claims formosa pescadores specifying surrendered japan roc signed treaty taipei recognizing treaties concluded december china japan null void interpretations documents legal implications rise debate sovereignty status taiwan,7.61,"cairo,declaration,uk,roc,representatives,specified,territories,formosa,pescadores,restored,japan,republic,china,terms,later,referred,potsdam,declaration,provisions,japan,agreed,carry,instrument,surrender,september,following,japans,surrender,wwii,roc,forces,assisted,small,american,teams,prepared,amphibious,lift,taiwan,accept,surrender,japanese,military,forces,general,order,administration,taiwan,october,general,rikichi,governor,general,taiwan,commander,chief,japanese,forces,island,signed,receipt,handed,roc,general,chen,yi,complete,official,turnover,chen,proclaimed,day,taiwan,retrocession,day,allies,entrusted,taiwan,penghu,islands,chinese,administration,military,occupation,nonetheless,considered,japanese,sovereignty,treaty,san,francisco,took,effect,disagreements,government,invite,china,attend,eventual,signing,treaty,san,francisco,japan,renounced,titles,claims,formosa,pescadores,specifying,surrendered,japan,roc,signed,treaty,taipei,recognizing,treaties,concluded,december,china,japan,null,void,interpretations,documents,legal,implications,rise,debate,sovereignty,status,taiwan",0.00,china
"after the end of world war ii the chinese civil war resumed between the chinese nationalists  led by generalissimo chiang kai shek and the chinese communist party  led by ccp chairman mao zedong throughout the months of  a series of chinese communist offensives led to the capture of its capital nanjing on  april and the subsequent defeat of the nationalist army on the mainland and the communists founded the peoples republic of china on  october
",end world war ii chinese civil war resumed chinese nationalists led generalissimo chiang kai shek chinese communist party led ccp chairman mao zedong months series chinese communist offensives led capture capital nanjing april subsequent defeat nationalist army mainland communists founded peoples republic china october,6.90,"end,world,war,ii,chinese,civil,war,resumed,chinese,nationalists,led,generalissimo,chiang,kai,shek,chinese,communist,party,led,ccp,chairman,mao,zedong,months,series,chinese,communist,offensives,led,capture,capital,nanjing,april,subsequent,defeat,nationalist,army,mainland,communists,founded,peoples,republic,china,october",0.00,china
"on  december  after the loss of four capitals chiang evacuated his nationalist government to taiwan and made taipei the temporary capital of the roc  some  million people consisting mainly of soldiers members of the ruling kuomintang and intellectual and business elites were evacuated from mainland china to taiwan at that time adding to the earlier population of approximately six million these people came to be known in taiwan as waisheng ren  residents who came to the island in the s and s after japans surrender as well as their descendants in addition the roc government took to taipei many national treasures and much of chinas gold and foreign currency reserves most of the  million ounces of gold brought to taiwan was used to pay soldiers salaries  ounces of the remaining gold was used to issue the new taiwan dollar part of a price stabilization program to slow the inflation in taiwan
",december loss capitals chiang evacuated nationalist government taiwan taipei temporary capital roc million people consisting mainly soldiers members ruling kuomintang intellectual business elites evacuated mainland china taiwan time adding earlier population approximately million people came known taiwan waisheng ren residents came island japans surrender descendants addition roc government took taipei national treasures chinas gold foreign currency reserves million ounces gold brought taiwan pay soldiers salaries ounces remaining gold issue new taiwan dollar price stabilization program slow inflation taiwan,8.11,"december,loss,capitals,chiang,evacuated,nationalist,government,taiwan,taipei,temporary,capital,roc,million,people,consisting,mainly,soldiers,members,ruling,kuomintang,intellectual,business,elites,evacuated,mainland,china,taiwan,time,adding,earlier,population,approximately,million,people,came,known,taiwan,waisheng,ren,residents,came,island,japans,surrender,descendants,addition,roc,government,took,taipei,national,treasures,chinas,gold,foreign,currency,reserves,million,ounces,gold,brought,taiwan,pay,soldiers,salaries,ounces,remaining,gold,issue,new,taiwan,dollar,price,stabilization,program,slow,inflation,taiwan",0.00,china
"after losing control of mainland china in  the roc retained control of taiwan and penghu  parts of fujian specifically kinmen wuqiu  and the matsu islands and two major islands in the south china sea  these territories have remained under roc governance until the present day the roc also briefly retained control of the entirety of hainan  parts of zhejiang specifically the dachen islands and yijiangshan islandsand portions of tibet qinghai sinkiang and yunnan the communists captured hainan in  captured the dachen islands and yijiangshan islands during the first taiwan strait crisis in  and defeated the roc revolts in northwest china in  roc forces in yunnan province entered burma and thailand in the s and were defeated by communists in  ever since losing control of mainland china the kuomintang continued to claim sovereignty over  of china which it defined to include mainland china  taiwan  outer mongolia and other minor territories
",losing control mainland china roc retained control taiwan penghu parts fujian specifically kinmen wuqiu matsu islands major islands south china sea territories remained roc governance present day roc briefly retained control entirety hainan parts zhejiang specifically dachen islands yijiangshan islandsand portions tibet qinghai sinkiang yunnan communists captured hainan captured dachen islands yijiangshan islands taiwan strait crisis defeated roc revolts northwest china roc forces yunnan province entered burma thailand defeated communists losing control mainland china kuomintang continued claim sovereignty china defined include mainland china taiwan outer mongolia minor territories,6.44,"losing,control,mainland,china,roc,retained,control,taiwan,penghu,parts,fujian,specifically,kinmen,wuqiu,matsu,islands,major,islands,south,china,sea,territories,remained,roc,governance,present,day,roc,briefly,retained,control,entirety,hainan,parts,zhejiang,specifically,dachen,islands,yijiangshan,islandsand,portions,tibet,qinghai,sinkiang,yunnan,communists,captured,hainan,captured,dachen,islands,yijiangshan,islands,taiwan,strait,crisis,defeated,roc,revolts,northwest,china,roc,forces,yunnan,province,entered,burma,thailand,defeated,communists,losing,control,mainland,china,kuomintang,continued,claim,sovereignty,china,defined,include,mainland,china,taiwan,outer,mongolia,minor,territories",0.00,china
"combat between both sides of the chinese civil war continued through the s following the eruption of the korean war us president harry s truman decided to intervene in the context of the cold war and dispatched the united states seventh fleet into the taiwan strait to prevent hostilities between the roc on taiwan and the prc on the mainland the united states also passed legislations such as the sino american mutual defense treaty and the formosa resolution of  thereby granting substantial foreign aid to the kmt regime between  and  the us foreign aid fully stabilized prices in taiwan by  the kmt government instituted many laws and land reforms that it had never effectively enacted on mainland china economic development was encouraged by american aid and programs such as the joint commission on rural reconstruction which turned the agricultural sector into the basis for later growth under the combined stimulus of the land reform and the agricultural development programs agricultural production increased at an average annual rate of  percent from  to  which was greater than the population growth  percent the government also implemented a policy of import substitution industrialization attempting to produce imported goods domestically the policy promoted the development of textile food and other labor intensive industries in the s and continued into the next decade
",combat sides chinese civil war continued following eruption korean war president harry truman decided intervene context cold war dispatched united states seventh fleet taiwan strait prevent hostilities roc taiwan prc mainland united states passed legislations sino american mutual defense treaty formosa resolution granting substantial foreign aid kmt regime foreign aid fully stabilized prices taiwan kmt government instituted laws land reforms effectively enacted mainland china economic development encouraged american aid programs joint commission rural reconstruction turned agricultural sector basis later growth combined stimulus land reform agricultural development programs agricultural production increased average annual rate percent greater population growth percent government implemented policy import substitution industrialization attempting produce imported goods domestically policy promoted development textile food labor intensive industries continued decade,7.08,"combat,sides,chinese,civil,war,continued,following,eruption,korean,war,president,harry,truman,decided,intervene,context,cold,war,dispatched,united,states,seventh,fleet,taiwan,strait,prevent,hostilities,roc,taiwan,prc,mainland,united,states,passed,legislations,sino,american,mutual,defense,treaty,formosa,resolution,granting,substantial,foreign,aid,kmt,regime,foreign,aid,fully,stabilized,prices,taiwan,kmt,government,instituted,laws,land,reforms,effectively,enacted,mainland,china,economic,development,encouraged,american,aid,programs,joint,commission,rural,reconstruction,turned,agricultural,sector,basis,later,growth,combined,stimulus,land,reform,agricultural,development,programs,agricultural,production,increased,average,annual,rate,percent,greater,population,growth,percent,government,implemented,policy,import,substitution,industrialization,attempting,produce,imported,goods,domestically,policy,promoted,development,textile,food,labor,intensive,industries,continued,decade",0.00,china
"as the chinese civil war continued without truce the government built up military fortifications throughout taiwan within this effort veterans built the now famous central cross island highway through the taroko gorge in the s during the second taiwan strait crisis in  taiwans landscape saw nike hercules missiles added with the formation of missile batteries throughout the island the two sides would continue to engage in sporadic military clashes with seldom publicized details well into the s on the china coastal islands with an unknown number of night raids
",chinese civil war continued truce government built military fortifications taiwan effort veterans built famous central cross island highway taroko gorge second taiwan strait crisis taiwans landscape saw nike hercules missiles added formation missile batteries island sides continue engage sporadic military clashes seldom publicized details china coastal islands unknown number night raids,6.73,"chinese,civil,war,continued,truce,government,built,military,fortifications,taiwan,effort,veterans,built,famous,central,cross,island,highway,taroko,gorge,second,taiwan,strait,crisis,taiwans,landscape,saw,nike,hercules,missiles,added,formation,missile,batteries,island,sides,continue,engage,sporadic,military,clashes,seldom,publicized,details,china,coastal,islands,unknown,number,night,raids",0.00,china
"because of the cold war most western nations and the united nations regarded the roc as the sole legitimate government of china until the s eventually especially after the expulsion in the united nations most nations switched diplomatic recognition to the prc until the s the roc government was regarded by western critics as undemocratic for upholding martial law severely repressing any political opposition and controlling the media the kmt did not allow the creation of new parties and those that existed did not seriously compete with the kmt thus competitive democratic elections did not exist
",cold war western nations united nations regarded roc sole legitimate government china eventually especially expulsion united nations nations switched diplomatic recognition prc roc government regarded western critics undemocratic upholding martial law severely repressing political opposition controlling media kmt allow creation new parties existed seriously compete kmt competitive democratic elections exist,7.67,"cold,war,western,nations,united,nations,regarded,roc,sole,legitimate,government,china,eventually,especially,expulsion,united,nations,nations,switched,diplomatic,recognition,prc,roc,government,regarded,western,critics,undemocratic,upholding,martial,law,severely,repressing,political,opposition,controlling,media,kmt,allow,creation,new,parties,existed,seriously,compete,kmt,competitive,democratic,elections,exist",0.00,china
"after the death of chiang ching kuo in  lee teng hui succeeded him and became the first president born in taiwan lee gained control of the kmt and was elected for a full six year term by the national assembly in  while a student movement called for democratic reforms the movement called for items such as the dissolution of the national assembly which was composed of the first congress members elected mostly in mainland china during  and had held the seats without re election for more than four decades in response to the students protest lee promised to hold a national affairs conference on constitutional reform and institutional democratization the constitution court also handed down its constitutional interpretation saying that the first congress members who had not been re elected should cease exercising their powers by the end of  the interpretation helped pave the way for re elections of the congress including the national assembly and the legislative yuan
",death chiang ching kuo lee teng hui succeeded president born taiwan lee gained control kmt elected year term national assembly student movement called democratic reforms movement called items dissolution national assembly composed congress members elected mainland china held seats election decades response students protest lee promised hold national affairs conference constitutional reform institutional democratization constitution court handed constitutional interpretation saying congress members elected cease exercising powers end interpretation helped pave way elections congress including national assembly legislative yuan,8.31,"death,chiang,ching,kuo,lee,teng,hui,succeeded,president,born,taiwan,lee,gained,control,kmt,elected,year,term,national,assembly,student,movement,called,democratic,reforms,movement,called,items,dissolution,national,assembly,composed,congress,members,elected,mainland,china,held,seats,election,decades,response,students,protest,lee,promised,hold,national,affairs,conference,constitutional,reform,institutional,democratization,constitution,court,handed,constitutional,interpretation,saying,congress,members,elected,cease,exercising,powers,end,interpretation,helped,pave,way,elections,congress,including,national,assembly,legislative,yuan",0.00,china
"in  the national assembly resolved to abolish the temporary provisions against the communist rebellion and introduced the additional articles of the constitution seats of the congress were re allocated to be elected in the taiwan area the nominal representation of mainland china in the congress was ultimately brought to an end in  with reforms continued in the s more positions were decided by elections in  lee teng hui was re elected in the first direct presidential election
",national assembly resolved abolish temporary provisions communist rebellion introduced additional articles constitution seats congress allocated elected taiwan area nominal representation mainland china congress ultimately brought end reforms continued positions decided elections lee teng hui elected direct presidential election,8.12,"national,assembly,resolved,abolish,temporary,provisions,communist,rebellion,introduced,additional,articles,constitution,seats,congress,allocated,elected,taiwan,area,nominal,representation,mainland,china,congress,ultimately,brought,end,reforms,continued,positions,decided,elections,lee,teng,hui,elected,direct,presidential,election",0.00,china
"under lee the constitution of the roc was passed from former constitution of five powers to be more tripartite government of taiwan province was streamlined and provincial level elections were suspended taiwan underwent a process of localization in which taiwanese culture and history were promoted over a pan china viewpoint in contrast to earlier kmt policies assimilationist language policy was replaced with support for multiculturalism and official respect for aboriginal languages and other minorities with democratization the issue of the political status of taiwan gradually resurfaced as a controversial issue where previously the discussion of anything other than unification under the roc was a taboo during the years of lees administration lee and the kmt were involved in corruption controversies known as black gold politics the corruption and split of the kmt were considered as factors that contributed to the partys loss in the  presidential election
",lee constitution roc passed constitution powers tripartite government taiwan province streamlined provincial level elections suspended taiwan underwent process localization taiwanese culture history promoted pan china viewpoint contrast earlier kmt policies assimilationist language policy replaced support multiculturalism official respect aboriginal languages minorities democratization issue political status taiwan gradually resurfaced controversial issue previously discussion unification roc taboo years lees administration lee kmt involved corruption controversies known black gold politics corruption split kmt considered factors contributed partys loss presidential election,7.13,"lee,constitution,roc,passed,constitution,powers,tripartite,government,taiwan,province,streamlined,provincial,level,elections,suspended,taiwan,underwent,process,localization,taiwanese,culture,history,promoted,pan,china,viewpoint,contrast,earlier,kmt,policies,assimilationist,language,policy,replaced,support,multiculturalism,official,respect,aboriginal,languages,minorities,democratization,issue,political,status,taiwan,gradually,resurfaced,controversial,issue,previously,discussion,unification,roc,taboo,years,lees,administration,lee,kmt,involved,corruption,controversies,known,black,gold,politics,corruption,split,kmt,considered,factors,contributed,partys,loss,presidential,election",0.00,china
"chen announced in his inauguration speech that he would not declare independence as long as the prc had no intention to use military force after a recession in  chens reference to the existence of one country on each side of the taiwan strait undercut cross strait relations in  he pushed for the first national referendum on cross strait relations before he was re elected by a narrow margin of  percent in  and called for an end to the national unification council in  state run companies began changing their names dropping china references and including taiwan in their official titles the ruling dpp also passed a resolution supporting a separate identity from china and the enactment of a new constitution for a normal country in  referendums were held on the same day as the presidential election asking whether taiwan should join the un in the process chen alienated moderate constituents who supported the status quo and those with cross strait economic ties as well as creating tension with the mainland and disagreements with the united states chens administration was also dogged by public concerns over reduced economic growth legislative gridlock due to a pan blue opposition controlled legislative yuan and corruption investigations involving the first family as well as government officials lowering his ratings to the s near the end of his second term
",chen announced inauguration speech declare independence long prc intention use military force recession chens reference existence country taiwan strait undercut cross strait relations pushed national referendum cross strait relations elected narrow margin percent called end national unification council state run companies began changing names dropping china references including taiwan official titles ruling dpp passed resolution supporting separate identity china enactment new constitution normal country referendums held day presidential election asking taiwan join un process chen alienated moderate constituents supported status quo cross strait economic ties creating tension mainland disagreements united states chens administration dogged public concerns reduced economic growth legislative gridlock pan blue opposition controlled legislative yuan corruption investigations involving family government officials lowering ratings near end second term,7.60,"chen,announced,inauguration,speech,declare,independence,long,prc,intention,use,military,force,recession,chens,reference,existence,country,taiwan,strait,undercut,cross,strait,relations,pushed,national,referendum,cross,strait,relations,elected,narrow,margin,percent,called,end,national,unification,council,state,run,companies,began,changing,names,dropping,china,references,including,taiwan,official,titles,ruling,dpp,passed,resolution,supporting,separate,identity,china,enactment,new,constitution,normal,country,referendums,held,day,presidential,election,asking,taiwan,join,un,process,chen,alienated,moderate,constituents,supported,status,quo,cross,strait,economic,ties,creating,tension,mainland,disagreements,united,states,chens,administration,dogged,public,concerns,reduced,economic,growth,legislative,gridlock,pan,blue,opposition,controlled,legislative,yuan,corruption,investigations,involving,family,government,officials,lowering,ratings,near,end,second,term",0.00,china
