Unclean,Clean,Noise_Pre_Processing,Training_Data,Noise_Post_Processing,Query
"in the  legislative elections the kmts majority in the legislative yuan increased its nominee ma ying jeou went on to win the presidency campaigning on a platform of increased economic growth and better ties with the prc under a policy of mutual non denial under ma taiwan and china opened up direct flights and cargo shipments the prc government even made it possible for taiwan to participate in the annual world health assembly ma also made an official apology for the white terror a foundation to compensate the victims had been established by law in  and over  people were compensated until it is cessation in  howerver closer economic ties with china raised concerns about its political consequences in  a group of university students successfully occupied the legislative yuan and prevented the ratification of the cross strait service trade agreement in what became known as the sunflower student movement the movement gave rise to youth based third parties such as the new power party and is viewed to have contributed to the dpps victories in the  presidential and legislative elections this marked the first time in taiwanese history that the dpp captured its legislative majority
",legislative elections kmts majority legislative yuan increased nominee ying jeou went win presidency campaigning platform increased economic growth better ties prc policy mutual non denial taiwan china opened direct flights cargo shipments prc government possible taiwan participate annual world health assembly official apology white terror foundation compensate victims established law people compensated cessation howerver closer economic ties china raised concerns political consequences group university students successfully occupied legislative yuan prevented ratification cross strait service trade agreement known sunflower student movement movement gave rise youth based parties new power party viewed contributed dpps victories presidential legislative elections marked time taiwanese history dpp captured legislative majority,7.55,"legislative,elections,kmts,majority,legislative,yuan,increased,nominee,ying,jeou,went,win,presidency,campaigning,platform,increased,economic,growth,better,ties,prc,policy,mutual,non,denial,taiwan,china,opened,direct,flights,cargo,shipments,prc,government,possible,taiwan,participate,annual,world,health,assembly,official,apology,white,terror,foundation,compensate,victims,established,law,people,compensated,cessation,howerver,closer,economic,ties,china,raised,concerns,political,consequences,group,university,students,successfully,occupied,legislative,yuan,prevented,ratification,cross,strait,service,trade,agreement,known,sunflower,student,movement,movement,gave,rise,youth,based,parties,new,power,party,viewed,contributed,dpps,victories,presidential,legislative,elections,marked,time,taiwanese,history,dpp,captured,legislative,majority",0.00,china
"in  tsai ing wen of the dpp became the president she called on the international community to defend democracy in the face of renewed threats from china and called on the latter to democratize and renounce the use of military force against taiwan in  tsai was re elected and the ruling dpp won a majority in the simultaneous legislative election the  democracy index published by london based economist intelligence unit upgraded taiwan from a flawed democracy to a full democracy raising it from the st place previously to the th the highest in asia
",tsai ing wen dpp president called international community defend democracy face renewed threats china called democratize renounce use military force taiwan tsai elected ruling dpp majority simultaneous legislative election democracy index published london based economist intelligence unit upgraded taiwan flawed democracy democracy raising st place previously th highest asia,8.17,"tsai,ing,wen,dpp,president,called,international,community,defend,democracy,face,renewed,threats,china,called,democratize,renounce,use,military,force,taiwan,tsai,elected,ruling,dpp,majority,simultaneous,legislative,election,democracy,index,published,london,based,economist,intelligence,unit,upgraded,taiwan,flawed,democracy,democracy,raising,st,place,previously,th,highest,asia",0.00,china
"the land controlled by the roc consists of  islandsp with a combined area of  square kilometres n the main island known historically as formosa makes up  percent of this area measuring  square kilometres  and lying some  kilometres  across the taiwan strait from the southeastern coast of mainland china the east china sea lies to its north the philippine sea to its east the luzon strait directly to its south and the south china sea to its southwest smaller islands include the penghu islands in the taiwan strait the kinmen matsu and wuqiu islands near the chinese coast and some of the south china sea islands
",land controlled roc consists islandsp combined area square kilometres n main island known historically formosa makes percent area measuring square kilometres lying kilometres taiwan strait southeastern coast mainland china east china sea lies north philippine sea east luzon strait directly south south china sea southwest smaller islands include penghu islands taiwan strait kinmen matsu wuqiu islands near chinese coast south china sea islands,6.84,"land,controlled,roc,consists,islandsp,combined,area,square,kilometres,n,main,island,known,historically,formosa,makes,percent,area,measuring,square,kilometres,lying,kilometres,taiwan,strait,southeastern,coast,mainland,china,east,china,sea,lies,north,philippine,sea,east,luzon,strait,directly,south,south,china,sea,southwest,smaller,islands,include,penghu,islands,taiwan,strait,kinmen,matsu,wuqiu,islands,near,chinese,coast,south,china,sea,islands",0.00,china
"taiwan contains four terrestrial ecoregions jian nan subtropical evergreen forests south china sea islands south taiwan monsoon rain forests and taiwan subtropical evergreen forests the eastern mountains are heavily forested and home to a diverse range of wildlife while land use in the western and northern lowlands is intensive the country had a  forest landscape integrity index mean score of  ranking it th globally out of  countries
",taiwan contains terrestrial ecoregions jian nan subtropical evergreen forests south china sea islands south taiwan monsoon rain forests taiwan subtropical evergreen forests eastern mountains heavily forested home diverse range wildlife land use western northern lowlands intensive country forest landscape integrity index mean score ranking th globally countries,4.57,"taiwan,contains,terrestrial,ecoregions,jian,nan,subtropical,evergreen,forests,south,china,sea,islands,south,taiwan,monsoon,rain,forests,taiwan,subtropical,evergreen,forests,eastern,mountains,heavily,forested,home,diverse,range,wildlife,land,use,western,northern,lowlands,intensive,country,forest,landscape,integrity,index,mean,score,ranking,th,globally,countries",0.00,china
"the east and south of taiwan are a complex system of belts formed by and part of the zone of active collision between the north luzon trough portion of the luzon volcanic arc and south china where accreted portions of the luzon arc and luzon forearc form the eastern coastal range and parallel inland longitudinal valley of taiwan respectively
",east south taiwan complex system belts formed zone active collision north luzon trough portion luzon volcanic arc south china accreted portions luzon arc luzon forearc form eastern coastal range parallel inland longitudinal valley taiwan respectively,6.98,"east,south,taiwan,complex,system,belts,formed,zone,active,collision,north,luzon,trough,portion,luzon,volcanic,arc,south,china,accreted,portions,luzon,arc,luzon,forearc,form,eastern,coastal,range,parallel,inland,longitudinal,valley,taiwan,respectively",0.00,china
"the political and legal statuses of taiwan are contentious issues the peoples republic of china  claims that taiwan is chinese territory and that the prc replaced the roc government in  becoming the sole legal government of china the roc however has its own currency widely accepted passport postage stamps internet tld armed forces and constitution with an independently elected president it has not formally renounced its claim to the mainland but roc government publications have increasingly downplayed this historical claim
",political legal statuses taiwan contentious issues peoples republic china claims taiwan chinese territory prc replaced roc government sole legal government china roc currency widely accepted passport postage stamps internet tld armed forces constitution independently elected president formally renounced claim mainland roc government publications increasingly downplayed historical claim,6.24,"political,legal,statuses,taiwan,contentious,issues,peoples,republic,china,claims,taiwan,chinese,territory,prc,replaced,roc,government,sole,legal,government,china,roc,currency,widely,accepted,passport,postage,stamps,internet,tld,armed,forces,constitution,independently,elected,president,formally,renounced,claim,mainland,roc,government,publications,increasingly,downplayed,historical,claim",0.00,china
"the political environment is complicated by the potential for military conflict should events outlined in the prcs anti secession law occur such as taiwan declaring de jure independence the prc suggested the one country two systems employed in hong kong as a model for peaceful unification with taiwan while it aims for peaceful reunification the prc does not rule out the use of force there is a substantial military presence on the fujian coast as well as prc sorties into taiwans adiz the prcs one china principle states that taiwan and mainland china are both part of china and that the prc is the only legitimate government of china it seeks to prevent or reduce any formal recognition of the roc as an independent sovereign state meaning that taiwan participates in many international forums as a non state member under names such as chinese taipei
",political environment complicated potential military conflict events outlined prcs anti secession law occur taiwan declaring de jure independence prc suggested country systems employed hong kong model peaceful unification taiwan aims peaceful reunification prc rule use force substantial military presence fujian coast prc sorties taiwans adiz prcs china principle states taiwan mainland china china prc legitimate government china seeks prevent reduce formal recognition roc independent sovereign state meaning taiwan participates international forums non state member names chinese taipei,7.95,"political,environment,complicated,potential,military,conflict,events,outlined,prcs,anti,secession,law,occur,taiwan,declaring,de,jure,independence,prc,suggested,country,systems,employed,hong,kong,model,peaceful,unification,taiwan,aims,peaceful,reunification,prc,rule,use,force,substantial,military,presence,fujian,coast,prc,sorties,taiwans,adiz,prcs,china,principle,states,taiwan,mainland,china,china,prc,legitimate,government,china,seeks,prevent,reduce,formal,recognition,roc,independent,sovereign,state,meaning,taiwan,participates,international,forums,non,state,member,names,chinese,taipei",0.00,china
"in november  the arats and sef held a meeting which would later become known as the  consensus the sef announced that both sides agreed that there was only one china but disagreed on the definition of china  while the arats announced that the two agreed on the one china principle but did not mention differences regarding its definition made in the sef statement this discrepancy between the two statements was criticized by the dpp and former president lee teng hui the prc has since viewed it as a prerequisite for dialogue between the roc and prc
",november arats sef held meeting later known consensus sef announced sides agreed china disagreed definition china arats announced agreed china principle mention differences definition sef statement discrepancy statements criticized dpp president lee teng hui prc viewed prerequisite dialogue roc prc,10.16,"november,arats,sef,held,meeting,later,known,consensus,sef,announced,sides,agreed,china,disagreed,definition,china,arats,announced,agreed,china,principle,mention,differences,definition,sef,statement,discrepancy,statements,criticized,dpp,president,lee,teng,hui,prc,viewed,prerequisite,dialogue,roc,prc",0.00,china
"president chen shui bian of the dpp elected in march  initially indicated a willingness to accept the  consensus but later backed down due to pressure within his party and sought a middle ground by attempting dialogue with the prc on the basis of the  consensus without explicitly accepting the one china principle this was not well received by the prc and official dialogue was suspended on  april  kuomintang chairman lien chan travelled to beijing and met with chinese communist party general secretary hu jintao the first meeting between the leaders of the two parties since the end of the chinese civil war in  according to us sources hu said in  that talks between taiwan and the mainland should be restored on the basis of the  consensus
",president chen shui bian dpp elected march initially indicated willingness accept consensus later backed pressure party sought middle ground attempting dialogue prc basis consensus explicitly accepting china principle received prc official dialogue suspended april kuomintang chairman lien chan travelled beijing met chinese communist party general secretary hu jintao meeting leaders parties end chinese civil war according sources hu said talks taiwan mainland restored basis consensus,8.19,"president,chen,shui,bian,dpp,elected,march,initially,indicated,willingness,accept,consensus,later,backed,pressure,party,sought,middle,ground,attempting,dialogue,prc,basis,consensus,explicitly,accepting,china,principle,received,prc,official,dialogue,suspended,april,kuomintang,chairman,lien,chan,travelled,beijing,met,chinese,communist,party,general,secretary,hu,jintao,meeting,leaders,parties,end,chinese,civil,war,according,sources,hu,said,talks,taiwan,mainland,restored,basis,consensus",0.00,china
"ma ying jeou of the kmt fully endorsed the  consensus though he stated that there would be neither unification nor declaration of independence during his presidency after becoming elected president in  talks between the roc and prc resumed direct weekend charter flights between taiwan and mainland china began in july  and the first direct daily charter flights took off in december  on  february  mainland affairs council head wang yu chi travelled to nanjing and met with taiwan affairs office head zhang zhijun the first meeting between high ranking officials from either side zhang paid a reciprocal visit to taiwan and met wang on  june  making zhang the first minister level prc official to ever visit taiwan on  november  ma ying jeou and xi jinping had a face to face meeting in singapore the first time two roc and prc leaders had met since 
",ying jeou kmt fully endorsed consensus stated unification declaration independence presidency elected president talks roc prc resumed direct weekend charter flights taiwan mainland china began july direct daily charter flights took december february mainland affairs council head wang yu chi travelled nanjing met taiwan affairs office head zhang zhijun meeting high ranking officials zhang paid reciprocal visit taiwan met wang june making zhang minister level prc official visit taiwan november ying jeou xi jinping face face meeting singapore time roc prc leaders met,7.04,"ying,jeou,kmt,fully,endorsed,consensus,stated,unification,declaration,independence,presidency,elected,president,talks,roc,prc,resumed,direct,weekend,charter,flights,taiwan,mainland,china,began,july,direct,daily,charter,flights,took,december,february,mainland,affairs,council,head,wang,yu,chi,travelled,nanjing,met,taiwan,affairs,office,head,zhang,zhijun,meeting,high,ranking,officials,zhang,paid,reciprocal,visit,taiwan,met,wang,june,making,zhang,minister,level,prc,official,visit,taiwan,november,ying,jeou,xi,jinping,face,face,meeting,singapore,time,roc,prc,leaders,met",0.00,china
"before  the foreign policy of republican china was complicated by a lack of internal unitycompeting centres of power all claimed legitimacy this situation changed after the defeat of the peiyang government by the kuomintang  which led to widespread diplomatic recognition of the republic of china
",foreign policy republican china complicated lack internal unitycompeting centres power claimed legitimacy situation changed defeat peiyang government kuomintang led widespread diplomatic recognition republic china,7.07,"foreign,policy,republican,china,complicated,lack,internal,unitycompeting,centres,power,claimed,legitimacy,situation,changed,defeat,peiyang,government,kuomintang,led,widespread,diplomatic,recognition,republic,china",0.00,china
"after the kmts retreat to taiwan most countries notably the countries in the western bloc continued to maintain relations with the roc but recognition gradually eroded and many countries switched recognition to the peoples republic of china in the s on  october  un resolution  was adopted by  votes to  with  abstensions recognizing the prc founded in  on the mainland as chinas sole representative in the united nations countries in support included france india the uk and the ussr and countries in opposition included japan and the united states
",kmts retreat taiwan countries notably countries western bloc continued maintain relations roc recognition gradually eroded countries switched recognition peoples republic china october un resolution adopted votes abstensions recognizing prc founded mainland chinas sole representative united nations countries support included france india uk ussr countries opposition included japan united states,7.09,"kmts,retreat,taiwan,countries,notably,countries,western,bloc,continued,maintain,relations,roc,recognition,gradually,eroded,countries,switched,recognition,peoples,republic,china,october,un,resolution,adopted,votes,abstensions,recognizing,prc,founded,mainland,chinas,sole,representative,united,nations,countries,support,included,france,india,uk,ussr,countries,opposition,included,japan,united,states",0.00,china
"the prc refuses to have diplomatic relations with any nation that has diplomatic relations with the roc and requires all nations with which it has diplomatic relations to make a statement recognizing its claims to taiwan as a result only un member states and the holy see maintain official diplomatic relations with the republic of china the roc maintains unofficial relations with most countries via de facto embassies and consulates called taipei economic and cultural representative offices  with branch offices called taipei economic and cultural offices  both tecro and teco are unofficial commercial entities of the roc in charge of maintaining diplomatic relations providing consular services  and serving the national interests of the roc in other countriescitation needed
",prc refuses diplomatic relations nation diplomatic relations roc requires nations diplomatic relations statement recognizing claims taiwan result un member states holy maintain official diplomatic relations republic china roc maintains unofficial relations countries de facto embassies consulates called taipei economic cultural representative offices branch offices called taipei economic cultural offices tecro teco unofficial commercial entities roc charge maintaining diplomatic relations providing consular services serving national interests roc countriescitation needed,6.39,"prc,refuses,diplomatic,relations,nation,diplomatic,relations,roc,requires,nations,diplomatic,relations,statement,recognizing,claims,taiwan,result,un,member,states,holy,maintain,official,diplomatic,relations,republic,china,roc,maintains,unofficial,relations,countries,de,facto,embassies,consulates,called,taipei,economic,cultural,representative,offices,branch,offices,called,taipei,economic,cultural,offices,tecro,teco,unofficial,commercial,entities,roc,charge,maintaining,diplomatic,relations,providing,consular,services,serving,national,interests,roc,countriescitation,needed",0.00,china
"from  to  the united states was a partner with taiwan in a mutual defense treaty the united states remains one of the main supporters of taiwan and through the taiwan relations act passed in  has continued selling arms and providing military training to the armed forces this situation continues to be an issue for the peoples republic of china which considers us involvement disruptive to the stability of the region the official position of the united states is that the prc is expected to use no force or threaten to use force against taiwan and the roc is to exercise prudence in managing all aspects of cross strait relations both are to refrain from performing actions or espousing statements that would unilaterally alter taiwans status
",united states partner taiwan mutual defense treaty united states remains main supporters taiwan taiwan relations act passed continued selling arms providing military training armed forces situation continues issue peoples republic china considers involvement disruptive stability region official position united states prc expected use force threaten use force taiwan roc exercise prudence managing aspects cross strait relations refrain performing actions espousing statements unilaterally alter taiwans status,8.06,"united,states,partner,taiwan,mutual,defense,treaty,united,states,remains,main,supporters,taiwan,taiwan,relations,act,passed,continued,selling,arms,providing,military,training,armed,forces,situation,continues,issue,peoples,republic,china,considers,involvement,disruptive,stability,region,official,position,united,states,prc,expected,use,force,threaten,use,force,taiwan,roc,exercise,prudence,managing,aspects,cross,strait,relations,refrain,performing,actions,espousing,statements,unilaterally,alter,taiwans,status",0.00,china
"the roc was a founding member of the united nations and held the seat of china on the security council and other un bodies until  when it was expelled by resolution  and replaced in all un organs with the prc since  the roc has petitioned the un for entry but its applications have not made it past committee stage due to the one china policy most un member states including the united states do not wish to discuss the issue of the rocs political status for fear of souring diplomatic ties with the prc
",roc founding member united nations held seat china security council un bodies expelled resolution replaced un organs prc roc petitioned un entry applications past committee stage china policy un member states including united states wish discuss issue rocs political status fear souring diplomatic ties prc,9.72,"roc,founding,member,united,nations,held,seat,china,security,council,un,bodies,expelled,resolution,replaced,un,organs,prc,roc,petitioned,un,entry,applications,past,committee,stage,china,policy,un,member,states,including,united,states,wish,discuss,issue,rocs,political,status,fear,souring,diplomatic,ties,prc",0.00,china
"the nagoya resolution in  approved by the international olympic committee  provided a compromise for the roc to use the name chinese taipei in international events where the prc is also a party such as the olympic games under the ioc charter roc flags cannot be flown at any official olympic venue or gathering the roc also participates in the asia pacific economic cooperation forum  and the world trade organization  under the names chinese taipei and separate customs territory of taiwan penghu kinmen and matsu respectively it was a founding member of the asian development bank but since chinas ascension in  has participated under the name taipei china the roc is able to participate as china in organizations in which the prc does not participate such as the world organization of the scout movement
",nagoya resolution approved international olympic committee provided compromise roc use chinese taipei international events prc party olympic games ioc charter roc flags flown official olympic venue gathering roc participates asia pacific economic cooperation forum world trade organization names chinese taipei separate customs territory taiwan penghu kinmen matsu respectively founding member asian development bank chinas ascension participated taipei china roc able participate china organizations prc participate world organization scout movement,7.93,"nagoya,resolution,approved,international,olympic,committee,provided,compromise,roc,use,chinese,taipei,international,events,prc,party,olympic,games,ioc,charter,roc,flags,flown,official,olympic,venue,gathering,roc,participates,asia,pacific,economic,cooperation,forum,world,trade,organization,names,chinese,taipei,separate,customs,territory,taiwan,penghu,kinmen,matsu,respectively,founding,member,asian,development,bank,chinas,ascension,participated,taipei,china,roc,able,participate,china,organizations,prc,participate,world,organization,scout,movement",0.00,china
"due to its limited international recognition the republic of china has been a member of the unrepresented nations and peoples organization  since the foundation of the organization in  represented by a government funded organization the taiwan foundation for democracy  under the name taiwan
",limited international recognition republic china member unrepresented nations peoples organization foundation organization represented government funded organization taiwan foundation democracy taiwan,7.88,"limited,international,recognition,republic,china,member,unrepresented,nations,peoples,organization,foundation,organization,represented,government,funded,organization,taiwan,foundation,democracy,taiwan",0.00,china
