Unclean,Clean,Noise_Pre_Processing,Training_Data,Noise_Post_Processing,Query
"the early currency of the united states did not exhibit faces of presidents as is the custom now although today by law only the portrait of a deceased individual may appear on united states currency in fact the newly formed government was against having portraits of leaders on the currency a practice compared to the policies of european monarchs the currency as we know it today did not get the faces they currently have until after the early th century before that heads side of coinage used profile faces and striding seated and standing figures from greek and roman mythology and composite native americans the last coins to be converted to profiles of historic americans were the dime  and the dollar 
",early currency united states exhibit faces presidents custom today law portrait deceased individual appear united states currency fact newly formed government portraits leaders currency practice compared policies european monarchs currency know today faces currently early th century heads coinage profile faces striding seated standing figures greek roman mythology composite native americans coins converted profiles historic americans dime dollar,8.90,"early,currency,united,states,exhibit,faces,presidents,custom,today,law,portrait,deceased,individual,appear,united,states,currency,fact,newly,formed,government,portraits,leaders,currency,practice,compared,policies,european,monarchs,currency,know,today,faces,currently,early,th,century,heads,coinage,profile,faces,striding,seated,standing,figures,greek,roman,mythology,composite,native,americans,coins,converted,profiles,historic,americans,dime,dollar",0.00,dollar
"continental currency depreciated badly during the war giving rise to the famous phrase not worth a continental a primary problem was that monetary policy was not coordinated between congress and the states which continued to issue bills of credit additionally neither congress nor the governments of the several states had the will or the means to retire the bills from circulation through taxation or the sale of bonds the currency was ultimately replaced by the silver dollar at the rate of  silver dollar to  continental dollars this resulted in the clause no state shall make anything but gold and silver coin a tender in payment of debts being written in to the united states constitution article  section 
",continental currency depreciated badly war giving rise famous phrase worth continental primary problem monetary policy coordinated congress states continued issue bills credit additionally congress governments states means retire bills circulation taxation sale bonds currency ultimately replaced silver dollar rate silver dollar continental dollars resulted clause state shall gold silver coin tender payment debts written united states constitution article section,8.15,"continental,currency,depreciated,badly,war,giving,rise,famous,phrase,worth,continental,primary,problem,monetary,policy,coordinated,congress,states,continued,issue,bills,credit,additionally,congress,governments,states,means,retire,bills,circulation,taxation,sale,bonds,currency,ultimately,replaced,silver,dollar,rate,silver,dollar,continental,dollars,resulted,clause,state,shall,gold,silver,coin,tender,payment,debts,written,united,states,constitution,article,section",0.00,dollar
"from implementation of the  mint act to the  implementation of the gold standard the dollar was on a bimetallic silver and gold standard defined as either  grains  of fine silver or  grains of fine gold 
",implementation mint act implementation gold standard dollar bimetallic silver gold standard defined grains fine silver grains fine gold,8.33,"implementation,mint,act,implementation,gold,standard,dollar,bimetallic,silver,gold,standard,defined,grains,fine,silver,grains,fine,gold",0.00,dollar
"following the rise in the price of silver during the california gold rush and the disappearance of circulating silver coins the coinage act of  reduced the standard for silver coins less than  from  grains to  grains   silver per  cents  the act also limited the free silver right of individuals to convert bullion into only one coin the silver dollar of  grains smaller coins of lower standard can only be produced by the united states mint using its own bullion
",following rise price silver california gold rush disappearance circulating silver coins coinage act reduced standard silver coins grains grains silver cents act limited free silver right individuals convert bullion coin silver dollar grains smaller coins lower standard produced united states mint bullion,7.97,"following,rise,price,silver,california,gold,rush,disappearance,circulating,silver,coins,coinage,act,reduced,standard,silver,coins,grains,grains,silver,cents,act,limited,free,silver,right,individuals,convert,bullion,coin,silver,dollar,grains,smaller,coins,lower,standard,produced,united,states,mint,bullion",0.00,dollar
"though the dollar came under the gold standard de jure only after  the bimetallic era was ended de facto when the coinage act of  suspended the minting of the standard silver dollar of  grains  the only fully legal tender coin that individuals could convert bullion into in unlimited  quantitiesa and right at the onset of the silver rush from the comstock lode in the s this was the so called crime of 
",dollar came gold standard de jure bimetallic era ended de facto coinage act suspended minting standard silver dollar grains fully legal tender coin individuals convert bullion unlimited quantitiesa right onset silver rush comstock lode called crime,8.91,"dollar,came,gold,standard,de,jure,bimetallic,era,ended,de,facto,coinage,act,suspended,minting,standard,silver,dollar,grains,fully,legal,tender,coin,individuals,convert,bullion,unlimited,quantitiesa,right,onset,silver,rush,comstock,lode,called,crime",0.00,dollar
"the gold standard act of  repealed the yous dollars historic link to silver and defined it solely as  grains  of fine gold  in  gold coins were confiscated by executive order  under franklin d roosevelt and in  the standard was changed to  per troy ounce fine gold or  grains  per dollar
",gold standard act repealed yous dollars historic link silver defined solely grains fine gold gold coins confiscated executive order franklin roosevelt standard changed troy ounce fine gold grains dollar,7.29,"gold,standard,act,repealed,yous,dollars,historic,link,silver,defined,solely,grains,fine,gold,gold,coins,confiscated,executive,order,franklin,roosevelt,standard,changed,troy,ounce,fine,gold,grains,dollar",0.00,dollar
"after  a series of revisions to the gold peg was implemented culminating in the nixon shock of august   which suddenly ended the convertibility of dollars to gold the yous dollar has since floated freely on the foreign exchange markets
",series revisions gold peg implemented culminating nixon shock august suddenly ended convertibility dollars gold yous dollar floated freely foreign exchange markets,7.63,"series,revisions,gold,peg,implemented,culminating,nixon,shock,august,suddenly,ended,convertibility,dollars,gold,yous,dollar,floated,freely,foreign,exchange,markets",0.00,dollar
"congress continued to issue paper money after the civil war the latest of which is the federal reserve note that was authorized by the federal reserve act of  since the discontinuation of all other types of notes  yous dollar notes have since been issued exclusively as federal reserve notes
",congress continued issue paper money civil war latest federal reserve note authorized federal reserve act discontinuation types notes yous dollar notes issued exclusively federal reserve notes,7.88,"congress,continued,issue,paper,money,civil,war,latest,federal,reserve,note,authorized,federal,reserve,act,discontinuation,types,notes,yous,dollar,notes,issued,exclusively,federal,reserve,notes",0.00,dollar
"the yous dollar first emerged as an important international reserve currency in the s displacing the british pound sterling as it emerged from the first world war relatively unscathed and since the united states was a significant recipient of wartime gold inflows after the united states emerged as an even stronger global superpower during the second world war the bretton woods agreement of  established the yous dollar as the worlds primary reserve currency and the only post war currency linked to gold despite all links to gold being severed in  the dollar continues to be the worlds foremost reserve currency for international trade to this day
",yous dollar emerged important international reserve currency displacing british pound sterling emerged world war relatively unscathed united states significant recipient wartime gold inflows united states emerged stronger global superpower second world war bretton woods agreement established yous dollar worlds primary reserve currency post war currency linked gold despite links gold severed dollar continues worlds foremost reserve currency international trade day,7.07,"yous,dollar,emerged,important,international,reserve,currency,displacing,british,pound,sterling,emerged,world,war,relatively,unscathed,united,states,significant,recipient,wartime,gold,inflows,united,states,emerged,stronger,global,superpower,second,world,war,bretton,woods,agreement,established,yous,dollar,worlds,primary,reserve,currency,post,war,currency,linked,gold,despite,links,gold,severed,dollar,continues,worlds,foremost,reserve,currency,international,trade,day",0.00,dollar
"the bretton woods agreement of  also defined the post world war ii monetary order and relations among modern day independent states by setting up a system of rules institutions and procedures to regulate the international monetary system the agreement founded the international monetary fund and other institutions of the modern day world bank group establishing the infrastructure for conducting international payments and accessing the global capital markets using the yous dollar
",bretton woods agreement defined post world war ii monetary order relations modern day independent states setting system rules institutions procedures regulate international monetary system agreement founded international monetary fund institutions modern day world bank group establishing infrastructure conducting international payments accessing global capital markets yous dollar,5.18,"bretton,woods,agreement,defined,post,world,war,ii,monetary,order,relations,modern,day,independent,states,setting,system,rules,institutions,procedures,regulate,international,monetary,system,agreement,founded,international,monetary,fund,institutions,modern,day,world,bank,group,establishing,infrastructure,conducting,international,payments,accessing,global,capital,markets,yous,dollar",0.00,dollar
"for most of the post war period the yous government has financed its own spending by borrowing heavily from the dollar lubricated global capital markets in debts denominated in its own currency and at minimal interest rates this ability to borrow heavily without facing a significant balance of payments crisis has been described as the united statess exorbitant privilege
",post war period yous government financed spending borrowing heavily dollar lubricated global capital markets debts denominated currency minimal interest rates ability borrow heavily facing significant balance payments crisis described united statess exorbitant privilege,6.97,"post,war,period,yous,government,financed,spending,borrowing,heavily,dollar,lubricated,global,capital,markets,debts,denominated,currency,minimal,interest,rates,ability,borrow,heavily,facing,significant,balance,payments,crisis,described,united,statess,exorbitant,privilege",0.00,dollar
"the united states mint has issued legal tender coins every year from  to the present from  to the present the only denominations produced for circulation have been the familiar penny nickel dime quarter half dollar and dollar
",united states mint issued legal tender coins year present present denominations produced circulation familiar penny nickel dime quarter half dollar dollar,7.08,"united,states,mint,issued,legal,tender,coins,year,present,present,denominations,produced,circulation,familiar,penny,nickel,dime,quarter,half,dollar,dollar",0.00,dollar
"gold and silver coins have been previously minted for general circulation from the th to the th centuries the last gold coins were minted in  the last  silver coins were minted in  and the last  silver half dollar was minted in 
",gold silver coins previously minted general circulation th th centuries gold coins minted silver coins minted silver half dollar minted,9.17,"gold,silver,coins,previously,minted,general,circulation,th,th,centuries,gold,coins,minted,silver,coins,minted,silver,half,dollar,minted",0.00,dollar
"the one dollar coin has never been in popular circulation from  to present despite several attempts to increase their usage since the s the most important reason of which is the continued production and popularity of the one dollar bill half dollar coins were commonly used currency since inception in  but has fallen out of use from the mid s when all silver half dollars began to be hoarded
",dollar coin popular circulation present despite attempts increase usage important reason continued production popularity dollar bill half dollar coins commonly currency inception fallen use mid silver half dollars began hoarded,9.92,"dollar,coin,popular,circulation,present,despite,attempts,increase,usage,important,reason,continued,production,popularity,dollar,bill,half,dollar,coins,commonly,currency,inception,fallen,use,mid,silver,half,dollars,began,hoarded",0.00,dollar
"the primary currency used for global trade between europe asia and the americas has historically been the spanish american silver dollar which created a global silver standard system from the th to th centuries due to abundant silver supplies in spanish america
the yous dollar itself was derived from this coin the spanish dollar was later displaced by the british pound sterling in the advent of the international gold standard in the last quarter of the th century
",primary currency global trade europe asia americas historically spanish american silver dollar created global silver standard system th th centuries abundant silver supplies spanish americathe yous dollar derived coin spanish dollar later displaced british pound sterling advent international gold standard quarter th century,7.48,"primary,currency,global,trade,europe,asia,americas,historically,spanish,american,silver,dollar,created,global,silver,standard,system,th,th,centuries,abundant,silver,supplies,spanish,americathe,yous,dollar,derived,coin,spanish,dollar,later,displaced,british,pound,sterling,advent,international,gold,standard,quarter,th,century",0.00,dollar
"the yous dollar began to displace the pound sterling as international reserve currency from the s since it emerged from the first world war relatively unscathed and since the united states was a significant recipient of wartime gold inflows
after the yous emerged as an even stronger global superpower during the second world war the bretton woods agreement of  established the post war international monetary system with the yous dollar ascending to become the worlds primary reserve currency for international trade and the only post war currency linked to gold at  per troy ounce
",yous dollar began displace pound sterling international reserve currency emerged world war relatively unscathed united states significant recipient wartime gold inflowsafter yous emerged stronger global superpower second world war bretton woods agreement established post war international monetary system yous dollar ascending worlds primary reserve currency international trade post war currency linked gold troy ounce,6.86,"yous,dollar,began,displace,pound,sterling,international,reserve,currency,emerged,world,war,relatively,unscathed,united,states,significant,recipient,wartime,gold,inflowsafter,yous,emerged,stronger,global,superpower,second,world,war,bretton,woods,agreement,established,post,war,international,monetary,system,yous,dollar,ascending,worlds,primary,reserve,currency,international,trade,post,war,currency,linked,gold,troy,ounce",0.00,dollar
"the yous dollar is joined by the worlds other major currencies   the euro pound sterling japanese yen and chinese renminbi   in the currency basket of the special drawing rights of the international monetary fund central banks worldwide have huge reserves of yous dollars in their holdings and are significant buyers of yous treasury bills and notes
",yous dollar joined worlds major currencies euro pound sterling japanese yen chinese renminbi currency basket special drawing rights international monetary fund central banks worldwide huge reserves yous dollars holdings significant buyers yous treasury bills notes,6.00,"yous,dollar,joined,worlds,major,currencies,euro,pound,sterling,japanese,yen,chinese,renminbi,currency,basket,special,drawing,rights,international,monetary,fund,central,banks,worldwide,huge,reserves,yous,dollars,holdings,significant,buyers,yous,treasury,bills,notes",0.00,dollar
"the yous dollar is predominantly the standard currency unit in which goods are quoted and traded and with which payments are settled in in the global commodity markets the yous dollar index is an important indicator of the dollars strength or weakness versus a basket of six foreign currencies
",yous dollar predominantly standard currency unit goods quoted traded payments settled global commodity markets yous dollar index important indicator dollars strength weakness versus basket foreign currencies,7.82,"yous,dollar,predominantly,standard,currency,unit,goods,quoted,traded,payments,settled,global,commodity,markets,yous,dollar,index,important,indicator,dollars,strength,weakness,versus,basket,foreign,currencies",0.00,dollar
"a frequent topic of debate is whether the strong dollar policy of the united states is indeed in americas own best interests as well as in the best interest of the international community
",frequent topic debate strong dollar policy united states americas best interests best interest international community,9.57,"frequent,topic,debate,strong,dollar,policy,united,states,americas,best,interests,best,interest,international,community",0.00,dollar
"for a more exhaustive discussion of countries using the yous dollar as official or customary currency or using currencies which are pegged to the yous dollar see international use of the yous dollardollarization and fixed exchange rates and currency substitutionus dollar
",exhaustive discussion countries yous dollar official customary currency currencies pegged yous dollar international use yous dollardollarization fixed exchange rates currency substitutionus dollar,6.99,"exhaustive,discussion,countries,yous,dollar,official,customary,currency,currencies,pegged,yous,dollar,international,use,yous,dollardollarization,fixed,exchange,rates,currency,substitutionus,dollar",0.00,dollar
"countries using the yous dollar as their official currency include
",countries yous dollar official currency include,5.97,"countries,yous,dollar,official,currency,include",0.00,dollar
"among the countries using the yous dollar together with other foreign currencies and their local currency are cambodia and zimbabwe
",countries yous dollar foreign currencies local currency cambodia zimbabwe,8.33,"countries,yous,dollar,foreign,currencies,local,currency,cambodia,zimbabwe",0.00,dollar
"currencies pegged to the yous dollar include
",currencies pegged yous dollar include,4.44,"currencies,pegged,yous,dollar,include",0.00,dollar
"the th paragraph of section  of article  of the yous constitution provides that the yous congress shall have the power to coin money and to regulate the value of domestic and foreign coins congress exercised those powers when it enacted the coinage act of  that act provided for the minting of the first yous dollar and it declared that the yous dollar shall have the value of a spanish milled dollar as the same is now current
",th paragraph section article yous constitution provides yous congress shall power coin money regulate value domestic foreign coins congress exercised powers enacted coinage act act provided minting yous dollar declared yous dollar shall value spanish milled dollar current,9.11,"th,paragraph,section,article,yous,constitution,provides,yous,congress,shall,power,coin,money,regulate,value,domestic,foreign,coins,congress,exercised,powers,enacted,coinage,act,act,provided,minting,yous,dollar,declared,yous,dollar,shall,value,spanish,milled,dollar,current",0.00,dollar
"the table above shows the equivalent amount of goods that in a particular year could be purchased with  the table shows that from  through  the yous dollar has lost about  of its buying power
",table shows equivalent goods particular year purchased table shows yous dollar lost buying power,10.42,"table,shows,equivalent,goods,particular,year,purchased,table,shows,yous,dollar,lost,buying,power",0.00,dollar
"the decline in the value of the yous dollar corresponds to price inflation which is a rise in the general level of prices of goods and services in an economy over a period of time a consumer price index  is a measure estimating the average price of consumer goods and services purchased by households the united states consumer price index published by the bureau of labor statistics is a measure estimating the average price of consumer goods and services in the united states it reflects inflation as experienced by consumers in their day to day living expenses a graph showing the yous cpi relative to  and the annual year over year change in cpi is shown at right
",decline value yous dollar corresponds price inflation rise general level prices goods services economy period time consumer price index measure estimating average price consumer goods services purchased households united states consumer price index published bureau labor statistics measure estimating average price consumer goods services united states reflects inflation experienced consumers day day living expenses graph showing yous cpi relative annual year year change cpi shown right,7.78,"decline,value,yous,dollar,corresponds,price,inflation,rise,general,level,prices,goods,services,economy,period,time,consumer,price,index,measure,estimating,average,price,consumer,goods,services,purchased,households,united,states,consumer,price,index,published,bureau,labor,statistics,measure,estimating,average,price,consumer,goods,services,united,states,reflects,inflation,experienced,consumers,day,day,living,expenses,graph,showing,yous,cpi,relative,annual,year,year,change,cpi,shown,right",0.00,dollar
"the value of the yous dollar declined significantly during wartime especially during the american civil war world war i and world war ii the federal reserve which was established in  was designed to furnish an elastic currency subject to substantial changes of quantity over short periods which differed significantly from previous forms of high powered money such as gold national banknotes and silver coins over the very long run the prior gold standard kept prices stablefor instance the price level and the value of the yous dollar in  were not very different from the price level in the s the federal reserve initially succeeded in maintaining the value of the yous dollar and price stability reversing the inflation caused by the first world war and stabilizing the value of the dollar during the s before presiding over a  deflation in yous prices in the s
",value yous dollar declined significantly wartime especially american civil war world war world war ii federal reserve established designed furnish elastic currency subject substantial changes quantity short periods differed significantly previous forms high powered money gold national banknotes silver coins long run prior gold standard kept prices stablefor instance price level value yous dollar different price level federal reserve initially succeeded maintaining value yous dollar price stability reversing inflation caused world war stabilizing value dollar presiding deflation yous prices,7.64,"value,yous,dollar,declined,significantly,wartime,especially,american,civil,war,world,war,world,war,ii,federal,reserve,established,designed,furnish,elastic,currency,subject,substantial,changes,quantity,short,periods,differed,significantly,previous,forms,high,powered,money,gold,national,banknotes,silver,coins,long,run,prior,gold,standard,kept,prices,stablefor,instance,price,level,value,yous,dollar,different,price,level,federal,reserve,initially,succeeded,maintaining,value,yous,dollar,price,stability,reversing,inflation,caused,world,war,stabilizing,value,dollar,presiding,deflation,yous,prices",0.00,dollar
