Unclean,Clean,Noise_Pre_Processing,Training_Data,Noise_Post_Processing,Query
"the united states dollar  is the official currency of the united states and several other countries the coinage act of  introduced the yous dollar at par with the spanish silver dollar divided it into  cents and authorized the minting of coins denominated in dollars and cents yous banknotes are issued in the form of federal reserve notes popularly called greenbacks due to their predominantly green color
",united states dollar official currency united states countries coinage act introduced yous dollar par spanish silver dollar divided cents authorized minting coins denominated dollars cents yous banknotes issued form federal reserve notes popularly called greenbacks predominantly green color,6.88,"united,states,dollar,official,currency,united,states,countries,coinage,act,introduced,yous,dollar,par,spanish,silver,dollar,divided,cents,authorized,minting,coins,denominated,dollars,cents,yous,banknotes,issued,form,federal,reserve,notes,popularly,called,greenbacks,predominantly,green,color",0.00,dollar
"the yous dollar was originally defined under a bimetallic standard of  grains   fine silver or from   grains  fine gold or  per troy ounce the gold standard act of  linked the dollar solely to gold from  its equivalence to gold was revised to  per troy ounce since  all links to gold have been repealed
",yous dollar originally defined bimetallic standard grains fine silver grains fine gold troy ounce gold standard act linked dollar solely gold equivalence gold revised troy ounce links gold repealed,7.92,"yous,dollar,originally,defined,bimetallic,standard,grains,fine,silver,grains,fine,gold,troy,ounce,gold,standard,act,linked,dollar,solely,gold,equivalence,gold,revised,troy,ounce,links,gold,repealed",0.00,dollar
"the yous dollar became an important international reserve currency after the first world war and displaced the pound sterling as the worlds primary reserve currency by the bretton woods agreement towards the end of the second world war the dollar is the most widely used currency in international transactions and a free floating currency it is also the official currency in several countries and the de facto currency in many others with federal reserve notes  used in circulation
",yous dollar important international reserve currency world war displaced pound sterling worlds primary reserve currency bretton woods agreement end second world war dollar widely currency international transactions free floating currency official currency countries de facto currency federal reserve notes circulation,7.88,"yous,dollar,important,international,reserve,currency,world,war,displaced,pound,sterling,worlds,primary,reserve,currency,bretton,woods,agreement,end,second,world,war,dollar,widely,currency,international,transactions,free,floating,currency,official,currency,countries,de,facto,currency,federal,reserve,notes,circulation",0.00,dollar
"article i section  of the yous constitution provides that congress has the power to coin money laws implementing this power are currently codified in title  of the yous code under section  which prescribes the forms in which the united states dollars should be issued these coins are both designated in the section as legal tender in payment of debts the sacagawea dollar is one example of the copper alloy dollar in contrast to the american silver eagle which is pure silver section  also provides for the minting and issuance of other coins which have values ranging from one cent  to  dollars these other coins are more fully described in coins of the united states dollar
",articlei section yous constitution provides congress power coin money laws implementing power currently codified title yous code section prescribes forms united states dollars issued coins designated section legal tender payment debts sacagawea dollar example copper alloy dollar contrast american silver eagle pure silver section provides minting issuance coins values ranging cent dollars coins fully described coins united states dollar,8.28,"articlei,section,yous,constitution,provides,congress,power,coin,money,laws,implementing,power,currently,codified,title,yous,code,section,prescribes,forms,united,states,dollars,issued,coins,designated,section,legal,tender,payment,debts,sacagawea,dollar,example,copper,alloy,dollar,contrast,american,silver,eagle,pure,silver,section,provides,minting,issuance,coins,values,ranging,cent,dollars,coins,fully,described,coins,united,states,dollar",0.00,dollar
"article i section  of the constitution provides that a regular statement and account of the receipts and expenditures of all public money shall be published from time to time which is further specified by section  of title  of the yous code the sums of money reported in the statements are currently expressed in yous dollars thus the yous dollar may be described as the unit of account of the united states dollar is one of the first words of section  in which the term refers to the spanish milled dollar or the coin worth eight spanish reales
",article section constitution provides regular statement account receipts expenditures public money shall published time time specified section title yous code sums money reported statements currently expressed yous dollars yous dollar described unit account united states dollar words section term refers spanish milled dollar coin worth spanish reales,9.16,"article,section,constitution,provides,regular,statement,account,receipts,expenditures,public,money,shall,published,time,time,specified,section,title,yous,code,sums,money,reported,statements,currently,expressed,yous,dollars,yous,dollar,described,unit,account,united,states,dollar,words,section,term,refers,spanish,milled,dollar,coin,worth,spanish,reales",0.00,dollar
dollars or unitseach to be of the value of a spanish milled dollar as the same is now current and to contain three hundred and seventy one grains and four sixteenth parts of a grain of pure or four hundred and sixteen grains of standard silver,dollars unitseach value spanish milled dollar current contain seventy grains sixteenth parts grain pure sixteen grains standard silver,11.52,"dollars,unitseach,value,spanish,milled,dollar,current,contain,seventy,grains,sixteenth,parts,grain,pure,sixteen,grains,standard,silver",0.00,dollar
section  of the act designates the united states dollar as the unit of currency of the united states  ,section act designates united states dollar unit currency united states,7.84,"section,act,designates,united,states,dollar,unit,currency,united,states",0.00,dollar
"unlike the spanish milled dollar the continental congress and the coinage act prescribed a decimal system of units to go with the unit dollar as follows the mill or one thousandth of a dollar the cent or one hundredth of a dollar the dime or one tenth of a dollar and the eagle or ten dollars the current relevance of these units
",unlike spanish milled dollar continental congress coinage act prescribed decimal system units unit dollar follows mill thousandth dollar cent hundredth dollar dime tenth dollar eagle dollars current relevance units,10.00,"unlike,spanish,milled,dollar,continental,congress,coinage,act,prescribed,decimal,system,units,unit,dollar,follows,mill,thousandth,dollar,cent,hundredth,dollar,dime,tenth,dollar,eagle,dollars,current,relevance,units",0.00,dollar
"the spanish peso or dollar was historically divided into eight reales   hence pieces of eight americans also learned counting in non decimal bits of  cents before  when mexican bits were more frequently encountered than american cents in fact this practice survived in new york stock exchange quotations until 
",spanish peso dollar historically divided reales pieces americans learned counting non decimal bits cents mexican bits frequently encountered american cents fact practice survived new york stock exchange quotations,6.43,"spanish,peso,dollar,historically,divided,reales,pieces,americans,learned,counting,non,decimal,bits,cents,mexican,bits,frequently,encountered,american,cents,fact,practice,survived,new,york,stock,exchange,quotations",0.00,dollar
"when currently issued in circulating form denominations less than or equal to a dollar are emitted as yous coins while denominations greater than or equal to a dollar are emitted as federal reserve notes disregarding these special cases
",currently issued circulating form denominations equal dollar emitted yous coins denominations greater equal dollar emitted federal reserve notes disregarding special cases,7.17,"currently,issued,circulating,form,denominations,equal,dollar,emitted,yous,coins,denominations,greater,equal,dollar,emitted,federal,reserve,notes,disregarding,special,cases",0.00,dollar
"in the th century count hieronymus schlick of bohemia began minting coins known as joachimstalers named for joachimstal the valley in which the silver was mined in turn the valleys name is titled after saint joachim whereby thal or tal a cognate of the english word dale is german for valley the joachimstaler was later shortened to the german taler a word that eventually found its way into many languages including
tolar  daler 
dalar and daler  daler or daalder  
talari 
tallare 
tallero  
  and dollar 
",th century count hieronymus schlick bohemia began minting coins known joachimstalers named joachimstal valley silver mined turn valleys titled saint joachim thal tal cognate english word dale german valley joachimstaler later shortened german taler word eventually found way languages includingtolar daler dalar daler daler daalder talari tallare tallero dollar,6.69,"th,century,count,hieronymus,schlick,bohemia,began,minting,coins,known,joachimstalers,named,joachimstal,valley,silver,mined,turn,valleys,titled,saint,joachim,thal,tal,cognate,english,word,dale,german,valley,joachimstaler,later,shortened,german,taler,word,eventually,found,way,languages,includingtolar,daler,dalar,daler,daler,daalder,talari,tallare,tallero,dollar",0.00,dollar
"though the dutch pioneered in modern day new york in the th century the use and the counting of money in silver dollars in the form of german dutch reichsthalers and native dutch leeuwendaalders  it was the ubiquitous spanish american eight real coin which became exclusively known as the dollar since the th century
",dutch pioneered modern day new york th century use counting money silver dollars form german dutch reichsthalers native dutch leeuwendaalders ubiquitous spanish american real coin exclusively known dollar th century,7.57,"dutch,pioneered,modern,day,new,york,th,century,use,counting,money,silver,dollars,form,german,dutch,reichsthalers,native,dutch,leeuwendaalders,ubiquitous,spanish,american,real,coin,exclusively,known,dollar,th,century",0.00,dollar
"the colloquialism buck  is often used to refer to dollars of various nations including the yous dollar this term dating to the th century may have originated with the colonial leather trade or it may also have originated from a poker term
",colloquialism buck refer dollars nations including yous dollar term dating th century originated colonial leather trade originated poker term,9.62,"colloquialism,buck,refer,dollars,nations,including,yous,dollar,term,dating,th,century,originated,colonial,leather,trade,originated,poker,term",0.00,dollar
"greenback is another nickname originally applied specifically to the th century demand note dollars which were printed black and green on the backside created by abraham lincoln to finance the north for the civil war it is still used to refer to the yous dollar  the term greenback is also used by the financial press in other countries such as
australia new zealand south africa and india
",greenback nickname originally applied specifically th century demand note dollars printed black green backside created abraham lincoln finance north civil war refer yous dollar term greenback financial press countries asaustralia new zealand south africa india,8.21,"greenback,nickname,originally,applied,specifically,th,century,demand,note,dollars,printed,black,green,backside,created,abraham,lincoln,finance,north,civil,war,refer,yous,dollar,term,greenback,financial,press,countries,asaustralia,new,zealand,south,africa,india",0.00,dollar
"other well known names of the dollar as a whole in denominations include greenmail green and dead presidents the latter of which referring to the deceased presidents pictured on most bills dollars in general have also been known as bones  the newer designs with portraits displayed in the main body of the obverse  upon paper color coded by denomination are sometimes referred to as bigface notes or monopoly moneycitation needed
",known names dollar denominations include greenmail green dead presidents referring deceased presidents pictured bills dollars general known bones newer designs portraits displayed main body obverse paper color coded denomination referred bigface notes monopoly moneycitation needed,8.14,"known,names,dollar,denominations,include,greenmail,green,dead,presidents,referring,deceased,presidents,pictured,bills,dollars,general,known,bones,newer,designs,portraits,displayed,main,body,obverse,paper,color,coded,denomination,referred,bigface,notes,monopoly,moneycitation,needed",0.00,dollar
"piastre was the original french word for the yous dollar used for example in the french text of the louisiana purchase though the yous dollar is called dollar in modern french the term piastre is still used among the speakers of cajun french and new england french as well as speakers in haiti and other french speaking caribbean islands
",piastre original french word yous dollar example french text louisiana purchase yous dollar called dollar modern french term piastre speakers cajun french new england french speakers haiti french speaking caribbean islands,8.28,"piastre,original,french,word,yous,dollar,example,french,text,louisiana,purchase,yous,dollar,called,dollar,modern,french,term,piastre,speakers,cajun,french,new,england,french,speakers,haiti,french,speaking,caribbean,islands",0.00,dollar
"the symbol  usually written before the numerical amount is used for the yous dollar  the sign was the result of a late th century evolution of the scribal abbreviation ps for the peso the common name for the spanish dollars that were in wide circulation in the new world from the th to the th centuries the p and the s eventually came to be written over each other giving rise to 
",symbol usually written numerical yous dollar sign result late th century evolution scribal abbreviation ps peso common spanish dollars wide circulation new world th th centuries p eventually came written giving rise,10.50,"symbol,usually,written,numerical,yous,dollar,sign,result,late,th,century,evolution,scribal,abbreviation,ps,peso,common,spanish,dollars,wide,circulation,new,world,th,th,centuries,p,eventually,came,written,giving,rise",0.00,dollar
"another popular explanation is that it is derived from the pillars of hercules on the spanish coat of arms of the spanish dollar these pillars of hercules on the silver spanish dollar coins take the form of two vertical bars  and a swinging cloth band in the shape of an scitation needed
",popular explanation derived pillars hercules spanish coat arms spanish dollar pillars hercules silver spanish dollar coins form vertical bars swinging cloth band shape scitation needed,9.38,"popular,explanation,derived,pillars,hercules,spanish,coat,arms,spanish,dollar,pillars,hercules,silver,spanish,dollar,coins,form,vertical,bars,swinging,cloth,band,shape,scitation,needed",0.00,dollar
"yet another explanation suggests that the dollar sign was formed from the capital letters you and s written or printed one on top of the other this theory popularized by novelist ayn rand in atlas shrugged does not consider the fact that the symbol was already in use before the formation of the united states
",explanation suggests dollar sign formed capital letters written printed theory popularized novelist ayn rand atlas shrugged consider fact symbol use formation united states,10.32,"explanation,suggests,dollar,sign,formed,capital,letters,written,printed,theory,popularized,novelist,ayn,rand,atlas,shrugged,consider,fact,symbol,use,formation,united,states",0.00,dollar
"the yous dollar was introduced at par with the spanish american silver dollar  the latter was produced from the rich silver mine output of spanish america minted in mexico city potos  lima  and elsewhere and was in wide circulation throughout the americas asia and europe from the th to th centuries the minting of machine milled spanish dollars since  boosted its worldwide reputation as a trade coin and positioned it to be model for the new currency of the united states
",yous dollar introduced par spanish american silver dollar produced rich silver output spanish america minted mexico city potos lima wide circulation americas asia europe th th centuries minting machine milled spanish dollars boosted worldwide reputation trade coin positioned model new currency united states,8.02,"yous,dollar,introduced,par,spanish,american,silver,dollar,produced,rich,silver,output,spanish,america,minted,mexico,city,potos,lima,wide,circulation,americas,asia,europe,th,th,centuries,minting,machine,milled,spanish,dollars,boosted,worldwide,reputation,trade,coin,positioned,model,new,currency,united,states",0.00,dollar
"even after the united states mint commenced issuing coins in  locally minted dollars and cents were less abundant in circulation than spanish american pesos and reales hence spanish mexican and american dollars all remained legal tender in the united states until the coinage act of  in particular colonists familiarity with the spanish two real quarter peso was the reason for issuing a quasi decimal  cent quarter dollar coin rather than a  cent coin
",united states mint commenced issuing coins locally minted dollars cents abundant circulation spanish american pesos reales spanish mexican american dollars remained legal tender united states coinage act particular colonists familiarity spanish real quarter peso reason issuing quasi decimal cent quarter dollar coin cent coin,6.40,"united,states,mint,commenced,issuing,coins,locally,minted,dollars,cents,abundant,circulation,spanish,american,pesos,reales,spanish,mexican,american,dollars,remained,legal,tender,united,states,coinage,act,particular,colonists,familiarity,spanish,real,quarter,peso,reason,issuing,quasi,decimal,cent,quarter,dollar,coin,cent,coin",0.00,dollar
"for the relationship between the spanish dollar and the individual state colonial currencies see connecticut pound delaware pound georgia pound maryland pound massachusetts pound new hampshire pound new jersey pound new york pound north carolina pound pennsylvania pound rhode island pound south carolina pound and virginia pound
",relationship spanish dollar individual state colonial currencies connecticut pound delaware pound georgia pound maryland pound massachusetts pound new hampshire pound new jersey pound new york pound north carolina pound pennsylvania pound rhode island pound south carolina pound virginia pound,2.42,"relationship,spanish,dollar,individual,state,colonial,currencies,connecticut,pound,delaware,pound,georgia,pound,maryland,pound,massachusetts,pound,new,hampshire,pound,new,jersey,pound,new,york,pound,north,carolina,pound,pennsylvania,pound,rhode,island,pound,south,carolina,pound,virginia,pound",0.00,dollar
"on july   the continental congress resolved that the money unit of the united states the dollar would contain  grains of fine silver on august   the continental congress continued that definition and further resolved that the money of account corresponding with the division of coins would proceed in a decimal ratio with the sub units being mills at  of a dollar cents at  of a dollar and dimes at  of a dollar
",july continental congress resolved money unit united states dollar contain grains fine silver august continental congress continued definition resolved money account corresponding division coins proceed decimal ratio sub units mills dollar cents dollar dimes dollar,8.74,"july,continental,congress,resolved,money,unit,united,states,dollar,contain,grains,fine,silver,august,continental,congress,continued,definition,resolved,money,account,corresponding,division,coins,proceed,decimal,ratio,sub,units,mills,dollar,cents,dollar,dimes,dollar",0.00,dollar
"after the adoption of the united states constitution the yous dollar was defined by the coinage act of  it specified a dollar based on the spanish milled dollar to contain  grains of fine silver or  grains  of standard silver of fineness    as well as an eagle to contain  grains of fine gold or  grains  of  karat or  fine gold alexander hamilton arrived at these numbers based on a treasury assay of the average fine silver content of a selection of worn spanish dollars which came out to be  grains combined with the prevailing gold silver ratio of  the standard for gold was calculated at    grains fine gold or  grains k gold rounding the latter to  grains finalized the dollars standard to  grains of fine gold or    grains   grams   troy ounces of fine silver
",adoption united states constitution yous dollar defined coinage act specified dollar based spanish milled dollar contain grains fine silver grains standard silver fineness eagle contain grains fine gold grains karat fine gold alexander hamilton arrived numbers based treasury assay average fine silver content selection worn spanish dollars came grains combined prevailing gold silver ratio standard gold calculated grains fine gold grains k gold rounding grains finalized dollars standard grains fine gold grains grams troy ounces fine silver,7.30,"adoption,united,states,constitution,yous,dollar,defined,coinage,act,specified,dollar,based,spanish,milled,dollar,contain,grains,fine,silver,grains,standard,silver,fineness,eagle,contain,grains,fine,gold,grains,karat,fine,gold,alexander,hamilton,arrived,numbers,based,treasury,assay,average,fine,silver,content,selection,worn,spanish,dollars,came,grains,combined,prevailing,gold,silver,ratio,standard,gold,calculated,grains,fine,gold,grains,k,gold,rounding,grains,finalized,dollars,standard,grains,fine,gold,grains,grams,troy,ounces,fine,silver",0.00,dollar
"the same coinage act also set the value of an eagle at  dollars and the dollar at  eagle it called for silver coins in denominations of     and  dollar as well as gold coins in denominations of   and  eagle the value of gold or silver contained in the dollar was then converted into relative value in the economy for the buying and selling of goods this allowed the value of things to remain fairly constant over time except for the influx and outflux of gold and silver in the nations economy
",coinage act set value eagle dollars dollar eagle called silver coins denominations dollar gold coins denominations eagle value gold silver contained dollar converted relative value economy buying selling goods allowed value things remain fairly constant time influx outflux gold silver nations economy,9.72,"coinage,act,set,value,eagle,dollars,dollar,eagle,called,silver,coins,denominations,dollar,gold,coins,denominations,eagle,value,gold,silver,contained,dollar,converted,relative,value,economy,buying,selling,goods,allowed,value,things,remain,fairly,constant,time,influx,outflux,gold,silver,nations,economy",0.00,dollar
"though a spanish dollar freshly minted after  theoretically contained  grains of silver of fineness   reliable assays of the period in fact confirmed a fine silver content of  grains  for the average spanish dollar in circulation 

the new yous silver dollar of  grains  therefore compared favorably and was received at par with the spanish dollar for foreign payments and after  the united states mint had to suspend making this coin out of its limited resources since it failed to stay in domestic circulation it was only after mexican independence in  when their pesos fine silver content of  grains was firmly upheld which the yous later had to compete with using a heavier  grains  trade dollar coin
",spanish dollar freshly minted theoretically contained grains silver fineness reliable assays period fact confirmed fine silver content grains average spanish dollar circulation new yous silver dollar grains compared favorably received par spanish dollar foreign payments united states mint suspend making coin limited resources failed stay domestic circulation mexican independence pesos fine silver content grains firmly upheld yous later compete heavier grains trade dollar coin,7.23,"spanish,dollar,freshly,minted,theoretically,contained,grains,silver,fineness,reliable,assays,period,fact,confirmed,fine,silver,content,grains,average,spanish,dollar,circulation,new,yous,silver,dollar,grains,compared,favorably,received,par,spanish,dollar,foreign,payments,united,states,mint,suspend,making,coin,limited,resources,failed,stay,domestic,circulation,mexican,independence,pesos,fine,silver,content,grains,firmly,upheld,yous,later,compete,heavier,grains,trade,dollar,coin",0.00,dollar
