Unclean,Clean,Noise_Pre_Processing,Training_Data,Noise_Post_Processing,Query
"under the bretton woods system established after world war ii the value of gold was fixed to  per ounce and the value of the yous dollar was thus anchored to the value of gold rising government spending in the s however led to doubts about the ability of the united states to maintain this convertibility gold stocks dwindled as banks and international investors began to convert dollars to gold and as a result the value of the dollar began to decline facing an emerging currency crisis and the imminent danger that the united states would no longer be able to redeem dollars for gold gold convertibility was finally terminated in  by president nixon resulting in the nixon shock
",bretton woods system established world war ii value gold fixed ounce value yous dollar anchored value gold rising government spending led doubts ability united states maintain convertibility gold stocks dwindled banks international investors began convert dollars gold result value dollar began decline facing emerging currency crisis imminent danger united states longer able redeem dollars gold gold convertibility finally terminated president nixon resulting nixon shock,7.93,"bretton,woods,system,established,world,war,ii,value,gold,fixed,ounce,value,yous,dollar,anchored,value,gold,rising,government,spending,led,doubts,ability,united,states,maintain,convertibility,gold,stocks,dwindled,banks,international,investors,began,convert,dollars,gold,result,value,dollar,began,decline,facing,emerging,currency,crisis,imminent,danger,united,states,longer,able,redeem,dollars,gold,gold,convertibility,finally,terminated,president,nixon,resulting,nixon,shock",0.00,dollar
"the value of the yous dollar was therefore no longer anchored to gold and it fell upon the federal reserve to maintain the value of the yous currency the federal reserve however continued to increase the money supply resulting in stagflation and a rapidly declining value of the yous dollar in the s this was largely due to the prevailing economic view at the time that inflation and real economic growth were linked  and so inflation was regarded as relatively benign between  and  the yous dollar lost two thirds of its value
",value yous dollar longer anchored gold fell federal reserve maintain value yous currency federal reserve continued increase money supply resulting stagflation rapidly declining value yous dollar largely prevailing economic view time inflation real economic growth linked inflation regarded relatively benign yous dollar lost thirds value,8.90,"value,yous,dollar,longer,anchored,gold,fell,federal,reserve,maintain,value,yous,currency,federal,reserve,continued,increase,money,supply,resulting,stagflation,rapidly,declining,value,yous,dollar,largely,prevailing,economic,view,time,inflation,real,economic,growth,linked,inflation,regarded,relatively,benign,yous,dollar,lost,thirds,value",0.00,dollar
"in  president carter appointed paul volcker chairman of the federal reserve the federal reserve tightened the money supply and inflation was substantially lower in the s and hence the value of the yous dollar stabilized
",president carter appointed paul volcker chairman federal reserve federal reserve tightened money supply inflation substantially lower value yous dollar stabilized,6.82,"president,carter,appointed,paul,volcker,chairman,federal,reserve,federal,reserve,tightened,money,supply,inflation,substantially,lower,value,yous,dollar,stabilized",0.00,dollar
"over the thirty year period from  to  the yous dollar lost over half its value this is because the federal reserve has targeted not zero inflation but a low stable rate of inflationbetween  and  the rate of inflation was approximately  and between  and  it was approximately  the so called great moderation of economic conditions since the s is credited to monetary policy targeting price stability
",thirty year period yous dollar lost half value federal reserve targeted zero inflation low stable rate inflationbetween rate inflation approximately approximately called great moderation economic conditions credited monetary policy targeting price stability,8.27,"thirty,year,period,yous,dollar,lost,half,value,federal,reserve,targeted,zero,inflation,low,stable,rate,inflationbetween,rate,inflation,approximately,approximately,called,great,moderation,economic,conditions,credited,monetary,policy,targeting,price,stability",0.00,dollar
"there is an ongoing debate about whether central banks should target zero inflation  or low stable inflation  although some economists are in favor of a zero inflation policy and therefore a constant value for the yous dollar others contend that such a policy limits the ability of the central bank to control interest rates and stimulate the economy when needed
",ongoing debate central banks target zero inflation low stable inflation economists favor zero inflation policy constant value yous dollar contend policy limits ability central bank control interest rates stimulate economy needed,7.99,"ongoing,debate,central,banks,target,zero,inflation,low,stable,inflation,economists,favor,zero,inflation,policy,constant,value,yous,dollar,contend,policy,limits,ability,central,bank,control,interest,rates,stimulate,economy,needed",0.00,dollar
