Unclean,Clean,Noise_Pre_Processing,Training_Data,Noise_Post_Processing,Query
The priest alone remained below  leaning against the wall  with his back to the whole theatre of events  and looking wistfully across to the park palings and the twinkling  twilit trees ,priest remained leaning wall theatre events looking wistfully park palings twinkling twilit trees,9.68,"priest,remained,leaning,wall,theatre,events,looking,wistfully,park,palings,twinkling,twilit,trees",0.00,
The Duke  however stimulated  had the instincts of an aristocrat  and desired rather to stare at the house than to spy on it  but Flambeau  who had the instincts of a burglar  had already swung himself from the wall into the fork of a straggling tree from which he could crawl quite close to the only illuminated window in the back of the high dark house ,Duke stimulated instincts aristocrat desired stare house spy Flambeau instincts burglar swung wall fork straggling tree crawl close illuminated window high dark house,12.11,"Duke,stimulated,instincts,aristocrat,desired,stare,house,spy,Flambeau,instincts,burglar,swung,wall,fork,straggling,tree,crawl,close,illuminated,window,high,dark,house",0.00,
A red blind had been pulled down over the light  but pulled crookedly  so that it gaped on one side  and by risking his neck along a branch that looked as treacherous as a twig  Flambeau could just see Colonel Dubosc walking about in a brilliantly   lighted and luxurious bedroom ,red blind pulled light pulled crookedly gaped risking neck branch looked treacherous twig Flambeau Colonel Dubosc walking brilliantly lighted luxurious bedroom,10.36,"red,blind,pulled,light,pulled,crookedly,gaped,risking,neck,branch,looked,treacherous,twig,Flambeau,Colonel,Dubosc,walking,brilliantly,lighted,luxurious,bedroom",0.00,
But close as Flambeau was to the house  he heard the words of his colleagues by the wall  and repeated them in a low voice ,close Flambeau house heard words colleagues wall repeated low voice,12.20,"close,Flambeau,house,heard,words,colleagues,wall,repeated,low,voice",0.00,
 They will never meet  said Father Brown ,meet said Father Brown,7.32,"meet,said,Father,Brown",0.00,
 Hirsch was right when he said that in such an affair the principals must not meet ,Hirsch right said affair principals meet,12.05,"Hirsch,right,said,affair,principals,meet",0.00,
Have you read a queer psychological story by Henry James  of two persons who so perpetually missed meeting each other by accident that they began to feel quite frightened of each other  and to think it was fate ,read queer psychological story Henry James persons perpetually missed meeting accident began feel frightened think fate,10.43,"read,queer,psychological,story,Henry,James,persons,perpetually,missed,meeting,accident,began,feel,frightened,think,fate",0.00,
 There are people in Paris who will cure them of such morbid fancies  said Valognes vindictively ,people Paris cure morbid fancies said Valognes vindictively,8.25,"people,Paris,cure,morbid,fancies,said,Valognes,vindictively",0.00,
 They will jolly well have to meet if we capture them and force them to fight ,jolly meet capture force fight,14.10,"jolly,meet,capture,force,fight",0.00,
 They will not meet on the Day of Judgement  said the priest ,meet Day Judgement said priest,11.48,"meet,Day,Judgement,said,priest",0.00,
 If God Almighty held the truncheon of the lists  if St Michael blew the trumpet for the swords to cross    even then  if one of them stood ready  the other would not come ,God Almighty held truncheon lists St Michael blew trumpet swords cross stood ready come,11.05,"God,Almighty,held,truncheon,lists,St,Michael,blew,trumpet,swords,cross,stood,ready,come",0.00,
 Oh  what does all this mysticism mean ,Oh mysticism mean,10.26,"Oh,mysticism,mean",0.00,
cried the Duc de Valognes  impatiently   why on earth shouldn  t they meet like other people ,cried Duc de Valognes impatiently earth meet like people,7.53,"cried,Duc,de,Valognes,impatiently,earth,meet,like,people",0.00,
 They are the opposite of each other  said Father Brown  with a queer kind of smile ,opposite said Father Brown queer kind smile,10.71,"opposite,said,Father,Brown,queer,kind,smile",0.00,
He continued to gaze at the darkening trees opposite  but Valognes turned his head sharply at a suppressed exclamation from Flambeau ,continued gaze darkening trees opposite Valognes turned head sharply suppressed exclamation Flambeau,6.77,"continued,gaze,darkening,trees,opposite,Valognes,turned,head,sharply,suppressed,exclamation,Flambeau",0.00,
That investigator  peering into the lighted room  had just seen the Colonel  after a pace or two  proceed to take his coat off ,investigator peering lighted room seen Colonel pace proceed coat,11.02,"investigator,peering,lighted,room,seen,Colonel,pace,proceed,coat",0.00,
Flambeau  s first thought was that this really looked like a fight  but he soon dropped the thought for another ,Flambeau thought looked like fight soon dropped thought,10.71,"Flambeau,thought,looked,like,fight,soon,dropped,thought",0.00,
The solidity and squareness of Dubosc  s chest and shoulders was all a powerful piece of padding and came off with his coat ,solidity squareness Dubosc chest shoulders powerful piece padding came coat,10.48,"solidity,squareness,Dubosc,chest,shoulders,powerful,piece,padding,came,coat",0.00,
In his shirt and trousers he was a comparatively slim gentleman  who walked across the bedroom to the bathroom with no more pugnacious purpose than that of washing himself ,shirt trousers comparatively slim gentleman walked bedroom bathroom pugnacious purpose washing,10.47,"shirt,trousers,comparatively,slim,gentleman,walked,bedroom,bathroom,pugnacious,purpose,washing",0.00,
He bent over a basin  dried his dripping hands and face on a towel  and turned again so that the strong light fell on his face ,bent basin dried dripping hands face towel turned strong light fell face,11.02,"bent,basin,dried,dripping,hands,face,towel,turned,strong,light,fell,face",0.00,
His brown complexion had gone  his big black moustache had gone  he    was clean   shaven and very pate ,brown complexion gone big black moustache gone clean shaven pate,7.69,"brown,complexion,gone,big,black,moustache,gone,clean,shaven,pate",0.00,
Nothing remained of the Colonel but his bright  hawk   like  brown eyes ,remained Colonel bright hawk like brown eyes,6.94,"remained,Colonel,bright,hawk,like,brown,eyes",0.00,
Under the wall Father Brown was going on in heavy meditation  as if to himself ,wall Father Brown going heavy meditation,11.39,"wall,Father,Brown,going,heavy,meditation",0.00,
 It is all just like what I was saying to Flambeau ,like saying Flambeau,15.69,"like,saying,Flambeau",0.00,
If it  s white instead of black  and solid instead of liquid  and so on all along the line    then there  s something wrong  Monsieur  there  s something wrong ,white instead black solid instead liquid line wrong Monsieur wrong,11.88,"white,instead,black,solid,instead,liquid,line,wrong,Monsieur,wrong",0.00,
One of these men is fair and the other dark  one stout and the other slim  one strong and the other weak ,men fair dark stout slim strong weak,14.29,"men,fair,dark,stout,slim,strong,weak",0.00,
One has a moustache and no beard  so you can  t see his mouth  the other has a beard and no moustache  so you can  t see his chin ,moustache beard mouth beard moustache chin,17.69,"moustache,beard,mouth,beard,moustache,chin",0.00,
One has hair cropped to his skull  but a scarf to hide his neck  the other has low shirt   collars  but long hair to bide his skull ,hair cropped skull scarf hide neck low shirt collars long hair bide skull,10.61,"hair,cropped,skull,scarf,hide,neck,low,shirt,collars,long,hair,bide,skull",0.00,
It  s all too neat and correct  Monsieur  and there  s something wrong ,neat correct Monsieur wrong,12.68,"neat,correct,Monsieur,wrong",0.00,
Things made so opposite are things that cannot quarrel ,Things opposite things quarrel,9.09,"Things,opposite,things,quarrel",0.00,
Like a face and a mask  like a lock and a key ,Like face mask like lock key,13.04,"Like,face,mask,like,lock,key",0.00,
Flambeau was peering into the house with a visage as white as a sheet ,Flambeau peering house visage white sheet,11.43,"Flambeau,peering,house,visage,white,sheet",0.00,
The occupant of the room was standing with his back to him  but in front of a looking   glass  and had already fitted round his face a sort of framework of rank red hair  hanging disordered from the head and clinging round the jaws and chin while leaving the mocking mouth uncovered ,occupant room standing looking glass fitted round face sort framework rank red hair hanging disordered head clinging round jaws chin leaving mocking mouth uncovered,9.89,"occupant,room,standing,looking,glass,fitted,round,face,sort,framework,rank,red,hair,hanging,disordered,head,clinging,round,jaws,chin,leaving,mocking,mouth,uncovered",0.00,
Seen thus in the glass the white face looked like the face of Judas laughing horribly and surrounded by capering flames of hell ,Seen glass white face looked like face Judas laughing horribly surrounded capering flames hell,7.03,"Seen,glass,white,face,looked,like,face,Judas,laughing,horribly,surrounded,capering,flames,hell",0.00,
For a spasm Flambeau saw the fierce  red   brown eyes dancing  then they were covered with a pair of blue spectacles ,spasm Flambeau saw fierce red brown eyes dancing covered pair blue spectacles,7.69,"spasm,Flambeau,saw,fierce,red,brown,eyes,dancing,covered,pair,blue,spectacles",0.00,
Slipping on a loose black coat  the figure vanished towards the front of the house ,Slipping loose black coat figure vanished house,9.64,"Slipping,loose,black,coat,figure,vanished,house",0.00,
A few moments later a roar of popular applause from the street beyond announced that Dr Hirsch had once more appeared upon the balcony ,moments later roar popular applause street announced Dr Hirsch appeared balcony,9.63,"moments,later,roar,popular,applause,street,announced,Dr,Hirsch,appeared,balcony",0.00,
TWO men appeared simultaneously at the two ends of a sort of passage running along the side of the Apollo Theatre in the Adelphi ,men appeared simultaneously ends sort passage running Apollo Theatre Adelphi,10.85,"men,appeared,simultaneously,ends,sort,passage,running,Apollo,Theatre,Adelphi",0.00,
The evening daylight in the streets was large and luminous  opalescent and empty ,evening daylight streets large luminous opalescent,8.64,"evening,daylight,streets,large,luminous,opalescent",0.00,
The passage was comparatively long and dark  so each man could see the other as a mere black silhouette at the other end ,passage comparatively long dark man mere black silhouette end,11.57,"passage,comparatively,long,dark,man,mere,black,silhouette,end",0.00,
Nevertheless  each man knew the other  even in that inky outline  for they were both men of striking appearance and they hated each other ,man knew inky outline men striking appearance hated,11.59,"man,knew,inky,outline,men,striking,appearance,hated",0.00,
The covered passage opened at one end on one of the steep streets of the Adelphi  and at the other on a terrace overlooking the sunset   coloured river ,covered passage opened end steep streets Adelphi terrace overlooking sunset coloured river,10.53,"covered,passage,opened,end,steep,streets,Adelphi,terrace,overlooking,sunset,coloured,river",0.00,
One side of the passage was a blank wall  for the building it supported was an old unsuccessful theatre restaurant  now shut up ,passage blank wall building supported old unsuccessful theatre restaurant shut,10.16,"passage,blank,wall,building,supported,old,unsuccessful,theatre,restaurant,shut",0.00,
The other side of the passage contained two doors  one at each end ,passage contained doors end,13.43,"passage,contained,doors,end",0.00,
Neither was what was commonly called the stage door  they were a sort of special and private stage doors used by very special performers  and in this case by the star actor and actress in the Shakespearean performance of the day ,commonly called stage door sort special private stage doors special performers case star actor actress Shakespearean performance day,10.04,"commonly,called,stage,door,sort,special,private,stage,doors,special,performers,case,star,actor,actress,Shakespearean,performance,day",0.00,
Persons of that eminence often like to have such private exits and entrances  for meeting friends or avoiding them ,Persons eminence like private exits entrances meeting friends avoiding,8.70,"Persons,eminence,like,private,exits,entrances,meeting,friends,avoiding",0.00,
The two men in question were certainly two such friends  men who evidently knew the doors and counted on their opening  for each approached the door at the upper end with equal coolness and confidence ,men question certainly friends men evidently knew doors counted opening approached door upper end equal coolness confidence,8.96,"men,question,certainly,friends,men,evidently,knew,doors,counted,opening,approached,door,upper,end,equal,coolness,confidence",0.00,
Not  however  with equal speed  but the man who walked fast was the man from the other end of the tunnel  so they both arrived before the secret stage door almost at the same instant ,equal speed man walked fast man end tunnel arrived secret stage door instant,12.02,"equal,speed,man,walked,fast,man,end,tunnel,arrived,secret,stage,door,instant",0.00,
They saluted each other with civility  and waited a moment before one of them  the sharper walker who seemed to have the shorter patience  knocked at the door ,saluted civility waited moment sharper walker shorter patience knocked door,11.32,"saluted,civility,waited,moment,sharper,walker,shorter,patience,knocked,door",0.00,
In this and everything else each man was opposite and neither could be called inferior ,man opposite called inferior,12.64,"man,opposite,called,inferior",0.00,
As private persons both were handsome  capable and popular ,private persons handsome capable popular,6.78,"private,persons,handsome,capable,popular",0.00,
As public persons  both were in the first public rank ,public persons public rank,11.11,"public,persons,public,rank",0.00,
But everything about them  from their glory to their good looks  was of a diverse and incomparable kind ,glory good looks diverse incomparable kind,11.54,"glory,good,looks,diverse,incomparable,kind",0.00,
Sir Wilson Seymour was the kind of man whose importance is known to everybody who knows ,Sir Wilson Seymour kind man importance known everybody knows,7.95,"Sir,Wilson,Seymour,kind,man,importance,known,everybody,knows",0.00,
The more you mixed with the innermost ring in every polity or profession  the more often you met Sir Wilson Seymour ,mixed innermost ring polity profession met Sir Wilson Seymour,10.34,"mixed,innermost,ring,polity,profession,met,Sir,Wilson,Seymour",0.00,
He was the one intelligent man on twenty unintelligent committees    on every sort of subject  from the reform of the Royal Academy to the project of bimetallism for Greater Britain ,intelligent man unintelligent committees sort subject reform Royal Academy project bimetallism Greater Britain,9.34,"intelligent,man,unintelligent,committees,sort,subject,reform,Royal,Academy,project,bimetallism,Greater,Britain",0.00,
In the Arts especially he was omnipotent ,Arts especially omnipotent,9.76,"Arts,especially,omnipotent",0.00,
He was so unique that nobody could quite decide whether he was a great aristocrat who had taken up Art  or a great artist whom the aristocrats had taken up ,unique decide great aristocrat taken Art great artist aristocrats taken,12.82,"unique,decide,great,aristocrat,taken,Art,great,artist,aristocrats,taken",0.00,
But you could not meet him for five minutes without realizing that you had really been ruled by him all your life ,meet minutes realizing ruled life,14.91,"meet,minutes,realizing,ruled,life",0.00,
His appearance was  distinguished  in exactly the same sense  it was at once conventional and unique ,appearance distinguished exactly sense conventional unique,9.90,"appearance,distinguished,exactly,sense,conventional,unique",0.00,
Fashion could have found no fault with his high silk hat    yet it was unlike anyone else  s hat    a little higher  perhaps  and adding something to his natural height ,Fashion found fault high silk hat unlike hat little higher adding natural height,10.06,"Fashion,found,fault,high,silk,hat,unlike,hat,little,higher,adding,natural,height",0.00,
His tall  slender figure had a slight stoop yet it looked the reverse of feeble ,tall slender figure slight stoop looked reverse feeble,8.75,"tall,slender,figure,slight,stoop,looked,reverse,feeble",0.00,
His hair was silver   grey  but he did not look old  it was worn longer than the common yet he did not look effeminate  it was curly but it did not look curled ,hair silver grey look old worn longer common look effeminate curly look curled,12.50,"hair,silver,grey,look,old,worn,longer,common,look,effeminate,curly,look,curled",0.00,
His carefully pointed beard made him look more manly and militant than otherwise  as it does in those old admirals of Velazquez with whose dark portraits his house was hung ,carefully pointed beard look manly militant old admirals Velazquez dark portraits house hung,9.83,"carefully,pointed,beard,look,manly,militant,old,admirals,Velazquez,dark,portraits,house,hung",0.00,
His grey gloves were a shade bluer  his silver   knobbed cane a shade longer than scores of such gloves and canes flapped and flourished about the theatres and the restaurants ,grey gloves shade bluer silver knobbed cane shade longer scores gloves canes flapped flourished theatres restaurants,7.95,"grey,gloves,shade,bluer,silver,knobbed,cane,shade,longer,scores,gloves,canes,flapped,flourished,theatres,restaurants",0.00,
The other man was not so tall  yet would have struck nobody as short  but merely as strong and handsome ,man tall struck short merely strong handsome,12.50,"man,tall,struck,short,merely,strong,handsome",0.00,
His hair also was curly  but fair and cropped close to a strong  massive head    the sort of head you break a door with  as Chaucer said of the Miller  s ,hair curly fair cropped close strong massive head sort head break door Chaucer said Miller,10.39,"hair,curly,fair,cropped,close,strong,massive,head,sort,head,break,door,Chaucer,said,Miller",0.00,
His military moustache and the carriage of his shoulders showed him a soldier  but he had a pair of those peculiar frank and piercing blue eyes which are more common in sailors ,military moustache carriage shoulders showed soldier pair peculiar frank piercing blue eyes common sailors,10.17,"military,moustache,carriage,shoulders,showed,soldier,pair,peculiar,frank,piercing,blue,eyes,common,sailors",0.00,
His face was somewhat square  his jaw was square  his shoulders were square  even his jacket was square ,face somewhat square jaw square shoulders square jacket square,8.65,"face,somewhat,square,jaw,square,shoulders,square,jacket,square",0.00,
Indeed  in the wild school of caricature then current  Mr Max Beerbohm had represented him as a proposition in the fourth book of Euclid ,wild school caricature current Mr Max Beerbohm represented proposition fourth book Euclid,8.76,"wild,school,caricature,current,Mr,Max,Beerbohm,represented,proposition,fourth,book,Euclid",0.00,
For he also was a public man  though with quite another sort of success ,public man sort success,13.89,"public,man,sort,success",0.00,
You did not have to be in the best society to have heard of Captain Cutler  of the siege of Hong   Kong  and the great march across China ,best society heard Captain Cutler siege Hong Kong great march China,12.32,"best,society,heard,Captain,Cutler,siege,Hong,Kong,great,march,China",0.00,
You could not get away from hearing of him wherever you were  his portrait was on every other postcard  his maps and battles in every other illustrated paper  songs in his honour in every other music   hall turn or on every other barrel   organ ,away hearing portrait postcard maps battles illustrated paper songs honour music hall turn barrel organ,11.84,"away,hearing,portrait,postcard,maps,battles,illustrated,paper,songs,honour,music,hall,turn,barrel,organ",0.00,
His fame  though probably more temporary  was ten times more wide  popular and spontaneous than the other man  s ,fame probably temporary times wide popular spontaneous man,9.73,"fame,probably,temporary,times,wide,popular,spontaneous,man",0.00,
In thousands of English homes he appeared enormous above England  like Nelson ,thousands English homes appeared enormous England like Nelson,5.13,"thousands,English,homes,appeared,enormous,England,like,Nelson",0.00,
Yet he had infinitely less power in England than Sir Wilson Seymour ,infinitely power England Sir Wilson Seymour,8.82,"infinitely,power,England,Sir,Wilson,Seymour",0.00,
The door was opened to them by an aged servant or  dresser  whose broken   down face and figure and black shabby coat and trousers contrasted queerly with the glittering interior of the great actress  s dressing   room ,door opened aged servant dresser broken face figure black shabby coat trousers contrasted queerly glittering interior great actress dressing room,7.76,"door,opened,aged,servant,dresser,broken,face,figure,black,shabby,coat,trousers,contrasted,queerly,glittering,interior,great,actress,dressing,room",0.00,
It was fitted and filled with looking   glasses at every angle of refraction  so that they looked like the hundred facets of one huge diamond    if one could get inside a diamond ,fitted filled looking glasses angle refraction looked like facets huge diamond inside diamond,10.61,"fitted,filled,looking,glasses,angle,refraction,looked,like,facets,huge,diamond,inside,diamond",0.00,
The other features of luxury  a few flowers  a few coloured cushions  a few scraps of stage costume  were multiplied by all the mirrors into the madness of the Arabian Nights  and danced and changed places perpetually as the shuffling attendant shifted a mirror outwards or shot one back against the wall ,features luxury flowers coloured cushions scraps stage costume multiplied mirrors madness Arabian Nights danced changed places perpetually shuffling attendant shifted mirror outwards shot wall,9.18,"features,luxury,flowers,coloured,cushions,scraps,stage,costume,multiplied,mirrors,madness,Arabian,Nights,danced,changed,places,perpetually,shuffling,attendant,shifted,mirror,outwards,shot,wall",0.00,
They both spoke to the dingy dresser by name  calling him Parkinson  and asking for the lady as Miss Aurora Rome ,spoke dingy dresser calling Parkinson asking lady Miss Aurora Rome,9.73,"spoke,dingy,dresser,calling,Parkinson,asking,lady,Miss,Aurora,Rome",0.00,
Parkinson said she was in the other room  but he would go and tell her ,Parkinson said room tell,15.49,"Parkinson,said,room,tell",0.00,
A shade crossed the brow of both visitors  for the other room was the private room of the great actor with whom Miss Aurora was performing  and she was of the kind that does not inflame admiration without inflaming jealousy ,shade crossed brow visitors room private room great actor Miss Aurora performing kind inflame admiration inflaming jealousy,10.27,"shade,crossed,brow,visitors,room,private,room,great,actor,Miss,Aurora,performing,kind,inflame,admiration,inflaming,jealousy",0.00,
In about half a minute  however  the inner door opened  and she entered as she always did  even in private life  so that the very silence seemed to be a roar of applause  and one well   deserved ,half minute inner door opened entered private life silence roar applause deserved,12.82,"half,minute,inner,door,opened,entered,private,life,silence,roar,applause,deserved",0.00,
She was clad in a somewhat strange garb of peacock green and peacock blue satins  that gleamed like blue and green metals  such as delight children and aesthetes  and her heavy  hot brown hair framed one of those magic faces which are dangerous to all men  but especially to boys and to men growing grey ,clad somewhat strange garb peacock green peacock blue satins gleamed like blue green metals delight children aesthetes heavy hot brown hair framed magic faces dangerous men especially boys men growing grey,7.89,"clad,somewhat,strange,garb,peacock,green,peacock,blue,satins,gleamed,like,blue,green,metals,delight,children,aesthetes,heavy,hot,brown,hair,framed,magic,faces,dangerous,men,especially,boys,men,growing,grey",0.00,
In company with her male colleague  the great American actor  Isidore Bruno  she was producing a particularly poetical and fantastic interpretation of Midsummer Night  s Dream  in which the artistic prominence was given to Oberon and Titania  or in other words to Bruno and herself ,company male colleague great American actor Isidore Bruno producing particularly poetical fantastic interpretation Midsummer Night Dream artistic prominence given Oberon Titania words Bruno,7.80,"company,male,colleague,great,American,actor,Isidore,Bruno,producing,particularly,poetical,fantastic,interpretation,Midsummer,Night,Dream,artistic,prominence,given,Oberon,Titania,words,Bruno",0.00,
Set in dreamy and exquisite scenery  and moving in mystical dances  the green costume  like burnished beetle   wings  expressed all the elusive individuality of an elfin queen ,Set dreamy exquisite scenery moving mystical dances green costume like burnished beetle wings expressed elusive individuality elfin queen,5.11,"Set,dreamy,exquisite,scenery,moving,mystical,dances,green,costume,like,burnished,beetle,wings,expressed,elusive,individuality,elfin,queen",0.00,
But when personally confronted in what was still broad daylight  a man looked only at the woman  s face ,personally confronted broad daylight man looked woman face,10.58,"personally,confronted,broad,daylight,man,looked,woman,face",0.00,
