Unclean,Clean,Noise_Pre_Processing,Training_Data,Noise_Post_Processing,Query
THE consulting   rooms of Dr Orion Hood  the eminent criminologist and specialist in certain moral disorders  lay along the sea   front at Scarborough  in a series of very large and well   lighted french windows  which showed the North Sea like one endless outer wall of blue   green marble ,consulting rooms Dr Orion Hood eminent criminologist specialist certain moral disorders lay sea Scarborough series large lighted french windows showed North Sea like endless outer wall blue green marble,6.53,"consulting,rooms,Dr,Orion,Hood,eminent,criminologist,specialist,certain,moral,disorders,lay,sea,Scarborough,series,large,lighted,french,windows,showed,North,Sea,like,endless,outer,wall,blue,green,marble",0.00,
In such a place the sea had something of the monotony of a blue   green dado  for the chambers themselves were ruled throughout by a terrible tidiness not unlike the terrible tidiness of the sea ,place sea monotony blue green dado chambers ruled terrible tidiness unlike terrible tidiness sea,10.77,"place,sea,monotony,blue,green,dado,chambers,ruled,terrible,tidiness,unlike,terrible,tidiness,sea",0.00,
It must not be supposed that Dr Hood  s apartments excluded luxury  or even poetry ,supposed Dr Hood apartments excluded luxury poetry,9.64,"supposed,Dr,Hood,apartments,excluded,luxury,poetry",0.00,
These things were there  in their place  but one felt that they were never allowed out of their place ,things place felt allowed place,13.73,"things,place,felt,allowed,place",0.00,
Luxury was there  there stood upon a special table eight or ten boxes of the best cigars  but they were built upon a plan so that the strongest were always nearest the wall and the mildest nearest the window ,Luxury stood special table boxes best cigars built plan strongest nearest wall mildest nearest window,11.54,"Luxury,stood,special,table,boxes,best,cigars,built,plan,strongest,nearest,wall,mildest,nearest,window",0.00,
A tantalus containing three kinds of spirit  all of a liqueur excellence  stood always on this table of luxury  but the fanciful have asserted that the whisky  brandy  and rum seemed always to stand at the same level ,tantalus containing kinds spirit liqueur excellence stood table luxury fanciful asserted whisky brandy rum stand level,10.14,"tantalus,containing,kinds,spirit,liqueur,excellence,stood,table,luxury,fanciful,asserted,whisky,brandy,rum,stand,level",0.00,
Poetry was there  the left   hand corner of the room was lined with as complete a set of English classics as the right hand could show of English and foreign physiologists ,Poetry left hand corner room lined complete set English classics right hand English foreign physiologists,9.30,"Poetry,left,hand,corner,room,lined,complete,set,English,classics,right,hand,English,foreign,physiologists",0.00,
But if one took a volume of Chaucer or Shelley from that rank  its absence irritated the mind like a gap in a man  s front teeth ,took volume Chaucer Shelley rank absence irritated mind like gap man teeth,11.63,"took,volume,Chaucer,Shelley,rank,absence,irritated,mind,like,gap,man,teeth",0.00,
One could not say the books were never read  probably they were  but there was a sense of their being chained to their places  like the Bibles in the old churches ,books read probably sense chained places like Bibles old churches,12.88,"books,read,probably,sense,chained,places,like,Bibles,old,churches",0.00,
Dr Hood treated his private book   shelf as if it were a public library ,Dr Hood treated private book shelf public library,8.33,"Dr,Hood,treated,private,book,shelf,public,library",0.00,
And if this strict scientific intangibility steeped even the shelves laden with lyrics and ballads and the tables laden with drink and tobacco  it goes without saying that yet more of such heathen holiness protected the other shelves that held the specialist  s library  and the other tables that sustained the frail and even fairylike instruments of chemistry or mechanics ,strict scientific intangibility steeped shelves laden lyrics ballads tables laden drink tobacco goes saying heathen holiness protected shelves held specialist library tables sustained frail fairylike instruments chemistry mechanics,8.56,"strict,scientific,intangibility,steeped,shelves,laden,lyrics,ballads,tables,laden,drink,tobacco,goes,saying,heathen,holiness,protected,shelves,held,specialist,library,tables,sustained,frail,fairylike,instruments,chemistry,mechanics",0.00,
Dr Hood paced the length of his string of apartments  bounded    as the boys  geographies say    on the east by the North Sea and on the west by the serried ranks of his sociological and criminologist library ,Dr Hood paced length string apartments bounded boys geographies east North Sea west serried ranks sociological criminologist library,9.09,"Dr,Hood,paced,length,string,apartments,bounded,boys,geographies,east,North,Sea,west,serried,ranks,sociological,criminologist,library",0.00,
He was clad in an artist  s velvet  but with none of an artist  s negligence  his hair was heavily shot with grey  but growing thick and healthy  his face was lean  but sanguine and expectant ,clad artist velvet artist negligence hair heavily shot grey growing thick healthy face lean sanguine expectant,10.42,"clad,artist,velvet,artist,negligence,hair,heavily,shot,grey,growing,thick,healthy,face,lean,sanguine,expectant",0.00,
Everything about him and his room indicated something at once rigid and restless  like that great northern sea by which  he had built his home ,room indicated rigid restless like great northern sea built home,10.49,"room,indicated,rigid,restless,like,great,northern,sea,built,home",0.00,
Fate  being in a funny mood  pushed the door open and introduced into those long  strict  sea   flanked apartments one who was perhaps the most startling opposite of them and their master ,Fate funny mood pushed door open introduced long strict sea flanked apartments startling opposite master,9.04,"Fate,funny,mood,pushed,door,open,introduced,long,strict,sea,flanked,apartments,startling,opposite,master",0.00,
In answer to a curt but civil summons  the door opened inwards and there shambled into the room a shapeless little figure  which seemed to find its own hat and umbrella as unmanageable as a mass of luggage ,answer curt civil summons door opened inwards shambled room shapeless little figure find hat umbrella unmanageable mass luggage,9.71,"answer,curt,civil,summons,door,opened,inwards,shambled,room,shapeless,little,figure,find,hat,umbrella,unmanageable,mass,luggage",0.00,
The umbrella was a black and prosaic bundle long past repair  the hat was a broad   curved black hat  clerical but not common in England  the man was the very embodiment of all that is homely and helpless ,umbrella black prosaic bundle long past repair hat broad curved black hat clerical common England man embodiment homely helpless,9.27,"umbrella,black,prosaic,bundle,long,past,repair,hat,broad,curved,black,hat,clerical,common,England,man,embodiment,homely,helpless",0.00,
The doctor regarded the new   comer with a restrained astonishment  not unlike that he would have shown if some huge but obviously harmless sea   beast had crawled into his room ,doctor regarded new comer restrained astonishment unlike shown huge obviously harmless sea beast crawled room,8.43,"doctor,regarded,new,comer,restrained,astonishment,unlike,shown,huge,obviously,harmless,sea,beast,crawled,room",0.00,
The new   comer regarded the doctor with that beaming but breathless geniality which characterizes a corpulent charwoman who has just managed to stuff herself into an omnibus ,new comer regarded doctor beaming breathless geniality characterizes corpulent charwoman managed stuff omnibus,8.00,"new,comer,regarded,doctor,beaming,breathless,geniality,characterizes,corpulent,charwoman,managed,stuff,omnibus",0.00,
It is a rich confusion of social self   congratulation and bodily disarray ,rich confusion social self congratulation bodily disarray,6.67,"rich,confusion,social,self,congratulation,bodily,disarray",0.00,
His hat tumbled to the carpet  his heavy umbrella slipped between his knees with a thud  he reached after the one and ducked after the other  but with an unimpaired smile on his round face spoke simultaneously as follows ,hat tumbled carpet heavy umbrella slipped knees thud reached ducked unimpaired smile round face spoke simultaneously follows,9.95,"hat,tumbled,carpet,heavy,umbrella,slipped,knees,thud,reached,ducked,unimpaired,smile,round,face,spoke,simultaneously,follows",0.00,
I  ve come about that business of the MacNabs ,come business MacNabs,13.04,"come,business,MacNabs",0.00,
I have heard  you often help people out of such troubles ,heard help people troubles,12.28,"heard,help,people,troubles",0.00,
Pray excuse me if I am wrong ,Pray excuse wrong,13.79,"Pray,excuse,wrong",0.00,
By this time he had sprawlingly recovered the hat  and made an odd little bobbing bow over it  as if setting everything quite right ,time sprawlingly recovered hat odd little bobbing bow setting right,10.61,"time,sprawlingly,recovered,hat,odd,little,bobbing,bow,setting,right",0.00,
 I hardly understand you  replied the scientist  with a cold intensity of manner ,hardly understand replied scientist cold intensity manner,7.41,"hardly,understand,replied,scientist,cold,intensity,manner",0.00,
 I fear you have mistaken the chambers ,fear mistaken chambers,10.26,"fear,mistaken,chambers",0.00,
I am Dr Hood  and my work is almost entirely literary and educational ,Dr Hood work entirely literary educational,10.00,"Dr,Hood,work,entirely,literary,educational",0.00,
It is true that I have sometimes been consulted by the police in cases of peculiar difficulty and importance  but   ,true consulted police cases peculiar difficulty importance,11.21,"true,consulted,police,cases,peculiar,difficulty,importance",0.00,
 Oh  this is of the greatest importance  broke in the little man called Brown ,Oh greatest importance broke little man called Brown,7.69,"Oh,greatest,importance,broke,little,man,called,Brown",0.00,
 Why  her mother won  t let them get engaged ,mother let engaged,13.33,"mother,let,engaged",0.00,
And he leaned back in his chair in radiant rationality ,leaned chair radiant rationality,10.91,"leaned,chair,radiant,rationality",0.00,
The brows of Dr Hood were drawn down darkly  but the eyes under them were bright with something that might be anger or might be amusement ,brows Dr Hood drawn darkly eyes bright anger amusement,12.32,"brows,Dr,Hood,drawn,darkly,eyes,bright,anger,amusement",0.00,
 You see  they want to get married  said the man with the clerical hat ,want married said man clerical hat,11.27,"want,married,said,man,clerical,hat",0.00,
 Maggie MacNab and young Todhunter want to get married ,Maggie MacNab young Todhunter want married,5.45,"Maggie,MacNab,young,Todhunter,want,married",0.00,
The great Orion Hood  s scientific triumphs had deprived him of many things    some said of his health  others of his God  but they had not wholly despoiled him of his sense of the absurd ,great Orion Hood scientific triumphs deprived things said health God wholly despoiled sense absurd,11.17,"great,Orion,Hood,scientific,triumphs,deprived,things,said,health,God,wholly,despoiled,sense,absurd",0.00,
At the last plea of the ingenuous priest a chuckle broke out of him from inside  and he threw himself into an arm   chair in an ironical attitude of the consulting physician ,plea ingenuous priest chuckle broke inside threw arm chair ironical attitude consulting physician,10.92,"plea,ingenuous,priest,chuckle,broke,inside,threw,arm,chair,ironical,attitude,consulting,physician",0.00,
 Mr Brown  he said gravely   it is quite fourteen and a half years since I was personally asked to test a personal problem  then it was the case of an attempt to poison the French President at a Lord Mayor  s Banquet ,Mr Brown said gravely fourteen half years personally asked test personal problem case attempt poison French President Lord Mayor Banquet,10.14,"Mr,Brown,said,gravely,fourteen,half,years,personally,asked,test,personal,problem,case,attempt,poison,French,President,Lord,Mayor,Banquet",0.00,
It is now  I understand  a question of whether some friend of yours called Maggie is a suitable fiancee for some friend of hers called Todhunter ,understand question friend called Maggie suitable fiancee friend called Todhunter,11.03,"understand,question,friend,called,Maggie,suitable,fiancee,friend,called,Todhunter",0.00,
Well  Mr Brown  I am a sportsman ,Mr Brown sportsman,12.12,"Mr,Brown,sportsman",0.00,
I will give the MacNab family my best advice  as good as I gave the French Republic and the King of England    no  better  fourteen years better ,MacNab family best advice good gave French Republic King England better fourteen years better,8.97,"MacNab,family,best,advice,good,gave,French,Republic,King,England,better,fourteen,years,better",0.00,
The little clergyman called Brown thanked him with unquestionable warmth  but still with a queer kind of simplicity ,little clergyman called Brown thanked unquestionable warmth queer kind simplicity,6.90,"little,clergyman,called,Brown,thanked,unquestionable,warmth,queer,kind,simplicity",0.00,
It was rather as if he were thanking a stranger in a smoking   room for some trouble in passing the matches  than as if he were  practically thanking the Curator of Kew Gardens for coming with him into a field to find a four   leaved clover ,thanking stranger smoking room trouble passing matches practically thanking Curator Kew Gardens coming field find leaved clover,12.03,"thanking,stranger,smoking,room,trouble,passing,matches,practically,thanking,Curator,Kew,Gardens,coming,field,find,leaved,clover",0.00,
With scarcely a semi   colon after his hearty thanks  the little man began his recital ,scarcely semi colon hearty thanks little man began recital,6.90,"scarcely,semi,colon,hearty,thanks,little,man,began,recital",0.00,
 I told you my name was Brown  well  that  s the fact  and I  m the priest of the little Catholic Church I dare say you  ve seen beyond those straggly streets  where the town ends towards the north ,told Brown fact priest little Catholic Church dare seen straggly streets town ends north,12.63,"told,Brown,fact,priest,little,Catholic,Church,dare,seen,straggly,streets,town,ends,north",0.00,
In the last and straggliest of those streets which runs along the sea like a sea   wall there is a very honest but rather sharp   tempered member of my flock  a widow called MacNab ,straggliest streets runs sea like sea wall honest sharp tempered member flock widow called MacNab,10.50,"straggliest,streets,runs,sea,like,sea,wall,honest,sharp,tempered,member,flock,widow,called,MacNab",0.00,
She has one daughter  and she let us lodgings  and between her and the daughter  and between her and the lodgers    well  I dare say there is a great deal to be said on both sides ,daughter let lodgings daughter lodgers dare great deal said sides,14.44,"daughter,let,lodgings,daughter,lodgers,dare,great,deal,said,sides",0.00,
At present she has only one lodger  the young man called Todhunter  but he has given more trouble than all the rest  for he wants to marry the young woman of the house ,present lodger young man called Todhunter given trouble rest wants marry young woman house,11.31,"present,lodger,young,man,called,Todhunter,given,trouble,rest,wants,marry,young,woman,house",0.00,
 And the young woman of the house  asked Dr Hood  with huge and silent amusement   what does she want ,young woman house asked Dr Hood huge silent amusement want,8.82,"young,woman,house,asked,Dr,Hood,huge,silent,amusement,want",0.00,
 Why  she wants to marry him  cried Father Brown  sitting up eagerly ,wants marry cried Father Brown sitting eagerly,7.25,"wants,marry,cried,Father,Brown,sitting,eagerly",0.00,
 It is indeed a hideous enigma  said Dr Hood ,hideous enigma said Dr Hood,8.89,"hideous,enigma,said,Dr,Hood",0.00,
 This young James Todhunter  continued the cleric   is a very decent man so far as I know  but then nobody knows very much ,young James Todhunter continued cleric decent man far know knows,10.57,"young,James,Todhunter,continued,cleric,decent,man,far,know,knows",0.00,
He is a bright  brownish little fellow  agile like a monkey  clean   shaven like an actor  and obliging like a born courtier ,bright brownish little fellow agile like monkey clean shaven like actor obliging like born courtier,5.60,"bright,brownish,little,fellow,agile,like,monkey,clean,shaven,like,actor,obliging,like,born,courtier",0.00,
He seems to have quite a pocketful of money  but nobody knows what his trade is ,pocketful money knows trade,15.00,"pocketful,money,knows,trade",0.00,
Mrs MacNab  therefore  is quite sure it is something dreadful  and probably connected with dynamite ,Mrs MacNab sure dreadful probably connected dynamite,8.00,"Mrs,MacNab,sure,dreadful,probably,connected,dynamite",0.00,
The dynamite must be of a shy and noiseless sort  for the poor fellow only shuts himself up for several hours of the day and studies something behind a locked door ,dynamite shy noiseless sort poor fellow shuts hours day studies locked door,11.59,"dynamite,shy,noiseless,sort,poor,fellow,shuts,hours,day,studies,locked,door",0.00,
He declares his privacy is temporary and justified  and promises to explain before the wedding ,declares privacy temporary justified promises explain wedding,8.42,"declares,privacy,temporary,justified,promises,explain,wedding",0.00,
That is all that anyone knows for certain  but Mrs MacNab will tell you a great deal more than even she is certain of ,knows certain Mrs MacNab tell great deal certain,13.56,"knows,certain,Mrs,MacNab,tell,great,deal,certain",0.00,
You know how the tales grow like grass on such a patch of ignorance as that ,know tales grow like grass patch ignorance,11.84,"know,tales,grow,like,grass,patch,ignorance",0.00,
There are tales of two voices heard talking in the room  though  when the door is opened  Todhunter is always found alone ,tales voices heard talking room door opened Todhunter found,10.66,"tales,voices,heard,talking,room,door,opened,Todhunter,found",0.00,
There are tales of a mysterious tall man in a silk hat  who once came out of the sea   mists and apparently out of the sea  stepping softly across the sandy fields and through the small back garden at twilight  till he was heard talking to the lodger at his open window ,tales mysterious tall man silk hat came sea mists apparently sea stepping softly sandy fields small garden twilight till heard talking lodger open window,10.37,"tales,mysterious,tall,man,silk,hat,came,sea,mists,apparently,sea,stepping,softly,sandy,fields,small,garden,twilight,till,heard,talking,lodger,open,window",0.00,
The colloquy seemed to end in a quarrel ,colloquy end quarrel,12.50,"colloquy,end,quarrel",0.00,
Todhunter dashed down his window with violence  and the man in the high hat melted into the sea   fog again ,Todhunter dashed window violence man high hat melted sea fog,9.26,"Todhunter,dashed,window,violence,man,high,hat,melted,sea,fog",0.00,
This story is told by the family with the fiercest mystification  but I really think Mrs MacNab prefers her own original tale  that the Other Man  crawls out every night from the big box in the corner  which is kept locked all day ,story told family fiercest mystification think Mrs MacNab prefers original tale Man crawls night big box corner kept locked day,9.96,"story,told,family,fiercest,mystification,think,Mrs,MacNab,prefers,original,tale,Man,crawls,night,big,box,corner,kept,locked,day",0.00,
You see  therefore  how this sealed door of Todhunter  s is treated as the gate of all the fancies and monstrosities of the  Thousand and One Nights ,sealed door Todhunter treated gate fancies monstrosities Thousand Nights,12.08,"sealed,door,Todhunter,treated,gate,fancies,monstrosities,Thousand,Nights",0.00,
And yet there is the little fellow in his respectable black jacket  as punctual and innocent as a parlour clock ,little fellow respectable black jacket punctual innocent parlour clock,9.82,"little,fellow,respectable,black,jacket,punctual,innocent,parlour,clock",0.00,
He pays his rent to the tick  he is practically a teetotaller  he is tirelessly kind with the younger children  and can keep them amused for a day on end  and  last and most urgent of all  he has made himself equally popular with the eldest daughter  who is ready to go to church with him tomorrow ,pays rent tick practically teetotaller tirelessly kind younger children amused day end urgent equally popular eldest daughter ready church tomorrow,12.42,"pays,rent,tick,practically,teetotaller,tirelessly,kind,younger,children,amused,day,end,urgent,equally,popular,eldest,daughter,ready,church,tomorrow",0.00,
A man warmly concerned with any large theories has always a relish for applying them to any triviality ,man warmly concerned large theories relish applying triviality,9.71,"man,warmly,concerned,large,theories,relish,applying,triviality",0.00,
The great specialist having condescended to the priest  s simplicity  condescended expansively ,great specialist condescended priest simplicity condescended expansively,5.26,"great,specialist,condescended,priest,simplicity,condescended,expansively",0.00,
He settled himself with comfort in his arm   chair and began to talk in the tone of a somewhat absent   minded lecturer ,settled comfort arm chair began talk tone somewhat absent minded lecturer,9.17,"settled,comfort,arm,chair,began,talk,tone,somewhat,absent,minded,lecturer",0.00,
 Even in a minute instance  it is best to look first to the main tendencies of Nature ,minute instance best look main tendencies Nature,11.63,"minute,instance,best,look,main,tendencies,Nature",0.00,
A particular flower may not be dead in early winter  but the flowers are dying  a particular pebble may never be wetted with the tide  but the tide is coming in ,particular flower dead early winter flowers dying particular pebble wetted tide tide coming,11.18,"particular,flower,dead,early,winter,flowers,dying,particular,pebble,wetted,tide,tide,coming",0.00,
To the scientific eye all human history is a series of collective movements  destructions or migrations  like the massacre of flies in winter or the return of birds in spring ,scientific eye human history series collective movements destructions migrations like massacre flies winter return birds spring,8.00,"scientific,eye,human,history,series,collective,movements,destructions,migrations,like,massacre,flies,winter,return,birds,spring",0.00,
Now the root fact in all history is Race ,root fact history Race,12.20,"root,fact,history,Race",0.00,
Race produces religion  Race produces legal and ethical wars ,Race produces religion Race produces legal ethical wars,1.64,"Race,produces,religion,Race,produces,legal,ethical,wars",0.00,
There is no stronger case than that of the wild  unworldly and perishing stock which we commonly call the Celts  of whom your friends the MacNabs are specimens ,stronger case wild unworldly perishing stock commonly Celts friends MacNabs specimens,10.62,"stronger,case,wild,unworldly,perishing,stock,commonly,Celts,friends,MacNabs,specimens",0.00,
Small  swarthy  and of this dreamy and drifting blood  they accept easily the superstitious explanation of any incidents  just as they still accept  that superstitious explanation of all incidents which you and your Church represent ,Small swarthy dreamy drifting blood accept easily superstitious explanation incidents accept superstitious explanation incidents Church represent,8.15,"Small,swarthy,dreamy,drifting,blood,accept,easily,superstitious,explanation,incidents,accept,superstitious,explanation,incidents,Church,represent",0.00,
It is not remarkable that such people  with the sea moaning behind them and the Church  droning in front of them  should put fantastic features into what are probably plain events ,remarkable people sea moaning Church droning fantastic features probably plain events,11.11,"remarkable,people,sea,moaning,Church,droning,fantastic,features,probably,plain,events",0.00,
You  with your small parochial responsibilities  see only this particular Mrs MacNab  terrified with this particular tale of two voices and a tall man out of the sea ,small parochial responsibilities particular Mrs MacNab terrified particular tale voices tall man sea,9.04,"small,parochial,responsibilities,particular,Mrs,MacNab,terrified,particular,tale,voices,tall,man,sea",0.00,
But the man with the scientific imagination sees  as it were  the whole clans of MacNab scattered over the whole world  in its ultimate average as uniform as a tribe of birds ,man scientific imagination sees clans MacNab scattered world ultimate average uniform tribe birds,10.86,"man,scientific,imagination,sees,clans,MacNab,scattered,world,ultimate,average,uniform,tribe,birds",0.00,
He sees thousands of Mrs MacNabs  in thousands of houses  dropping their little drop of morbidity in the tea   cups of their friends  he sees   ,sees thousands Mrs MacNabs thousands houses dropping little drop morbidity tea cups friends sees,7.64,"sees,thousands,Mrs,MacNabs,thousands,houses,dropping,little,drop,morbidity,tea,cups,friends,sees",0.00,
Before the scientist could conclude his sentence  another and more impatient summons sounded from without  someone with swishing skirts was marshalled hurriedly down the corridor  and the door opened on a young girl  decently dressed but disordered and red   hot with haste ,scientist conclude sentence impatient summons sounded swishing skirts marshalled hurriedly corridor door opened young girl decently dressed disordered red hot haste,7.66,"scientist,conclude,sentence,impatient,summons,sounded,swishing,skirts,marshalled,hurriedly,corridor,door,opened,young,girl,decently,dressed,disordered,red,hot,haste",0.00,
