Unclean,Clean,Noise_Pre_Processing,Training_Data,Noise_Post_Processing,Query
I fancied  perhaps  that he feared confronting Arthur more than I knew ,fancied feared confronting Arthur knew,9.86,"fancied,feared,confronting,Arthur,knew",0.00,
Anyhow  I settled down at last  and had a quiet dinner alone  and  my thoughts  a little released  fled to Philip and lost themselves  I suppose ,settled quiet dinner thoughts little released fled Philip lost suppose,11.03,"settled,quiet,dinner,thoughts,little,released,fled,Philip,lost,suppose",0.00,
Anyhow  I was looking blankly  but rather pleasantly than otherwise  at another window  uncurtained  but by this time black as a slate with the final night   fall ,looking blankly pleasantly window uncurtained time black slate final night fall,9.82,"looking,blankly,pleasantly,window,uncurtained,time,black,slate,final,night,fall",0.00,
It seemed to me that something like a snail was on the outside of the window   pane ,like snail outside window pane,14.29,"like,snail,outside,window,pane",0.00,
But when I stared harder  it was more like a man  s thumb pressed on the pane  it had that curled look that a thumb has ,stared harder like man thumb pressed pane curled look thumb,13.33,"stared,harder,like,man,thumb,pressed,pane,curled,look,thumb",0.00,
With my fear and courage re   awakened together  I rushed at the window and then recoiled with a strangled scream that any man but Arthur must have heard ,fear courage awakened rushed window recoiled strangled scream man Arthur heard,11.04,"fear,courage,awakened,rushed,window,recoiled,strangled,scream,man,Arthur,heard",0.00,
It was the tip of a crooked nose  crushed against the glass  it looked white with the pressure  and the staring face and eyes behind it were at first invisible and afterwards grey like a ghost ,tip crooked nose crushed glass looked white pressure staring face eyes invisible grey like ghost,10.88,"tip,crooked,nose,crushed,glass,looked,white,pressure,staring,face,eyes,invisible,grey,like,ghost",0.00,
I slammed the shutters together somehow  rushed up to my room and locked myself in ,slammed shutters rushed room locked,12.05,"slammed,shutters,rushed,room,locked",0.00,
But  even as I passed  I could swear I saw a second black window with something on it that was like a snail ,passed swear saw second black window like snail,13.89,"passed,swear,saw,second,black,window,like,snail",0.00,
If the thing was crawling close all around the house like a cat  it might have purposes worse even than blackmail ,thing crawling close house like cat purposes worse blackmail,10.53,"thing,crawling,close,house,like,cat,purposes,worse,blackmail",0.00,
My brother might cast me out and curse me for ever  but he was a gentleman  and would defend me on the spot ,brother cast curse gentleman defend spot,15.74,"brother,cast,curse,gentleman,defend,spot",0.00,
After ten minutes  curious thinking  I went down  knocked on the door and then went in  to see the last and worst sight ,minutes curious thinking went knocked door went worst sight,11.67,"minutes,curious,thinking,went,knocked,door,went,worst,sight",0.00,
 My brother  s chair was empty  and he was obviously out ,brother chair obviously,14.04,"brother,chair,obviously",0.00,
But the man with the crooked nose was sitting waiting for his return  with his hat still insolently on his head  and actually reading one of my brother  s books under my brother  s lamp ,man crooked nose sitting waiting return hat insolently head actually reading brother books brother lamp,10.75,"man,crooked,nose,sitting,waiting,return,hat,insolently,head,actually,reading,brother,books,brother,lamp",0.00,
His face was composed and occupied  but his nose   tip still had the air of being the most mobile part of his face  as if it had just turned from left to right like an elephant  s proboscis ,face composed occupied nose tip air mobile face turned left right like elephant proboscis,12.63,"face,composed,occupied,nose,tip,air,mobile,face,turned,left,right,like,elephant,proboscis",0.00,
I had thought him poisonous enough while he was pursuing and watching me  but I think his unconsciousness of my presence was more frightful still ,thought poisonous pursuing watching think unconsciousness presence frightful,11.64,"thought,poisonous,pursuing,watching,think,unconsciousness,presence,frightful",0.00,
 I think I screamed loud and long  but that doesn  t matter ,think screamed loud long matter,11.67,"think,screamed,loud,long,matter",0.00,
What I did next does matter  I gave him all the money I had  including a good deal in paper which  though it was mine  I dare say I had no right to touch ,matter gave money including good deal paper dare right touch,15.58,"matter,gave,money,including,good,deal,paper,dare,right,touch",0.00,
He went off at last  with hateful  tactful regrets all in long words  and I sat down  feeling ruined in every sense ,went hateful tactful regrets long words sat feeling ruined sense,10.34,"went,hateful,tactful,regrets,long,words,sat,feeling,ruined,sense",0.00,
And yet I was saved that very night by a pure accident ,saved night pure accident,14.55,"saved,night,pure,accident",0.00,
Arthur had gone off suddenly to London  as he so often did  for bargains  and returned  late but radiant  having nearly secured a treasure that was an added splendour even to the family Collection ,Arthur gone suddenly London bargains returned late radiant nearly secured treasure added splendour family Collection,9.64,"Arthur,gone,suddenly,London,bargains,returned,late,radiant,nearly,secured,treasure,added,splendour,family,Collection",0.00,
He was so resplendent that I was almost emboldened to confess the abstraction of the lesser gem    but he bore down all other topics with his over   powering projects ,resplendent emboldened confess abstraction lesser gem bore topics powering projects,11.38,"resplendent,emboldened,confess,abstraction,lesser,gem,bore,topics,powering,projects",0.00,
Because the bargain might still misfire any moment  he insisted on my packing at once and going up with him to lodgings he had already taken in Fulham  to be near the curio   shop in question ,bargain misfire moment insisted packing going lodgings taken Fulham near curio shop question,11.98,"bargain,misfire,moment,insisted,packing,going,lodgings,taken,Fulham,near,curio,shop,question",0.00,
Thus in spite of myself  I fled from my foe almost in the dead of night    but from Philip also  My brother was often at the South Kensington Museum  and  in order to make some sort of secondary life for myself  I paid for a few lessons at the Art Schools ,spite fled foe dead night Philip brother South Kensington Museum order sort secondary life paid lessons Art Schools,12.89,"spite,fled,foe,dead,night,Philip,brother,South,Kensington,Museum,order,sort,secondary,life,paid,lessons,Art,Schools",0.00,
I was coming back from them this evening  when I saw the abomination of desolation walking alive down the long straight street and the rest is as this gentleman has said ,coming evening saw abomination desolation walking alive long straight street rest gentleman said,10.59,"coming,evening,saw,abomination,desolation,walking,alive,long,straight,street,rest,gentleman,said",0.00,
I don  t deserve to be helped  and I don  t question or complain of my punishment  it is just  it ought to have happened ,deserve helped question complain punishment ought happened,14.88,"deserve,helped,question,complain,punishment,ought,happened",0.00,
But I still question  with bursting brains  how it can have happened ,question bursting brains happened,11.59,"question,bursting,brains,happened",0.00,
or how can anyone but Philip and myself know I gave him a tiny coin in the middle of the sea ,Philip know gave tiny coin middle sea,15.05,"Philip,know,gave,tiny,coin,middle,sea",0.00,
 It is an extraordinary problem  admitted Flambeau ,extraordinary problem admitted Flambeau,5.88,"extraordinary,problem,admitted,Flambeau",0.00,
 Not so extraordinary as the answer  remarked Father Brown rather gloomily ,extraordinary answer remarked Father Brown gloomily,6.67,"extraordinary,answer,remarked,Father,Brown,gloomily",0.00,
 Miss Carstairs  will you be at home if we call at your Fulham place in an hour and a half hence ,Miss Carstairs home Fulham place hour half,14.43,"Miss,Carstairs,home,Fulham,place,hour,half",0.00,
The girl looked at him  and then rose and put her gloves on ,girl looked rose gloves,15.00,"girl,looked,rose,gloves",0.00,
 Yes  she said   I  ll be there  and almost instantly left the place ,Yes said instantly left place,11.59,"Yes,said,instantly,left,place",0.00,
That night the detective and the priest were still talking of the matter as they drew near the Fulham house  a tenement strangely mean even for a temporary residence of the Carstairs family ,night detective priest talking matter drew near Fulham house tenement strangely mean temporary residence Carstairs family,8.95,"night,detective,priest,talking,matter,drew,near,Fulham,house,tenement,strangely,mean,temporary,residence,Carstairs,family",0.00,
 Of course the superficial  on reflection  said Flambeau   would think first of this Australian brother who  s been in trouble before  who  s come back so suddenly and who  s just the man to have shabby confederates ,course superficial reflection said Flambeau think Australian brother trouble come suddenly man shabby confederates,10.65,"course,superficial,reflection,said,Flambeau,think,Australian,brother,trouble,come,suddenly,man,shabby,confederates",0.00,
But I can  t see how he can come into the thing by any process of thought  unless ,come thing process thought,17.07,"come,thing,process,thought",0.00,
asked his companion patiently ,asked companion patiently,3.33,"asked,companion,patiently",0.00,
Flambeau lowered his voice ,Flambeau lowered voice,3.70,"Flambeau,lowered,voice",0.00,
 Unless the girl  s lover comes in  too  and he would be the blacker villain ,girl lover comes blacker villain,12.99,"girl,lover,comes,blacker,villain",0.00,
The Australian chap did know that Hawker wanted the coin ,Australian chap know Hawker wanted coin,7.02,"Australian,chap,know,Hawker,wanted,coin",0.00,
But I can  t see how on earth he could know that Hawker had got it  unless Hawker signalled to him or his representative across the shore ,earth know Hawker got Hawker signalled representative shore,13.77,"earth,know,Hawker,got,Hawker,signalled,representative,shore",0.00,
 That is true  assented the priest  with respect ,true assented priest respect,8.16,"true,assented,priest,respect",0.00,
went on Flambeau eagerly ,went Flambeau eagerly,4.00,"went,Flambeau,eagerly",0.00,
 this Hawker hears his love insulted  but doesn  t strike till he  s got to the soft sand   hills  where he can be victor in a mere sham   fight ,Hawker hears love insulted strike till got soft sand hills victor mere sham fight,10.34,"Hawker,hears,love,insulted,strike,till,got,soft,sand,hills,victor,mere,sham,fight",0.00,
If he  d struck amid rocks and sea  he might have hurt his ally ,struck amid rocks sea hurt ally,12.50,"struck,amid,rocks,sea,hurt,ally",0.00,
 That is true again  said Father Brown  nodding ,true said Father Brown nodding,6.25,"true,said,Father,Brown,nodding",0.00,
You want one person for suicide  two people for murder  but at least three people for blackmail ,want person suicide people murder people blackmail,10.42,"want,person,suicide,people,murder,people,blackmail",0.00,
asked the priest softly ,asked priest softly,4.17,"asked,priest,softly",0.00,
 Well  obviously  cried his friend   there must be one to be exposed  one to threaten exposure  and one at least whom exposure would horrify ,obviously cried friend exposed threaten exposure exposure horrify,11.35,"obviously,cried,friend,exposed,threaten,exposure,exposure,horrify",0.00,
After a long ruminant pause  the priest said   You miss a logical step ,long ruminant pause priest said miss logical step,7.04,"long,ruminant,pause,priest,said,miss,logical,step",0.00,
Three persons are needed as ideas ,persons needed ideas,8.82,"persons,needed,ideas",0.00,
 Why shouldn  t a blackmailer  asked Brown  in a low voice   threaten his victim with himself ,blackmailer asked Brown low voice threaten victim,9.57,"blackmailer,asked,Brown,low,voice,threaten,victim",0.00,
Suppose a wife became a rigid teetotaller in order to frighten her husband into concealing his pub   frequenting  and then wrote him blackmailing letters in another hand  threatening to tell his wife ,Suppose wife rigid teetotaller order frighten husband concealing pub frequenting wrote blackmailing letters hand threatening tell wife,7.50,"Suppose,wife,rigid,teetotaller,order,frighten,husband,concealing,pub,frequenting,wrote,blackmailing,letters,hand,threatening,tell,wife",0.00,
Suppose a father forbade a son to gamble and then  following him in a good disguise  threatened the boy with his own sham paternal strictness ,Suppose father forbade son gamble following good disguise threatened boy sham paternal strictness,8.45,"Suppose,father,forbade,son,gamble,following,good,disguise,threatened,boy,sham,paternal,strictness",0.00,
cried Flambeau   you don  t mean   ,cried Flambeau mean,8.57,"cried,Flambeau,mean",0.00,
An active figure ran down the steps of the house and showed under the golden lamplight the unmistakable head that resembled the Roman coin ,active figure ran steps house showed golden lamplight unmistakable head resembled Roman coin,7.91,"active,figure,ran,steps,house,showed,golden,lamplight,unmistakable,head,resembled,Roman,coin",0.00,
 Miss Carstairs  said Hawker without ceremony   wouldn  t go in till you came ,Miss Carstairs said Hawker ceremony till came,7.69,"Miss,Carstairs,said,Hawker,ceremony,till,came",0.00,
 Well  observed Brown confidently   don  t you think it  s the best thing she can do to stop outside    with you to look after her ,observed Brown confidently think best thing stop outside look,12.21,"observed,Brown,confidently,think,best,thing,stop,outside,look",0.00,
 Yes  said the young man  in an undertone   I guessed on the sands and now I know  that was why I let him fall soft ,Yes said young man undertone guessed sands know let fall soft,12.07,"Yes,said,young,man,undertone,guessed,sands,know,let,fall,soft",0.00,
Taking a latchkey from the girl and the coin from Hawker  Flambeau let himself and his friend into the empty house and passed into the outer parlour ,Taking latchkey girl coin Hawker Flambeau let friend house passed outer parlour,10.07,"Taking,latchkey,girl,coin,Hawker,Flambeau,let,friend,house,passed,outer,parlour",0.00,
The man whom Father Brown had seen pass the tavern was standing against the wall as if at bay  unchanged  save that he had taken off his black coat and was wearing a brown dressing   gown ,man Father Brown seen pass tavern standing wall bay unchanged save taken black coat wearing brown dressing gown,9.57,"man,Father,Brown,seen,pass,tavern,standing,wall,bay,unchanged,save,taken,black,coat,wearing,brown,dressing,gown",0.00,
 We have come  said Father Brown politely   to give back this coin to its owner ,come said Father Brown politely coin owner,10.00,"come,said,Father,Brown,politely,coin,owner",0.00,
And he handed it to the man with the nose ,handed man nose,16.67,"handed,man,nose",0.00,
Flambeau  s eyes rolled ,Flambeau eyes rolled,4.17,"Flambeau,eyes,rolled",0.00,
 Is this man a coin   collector ,man coin collector,9.38,"man,coin,collector",0.00,
 This man is Mr Arthur Carstairs  said the priest positively   and he is a coin   collector of a somewhat singular kind ,man Mr Arthur Carstairs said priest positively coin collector somewhat singular kind,7.50,"man,Mr,Arthur,Carstairs,said,priest,positively,coin,collector,somewhat,singular,kind",0.00,
The man changed colour so horribly that the crooked nose stood out on his face like a separate and comic thing ,man changed colour horribly crooked nose stood face like separate comic thing,8.11,"man,changed,colour,horribly,crooked,nose,stood,face,like,separate,comic,thing",0.00,
He spoke  nevertheless  with a sort of despairing dignity ,spoke sort despairing dignity,8.62,"spoke,sort,despairing,dignity",0.00,
 You shall see  then  he said   that I have not lost all the family qualities ,shall said lost family qualities,12.82,"shall,said,lost,family,qualities",0.00,
And he turned suddenly and strode into an inner room  slamming the door ,turned suddenly strode inner room slamming door,8.33,"turned,suddenly,strode,inner,room,slamming,door",0.00,
shouted Father Brown  bounding and half falling over a chair  and  after a wrench or two  Flambeau had the door open ,shouted Father Brown bounding half falling chair wrench Flambeau door open,8.55,"shouted,Father,Brown,bounding,half,falling,chair,wrench,Flambeau,door,open",0.00,
In dead silence Flambeau strode across and telephoned for doctor and police ,dead silence Flambeau strode telephoned doctor police,6.58,"dead,silence,Flambeau,strode,telephoned,doctor,police",0.00,
An empty medicine bottle lay on the floor ,medicine bottle lay floor,9.52,"medicine,bottle,lay,floor",0.00,
Across the table the body of the man in the brown dressing   gown lay amid his burst and gaping brown   paper parcels  out of which poured and rolled  not Roman  but very modern English coins ,table body man brown dressing gown lay amid burst gaping brown paper parcels poured rolled Roman modern English coins,8.33,"table,body,man,brown,dressing,gown,lay,amid,burst,gaping,brown,paper,parcels,poured,rolled,Roman,modern,English,coins",0.00,
The priest held up the bronze head of Caesar ,priest held bronze head Caesar,8.89,"priest,held,bronze,head,Caesar",0.00,
 This  he said   was all that was left of the Carstairs Collection ,said left Carstairs Collection,11.94,"said,left,Carstairs,Collection",0.00,
After a silence he went on  with more than common gentleness   It was a cruel will his wicked father made  and you see he did resent it a little ,silence went common gentleness cruel wicked father resent little,13.79,"silence,went,common,gentleness,cruel,wicked,father,resent,little",0.00,
He hated the Roman money he had  and grew fonder of the real money denied him ,hated Roman money grew fonder real money denied,10.26,"hated,Roman,money,grew,fonder,real,money,denied",0.00,
He not only sold the Collection bit by bit  but sank bit by bit to the basest ways of making money    even to blackmailing his own family in a disguise ,sold Collection bit bit sank bit bit basest ways making money blackmailing family disguise,10.53,"sold,Collection,bit,bit,sank,bit,bit,basest,ways,making,money,blackmailing,family,disguise",0.00,
He blackmailed his brother from Australia for his little forgotten crime  he blackmailed his sister for the theft he alone could have noticed ,blackmailed brother Australia little forgotten crime blackmailed sister theft noticed,9.15,"blackmailed,brother,Australia,little,forgotten,crime,blackmailed,sister,theft,noticed",0.00,
And that  by the way  is why she had that supernatural guess when he was away on the sand   dunes ,way supernatural guess away sand dunes,14.29,"way,supernatural,guess,away,sand,dunes",0.00,
Mere figure and gait  however distant  are more likely to remind us of somebody than a well   made   up face quite close ,Mere figure gait distant likely remind somebody face close,10.74,"Mere,figure,gait,distant,likely,remind,somebody,face,close",0.00,
 Well  growled the detective   and so this great numismatist and coin   collector was nothing but a vulgar miser ,growled detective great numismatist coin collector vulgar miser,8.85,"growled,detective,great,numismatist,coin,collector,vulgar,miser",0.00,
asked Father Brown  in the same strange  indulgent tone ,asked Father Brown strange indulgent tone,5.36,"asked,Father,Brown,strange,indulgent,tone",0.00,
 What is there wrong about a miser that is not often as wrong about a collector ,wrong miser wrong collector,15.00,"wrong,miser,wrong,collector",0.00,
What is wrong  except  thou shalt not make to thyself any graven image  thou shalt not bow down to them nor serve them  for I  but we must go and see how the poor young people are getting on ,wrong thou shalt thyself graven image thou shalt bow serve poor young people getting,13.09,"wrong,thou,shalt,thyself,graven,image,thou,shalt,bow,serve,poor,young,people,getting",0.00,
 I think  said Flambeau   that in spite of everything  they are probably getting on very well ,think said Flambeau spite probably getting,10.64,"think,said,Flambeau,spite,probably,getting",0.00,
MR EDWARD NUTT  the industrious editor of the Daily Reformer  sat at his desk  opening letters and marking proofs to the merry tune of a typewriter  worked by a vigorous young lady ,MR EDWARD NUTT industrious editor Daily Reformer sat desk opening letters marking proofs merry tune typewriter worked vigorous young lady,6.63,"MR,EDWARD,NUTT,industrious,editor,Daily,Reformer,sat,desk,opening,letters,marking,proofs,merry,tune,typewriter,worked,vigorous,young,lady",0.00,
He was a stoutish  fair man  in his shirt   sleeves  his movements were resolute  his mouth firm and his tones final  but his round  rather babyish blue eyes had a bewildered and even wistful look that rather contradicted all this ,stoutish fair man shirt sleeves movements resolute mouth firm tones final round babyish blue eyes bewildered wistful look contradicted,9.09,"stoutish,fair,man,shirt,sleeves,movements,resolute,mouth,firm,tones,final,round,babyish,blue,eyes,bewildered,wistful,look,contradicted",0.00,
Nor indeed was the expression altogether misleading ,expression altogether misleading,7.69,"expression,altogether,misleading",0.00,
It might truly be said of him  as for many journalists in authority  that his most familiar emotion was one of continuous fear  fear of libel actions  fear of lost advertisements  fear of misprints  fear of the sack ,truly said journalists authority familiar emotion continuous fear fear libel actions fear lost advertisements fear misprints fear sack,9.26,"truly,said,journalists,authority,familiar,emotion,continuous,fear,fear,libel,actions,fear,lost,advertisements,fear,misprints,fear,sack",0.00,
His life was a series of distracted compromises between the proprietor of the paper  who was a senile soap   boiler with three ineradicable mistakes in his mind  and the very able staff he had collected to run the paper  some of whom were brilliant and experienced men and  sincere enthusiasts for the political policy of the paper ,life series distracted compromises proprietor paper senile soap boiler ineradicable mistakes mind able staff collected run paper brilliant experienced men sincere enthusiasts political policy paper,9.64,"life,series,distracted,compromises,proprietor,paper,senile,soap,boiler,ineradicable,mistakes,mind,able,staff,collected,run,paper,brilliant,experienced,men,sincere,enthusiasts,political,policy,paper",0.00,
A letter from one of these lay immediately before him  and rapid and resolute as he was  he seemed almost to hesitate before opening it ,letter lay immediately rapid resolute hesitate opening,13.24,"letter,lay,immediately,rapid,resolute,hesitate,opening",0.00,
He took up a strip of proof instead  ran down it with a blue eye  and a blue pencil  altered the word  adultery  to the word  impropriety  and the word  Jew  to the word  Alien  rang a bell and sent it flying upstairs ,took strip proof instead ran blue eye blue pencil altered word adultery word impropriety word Jew word Alien rang bell sent flying upstairs,9.17,"took,strip,proof,instead,ran,blue,eye,blue,pencil,altered,word,adultery,word,impropriety,word,Jew,word,Alien,rang,bell,sent,flying,upstairs",0.00,
Then  with a more thoughtful eye  he ripped open the letter from his more distinguished contributor  which bore a postmark of Devonshire  and read as follows ,thoughtful eye ripped open letter distinguished contributor bore postmark Devonshire read follows,8.86,"thoughtful,eye,ripped,open,letter,distinguished,contributor,bore,postmark,Devonshire,read,follows",0.00,
DEAR NUTT    As I see you  re working Spooks and Dooks at the same time  what about an article on that rum business of the Eyres of Exmoor  or as the old women call it down here  the Devil  s Ear of Eyre ,DEAR NUTT working Spooks Dooks time article rum business Eyres Exmoor old women Devil Ear Eyre,13.24,"DEAR,NUTT,working,Spooks,Dooks,time,article,rum,business,Eyres,Exmoor,old,women,Devil,Ear,Eyre",0.00,
The head of the family  you know  is the Duke of Exmoor  he is one of the few really stiff old Tory aristocrats left  a sound old crusted tyrant it is quite in our line to make trouble about ,head family know Duke Exmoor stiff old Tory aristocrats left sound old crusted tyrant line trouble,12.04,"head,family,know,Duke,Exmoor,stiff,old,Tory,aristocrats,left,sound,old,crusted,tyrant,line,trouble",0.00,
And I think I  m on the track of a story that will make trouble ,think track story trouble,17.19,"think,track,story,trouble",0.00,
Of course I don  t believe in the old legend about James I  and as for you  you don  t believe in anything  not even in journalism ,course believe old legend James believe journalism,15.27,"course,believe,old,legend,James,believe,journalism",0.00,
The legend  you  ll probably remember  was about the blackest business in English history    the poisoning of Overbury by that witch  s cat Frances Howard  and the quite mysterious terror which forced the King to pardon the murderers ,legend probably remember blackest business English history poisoning Overbury witch cat Frances Howard mysterious terror forced King pardon murderers,8.12,"legend,probably,remember,blackest,business,English,history,poisoning,Overbury,witch,cat,Frances,Howard,mysterious,terror,forced,King,pardon,murderers",0.00,
