Unclean,Clean,Noise_Pre_Processing,Training_Data,Noise_Post_Processing,Query
Then he flung the garden door over the garden wall  just as a third shot picked up a spurt of snow and dust behind his heel ,flung garden door garden wall shot picked spurt snow dust heel,12.10,"flung,garden,door,garden,wall,shot,picked,spurt,snow,dust,heel",0.00,
Without ceremony he snatched up the little priest  slung him astraddle on his shoulders  and went racing towards Seawood as fast as his long legs could carry him ,ceremony snatched little priest slung astraddle shoulders went racing Seawood fast long legs carry,8.64,"ceremony,snatched,little,priest,slung,astraddle,shoulders,went,racing,Seawood,fast,long,legs,carry",0.00,
It was not until nearly two miles farther on that he set his small companion down ,nearly miles farther set small companion,12.20,"nearly,miles,farther,set,small,companion",0.00,
It had hardly been a dignified escape  in spite of the classic model of Anchises  but Father Brown  s face only wore a broad grin ,hardly dignified escape spite classic model Anchises Father Brown face wore broad grin,9.23,"hardly,dignified,escape,spite,classic,model,Anchises,Father,Brown,face,wore,broad,grin",0.00,
 Well  said Flambeau  after an impatient silence  as they resumed their more conventional tramp through the streets on the edge of the town  where no outrage need be feared   I don  t know what all this means  but I take it I may trust my own eyes that you never met the man you have so accurately described ,said Flambeau impatient silence resumed conventional tramp streets edge town outrage need feared know means trust eyes met man accurately described,12.01,"said,Flambeau,impatient,silence,resumed,conventional,tramp,streets,edge,town,outrage,need,feared,know,means,trust,eyes,met,man,accurately,described",0.00,
 I did meet him in a way  Brown said  biting his finger rather nervously    I did really ,meet way Brown said biting finger nervously,11.24,"meet,way,Brown,said,biting,finger,nervously",0.00,
And it was too dark to see him properly  because it was under that bandstand affair ,dark properly bandstand affair,14.29,"dark,properly,bandstand,affair",0.00,
But I  m afraid I didn  t describe him so very accurately after all  for his pince   nez was broken under him  and the long gold pin wasn  t stuck through his purple scarf but through his heart ,afraid describe accurately pince nez broken long gold pin stuck purple scarf heart,12.89,"afraid,describe,accurately,pince,nez,broken,long,gold,pin,stuck,purple,scarf,heart",0.00,
 And I suppose  said the other in a lower voice   that glass   eyed guy had something to do with it ,suppose said lower voice glass eyed guy,13.00,"suppose,said,lower,voice,glass,eyed,guy",0.00,
 I had hoped he had only a little  answered Brown in a rather troubled voice   and I may have been wrong in what I did ,hoped little answered Brown troubled voice wrong,15.13,"hoped,little,answered,Brown,troubled,voice,wrong",0.00,
But I fear this business has deep roots and dark ,fear business deep roots dark,10.20,"fear,business,deep,roots,dark",0.00,
They walked on through some streets in silence ,walked streets silence,10.64,"walked,streets,silence",0.00,
The yellow lamps were beginning to be lit in the cold blue twilight  and they were evidently approaching the more central parts of the town ,yellow lamps beginning lit cold blue twilight evidently approaching central parts town,9.29,"yellow,lamps,beginning,lit,cold,blue,twilight,evidently,approaching,central,parts,town",0.00,
Highly coloured bills announcing the glove   fight between Nigger Ned and Malvoli were slapped about the walls ,Highly coloured bills announcing glove fight Nigger Ned Malvoli slapped walls,5.41,"Highly,coloured,bills,announcing,glove,fight,Nigger,Ned,Malvoli,slapped,walls",0.00,
 Well  said Flambeau   I never murdered anyone  even in my criminal days  but I can almost sympathize with anyone doing it in such a dreary place ,said Flambeau murdered criminal days sympathize dreary place,12.33,"said,Flambeau,murdered,criminal,days,sympathize,dreary,place",0.00,
Of all God   forsaken dustbins of Nature  I think the most heart   breaking are places like that bandstand  that were meant to be festive and are forlorn ,God forsaken dustbins Nature think heart breaking places like bandstand meant festive forlorn,9.09,"God,forsaken,dustbins,Nature,think,heart,breaking,places,like,bandstand,meant,festive,forlorn",0.00,
I can fancy a morbid man feeling he must kill his rival in the solitude and irony of such a scene ,fancy morbid man feeling kill rival solitude irony scene,12.24,"fancy,morbid,man,feeling,kill,rival,solitude,irony,scene",0.00,
I remember once taking a tramp in your glorious Surrey hills  thinking of nothing but gorse and skylarks  when I came out on a vast circle of land  and over me lifted a vast  voiceless structure  tier above tier of seats  as huge as a Roman amphitheatre and as empty as a new letter   rack ,remember taking tramp glorious Surrey hills thinking gorse skylarks came vast circle land lifted vast voiceless structure tier tier seats huge Roman amphitheatre new letter rack,10.00,"remember,taking,tramp,glorious,Surrey,hills,thinking,gorse,skylarks,came,vast,circle,land,lifted,vast,voiceless,structure,tier,tier,seats,huge,Roman,amphitheatre,new,letter,rack",0.00,
A bird sailed in heaven over it ,bird sailed heaven,12.50,"bird,sailed,heaven",0.00,
It was the Grand Stand at Epsom ,Grand Stand Epsom,12.50,"Grand,Stand,Epsom",0.00,
 It  s odd you should mention Epsom  said the priest ,odd mention Epsom said priest,9.43,"odd,mention,Epsom,said,priest",0.00,
 Do you remember what was called the Sutton Mystery  because two suspected men    ice   cream men  I think    happened to live at Sutton ,remember called Sutton Mystery suspected men ice cream men think happened live Sutton,7.30,"remember,called,Sutton,Mystery,suspected,men,ice,cream,men,think,happened,live,Sutton",0.00,
A man was found strangled  it was said  on the Downs round that part ,man found strangled said Downs round,11.59,"man,found,strangled,said,Downs,round",0.00,
As a fact  I know  that he was found close up to the Epsom Grand Stand    in fact  only hidden by one of the lower doors being pushed back ,fact know found close Epsom Grand Stand fact hidden lower doors pushed,12.23,"fact,know,found,close,Epsom,Grand,Stand,fact,hidden,lower,doors,pushed",0.00,
 That is queer  assented Flambeau ,queer assented Flambeau,5.88,"queer,assented,Flambeau",0.00,
 But it rather confirms my view that such pleasure places look awfully lonely out of season  or the man wouldn  t have been murdered there ,confirms view pleasure places look awfully lonely season man murdered,10.79,"confirms,view,pleasure,places,look,awfully,lonely,season,man,murdered",0.00,
 I  m not so sure he    began Brown  and stopped ,sure began Brown stopped,12.24,"sure,began,Brown,stopped",0.00,
 Not so sure he was murdered out of the season  answered the little priest  with simplicity ,sure murdered season answered little priest simplicity,9.78,"sure,murdered,season,answered,little,priest,simplicity",0.00,
 Don  t you think there  s something rather tricky about this solitude  Flambeau ,think tricky solitude Flambeau,11.11,"think,tricky,solitude,Flambeau",0.00,
Do you feel sure a wise murderer would always want the spot to be lonely ,feel sure wise murderer want spot lonely,10.96,"feel,sure,wise,murderer,want,spot,lonely",0.00,
And  short of that  the more alone he is  the more certain he is to be seen ,short certain seen,18.42,"short,certain,seen",0.00,
No  I think there must be some other    Why  here we are at the Pavilion or Palace  or whatever they call it ,think Pavilion Palace,17.43,"think,Pavilion,Palace",0.00,
They had emerged on a small square  brilliantly lighted  of which the principal building was gay with gilding  gaudy with posters  and flanked with two giant photographs of Malvoli and Nigger Ned ,emerged small square brilliantly lighted principal building gay gilding gaudy posters flanked giant photographs Malvoli Nigger Ned,7.65,"emerged,small,square,brilliantly,lighted,principal,building,gay,gilding,gaudy,posters,flanked,giant,photographs,Malvoli,Nigger,Ned",0.00,
cried Flambeau in great surprise  as his clerical friend stumped straight up the broad steps ,cried Flambeau great surprise clerical friend stumped straight broad steps,5.38,"cried,Flambeau,great,surprise,clerical,friend,stumped,straight,broad,steps",0.00,
 I didn  t know pugilism was your latest hobby ,know pugilism latest hobby,10.64,"know,pugilism,latest,hobby",0.00,
 I don  t think there will be any fight  replied Father Brown ,think fight replied Father Brown,11.29,"think,fight,replied,Father,Brown",0.00,
They passed rapidly through ante   rooms and inner rooms  they passed through the hall of combat itself  raised  roped  and padded with innumerable seats and boxes  and still the cleric did not look round or pause till he came to a clerk at a desk outside a door marked  Committee ,passed rapidly ante rooms inner rooms passed hall combat raised roped padded innumerable seats boxes cleric look round pause till came clerk desk outside door marked Committee,8.19,"passed,rapidly,ante,rooms,inner,rooms,passed,hall,combat,raised,roped,padded,innumerable,seats,boxes,cleric,look,round,pause,till,came,clerk,desk,outside,door,marked,Committee",0.00,
There he stopped and asked to see Lord Pooley ,stopped asked Lord Pooley,10.87,"stopped,asked,Lord,Pooley",0.00,
The attendant observed that his lordship was very busy  as the fight was coming on soon  but Father Brown had a good   tempered tedium of reiteration for which the official mind is generally not prepared ,attendant observed lordship busy fight coming soon Father Brown good tempered tedium reiteration official mind generally prepared,8.82,"attendant,observed,lordship,busy,fight,coming,soon,Father,Brown,good,tempered,tedium,reiteration,official,mind,generally,prepared",0.00,
In a few moments the rather baffled Flambeau found himself in the presence of a man who was still shouting directions to another man going out of the room ,moments baffled Flambeau found presence man shouting directions man going room,11.61,"moments,baffled,Flambeau,found,presence,man,shouting,directions,man,going,room",0.00,
 Be careful  you know  about the ropes after the fourth    Well  and what do you want  I wonder ,careful know ropes fourth want wonder,12.50,"careful,know,ropes,fourth,want,wonder",0.00,
Lord Pooley was a gentleman  and  like most of the few remaining to our race  was worried    especially about money ,Lord Pooley gentleman like remaining race worried especially money,9.48,"Lord,Pooley,gentleman,like,remaining,race,worried,especially,money",0.00,
He was half grey and half flaxen  and he had the eyes of fever and a high   bridged  frost   bitten nose ,half grey half flaxen eyes fever high bridged frost bitten nose,9.52,"half,grey,half,flaxen,eyes,fever,high,bridged,frost,bitten,nose",0.00,
 Only a word  said Father Brown ,word said Father Brown,6.25,"word,said,Father,Brown",0.00,
 I have come to prevent a man being killed ,come prevent man killed,11.63,"come,prevent,man,killed",0.00,
Lord Pooley bounded off his chair as if a spring had flung him from it ,Lord Pooley bounded chair spring flung,12.68,"Lord,Pooley,bounded,chair,spring,flung",0.00,
 You and your committees and parsons and petitions ,committees parsons petitions,9.80,"committees,parsons,petitions",0.00,
Weren  t there parsons in the old days  when they fought without gloves ,parsons old days fought gloves,11.11,"parsons,old,days,fought,gloves",0.00,
Now they  re fighting with the regulation gloves  and there  s not the rag of a possibility of either of the boxers being killed ,fighting regulation gloves rag possibility boxers killed,13.18,"fighting,regulation,gloves,rag,possibility,boxers,killed",0.00,
 I didn  t mean either of the boxers  said the little priest ,mean boxers said little priest,11.48,"mean,boxers,said,little,priest",0.00,
said the nobleman  with a touch of frosty humour ,said nobleman touch frosty humour,8.16,"said,nobleman,touch,frosty,humour",0.00,
 I don  t know who  s going to be killed  replied Father Brown  with a reflective stare ,know going killed replied Father Brown reflective stare,10.23,"know,going,killed,replied,Father,Brown,reflective,stare",0.00,
I never could see anything wrong about prize   fights ,wrong prize fights,11.11,"wrong,prize,fights",0.00,
As it is  I must ask you to announce that the fight is off for the present ,ask announce fight present,17.33,"ask,announce,fight,present",0.00,
jeered the gentleman with feverish eyes ,jeered gentleman feverish eyes,5.00,"jeered,gentleman,feverish,eyes",0.00,
 And what do you say to the two thousand people who have come to see it ,thousand people come,18.06,"thousand,people,come",0.00,
 I say there will be one thousand nine   hundred and ninety   nine of them left alive when they have seen it  said Father Brown ,thousand ninety left alive seen said Father Brown,12.50,"thousand,ninety,left,alive,seen,said,Father,Brown",0.00,
Lord Pooley looked at Flambeau ,Lord Pooley looked Flambeau,3.23,"Lord,Pooley,looked,Flambeau",0.00,
 And took here  resumed Pooley in his restless way   it  s worse than that ,took resumed Pooley restless way worse,10.67,"took,resumed,Pooley,restless,way,worse",0.00,
A whole pack of Italians have turned up to back Malvoli    swarthy  savage fellows of some country  anyhow ,pack Italians turned Malvoli swarthy savage fellows country,9.35,"pack,Italians,turned,Malvoli,swarthy,savage,fellows,country",0.00,
You know what these Mediterranean races are like ,know Mediterranean races like,8.16,"know,Mediterranean,races,like",0.00,
If I send out word that it  s off we shall have Malvoli storming in here at the head of a whole Corsican clan ,send word shall Malvoli storming head Corsican clan,14.55,"send,word,shall,Malvoli,storming,head,Corsican,clan",0.00,
 My lord  it is a matter of life and death  said the priest ,lord matter life death said priest,11.67,"lord,matter,life,death,said,priest",0.00,
The nobleman struck the bell on the table with an odd air of new curiosity ,nobleman struck bell table odd air new curiosity,9.33,"nobleman,struck,bell,table,odd,air,new,curiosity",0.00,
He said to the clerk who appeared almost instantly in the doorway   I have a serious announcement to make to the audience shortly ,said clerk appeared instantly doorway announcement audience shortly,11.54,"said,clerk,appeared,instantly,doorway,announcement,audience,shortly",0.00,
Meanwhile  would you kindly tell the two champions that the fight will have to be put off ,kindly tell champions fight,14.44,"kindly,tell,champions,fight",0.00,
The clerk stared for some seconds as if at a demon and vanished ,clerk stared seconds demon vanished,12.50,"clerk,stared,seconds,demon,vanished",0.00,
asked Lord Pooley abruptly ,asked Lord Pooley abruptly,0.00,"asked,Lord,Pooley,abruptly",0.00,
 I consulted a bandstand  said Father Brown  scratching his head ,consulted bandstand said Father Brown scratching head,4.62,"consulted,bandstand,said,Father,Brown,scratching,head",0.00,
 But  no  I  m wrong  I consulted a book  too ,wrong consulted book,15.22,"wrong,consulted,book",0.00,
I picked it up on a bookstall in London    very cheap  too ,picked bookstall London cheap,13.56,"picked,bookstall,London,cheap",0.00,
He had taken out of his pocket a small  stout  leather   bound volume  and Flambeau  looking over his shoulder  could see that it was some book of old travels  and had a leaf turned down for reference ,taken pocket small stout leather bound volume Flambeau looking shoulder book old travels leaf turned reference,10.45,"taken,pocket,small,stout,leather,bound,volume,Flambeau,looking,shoulder,book,old,travels,leaf,turned,reference",0.00,
 The only form in which Voodoo    began Father Brown  reading aloud ,form Voodoo began Father Brown reading aloud,5.88,"form,Voodoo,began,Father,Brown,reading,aloud",0.00,
 In which Voodoo  repeated the reader  almost with relish   is widely organized outside Jamaica itself is in the form known as the Monkey  or the God of the Gongs  which is powerful in many parts of the two American continents  especially among half   breeds  many of whom look exactly like white men ,Voodoo repeated reader relish widely organized outside Jamaica form known Monkey God Gongs powerful parts American continents especially half breeds look exactly like white men,8.97,"Voodoo,repeated,reader,relish,widely,organized,outside,Jamaica,form,known,Monkey,God,Gongs,powerful,parts,American,continents,especially,half,breeds,look,exactly,like,white,men",0.00,
It differs from most other forms of devil   worship and human sacrifice in the fact that the blood is not she would formally on the altar  but by a sort of assassination among the crowd ,differs forms devil worship human sacrifice fact blood formally altar sort assassination crowd,11.83,"differs,forms,devil,worship,human,sacrifice,fact,blood,formally,altar,sort,assassination,crowd",0.00,
The gongs beat with a deafening din as the doors of the shrine open and the monkey   god is revealed  almost the whole congregation rivet ecstatic eyes on him ,gongs beat deafening din doors shrine open monkey god revealed congregation rivet ecstatic eyes,9.43,"gongs,beat,deafening,din,doors,shrine,open,monkey,god,revealed,congregation,rivet,ecstatic,eyes",0.00,
The door of the room was flung open  and the fashionable negro stood framed in it  his eyeballs rolling  his silk hat still insolently tilted on his head ,door room flung open fashionable negro stood framed eyeballs rolling silk hat insolently tilted head,8.44,"door,room,flung,open,fashionable,negro,stood,framed,eyeballs,rolling,silk,hat,insolently,tilted,head",0.00,
he cried  showing his apish teeth ,cried showing apish teeth,5.88,"cried,showing,apish,teeth",0.00,
You steal a coloured gentleman  s prize    prize his already    yo  think yo  jes  save that white  Talian trash   ,steal coloured gentleman prize prize yo think yo jes save white Talian trash,5.22,"steal,coloured,gentleman,prize,prize,yo,think,yo,jes,save,white,Talian,trash",0.00,
 The matter is only deferred  said the nobleman quietly ,matter deferred said nobleman quietly,7.14,"matter,deferred,said,nobleman,quietly",0.00,
 Who you to    shouted Nigger Ned  beginning to storm ,shouted Nigger Ned beginning storm,7.41,"shouted,Nigger,Ned,beginning,storm",0.00,
 My name is Pooley  replied the other  with a creditable coolness ,Pooley replied creditable coolness,10.61,"Pooley,replied,creditable,coolness",0.00,
 I am the organizing secretary  and I advise you just now to leave the room ,organizing secretary advise leave room,13.16,"organizing,secretary,advise,leave,room",0.00,
demanded the dark champion  pointing to the priest disdainfully ,demanded dark champion pointing priest disdainfully,4.69,"demanded,dark,champion,pointing,priest,disdainfully",0.00,
 And I advise you just now to leave the country ,advise leave country,14.58,"advise,leave,country",0.00,
The prize   fighter stood glaring for a few seconds  and then  rather to the surprise of Flambeau and the others  strode out  sending the door to with a crash behind him ,prize fighter stood glaring seconds surprise Flambeau strode sending door crash,11.76,"prize,fighter,stood,glaring,seconds,surprise,Flambeau,strode,sending,door,crash",0.00,
 Well  asked Father Brown rubbing his dusty hair up   what do you think of Leonardo da Vinci ,asked Father Brown rubbing dusty hair think Leonardo da Vinci,7.53,"asked,Father,Brown,rubbing,dusty,hair,think,Leonardo,da,Vinci",0.00,
A beautiful Italian head ,beautiful Italian head,4.00,"beautiful,Italian,head",0.00,
 Look here  said Lord Pooley   I  ve taken a considerable responsibility  on your bare word ,Look said Lord Pooley taken considerable responsibility bare word,6.52,"Look,said,Lord,Pooley,taken,considerable,responsibility,bare,word",0.00,
I think you ought to tell me more about this ,think ought tell,15.56,"think,ought,tell",0.00,
 You are quite right  my lord  answered Brown ,right lord answered Brown,8.70,"right,lord,answered,Brown",0.00,
He put the little leather book in his overcoat pocket ,little leather book overcoat pocket,9.26,"little,leather,book,overcoat,pocket",0.00,
 I think we know all that this can tell us  but you shall look at it to see if I  m right ,think know tell shall look right,17.78,"think,know,tell,shall,look,right",0.00,
That negro who has just swaggered out is one of the most dangerous men on earth  for he has the brains of a European  with the instincts of a cannibal ,negro swaggered dangerous men earth brains European instincts cannibal,13.91,"negro,swaggered,dangerous,men,earth,brains,European,instincts,cannibal",0.00,
He has turned what was clean  common   sense butchery among his fellow   barbarians into a very modern and scientific secret society of assassins ,turned clean common sense butchery fellow barbarians modern scientific secret society assassins,7.53,"turned,clean,common,sense,butchery,fellow,barbarians,modern,scientific,secret,society,assassins",0.00,
He doesn  t know I know it  nor  for the matter of that  that I can  t prove it ,know know matter prove,18.75,"know,know,matter,prove",0.00,
There was a silence  and the little man went on ,silence little man went,12.50,"silence,little,man,went",0.00,
 But if I want to murder somebody  will it really be the best plan to make sure I  m alone with him ,want murder somebody best plan sure,16.00,"want,murder,somebody,best,plan,sure",0.00,
Lord Pooley  s eyes recovered their frosty twinkle as he looked at the little clergyman ,Lord Pooley eyes recovered frosty twinkle looked little clergyman,6.82,"Lord,Pooley,eyes,recovered,frosty,twinkle,looked,little,clergyman",0.00,
He only said   If you want to murder somebody  I should advise it ,said want murder somebody advise,12.12,"said,want,murder,somebody,advise",0.00,
Father Brown shook his head  like a murderer of much riper experience ,Father Brown shook head like murderer riper experience,5.71,"Father,Brown,shook,head,like,murderer,riper,experience",0.00,
 So Flambeau said  he replied  with a sigh ,Flambeau said replied sigh,9.30,"Flambeau,said,replied,sigh",0.00,
The more a man feels lonely the less he can be sure he is alone ,man feels lonely sure,17.19,"man,feels,lonely,sure",0.00,
It must mean empty spaces round him  and they are just what make him obvious ,mean spaces round obvious,14.29,"mean,spaces,round,obvious",0.00,
Have you never seen one ploughman from the heights  or one shepherd from the valleys ,seen ploughman heights shepherd valleys,11.76,"seen,ploughman,heights,shepherd,valleys",0.00,
Have you never walked along a cliff  and seen one man walking along the sands ,walked cliff seen man walking sands,11.54,"walked,cliff,seen,man,walking,sands",0.00,
Didn  t you know when he  s killed a crab  and wouldn  t you have known if it had been a creditor ,know killed crab known creditor,17.35,"know,killed,crab,known,creditor",0.00,
For an intelligent murderer  such as you or I might be  it is an impossible plan to make sure that nobody is looking at you ,intelligent murderer impossible plan sure looking,15.32,"intelligent,murderer,impossible,plan,sure,looking",0.00,
 To make sure that everybody is looking at something else ,sure everybody looking,12.07,"sure,everybody,looking",0.00,
A man is throttled close by the big stand at Epsom ,man throttled close big stand Epsom,9.80,"man,throttled,close,big,stand,Epsom",0.00,
Anybody might have seen it done while the stand stood empty    any tramp under the hedges or motorist among the hills ,Anybody seen stand stood tramp hedges motorist hills,11.02,"Anybody,seen,stand,stood,tramp,hedges,motorist,hills",0.00,
But nobody would have seen it when the stand was crowded and the whole ring roaring  when the favourite was coming in first    or wasn  t ,seen stand crowded ring roaring favourite coming,13.77,"seen,stand,crowded,ring,roaring,favourite,coming",0.00,
The twisting of a neck   cloth  the thrusting of a body behind a door could be done in an instant    so long as it was that instant ,twisting neck cloth thrusting body door instant long instant,13.64,"twisting,neck,cloth,thrusting,body,door,instant,long,instant",0.00,
It was the same  of course  he continued turning to Flambeau   with that poor fellow under the bandstand ,course continued turning Flambeau poor fellow bandstand,10.48,"course,continued,turning,Flambeau,poor,fellow,bandstand",0.00,
He was dropped through the hole  just at some very dramatic moment of the entertainment  when the bow of some great violinist or the voice of some great singer opened or came to its climax ,dropped hole dramatic moment entertainment bow great violinist voice great singer opened came climax,11.11,"dropped,hole,dramatic,moment,entertainment,bow,great,violinist,voice,great,singer,opened,came,climax",0.00,
And here  of course  when the knock   out blow came    it would not be the only one ,course knock blow came,15.48,"course,knock,blow,came",0.00,
That is the little trick Nigger Ned has adopted from his old God of Gongs ,little trick Nigger Ned adopted old God Gongs,9.46,"little,trick,Nigger,Ned,adopted,old,God,Gongs",0.00,
 By the way  Malvoli    Pooley began ,way Malvoli Pooley began,5.41,"way,Malvoli,Pooley,began",0.00,
 Malvoli  said the priest   has nothing to do with it ,Malvoli said priest,12.96,"Malvoli,said,priest",0.00,
I dare say he has some Italians with him  but our amiable friends are not Italians ,dare Italians amiable friends Italians,13.25,"dare,Italians,amiable,friends,Italians",0.00,
